{"scan_time": 1668008008, "url": "https://cybertotal.cycarrier.com/app/intelligence/fe525df112d2448eaf8c70c8332b5041", "whois": [{"abuse": {"zip": "100032", "address": "china mobile communications corporation 29 jinrong ave.\nxicheng district beijing\n100032\n", "city": "xicheng district beijing", "whoisContactID": 0, "street": "china mobile communications corporation 29 jinrong ave.", "name": "IRT-CHINAMOBILE2-CN", "id": 0, "email": "abuse@chinamobile.com"}, "technical": {"zip": "100032", "address": "29 jinrong ave\nxicheng district beijing\n100032\n", "city": "xicheng district beijing", "phone": "+86 1052686688", "whoisContactID": 0, "street": "29 jinrong ave", "name": "haijun li", "id": 0, "fax": "+86 10 52616187", "email": "hostmaster@chinamobile.com,abuse@chinamobile.com"}, "rawResponse": {"domain": "112.0.0.0", "whoisID": 6800505882083444902, "unparsed": "{\"rdapConformance\":[\"history_version_0\",\"nro_rdap_profile_0\",\"cidr0\",\"rdap_level_0\"],\"objectClassName\":\"ip network\",\"handle\":\"112.0.0.0 - 112.63.255.255\",\"port43\":\"whois.apnic.net\",\"lang\":null,\"events\":[{\"eventAction\":\"registration\",\"eventDate\":\"2008-12-15T04:05:15Z\",\"eventActor\":null,\"status\":[]},{\"eventAction\":\"last changed\",\"eventDate\":\"2020-12-15T02:55:47Z\",\"eventActor\":null,\"status\":[]}],\"notices\":[{\"title\":\"Source\",\"type\":null,\"description\":[\"Objects returned came from source\",\"APNIC\"],\"links\":[]},{\"title\":\"Terms and Conditions\",\"type\":null,\"description\":[\"This is the APNIC WHOIS Database query service. The objects are in RDAP format.\"],\"links\":[{\"value\":\"https://rdap.apnic.net/ip/112.27.80.120\",\"rel\":\"terms-of-service\",\"href\":\"http://www.apnic.net/db/dbcopyright.html\",\"hreflang\":null,\"title\":null,\"media\":null,\"type\":\"text/html\"}]},{\"title\":\"Whois Inaccuracy Reporting\",\"type\":null,\"description\":[\"If you see inaccuracies in the results, please visit: \"],\"links\":[{\"value\":\"https://rdap.apnic.net/ip/112.27.80.120\",\"rel\":\"inaccuracy-report\",\"href\":\"https://www.apnic.net/manage-ip/using-whois/abuse-and-spamming/invalid-contact-form\",\"hreflang\":null,\"title\":null,\"media\":null,\"type\":\"text/html\"}]}],\"status\":[\"active\"],\"entities\":[{\"rdapConformance\":[\"history_version_0\",\"nro_rdap_profile_0\",\"cidr0\",\"rdap_level_0\"],\"objectClassName\":\"entity\",\"handle\":\"ORG-CMCC1-AP\",\"port43\":\"whois.apnic.net\",\"lang\":null,\"events\":[{\"eventAction\":\"registration\",\"eventDate\":\"2018-01-20T12:57:51Z\",\"eventActor\":null,\"status\":[]},{\"eventAction\":\"last changed\",\"eventDate\":\"2018-01-20T12:57:51Z\",\"eventActor\":null,\"status\":[]}],\"notices\":[{\"title\":\"Source\",\"type\":null,\"description\":[\"Objects returned came from source\",\"APNIC\"],\"links\":[]},{\"title\":\"Terms and Conditions\",\"type\":null,\"description\":[\"This is the APNIC WHOIS Database query service. The objects are in RDAP format.\"],\"links\":[{\"value\":\"https://rdap.apnic.net/entity/ORG-CMCC1-AP\",\"rel\":\"terms-of-service\",\"href\":\"http://www.apnic.net/db/dbcopyright.html\",\"hreflang\":null,\"title\":null,\"media\":null,\"type\":\"text/html\"}]},{\"title\":\"Whois Inaccuracy Reporting\",\"type\":null,\"description\":[\"If you see inaccuracies in the results, please visit: \"],\"links\":[{\"value\":\"https://rdap.apnic.net/entity/ORG-CMCC1-AP\",\"rel\":\"inaccuracy-report\",\"href\":\"https://www.apnic.net/manage-ip/using-whois/abuse-and-spamming/invalid-contact-form\",\"hreflang\":null,\"title\":null,\"media\":null,\"type\":\"text/html\"}]}],\"status\":[],\"entities\":[],\"remarks\":[],\"links\":[{\"value\":\"https://rdap.apnic.net/entity/ORG-CMCC1-AP\",\"rel\":\"self\",\"href\":\"https://rdap.apnic.net/entity/ORG-CMCC1-AP\",\"hreflang\":null,\"title\":null,\"media\":null,\"type\":\"application/rdap+json\"}],\"nameservers\":[],\"entity\":null,\"legalRepresentative\":null,\"errorCode\":null,\"errorTitle\":null,\"errorDescription\":[],\"vcardArray\":[\"vcard\",[[\"version\",{},\"text\",\"4.0\"],[\"fn\",{},\"text\",\"China Mobile Communications Corporation\"],[\"kind\",{},\"text\",\"org\"],[\"adr\",{\"label\":\"29,Jinrong Ave.,\\nXicheng District,\"},\"text\",[\"\",\"\",\"29 jinrong ave. xicheng\",\"district\",\"\",\"\",\"\"]],[\"tel\",{\"type\":\"voice\"},\"text\",\"+861052686688\"],[\"tel\",{\"type\":\"fax\"},\"text\",\"+861052616187\"],[\"email\",{},\"text\",\"hostmaster@chinamobile.com\"]]],\"roles\":[\"registrant\"],\"publicIds\":[],\"networks\":[{\"rdapConformance\":[],\"objectClassName\":\"ip network\",\"handle\":\"45.121.176.0 - 45.121.179.255\",\"port43\":null,\"lang\":null,\"events\":[{\"eventAction\":\"registration\",\"eventDate\":\"2015-07-03T01:12:34Z\",\"eventActor\":null,\"status\":[]},{\"eventAction\":\"last changed\",\"eventDate\":\"2020-10-20T00:58:43Z\",\"eventActor\":null,\"status\":[]}],\"notices\":[],\"status\":[\"active\"],\"entities\":[],\"remarks\":[{\"title\":\"description\",\"description\":[\"China Mobile Communications Corporation\",\"Mobile Communications Network Operator in China\",\"Internet Service Provider in China\"],\"type\":null,\"links\":null},{\"title\":\"remarks\",\"description\":[\"service provider\",\"--------------------------------------------------------\",\"To report network abuse, please contact mnt-irt\",\"For troubleshooting, please contact tech-c and admin-c\",\"Report invalid contact via www.apnic.net/invalidcontact\",\"--------------------------------------------------------\"],\"type\":null,\"links\":null}],\"links\":[{\"value\":\"https://rdap.apnic.net/entity/ORG-CMCC1-AP\",\"rel\":\"self\",\"href\":\"https://rdap.apnic.net/ip/45.121.176.0/22\",\"hreflang\":null,\"title\":null,\"media\":null,\"type\":\"application/rdap+json\"},{\"value\":\"https://rdap.apnic.net/entity/ORG-CMCC1-AP\",\"rel\":\"related\",\"href\":\"https://netox.apnic.net/search/45.121.176.0%2F22?utm_source=rdap&utm_medium=result&utm_campaign=rdap_result\",\"hreflang\":null,\"title\":null,\"media\":null,\"type\":\"text/html\"}],\"nameservers\":[],\"entity\":null,\"legalRepresentative\":null,\"errorCode\":null,\"errorTitle\":null,\"errorDescription\":[],\"startAddress\":\"45.121.176.0\",\"endAddress\":\"45.121.179.255\",\"ipVersion\":\"v4\",\"name\":\"CMNET\",\"type\":\"ALLOCATED PORTABLE\",\"country\":\"CN\",\"parentHandle\":null,\"cidr0_cidrs\":[{\"v4prefix\":\"45.121.176.0\",\"v6prefix\":null,\"length\":\"22\"}],\"arin_originas0_originautnums\":[],\"lacnic_originAutnum\":null,\"lacnic_reverseDelegations\":[],\"lacnic_legalRepresentative\":null,\"nicbr_autnum\":null,\"nicbr_reverseDelegations\":[],\"secureDNS\":null},{\"rdapConformance\":[],\"objectClassName\":\"ip network\",\"handle\":\"36.128.0.0 - 36.191.255.255\",\"port43\":null,\"lang\":null,\"events\":[{\"eventAction\":\"registration\",\"eventDate\":\"2011-01-24T03:40:07Z\",\"eventActor\":null,\"status\":[]},{\"eventAction\":\"last changed\",\"eventDate\":\"2020-12-15T02:49:29Z\",\"eventActor\":null,\"status\":[]}],\"notices\":[],\"status\":[\"active\"],\"entities\":[],\"remarks\":[{\"title\":\"description\",\"description\":[\"China Mobile Communications Corporation\",\"Mobile Communications Network Operator in China\",\"Internet Service Provider in China\"],\"type\":null,\"links\":null},{\"title\":\"remarks\",\"description\":[\"service provider\",\"--------------------------------------------------------\",\"To report network abuse, please contact mnt-irt\",\"For troubleshooting, please contact tech-c and admin-c\",\"Report invalid contact via www.apnic.net/invalidcontact\",\"--------------------------------------------------------\"],\"type\":null,\"links\":null}],\"links\":[{\"value\":\"https://rdap.apnic.net/entity/ORG-CMCC1-AP\",\"rel\":\"self\",\"href\":\"https://rdap.apnic.net/ip/36.128.0.0/10\",\"hreflang\":null,\"title\":null,\"media\":null,\"type\":\"application/rdap+json\"},{\"value\":\"https://rdap.apnic.net/entity/ORG-CMCC1-AP\",\"rel\":\"related\",\"href\":\"https://netox.apnic.net/search/36.128.0.0%2F10?utm_source=rdap&utm_medium=result&utm_campaign=rdap_result\",\"hreflang\":null,\"title\":null,\"media\":null,\"type\":\"text/html\"}],\"nameservers\":[],\"entity\":null,\"legalRepresentative\":null,\"errorCode\":null,\"errorTitle\":null,\"errorDescription\":[],\"startAddress\":\"36.128.0.0\",\"endAddress\":\"36.191.255.255\",\"ipVersion\":\"v4\",\"name\":\"CMNET\",\"type\":\"ALLOCATED PORTABLE\",\"country\":\"CN\",\"parentHandle\":null,\"cidr0_cidrs\":[{\"v4prefix\":\"36.128.0.0\",\"v6prefix\":null,\"length\":\"10\"}],\"arin_originas0_originautnums\":[],\"lacnic_originAutnum\":null,\"lacnic_reverseDelegations\":[],\"lacnic_legalRepresentative\":null,\"nicbr_autnum\":null,\"nicbr_reverseDelegations\":[],\"secureDNS\":null},{\"rdapConformance\":[],\"objectClassName\":\"ip network\",\"handle\":\"103.20.112.0 - 103.20.115.255\",\"port43\":null,\"lang\":null,\"events\":[{\"eventAction\":\"registration\",\"eventDate\":\"2012-09-14T02:12:05Z\",\"eventActor\":null,\"status\":[]},{\"eventAction\":\"last changed\",\"eventDate\":\"2020-12-15T02:49:30Z\",\"eventActor\":null,\"status\":[]}],\"notices\":[],\"status\":[\"active\"],\"entities\":[],\"remarks\":[{\"title\":\"description\",\"description\":[\"China Mobile Communications Corporation\",\"Mobile Communications Network Operator in China\",\"Internet Service Provider in China\"],\"type\":null,\"links\":null},{\"title\":\"remarks\",\"description\":[\"service provider\",\"--------------------------------------------------------\",\"To report network abuse, please contact mnt-irt\",\"For troubleshooting, please contact tech-c and admin-c\",\"Report invalid contact via www.apnic.net/invalidcontact\",\"--------------------------------------------------------\"],\"type\":null,\"links\":null}],\"links\":[{\"value\":\"https://rdap.apnic.net/entity/ORG-CMCC1-AP\",\"rel\":\"self\",\"href\":\"https://rdap.apnic.net/ip/103.20.112.0/22\",\"hreflang\":null,\"title\":null,\"media\":null,\"type\":\"application/rdap+json\"},{\"value\":\"https://rdap.apnic.net/entity/ORG-CMCC1-AP\",\"rel\":\"related\",\"href\":\"https://netox.apnic.net/search/103.20.112.0%2F22?utm_source=rdap&utm_medium=result&utm_campaign=rdap_result\",\"hreflang\":null,\"title\":null,\"media\":null,\"type\":\"text/html\"}],\"nameservers\":[],\"entity\":null,\"legalRepresentative\":null,\"errorCode\":null,\"errorTitle\":null,\"errorDescription\":[],\"startAddress\":\"103.20.112.0\",\"endAddress\":\"103.20.115.255\",\"ipVersion\":\"v4\",\"name\":\"CMNET\",\"type\":\"ALLOCATED PORTABLE\",\"country\":\"CN\",\"parentHandle\":null,\"cidr0_cidrs\":[{\"v4prefix\":\"103.20.112.0\",\"v6prefix\":null,\"length\":\"22\"}],\"arin_originas0_originautnums\":[],\"lacnic_originAutnum\":null,\"lacnic_reverseDelegations\":[],\"lacnic_legalRepresentative\":null,\"nicbr_autnum\":null,\"nicbr_reverseDelegations\":[],\"secureDNS\":null},{\"rdapConformance\":[],\"objectClassName\":\"ip network\",\"handle\":\"112.0.0.0 - 112.63.255.255\",\"port43\":null,\"lang\":null,\"events\":[{\"eventAction\":\"registration\",\"eventDate\":\"2008-12-15T04:05:15Z\",\"eventActor\":null,\"status\":[]},{\"eventAction\":\"last changed\",\"eventDate\":\"2020-12-15T02:55:47Z\",\"eventActor\":null,\"status\":[]}],\"notices\":[],\"status\":[\"active\"],\"entities\":[],\"remarks\":[{\"title\":\"description\",\"description\":[\"China Mobile Communications Corporation\",\"Mobile Communications Network Operator in China\",\"Internet Service Provider in China\"],\"type\":null,\"links\":null},{\"title\":\"remarks\",\"description\":[\"service provider\",\"--------------------------------------------------------\",\"To report network abuse, please contact mnt-irt\",\"For troubleshooting, please contact tech-c and admin-c\",\"Report invalid contact via www.apnic.net/invalidcontact\",\"--------------------------------------------------------\"],\"type\":null,\"links\":null}],\"links\":[{\"value\":\"https://rdap.apnic.net/entity/ORG-CMCC1-AP\",\"rel\":\"self\",\"href\":\"https://rdap.apnic.net/ip/112.0.0.0/10\",\"hreflang\":null,\"title\":null,\"media\":null,\"type\":\"application/rdap+json\"},{\"value\":\"https://rdap.apnic.net/entity/ORG-CMCC1-AP\",\"rel\":\"related\",\"href\":\"https://netox.apnic.net/search/112.0.0.0%2F10?utm_source=rdap&utm_medium=result&utm_campaign=rdap_result\",\"hreflang\":null,\"title\":null,\"media\":null,\"type\":\"text/html\"}],\"nameservers\":[],\"entity\":null,\"legalRepresentative\":null,\"errorCode\":null,\"errorTitle\":null,\"errorDescription\":[],\"startAddress\":\"112.0.0.0\",\"endAddress\":\"112.63.255.255\",\"ipVersion\":\"v4\",\"name\":\"CMNET\",\"type\":\"ALLOCATED PORTABLE\",\"country\":\"CN\",\"parentHandle\":null,\"cidr0_cidrs\":[{\"v4prefix\":\"112.0.0.0\",\"v6prefix\":null,\"length\":\"10\"}],\"arin_originas0_originautnums\":[],\"lacnic_originAutnum\":null,\"lacnic_reverseDelegations\":[],\"lacnic_legalRepresentative\":null,\"nicbr_autnum\":null,\"nicbr_reverseDelegations\":[],\"secureDNS\":null},{\"rdapConformance\":[],\"objectClassName\":\"ip network\",\"handle\":\"183.192.0.0 - 183.255.255.255\",\"port43\":null,\"lang\":null,\"events\":[{\"eventAction\":\"registration\",\"eventDate\":\"2009-11-08T07:42:25Z\",\"eventActor\":null,\"status\":[]},{\"eventAction\":\"last changed\",\"eventDate\":\"2020-12-15T02:55:48Z\",\"eventActor\":null,\"status\":[]}],\"notices\":[],\"status\":[\"active\"],\"entities\":[],\"remarks\":[{\"title\":\"description\",\"description\":[\"China Mobile Communications Corporation\",\"Mobile Communications Network Operator in China\",\"Internet Service Provider in China\"],\"type\":null,\"links\":null},{\"title\":\"remarks\",\"description\":[\"service provider\",\"--------------------------------------------------------\",\"To report network abuse, please contact mnt-irt\",\"For troubleshooting, please contact tech-c and admin-c\",\"Report invalid contact via www.apnic.net/invalidcontact\",\"--------------------------------------------------------\"],\"type\":null,\"links\":null}],\"links\":[{\"value\":\"https://rdap.apnic.net/entity/ORG-CMCC1-AP\",\"rel\":\"self\",\"href\":\"https://rdap.apnic.net/ip/183.192.0.0/10\",\"hreflang\":null,\"title\":null,\"media\":null,\"type\":\"application/rdap+json\"},{\"value\":\"https://rdap.apnic.net/entity/ORG-CMCC1-AP\",\"rel\":\"related\",\"href\":\"https://netox.apnic.net/search/183.192.0.0%2F10?utm_source=rdap&utm_medium=result&utm_campaign=rdap_result\",\"hreflang\":null,\"title\":null,\"media\":null,\"type\":\"text/html\"}],\"nameservers\":[],\"entity\":null,\"legalRepresentative\":null,\"errorCode\":null,\"errorTitle\":null,\"errorDescription\":[],\"startAddress\":\"183.192.0.0\",\"endAddress\":\"183.255.255.255\",\"ipVersion\":\"v4\",\"name\":\"CMNET\",\"type\":\"ALLOCATED PORTABLE\",\"country\":\"CN\",\"parentHandle\":null,\"cidr0_cidrs\":[{\"v4prefix\":\"183.192.0.0\",\"v6prefix\":null,\"length\":\"10\"}],\"arin_originas0_originautnums\":[],\"lacnic_originAutnum\":null,\"lacnic_reverseDelegations\":[],\"lacnic_legalRepresentative\":null,\"nicbr_autnum\":null,\"nicbr_reverseDelegations\":[],\"secureDNS\":null}],\"autnums\":[{\"rdapConformance\":[],\"objectClassName\":\"autnum\",\"handle\":\"AS132525\",\"port43\":null,\"lang\":null,\"events\":[{\"eventAction\":\"registration\",\"eventDate\":\"2012-12-12T00:14:57Z\",\"eventActor\":null,\"status\":[]},{\"eventAction\":\"last changed\",\"eventDate\":\"2020-06-01T01:55:27Z\",\"eventActor\":null,\"status\":[]}],\"notices\":[],\"status\":[\"active\"],\"entities\":[],\"remarks\":[{\"title\":\"description\",\"description\":[\"HeiLongJiang Mobile Communication Company Limited\",\"The IP core network of HeiLongJiang Mobile Communication Company Limited\",\"Telecommunication Service Provider\",\"Harbin\"],\"type\":null,\"links\":null}],\"links\":[{\"value\":\"https://rdap.apnic.net/entity/ORG-CMCC1-AP\",\"rel\":\"self\",\"href\":\"https://rdap.apnic.net/autnum/132525\",\"hreflang\":null,\"title\":null,\"media\":null,\"type\":\"application/rdap+json\"},{\"value\":\"https://rdap.apnic.net/entity/ORG-CMCC1-AP\",\"rel\":\"related\",\"href\":\"https://netox.apnic.net/search/AS132525?utm_source=rdap&utm_medium=result&utm_campaign=rdap_result\",\"hreflang\":null,\"title\":null,\"media\":null,\"type\":\"text/html\"}],\"nameservers\":[],\"entity\":null,\"legalRepresentative\":null,\"errorCode\":null,\"errorTitle\":null,\"errorDescription\":[],\"startAutnum\":132525,\"endAutnum\":132525,\"name\":\"CMNET-HEILONGJIANG-CN\",\"type\":null,\"country\":\"CN\",\"nicbr_routingPolicy\":[]},{\"rdapConformance\":[],\"objectClassName\":\"autnum\",\"handle\":\"AS132511\",\"port43\":null,\"lang\":null,\"events\":[{\"eventAction\":\"registration\",\"eventDate\":\"2012-12-05T01:45:40Z\",\"eventActor\":null,\"status\":[]},{\"eventAction\":\"last changed\",\"eventDate\":\"2020-06-03T01:03:33Z\",\"eventActor\":null,\"status\":[]}],\"notices\":[],\"status\":[\"active\"],\"entities\":[],\"remarks\":[{\"title\":\"description\",\"description\":[\"JiLin Mobile Communication Company Limited\",\"The Internet Data Center of\",\"JiLin Mobile Communication Company Limited\",\"Telecommunication Service Provider\",\"Changchun\"],\"type\":null,\"links\":null}],\"links\":[{\"value\":\"https://rdap.apnic.net/entity/ORG-CMCC1-AP\",\"rel\":\"self\",\"href\":\"https://rdap.apnic.net/autnum/132511\",\"hreflang\":null,\"title\":null,\"media\":null,\"type\":\"application/rdap+json\"},{\"value\":\"https://rdap.apnic.net/entity/ORG-CMCC1-AP\",\"rel\":\"related\",\"href\":\"https://netox.apnic.net/search/AS132511?utm_source=rdap&utm_medium=result&utm_campaign=rdap_result\",\"hreflang\":null,\"title\":null,\"media\":null,\"type\":\"text/html\"}],\"nameservers\":[],\"entity\":null,\"legalRepresentative\":null,\"errorCode\":null,\"errorTitle\":null,\"errorDescription\":[],\"startAutnum\":132511,\"endAutnum\":132511,\"name\":\"CMNET-JLIDC-CN\",\"type\":null,\"country\":\"CN\",\"nicbr_routingPolicy\":[]},{\"rdapConformance\":[],\"objectClassName\":\"autnum\",\"handle\":\"AS134810\",\"port43\":null,\"lang\":null,\"events\":[{\"eventAction\":\"registration\",\"eventDate\":\"2017-01-03T02:16:02Z\",\"eventActor\":null,\"status\":[]},{\"eventAction\":\"last changed\",\"eventDate\":\"2020-06-03T01:03:33Z\",\"eventActor\":null,\"status\":[]}],\"notices\":[],\"status\":[\"active\"],\"entities\":[],\"remarks\":[{\"title\":\"description\",\"description\":[\"China Mobile Group JiLin communications corporation\"],\"type\":null,\"links\":null}],\"links\":[{\"value\":\"https://rdap.apnic.net/entity/ORG-CMCC1-AP\",\"rel\":\"self\",\"href\":\"https://rdap.apnic.net/autnum/134810\",\"hreflang\":null,\"title\":null,\"media\":null,\"type\":\"application/rdap+json\"},{\"value\":\"https://rdap.apnic.net/entity/ORG-CMCC1-AP\",\"rel\":\"related\",\"href\":\"https://netox.apnic.net/search/AS134810?utm_source=rdap&utm_medium=result&utm_campaign=rdap_result\",\"hreflang\":null,\"title\":null,\"media\":null,\"type\":\"text/html\"}],\"nameservers\":[],\"entity\":null,\"legalRepresentative\":null,\"errorCode\":null,\"errorTitle\":null,\"errorDescription\":[],\"startAutnum\":134810,\"endAutnum\":134810,\"name\":\"CMNET-JILIN-AS-AP\",\"type\":null,\"country\":\"CN\",\"nicbr_routingPolicy\":[]},{\"rdapConformance\":[],\"objectClassName\":\"autnum\",\"handle\":\"AS132510\",\"port43\":null,\"lang\":null,\"events\":[{\"eventAction\":\"registration\",\"eventDate\":\"2012-12-04T06:59:12Z\",\"eventActor\":null,\"status\":[]},{\"eventAction\":\"last changed\",\"eventDate\":\"2020-06-17T13:04:35Z\",\"eventActor\":null,\"status\":[]}],\"notices\":[],\"status\":[\"active\"],\"entities\":[],\"remarks\":[{\"title\":\"description\",\"description\":[\"IDC ShanXi China Mobile communications corporation\",\"the IDC network of China Mobile Group ShanXi Company\",\"Telecommunication Service Provider\",\"shanxi\"],\"type\":null,\"links\":null},{\"title\":\"remarks\",\"description\":[\"Please send abuse e-mail to abuse@chinamobile.com\"],\"type\":null,\"links\":null}],\"links\":[{\"value\":\"https://rdap.apnic.net/entity/ORG-CMCC1-AP\",\"rel\":\"self\",\"href\":\"https://rdap.apnic.net/autnum/132510\",\"hreflang\":null,\"title\":null,\"media\":null,\"type\":\"application/rdap+json\"},{\"value\":\"https://rdap.apnic.net/entity/ORG-CMCC1-AP\",\"rel\":\"related\",\"href\":\"https://netox.apnic.net/search/AS132510?utm_source=rdap&utm_medium=result&utm_campaign=rdap_result\",\"hreflang\":null,\"title\":null,\"media\":null,\"type\":\"text/html\"}],\"nameservers\":[],\"entity\":null,\"legalRepresentative\":null,\"errorCode\":null,\"errorTitle\":null,\"errorDescription\":[],\"startAutnum\":132510,\"endAutnum\":132510,\"name\":\"ShanXiMCC-IDC\",\"type\":null,\"country\":\"CN\",\"nicbr_routingPolicy\":[]},{\"rdapConformance\":[],\"objectClassName\":\"autnum\",\"handle\":\"AS140895\",\"port43\":null,\"lang\":null,\"events\":[{\"eventAction\":\"registration\",\"eventDate\":\"2020-07-07T02:42:36Z\",\"eventActor\":null,\"status\":[]},{\"eventAction\":\"last changed\",\"eventDate\":\"2020-07-07T02:42:40Z\",\"eventActor\":null,\"status\":[]}],\"notices\":[],\"status\":[\"active\"],\"entities\":[],\"remarks\":[{\"title\":\"description\",\"description\":[\"China Mobile Group AnHui communications corporation\",\"Telecommunication Service Provider\",\"No.609 Huangshan Road, Hefei City, Anhui Province\"],\"type\":null,\"links\":null}],\"links\":[{\"value\":\"https://rdap.apnic.net/entity/ORG-CMCC1-AP\",\"rel\":\"self\",\"href\":\"https://rdap.apnic.net/autnum/140895\",\"hreflang\":null,\"title\":null,\"media\":null,\"type\":\"application/rdap+json\"},{\"value\":\"https://rdap.apnic.net/entity/ORG-CMCC1-AP\",\"rel\":\"related\",\"href\":\"https://netox.apnic.net/search/AS140895?utm_source=rdap&utm_medium=result&utm_campaign=rdap_result\",\"hreflang\":null,\"title\":null,\"media\":null,\"type\":\"text/html\"}],\"nameservers\":[],\"entity\":null,\"legalRepresentative\":null,\"errorCode\":null,\"errorTitle\":null,\"errorDescription\":[],\"startAutnum\":140895,\"endAutnum\":140895,\"name\":\"CMNET-ANHUI-CN\",\"type\":null,\"country\":\"CN\",\"nicbr_routingPolicy\":[]},{\"rdapConformance\":[],\"objectClassName\":\"autnum\",\"handle\":\"AS132501\",\"port43\":null,\"lang\":null,\"events\":[{\"eventAction\":\"registration\",\"eventDate\":\"2012-11-29T23:48:01Z\",\"eventActor\":null,\"status\":[]},{\"eventAction\":\"last changed\",\"eventDate\":\"2020-07-15T13:09:42Z\",\"eventActor\":null,\"status\":[]}],\"notices\":[],\"status\":[\"active\"],\"entities\":[],\"remarks\":[{\"title\":\"description\",\"description\":[\"China Mobile Group FuJian communications corporation\"],\"type\":null,\"links\":null},{\"title\":\"remarks\",\"description\":[\"Please send abuse e-mail to abuse@chinamobile.com\"],\"type\":null,\"links\":null}],\"links\":[{\"value\":\"https://rdap.apnic.net/entity/ORG-CMCC1-AP\",\"rel\":\"self\",\"href\":\"https://rdap.apnic.net/autnum/132501\",\"hreflang\":null,\"title\":null,\"media\":null,\"type\":\"application/rdap+json\"},{\"value\":\"https://rdap.apnic.net/entity/ORG-CMCC1-AP\",\"rel\":\"related\",\"href\":\"https://netox.apnic.net/search/AS132501?utm_source=rdap&utm_medium=result&utm_campaign=rdap_result\",\"hreflang\":null,\"title\":null,\"media\":null,\"type\":\"text/html\"}],\"nameservers\":[],\"entity\":null,\"legalRepresentative\":null,\"errorCode\":null,\"errorTitle\":null,\"errorDescription\":[],\"startAutnum\":132501,\"endAutnum\":132501,\"name\":\"CMNET-FuJian\",\"type\":null,\"country\":\"CN\",\"nicbr_routingPolicy\":[]},{\"rdapConformance\":[],\"objectClassName\":\"autnum\",\"handle\":\"AS56040\",\"port43\":null,\"lang\":null,\"events\":[{\"eventAction\":\"registration\",\"eventDate\":\"2011-01-18T23:39:33Z\",\"eventActor\":null,\"status\":[]},{\"eventAction\":\"last changed\",\"eventDate\":\"2020-07-15T13:09:53Z\",\"eventActor\":null,\"status\":[]}],\"notices\":[],\"status\":[\"active\"],\"entities\":[],\"remarks\":[{\"title\":\"description\",\"description\":[\"China Mobile communications corporation\",\"the IP core network of China Mobile Group GuangDong Company\",\"Telecommunication Service Provider\",\"No.11,ZhuJiangXi road,GuangZhou\"],\"type\":null,\"links\":null},{\"title\":\"remarks\",\"description\":[\"Please send abuse e-mail to dengwei5@gd.chinamobile.com\"],\"type\":null,\"links\":null}],\"links\":[{\"value\":\"https://rdap.apnic.net/entity/ORG-CMCC1-AP\",\"rel\":\"self\",\"href\":\"https://rdap.apnic.net/autnum/56040\",\"hreflang\":null,\"title\":null,\"media\":null,\"type\":\"application/rdap+json\"},{\"value\":\"https://rdap.apnic.net/entity/ORG-CMCC1-AP\",\"rel\":\"related\",\"href\":\"https://netox.apnic.net/search/AS56040?utm_source=rdap&utm_medium=result&utm_campaign=rdap_result\",\"hreflang\":null,\"title\":null,\"media\":null,\"type\":\"text/html\"}],\"nameservers\":[],\"entity\":null,\"legalRepresentative\":null,\"errorCode\":null,\"errorTitle\":null,\"errorDescription\":[],\"startAutnum\":56040,\"endAutnum\":56040,\"name\":\"CMNET-GuangDong-AP\",\"type\":null,\"country\":\"CN\",\"nicbr_routingPolicy\":[]},{\"rdapConformance\":[],\"objectClassName\":\"autnum\",\"handle\":\"AS56041\",\"port43\":null,\"lang\":null,\"events\":[{\"eventAction\":\"registration\",\"eventDate\":\"2011-01-18T23:46:06Z\",\"eventActor\":null,\"status\":[]},{\"eventAction\":\"last changed\",\"eventDate\":\"2020-07-15T13:09:53Z\",\"eventActor\":null,\"status\":[]}],\"notices\":[],\"status\":[\"active\"],\"entities\":[],\"remarks\":[{\"title\":\"description\",\"description\":[\"China Mobile communications corporation\",\"IP core network of China Mobile Group Zhejiang Company\",\"Telecommunication Service Provider Zhejiang\"],\"type\":null,\"links\":null},{\"title\":\"remarks\",\"description\":[\"Please send abuse e-mail to abuse@chinamobile.com\"],\"type\":null,\"links\":null}],\"links\":[{\"value\":\"https://rdap.apnic.net/entity/ORG-CMCC1-AP\",\"rel\":\"self\",\"href\":\"https://rdap.apnic.net/autnum/56041\",\"hreflang\":null,\"title\":null,\"media\":null,\"type\":\"application/rdap+json\"},{\"value\":\"https://rdap.apnic.net/entity/ORG-CMCC1-AP\",\"rel\":\"related\",\"href\":\"https://netox.apnic.net/search/AS56041?utm_source=rdap&utm_medium=result&utm_campaign=rdap_result\",\"hreflang\":null,\"title\":null,\"media\":null,\"type\":\"text/html\"}],\"nameservers\":[],\"entity\":null,\"legalRepresentative\":null,\"errorCode\":null,\"errorTitle\":null,\"errorDescription\":[],\"startAutnum\":56041,\"endAutnum\":56041,\"name\":\"CMNET-Zhejiang-AP\",\"type\":null,\"country\":\"CN\",\"nicbr_routingPolicy\":[]},{\"rdapConformance\":[],\"objectClassName\":\"autnum\",\"handle\":\"AS56047\",\"port43\":null,\"lang\":null,\"events\":[{\"eventAction\":\"registration\",\"eventDate\":\"2011-01-19T00:13:07Z\",\"eventActor\":null,\"status\":[]},{\"eventAction\":\"last changed\",\"eventDate\":\"2020-07-15T13:09:53Z\",\"eventActor\":null,\"status\":[]}],\"notices\":[],\"status\":[\"active\"],\"entities\":[],\"remarks\":[{\"title\":\"description\",\"description\":[\"China Mobile communications corporation\",\"the IP core network of China Mobile Group Hunan Company\",\"Telecommunication Service Provider\",\"hunan\"],\"type\":null,\"links\":null},{\"title\":\"remarks\",\"description\":[\"Please send abuse e-mail to abuse@chinamobile.com\"],\"type\":null,\"links\":null}],\"links\":[{\"value\":\"https://rdap.apnic.net/entity/ORG-CMCC1-AP\",\"rel\":\"self\",\"href\":\"https://rdap.apnic.net/autnum/56047\",\"hreflang\":null,\"title\":null,\"media\":null,\"type\":\"application/rdap+json\"},{\"value\":\"https://rdap.apnic.net/entity/ORG-CMCC1-AP\",\"rel\":\"related\",\"href\":\"https://netox.apnic.net/search/AS56047?utm_source=rdap&utm_medium=result&utm_campaign=rdap_result\",\"hreflang\":null,\"title\":null,\"media\":null,\"type\":\"text/html\"}],\"nameservers\":[],\"entity\":null,\"legalRepresentative\":null,\"errorCode\":null,\"errorTitle\":null,\"errorDescription\":[],\"startAutnum\":56047,\"endAutnum\":56047,\"name\":\"CMNET-Hunan-AP\",\"type\":null,\"country\":\"CN\",\"nicbr_routingPolicy\":[]},{\"rdapConformance\":[],\"objectClassName\":\"autnum\",\"handle\":\"AS56048\",\"port43\":null,\"lang\":null,\"events\":[{\"eventAction\":\"registration\",\"eventDate\":\"2011-01-19T00:16:26Z\",\"eventActor\":null,\"status\":[]},{\"eventAction\":\"last changed\",\"eventDate\":\"2020-07-15T13:09:53Z\",\"eventActor\":null,\"status\":[]}],\"notices\":[],\"status\":[\"active\"],\"entities\":[],\"remarks\":[{\"title\":\"description\",\"description\":[\"China Mobile Communicaitons Corporation\",\"the IP core network of China Mobile Group beijing Company\",\"Internet Service Provider\"],\"type\":null,\"links\":null}],\"links\":[{\"value\":\"https://rdap.apnic.net/entity/ORG-CMCC1-AP\",\"rel\":\"self\",\"href\":\"https://rdap.apnic.net/autnum/56048\",\"hreflang\":null,\"title\":null,\"media\":null,\"type\":\"application/rdap+json\"},{\"value\":\"https://rdap.apnic.net/entity/ORG-CMCC1-AP\",\"rel\":\"related\",\"href\":\"https://netox.apnic.net/search/AS56048?utm_source=rdap&utm_medium=result&utm_campaign=rdap_result\",\"hreflang\":null,\"title\":null,\"media\":null,\"type\":\"text/html\"}],\"nameservers\":[],\"entity\":null,\"legalRepresentative\":null,\"errorCode\":null,\"errorTitle\":null,\"errorDescription\":[],\"startAutnum\":56048,\"endAutnum\":56048,\"name\":\"CMNET-BEIJING-AP\",\"type\":null,\"country\":\"CN\",\"nicbr_routingPolicy\":[]},{\"rdapConformance\":[],\"objectClassName\":\"autnum\",\"handle\":\"AS136755\",\"port43\":null,\"lang\":null,\"events\":[{\"eventAction\":\"registration\",\"eventDate\":\"2017-06-15T09:12:51Z\",\"eventActor\":null,\"status\":[]},{\"eventAction\":\"last changed\",\"eventDate\":\"2020-07-15T13:09:53Z\",\"eventActor\":null,\"status\":[]}],\"notices\":[],\"status\":[\"active\"],\"entities\":[],\"remarks\":[{\"title\":\"description\",\"description\":[\"Qinghai Mobile Communication Company Limited\",\"The Internet Data Center of Qinghia Mobile Communication Company Limited\",\"Telecommunication Service Provider\",\"Floor-2 208 Qinghai Mobile Hub Building, No. 48 East Kunlun Road, Chengdong Economic Development Zone, Xinig City, Qinghai Province\"],\"type\":null,\"links\":null}],\"links\":[{\"value\":\"https://rdap.apnic.net/entity/ORG-CMCC1-AP\",\"rel\":\"self\",\"href\":\"https://rdap.apnic.net/autnum/136755\",\"hreflang\":null,\"title\":null,\"media\":null,\"type\":\"application/rdap+json\"},{\"value\":\"https://rdap.apnic.net/entity/ORG-CMCC1-AP\",\"rel\":\"related\",\"href\":\"https://netox.apnic.net/search/AS136755?utm_source=rdap&utm_medium=result&utm_campaign=rdap_result\",\"hreflang\":null,\"title\":null,\"media\":null,\"type\":\"text/html\"}],\"nameservers\":[],\"entity\":null,\"legalRepresentative\":null,\"errorCode\":null,\"errorTitle\":null,\"errorDescription\":[],\"startAutnum\":136755,\"endAutnum\":136755,\"name\":\"CMNET-QHIDC-CN\",\"type\":null,\"country\":\"CN\",\"nicbr_routingPolicy\":[]},{\"rdapConformance\":[],\"objectClassName\":\"autnum\",\"handle\":\"AS24059\",\"port43\":null,\"lang\":null,\"events\":[{\"eventAction\":\"registration\",\"eventDate\":\"2008-09-04T06:40:38Z\",\"eventActor\":null,\"status\":[]},{\"eventAction\":\"last changed\",\"eventDate\":\"2020-07-15T13:09:54Z\",\"eventActor\":null,\"status\":[]}],\"notices\":[],\"status\":[\"active\"],\"entities\":[],\"remarks\":[{\"title\":\"description\",\"description\":[\"China Mobile communications corporation\",\"the 2nd IP core network of China Mobile\",\"No.29,Jinrong Ane.,Xicheng district,beijing P.R.C.,100032\"],\"type\":null,\"links\":null},{\"title\":\"remarks\",\"description\":[\"------------------------------\",\"Please send abuse e-mail to\",\"abuse@chinamobile.com\",\"Please send probe e-mail to\",\"abuse@chinamobile.com\",\"-------------------------------\"],\"type\":null,\"links\":null}],\"links\":[{\"value\":\"https://rdap.apnic.net/entity/ORG-CMCC1-AP\",\"rel\":\"self\",\"href\":\"https://rdap.apnic.net/autnum/24059\",\"hreflang\":null,\"title\":null,\"media\":null,\"type\":\"application/rdap+json\"},{\"value\":\"https://rdap.apnic.net/entity/ORG-CMCC1-AP\",\"rel\":\"related\",\"href\":\"https://netox.apnic.net/search/AS24059?utm_source=rdap&utm_medium=result&utm_campaign=rdap_result\",\"hreflang\":null,\"title\":null,\"media\":null,\"type\":\"text/html\"}],\"nameservers\":[],\"entity\":null,\"legalRepresentative\":null,\"errorCode\":null,\"errorTitle\":null,\"errorDescription\":[],\"startAutnum\":24059,\"endAutnum\":24059,\"name\":\"CMNET2-AS-AP\",\"type\":null,\"country\":\"CN\",\"nicbr_routingPolicy\":[]},{\"rdapConformance\":[],\"objectClassName\":\"autnum\",\"handle\":\"AS45120\",\"port43\":null,\"lang\":null,\"events\":[{\"eventAction\":\"registration\",\"eventDate\":\"2008-09-04T06:40:44Z\",\"eventActor\":null,\"status\":[]},{\"eventAction\":\"last changed\",\"eventDate\":\"2020-07-15T13:09:54Z\",\"eventActor\":null,\"status\":[]}],\"notices\":[],\"status\":[\"active\"],\"entities\":[],\"remarks\":[{\"title\":\"description\",\"description\":[\"China Mobile communications corporation\",\"the 3rd IP core network of China Mobile\",\"Telecommunication Service Provider\",\"Beijing\"],\"type\":null,\"links\":null},{\"title\":\"remarks\",\"description\":[\"Please send abuse e-mail to abuse@chinamobile.com\"],\"type\":null,\"links\":null}],\"links\":[{\"value\":\"https://rdap.apnic.net/entity/ORG-CMCC1-AP\",\"rel\":\"self\",\"href\":\"https://rdap.apnic.net/autnum/45120\",\"hreflang\":null,\"title\":null,\"media\":null,\"type\":\"application/rdap+json\"},{\"value\":\"https://rdap.apnic.net/entity/ORG-CMCC1-AP\",\"rel\":\"related\",\"href\":\"https://netox.apnic.net/search/AS45120?utm_source=rdap&utm_medium=result&utm_campaign=rdap_result\",\"hreflang\":null,\"title\":null,\"media\":null,\"type\":\"text/html\"}],\"nameservers\":[],\"entity\":null,\"legalRepresentative\":null,\"errorCode\":null,\"errorTitle\":null,\"errorDescription\":[],\"startAutnum\":45120,\"endAutnum\":45120,\"name\":\"CMNET3-AS-AP\",\"type\":null,\"country\":\"CN\",\"nicbr_routingPolicy\":[]},{\"rdapConformance\":[],\"objectClassName\":\"autnum\",\"handle\":\"AS56042\",\"port43\":null,\"lang\":null,\"events\":[{\"eventAction\":\"registration\",\"eventDate\":\"2011-01-18T23:51:02Z\",\"eventActor\":null,\"status\":[]},{\"eventAction\":\"last changed\",\"eventDate\":\"2020-07-15T13:09:54Z\",\"eventActor\":null,\"status\":[]}],\"notices\":[],\"status\":[\"active\"],\"entities\":[],\"remarks\":[{\"title\":\"description\",\"description\":[\"China Mobile communications corporation\",\"IP core network of China Mobile Group Shanxi Company\",\"Telecommunication Service Provider Shanxi\"],\"type\":null,\"links\":null},{\"title\":\"remarks\",\"description\":[\"Please send abuse e-mail to abuse@chinamobile.com\"],\"type\":null,\"links\":null}],\"links\":[{\"value\":\"https://rdap.apnic.net/entity/ORG-CMCC1-AP\",\"rel\":\"self\",\"href\":\"https://rdap.apnic.net/autnum/56042\",\"hreflang\":null,\"title\":null,\"media\":null,\"type\":\"application/rdap+json\"},{\"value\":\"https://rdap.apnic.net/entity/ORG-CMCC1-AP\",\"rel\":\"related\",\"href\":\"https://netox.apnic.net/search/AS56042?utm_source=rdap&utm_medium=result&utm_campaign=rdap_result\",\"hreflang\":null,\"title\":null,\"media\":null,\"type\":\"text/html\"}],\"nameservers\":[],\"entity\":null,\"legalRepresentative\":null,\"errorCode\":null,\"errorTitle\":null,\"errorDescription\":[],\"startAutnum\":56042,\"endAutnum\":56042,\"name\":\"CMNET-Shanxi-AP\",\"type\":null,\"country\":\"CN\",\"nicbr_routingPolicy\":[]},{\"rdapConformance\":[],\"objectClassName\":\"autnum\",\"handle\":\"AS56044\",\"port43\":null,\"lang\":null,\"events\":[{\"eventAction\":\"registration\",\"eventDate\":\"2011-01-19T00:00:08Z\",\"eventActor\":null,\"status\":[]},{\"eventAction\":\"last changed\",\"eventDate\":\"2020-07-15T13:09:54Z\",\"eventActor\":null,\"status\":[]}],\"notices\":[],\"status\":[\"active\"],\"entities\":[],\"remarks\":[{\"title\":\"description\",\"description\":[\"China Mobile communications corporation\",\"the 1st IP core network of China Mobile(LiaoNing)\",\"21ViaNet(China),Inc. Service Provider\",\"Liaoning\"],\"type\":null,\"links\":null},{\"title\":\"remarks\",\"description\":[\"Please send abuse e-mail to abuse@chinamobile.com\"],\"type\":null,\"links\":null}],\"links\":[{\"value\":\"https://rdap.apnic.net/entity/ORG-CMCC1-AP\",\"rel\":\"self\",\"href\":\"https://rdap.apnic.net/autnum/56044\",\"hreflang\":null,\"title\":null,\"media\":null,\"type\":\"application/rdap+json\"},{\"value\":\"https://rdap.apnic.net/entity/ORG-CMCC1-AP\",\"rel\":\"related\",\"href\":\"https://netox.apnic.net/search/AS56044?utm_source=rdap&utm_medium=result&utm_campaign=rdap_result\",\"hreflang\":null,\"title\":null,\"media\":null,\"type\":\"text/html\"}],\"nameservers\":[],\"entity\":null,\"legalRepresentative\":null,\"errorCode\":null,\"errorTitle\":null,\"errorDescription\":[],\"startAutnum\":56044,\"endAutnum\":56044,\"name\":\"CMNET-AS-Liaoning\",\"type\":null,\"country\":\"CN\",\"nicbr_routingPolicy\":[]},{\"rdapConformance\":[],\"objectClassName\":\"autnum\",\"handle\":\"AS56045\",\"port43\":null,\"lang\":null,\"events\":[{\"eventAction\":\"registration\",\"eventDate\":\"2011-01-19T00:04:07Z\",\"eventActor\":null,\"status\":[]},{\"eventAction\":\"last changed\",\"eventDate\":\"2020-07-15T13:09:54Z\",\"eventActor\":null,\"status\":[]}],\"notices\":[],\"status\":[\"active\"],\"entities\":[],\"remarks\":[{\"title\":\"description\",\"description\":[\"China Mobile communications corporation\",\"the IP core network of China Mobile Group Jiangxi Company\",\"Telecommunication Service Provider\",\"Jiangxi\"],\"type\":null,\"links\":null},{\"title\":\"remarks\",\"description\":[\"Please send abuse e-mail to abuse@chinamobile.com\"],\"type\":null,\"links\":null}],\"links\":[{\"value\":\"https://rdap.apnic.net/entity/ORG-CMCC1-AP\",\"rel\":\"self\",\"href\":\"https://rdap.apnic.net/autnum/56045\",\"hreflang\":null,\"title\":null,\"media\":null,\"type\":\"application/rdap+json\"},{\"value\":\"https://rdap.apnic.net/entity/ORG-CMCC1-AP\",\"rel\":\"related\",\"href\":\"https://netox.apnic.net/search/AS56045?utm_source=rdap&utm_medium=result&utm_campaign=rdap_result\",\"hreflang\":null,\"title\":null,\"media\":null,\"type\":\"text/html\"}],\"nameservers\":[],\"entity\":null,\"legalRepresentative\":null,\"errorCode\":null,\"errorTitle\":null,\"errorDescription\":[],\"startAutnum\":56045,\"endAutnum\":56045,\"name\":\"CMNET-Jiangxi-AP\",\"type\":null,\"country\":\"CN\",\"nicbr_routingPolicy\":[]},{\"rdapConformance\":[],\"objectClassName\":\"autnum\",\"handle\":\"AS138407\",\"port43\":null,\"lang\":null,\"events\":[{\"eventAction\":\"registration\",\"eventDate\":\"2018-11-04T23:06:36Z\",\"eventActor\":null,\"status\":[]},{\"eventAction\":\"last changed\",\"eventDate\":\"2020-07-15T13:09:54Z\",\"eventActor\":null,\"status\":[]}],\"notices\":[],\"status\":[\"active\"],\"entities\":[],\"remarks\":[{\"title\":\"description\",\"description\":[\"The Internet Data Center of Guizhou Mobile Communication Company Limited\"],\"type\":null,\"links\":null}],\"links\":[{\"value\":\"https://rdap.apnic.net/entity/ORG-CMCC1-AP\",\"rel\":\"self\",\"href\":\"https://rdap.apnic.net/autnum/138407\",\"hreflang\":null,\"title\":null,\"media\":null,\"type\":\"application/rdap+json\"},{\"value\":\"https://rdap.apnic.net/entity/ORG-CMCC1-AP\",\"rel\":\"related\",\"href\":\"https://netox.apnic.net/search/AS138407?utm_source=rdap&utm_medium=result&utm_campaign=rdap_result\",\"hreflang\":null,\"title\":null,\"media\":null,\"type\":\"text/html\"}],\"nameservers\":[],\"entity\":null,\"legalRepresentative\":null,\"errorCode\":null,\"errorTitle\":null,\"errorDescription\":[],\"startAutnum\":138407,\"endAutnum\":138407,\"name\":\"CMNET-GZIDC-CN\",\"type\":null,\"country\":\"CN\",\"nicbr_routingPolicy\":[]},{\"rdapConformance\":[],\"objectClassName\":\"autnum\",\"handle\":\"AS139080\",\"port43\":null,\"lang\":null,\"events\":[{\"eventAction\":\"registration\",\"eventDate\":\"2019-05-21T05:45:06Z\",\"eventActor\":null,\"status\":[]},{\"eventAction\":\"last changed\",\"eventDate\":\"2020-07-15T13:09:54Z\",\"eventActor\":null,\"status\":[]}],\"notices\":[],\"status\":[\"active\"],\"entities\":[],\"remarks\":[{\"title\":\"description\",\"description\":[\"The Internet Data Center of Sichuan Mobile Communication Company Limited\"],\"type\":null,\"links\":null}],\"links\":[{\"value\":\"https://rdap.apnic.net/entity/ORG-CMCC1-AP\",\"rel\":\"self\",\"href\":\"https://rdap.apnic.net/autnum/139080\",\"hreflang\":null,\"title\":null,\"media\":null,\"type\":\"application/rdap+json\"},{\"value\":\"https://rdap.apnic.net/entity/ORG-CMCC1-AP\",\"rel\":\"related\",\"href\":\"https://netox.apnic.net/search/AS139080?utm_source=rdap&utm_medium=result&utm_campaign=rdap_result\",\"hreflang\":null,\"title\":null,\"media\":null,\"type\":\"text/html\"}],\"nameservers\":[],\"entity\":null,\"legalRepresentative\":null,\"errorCode\":null,\"errorTitle\":null,\"errorDescription\":[],\"startAutnum\":139080,\"endAutnum\":139080,\"name\":\"CMNET-SCIDC-CN\",\"type\":null,\"country\":\"CN\",\"nicbr_routingPolicy\":[]},{\"rdapConformance\":[],\"objectClassName\":\"autnum\",\"handle\":\"AS140105\",\"port43\":null,\"lang\":null,\"events\":[{\"eventAction\":\"registration\",\"eventDate\":\"2020-02-14T03:23:14Z\",\"eventActor\":null,\"status\":[]},{\"eventAction\":\"last changed\",\"eventDate\":\"2020-07-15T13:09:54Z\",\"eventActor\":null,\"status\":[]}],\"notices\":[],\"status\":[\"active\"],\"entities\":[],\"remarks\":[{\"title\":\"description\",\"description\":[\"Shaanxi Mobile Communication Company Limited\",\"The Internet Data Center of Shaanxi Mobile\",\"Telecommunication Service Provider\",\"Xi'an Shaanxi\"],\"type\":null,\"links\":null}],\"links\":[{\"value\":\"https://rdap.apnic.net/entity/ORG-CMCC1-AP\",\"rel\":\"self\",\"href\":\"https://rdap.apnic.net/autnum/140105\",\"hreflang\":null,\"title\":null,\"media\":null,\"type\":\"application/rdap+json\"},{\"value\":\"https://rdap.apnic.net/entity/ORG-CMCC1-AP\",\"rel\":\"related\",\"href\":\"https://netox.apnic.net/search/AS140105?utm_source=rdap&utm_medium=result&utm_campaign=rdap_result\",\"hreflang\":null,\"title\":null,\"media\":null,\"type\":\"text/html\"}],\"nameservers\":[],\"entity\":null,\"legalRepresentative\":null,\"errorCode\":null,\"errorTitle\":null,\"errorDescription\":[],\"startAutnum\":140105,\"endAutnum\":140105,\"name\":\"CMNET-SNIDC-CN-AP\",\"type\":null,\"country\":\"CN\",\"nicbr_routingPolicy\":[]},{\"rdapConformance\":[],\"objectClassName\":\"autnum\",\"handle\":\"AS56046\",\"port43\":null,\"lang\":null,\"events\":[{\"eventAction\":\"registration\",\"eventDate\":\"2011-01-19T00:07:49Z\",\"eventActor\":null,\"status\":[]},{\"eventAction\":\"last changed\",\"eventDate\":\"2020-07-15T13:09:55Z\",\"eventActor\":null,\"status\":[]}],\"notices\":[],\"status\":[\"active\"],\"entities\":[],\"remarks\":[{\"title\":\"description\",\"description\":[\"China Mobile communications corporation\",\"the IP core network of China Mobile Group Jiangsu Company\",\"Telecommunication Service Provider\",\"No.51,huju road,Nanjing\"],\"type\":null,\"links\":null},{\"title\":\"remarks\",\"description\":[\"Please send abuse e-mail to qihuang@js.chinamobile.com\"],\"type\":null,\"links\":null}],\"links\":[{\"value\":\"https://rdap.apnic.net/entity/ORG-CMCC1-AP\",\"rel\":\"self\",\"href\":\"https://rdap.apnic.net/autnum/56046\",\"hreflang\":null,\"title\":null,\"media\":null,\"type\":\"application/rdap+json\"},{\"value\":\"https://rdap.apnic.net/entity/ORG-CMCC1-AP\",\"rel\":\"related\",\"href\":\"https://netox.apnic.net/search/AS56046?utm_source=rdap&utm_medium=result&utm_campaign=rdap_result\",\"hreflang\":null,\"title\":null,\"media\":null,\"type\":\"text/html\"}],\"nameservers\":[],\"entity\":null,\"legalRepresentative\":null,\"errorCode\":null,\"errorTitle\":null,\"errorDescription\":[],\"startAutnum\":56046,\"endAutnum\":56046,\"name\":\"CMNET-Jiangsu-AP\",\"type\":null,\"country\":\"CN\",\"nicbr_routingPolicy\":[]},{\"rdapConformance\":[],\"objectClassName\":\"autnum\",\"handle\":\"AS141425\",\"port43\":null,\"lang\":null,\"events\":[{\"eventAction\":\"registration\",\"eventDate\":\"2020-11-19T10:47:02Z\",\"eventActor\":null,\"status\":[]},{\"eventAction\":\"last changed\",\"eventDate\":\"2020-11-19T10:47:06Z\",\"eventActor\":null,\"status\":[]}],\"notices\":[],\"status\":[\"active\"],\"entities\":[],\"remarks\":[{\"title\":\"description\",\"description\":[\"China Mobile Group Guangdong communications corporation\",\"Telecommunication Service Provider\",\"No.11 ZhuJiangXi Road, TianHe District, Guangzhou, GuangDong Province,China\"],\"type\":null,\"links\":null}],\"links\":[{\"value\":\"https://rdap.apnic.net/entity/ORG-CMCC1-AP\",\"rel\":\"self\",\"href\":\"https://rdap.apnic.net/autnum/141425\",\"hreflang\":null,\"title\":null,\"media\":null,\"type\":\"application/rdap+json\"},{\"value\":\"https://rdap.apnic.net/entity/ORG-CMCC1-AP\",\"rel\":\"related\",\"href\":\"https://netox.apnic.net/search/AS141425?utm_source=rdap&utm_medium=result&utm_campaign=rdap_result\",\"hreflang\":null,\"title\":null,\"media\":null,\"type\":\"text/html\"}],\"nameservers\":[],\"entity\":null,\"legalRepresentative\":null,\"errorCode\":null,\"errorTitle\":null,\"errorDescription\":[],\"startAutnum\":141425,\"endAutnum\":141425,\"name\":\"CMNET-GUANGDONG-CN\",\"type\":null,\"country\":\"CN\",\"nicbr_routingPolicy\":[]}],\"nicbr_domainCount\":0,\"nicbr_inetCount\":0,\"nicbr_autnumCount\":0,\"url\":null,\"contact_URI\":null},{\"rdapConformance\":[\"history_version_0\",\"nro_rdap_profile_0\",\"cidr0\",\"rdap_level_0\"],\"objectClassName\":\"entity\",\"handle\":\"HL1318-AP\",\"port43\":\"whois.apnic.net\",\"lang\":null,\"events\":[{\"eventAction\":\"registration\",\"eventDate\":\"2008-09-04T07:45:35Z\",\"eventActor\":null,\"status\":[]},{\"eventAction\":\"last changed\",\"eventDate\":\"2016-11-29T09:38:38Z\",\"eventActor\":null,\"status\":[]}],\"notices\":[{\"title\":\"Source\",\"type\":null,\"description\":[\"Objects returned came from source\",\"APNIC\"],\"links\":[]},{\"title\":\"Terms and Conditions\",\"type\":null,\"description\":[\"This is the APNIC WHOIS Database query service. The objects are in RDAP format.\"],\"links\":[{\"value\":\"https://rdap.apnic.net/entity/HL1318-AP\",\"rel\":\"terms-of-service\",\"href\":\"http://www.apnic.net/db/dbcopyright.html\",\"hreflang\":null,\"title\":null,\"media\":null,\"type\":\"text/html\"}]},{\"title\":\"Whois Inaccuracy Reporting\",\"type\":null,\"description\":[\"If you see inaccuracies in the results, please visit: \"],\"links\":[{\"value\":\"https://rdap.apnic.net/entity/HL1318-AP\",\"rel\":\"inaccuracy-report\",\"href\":\"https://www.apnic.net/manage-ip/using-whois/abuse-and-spamming/invalid-contact-form\",\"hreflang\":null,\"title\":null,\"media\":null,\"type\":\"text/html\"}]}],\"status\":[],\"entities\":[],\"remarks\":[],\"links\":[{\"value\":\"https://rdap.apnic.net/entity/HL1318-AP\",\"rel\":\"self\",\"href\":\"https://rdap.apnic.net/entity/HL1318-AP\",\"hreflang\":null,\"title\":null,\"media\":null,\"type\":\"application/rdap+json\"}],\"nameservers\":[],\"entity\":null,\"legalRepresentative\":null,\"errorCode\":null,\"errorTitle\":null,\"errorDescription\":[],\"vcardArray\":[\"vcard\",[[\"version\",{},\"text\",\"4.0\"],[\"fn\",{},\"text\",\"haijun li\"],[\"kind\",{},\"text\",\"individual\"],[\"adr\",{\"label\":\"29,Jinrong Ave, Xicheng district,beijing,100032\"},\"text\",[\"\",\"\",\"29 jinrong ave\",\"xicheng district beijing\",\"\",\"100032\",\"\"]],[\"tel\",{\"type\":\"voice\"},\"text\",\"+86 1052686688\"],[\"tel\",{\"type\":\"fax\"},\"text\",\"+86 10 52616187\"],[\"email\",{},\"text\",\"hostmaster@chinamobile.com\"],[\"email\",{\"pref\":\"1\"},\"text\",\"abuse@chinamobile.com\"]]],\"roles\":[\"technical\"],\"publicIds\":[],\"networks\":null,\"autnums\":null,\"nicbr_domainCount\":0,\"nicbr_inetCount\":0,\"nicbr_autnumCount\":0,\"url\":null,\"contact_URI\":null},{\"rdapConformance\":[\"history_version_0\",\"nro_rdap_profile_0\",\"cidr0\",\"rdap_level_0\"],\"objectClassName\":\"entity\",\"handle\":\"IRT-CHINAMOBILE2-CN\",\"port43\":\"whois.apnic.net\",\"lang\":null,\"events\":[{\"eventAction\":\"registration\",\"eventDate\":\"2010-11-23T08:01:28Z\",\"eventActor\":null,\"status\":[]},{\"eventAction\":\"last changed\",\"eventDate\":\"2022-01-26T00:14:33Z\",\"eventActor\":null,\"status\":[]}],\"notices\":[{\"title\":\"Source\",\"type\":null,\"description\":[\"Objects returned came from source\",\"APNIC\"],\"links\":[]},{\"title\":\"Terms and Conditions\",\"type\":null,\"description\":[\"This is the APNIC WHOIS Database query service. The objects are in RDAP format.\"],\"links\":[{\"value\":\"https://rdap.apnic.net/entity/IRT-CHINAMOBILE2-CN\",\"rel\":\"terms-of-service\",\"href\":\"http://www.apnic.net/db/dbcopyright.html\",\"hreflang\":null,\"title\":null,\"media\":null,\"type\":\"text/html\"}]},{\"title\":\"Whois Inaccuracy Reporting\",\"type\":null,\"description\":[\"If you see inaccuracies in the results, please visit: \"],\"links\":[{\"value\":\"https://rdap.apnic.net/entity/IRT-CHINAMOBILE2-CN\",\"rel\":\"inaccuracy-report\",\"href\":\"https://www.apnic.net/manage-ip/using-whois/abuse-and-spamming/invalid-contact-form\",\"hreflang\":null,\"title\":null,\"media\":null,\"type\":\"text/html\"}]}],\"status\":[],\"entities\":[{\"rdapConformance\":[],\"objectClassName\":\"entity\",\"handle\":null,\"port43\":null,\"lang\":null,\"events\":[],\"notices\":[],\"status\":[],\"entities\":[],\"remarks\":[],\"links\":[],\"nameservers\":[],\"entity\":null,\"legalRepresentative\":null,\"errorCode\":null,\"errorTitle\":null,\"errorDescription\":[],\"vcardArray\":null,\"roles\":[\"technical\"],\"publicIds\":[],\"networks\":null,\"autnums\":null,\"nicbr_domainCount\":0,\"nicbr_inetCount\":0,\"nicbr_autnumCount\":0,\"url\":null,\"contact_URI\":null},{\"rdapConformance\":[],\"objectClassName\":\"entity\",\"handle\":\"ct74-AP\",\"port43\":null,\"lang\":null,\"events\":[{\"eventAction\":\"registration\",\"eventDate\":\"2008-09-04T07:54:17Z\",\"eventActor\":null,\"status\":[]},{\"eventAction\":\"last changed\",\"eventDate\":\"2016-11-29T09:37:27Z\",\"eventActor\":null,\"status\":[]}],\"notices\":[],\"status\":[],\"entities\":[],\"remarks\":[],\"links\":[{\"value\":\"https://rdap.apnic.net/entity/IRT-CHINAMOBILE2-CN\",\"rel\":\"self\",\"href\":\"https://rdap.apnic.net/entity/ct74-AP\",\"hreflang\":null,\"title\":null,\"media\":null,\"type\":\"application/rdap+json\"}],\"nameservers\":[],\"entity\":null,\"legalRepresentative\":null,\"errorCode\":null,\"errorTitle\":null,\"errorDescription\":[],\"vcardArray\":[\"vcard\",[[\"version\",{},\"text\",\"4.0\"],[\"fn\",{},\"text\",\"chinamobile tech\"],[\"kind\",{},\"text\",\"group\"],[\"adr\",{\"label\":\"29, Jinrong Ave.,Xicheng district\\nBeijing\"},\"text\",[\"\",\"\",\"\",\"\",\"\",\"\",\"\"]],[\"tel\",{\"type\":\"voice\"},\"text\",\"+86 5268 6688\"],[\"tel\",{\"type\":\"fax\"},\"text\",\"+86 5261 6187\"],[\"email\",{},\"text\",\"hostmaster@chinamobile.com\"],[\"email\",{\"pref\":\"1\"},\"text\",\"abuse@chinamobile.com\"]]],\"roles\":[\"admin\"],\"publicIds\":[],\"networks\":null,\"autnums\":null,\"nicbr_domainCount\":0,\"nicbr_inetCount\":0,\"nicbr_autnumCount\":0,\"url\":null,\"contact_URI\":null}],\"remarks\":[{\"title\":\"remarks\",\"description\":[\"abuse@chinamobile.com was validated on 2022-01-26\"],\"type\":null,\"links\":null}],\"links\":[{\"value\":\"https://rdap.apnic.net/entity/IRT-CHINAMOBILE2-CN\",\"rel\":\"self\",\"href\":\"https://rdap.apnic.net/entity/IRT-CHINAMOBILE2-CN\",\"hreflang\":null,\"title\":null,\"media\":null,\"type\":\"application/rdap+json\"}],\"nameservers\":[],\"entity\":null,\"legalRepresentative\":null,\"errorCode\":null,\"errorTitle\":null,\"errorDescription\":[],\"vcardArray\":[\"vcard\",[[\"version\",{},\"text\",\"4.0\"],[\"fn\",{},\"text\",\"IRT-CHINAMOBILE2-CN\"],[\"kind\",{},\"text\",\"group\"],[\"adr\",{\"label\":\"China Mobile Communications Corporation\\n29, Jinrong Ave., Xicheng District, Beijing, 100032\"},\"text\",[\"\",\"\",\"china mobile communications corporation 29 jinrong ave.\",\"xicheng district beijing\",\"\",\"100032\",\"\"]],[\"email\",{},\"text\",\"abuse@chinamobile.com\"],[\"email\",{\"pref\":\"1\"},\"text\",\"abuse@chinamobile.com\"]]],\"roles\":[\"abuse\"],\"publicIds\":[],\"networks\":null,\"autnums\":null,\"nicbr_domainCount\":0,\"nicbr_inetCount\":0,\"nicbr_autnumCount\":0,\"url\":null,\"contact_URI\":null},{\"rdapConformance\":[\"history_version_0\",\"nro_rdap_profile_0\",\"cidr0\",\"rdap_level_0\"],\"objectClassName\":\"entity\",\"handle\":\"ct74-AP\",\"port43\":\"whois.apnic.net\",\"lang\":null,\"events\":[{\"eventAction\":\"registration\",\"eventDate\":\"2008-09-04T07:54:17Z\",\"eventActor\":null,\"status\":[]},{\"eventAction\":\"last changed\",\"eventDate\":\"2016-11-29T09:37:27Z\",\"eventActor\":null,\"status\":[]}],\"notices\":[{\"title\":\"Source\",\"type\":null,\"description\":[\"Objects returned came from source\",\"APNIC\"],\"links\":[]},{\"title\":\"Terms and Conditions\",\"type\":null,\"description\":[\"This is the APNIC WHOIS Database query service. The objects are in RDAP format.\"],\"links\":[{\"value\":\"https://rdap.apnic.net/entity/ct74-AP\",\"rel\":\"terms-of-service\",\"href\":\"http://www.apnic.net/db/dbcopyright.html\",\"hreflang\":null,\"title\":null,\"media\":null,\"type\":\"text/html\"}]},{\"title\":\"Whois Inaccuracy Reporting\",\"type\":null,\"description\":[\"If you see inaccuracies in the results, please visit: \"],\"links\":[{\"value\":\"https://rdap.apnic.net/entity/ct74-AP\",\"rel\":\"inaccuracy-report\",\"href\":\"https://www.apnic.net/manage-ip/using-whois/abuse-and-spamming/invalid-contact-form\",\"hreflang\":null,\"title\":null,\"media\":null,\"type\":\"text/html\"}]}],\"status\":[],\"entities\":[{\"rdapConformance\":[],\"objectClassName\":\"entity\",\"handle\":\"HL1318-AP\",\"port43\":null,\"lang\":null,\"events\":[{\"eventAction\":\"registration\",\"eventDate\":\"2008-09-04T07:45:35Z\",\"eventActor\":null,\"status\":[]},{\"eventAction\":\"last changed\",\"eventDate\":\"2016-11-29T09:38:38Z\",\"eventActor\":null,\"status\":[]}],\"notices\":[],\"status\":[],\"entities\":[],\"remarks\":[],\"links\":[{\"value\":\"https://rdap.apnic.net/entity/ct74-AP\",\"rel\":\"self\",\"href\":\"https://rdap.apnic.net/entity/HL1318-AP\",\"hreflang\":null,\"title\":null,\"media\":null,\"type\":\"application/rdap+json\"}],\"nameservers\":[],\"entity\":null,\"legalRepresentative\":null,\"errorCode\":null,\"errorTitle\":null,\"errorDescription\":[],\"vcardArray\":[\"vcard\",[[\"version\",{},\"text\",\"4.0\"],[\"fn\",{},\"text\",\"haijun li\"],[\"kind\",{},\"text\",\"individual\"],[\"adr\",{\"label\":\"29,Jinrong Ave, Xicheng district,beijing,100032\"},\"text\",[\"\",\"\",\"\",\"\",\"\",\"\",\"\"]],[\"tel\",{\"type\":\"voice\"},\"text\",\"+86 1052686688\"],[\"tel\",{\"type\":\"fax\"},\"text\",\"+86 10 52616187\"],[\"email\",{},\"text\",\"hostmaster@chinamobile.com\"],[\"email\",{\"pref\":\"1\"},\"text\",\"abuse@chinamobile.com\"]]],\"roles\":[\"technical\",\"admin\"],\"publicIds\":[],\"networks\":null,\"autnums\":null,\"nicbr_domainCount\":0,\"nicbr_inetCount\":0,\"nicbr_autnumCount\":0,\"url\":null,\"contact_URI\":null}],\"remarks\":[],\"links\":[{\"value\":\"https://rdap.apnic.net/entity/ct74-AP\",\"rel\":\"self\",\"href\":\"https://rdap.apnic.net/entity/ct74-AP\",\"hreflang\":null,\"title\":null,\"media\":null,\"type\":\"application/rdap+json\"}],\"nameservers\":[],\"entity\":null,\"legalRepresentative\":null,\"errorCode\":null,\"errorTitle\":null,\"errorDescription\":[],\"vcardArray\":[\"vcard\",[[\"version\",{},\"text\",\"4.0\"],[\"fn\",{},\"text\",\"chinamobile tech\"],[\"kind\",{},\"text\",\"group\"],[\"adr\",{\"label\":\"29, Jinrong Ave.,Xicheng district\\nBeijing\"},\"text\",[\"\",\"\",\"29 jinrong ave.\",\"xicheng district beijing\",\"\",\"\",\"\"]],[\"tel\",{\"type\":\"voice\"},\"text\",\"+86 5268 6688\"],[\"tel\",{\"type\":\"fax\"},\"text\",\"+86 5261 6187\"],[\"email\",{},\"text\",\"hostmaster@chinamobile.com\"],[\"email\",{\"pref\":\"1\"},\"text\",\"abuse@chinamobile.com\"]]],\"roles\":[\"admin\"],\"publicIds\":[],\"networks\":null,\"autnums\":null,\"nicbr_domainCount\":0,\"nicbr_inetCount\":0,\"nicbr_autnumCount\":0,\"url\":null,\"contact_URI\":null}],\"remarks\":[{\"title\":\"description\",\"description\":[\"China Mobile Communications Corporation\",\"Mobile Communications Network Operator in China\",\"Internet Service Provider in China\"],\"type\":null,\"links\":null},{\"title\":\"remarks\",\"description\":[\"service provider\",\"--------------------------------------------------------\",\"To report network abuse, please contact mnt-irt\",\"For troubleshooting, please contact tech-c and admin-c\",\"Report invalid contact via www.apnic.net/invalidcontact\",\"--------------------------------------------------------\"],\"type\":null,\"links\":null}],\"links\":[{\"value\":\"https://rdap.apnic.net/ip/112.27.80.120\",\"rel\":\"self\",\"href\":\"https://rdap.apnic.net/ip/112.0.0.0/10\",\"hreflang\":null,\"title\":null,\"media\":null,\"type\":\"application/rdap+json\"},{\"value\":\"https://rdap.apnic.net/ip/112.27.80.120\",\"rel\":\"related\",\"href\":\"https://netox.apnic.net/search/112.0.0.0%2F10?utm_source=rdap&utm_medium=result&utm_campaign=rdap_result\",\"hreflang\":null,\"title\":null,\"media\":null,\"type\":\"text/html\"}],\"nameservers\":[],\"entity\":null,\"legalRepresentative\":null,\"errorCode\":null,\"errorTitle\":null,\"errorDescription\":[],\"startAddress\":\"112.0.0.0\",\"endAddress\":\"112.63.255.255\",\"ipVersion\":\"v4\",\"name\":\"CMNET\",\"type\":\"ALLOCATED PORTABLE\",\"country\":\"CN\",\"parentHandle\":null,\"cidr0_cidrs\":[{\"v4prefix\":\"112.0.0.0\",\"v6prefix\":null,\"length\":\"10\"}],\"arin_originas0_originautnums\":[],\"lacnic_originAutnum\":null,\"lacnic_reverseDelegations\":[],\"lacnic_legalRepresentative\":null,\"nicbr_autnum\":null,\"nicbr_reverseDelegations\":[],\"secureDNS\":null}", "raw": "IP Network: \n  Handle: 112.0.0.0 - 112.63.255.255\n  Start Address: 112.0.0.0\n  End Address: 112.63.255.255\n  IP Version: v4\n  Name: CMNET\n  Type: ALLOCATED PORTABLE\n  Country: CN\n  Port43: whois.apnic.net\n\n  Cidr: \n    Prefix: 112.0.0.0\n    Length: 10\n  Event: \n    Action: registration\n    Date: 2008-12-15T04:05:15Z\n  Event: \n    Action: last changed\n    Date: 2020-12-15T02:55:47Z\n    Status: active\n  Entity: \n    Handle: ORG-CMCC1-AP\n    Role: \n      REGISTRANT\n    VCard: \n      Formatted Name: China Mobile Communications Corporation\n      Kind: org\n      Address: \n          Street: 29 jinrong ave. xicheng\n          Locale: district\n        LABEL: \n          29,Jinrong Ave.,\n          Xicheng District,\n      Telephone: +861052686688\n          TYPE: voice\n      Telephone: +861052616187\n          TYPE: fax\n      Email: hostmaster@chinamobile.com\n    Event: \n      Action: registration\n      Date: 2018-01-20T12:57:51Z\n    Event: \n      Action: last changed\n      Date: 2018-01-20T12:57:51Z\n    Link: \n      Rel: self\n      Value: https://rdap.apnic.net/entity/ORG-CMCC1-AP\n      Type: application/rdap+json\n      Href: https://rdap.apnic.net/entity/ORG-CMCC1-AP\n    Notice: \n      Title: Source\n      Description: \n        Objects returned came from source\n        APNIC\n    Notice: \n      Title: Terms and Conditions\n        Description: This is the APNIC WHOIS Database query service. The objects are in RDAP format.\n        Link: \n          Rel: terms-of-service\n          Value: https://rdap.apnic.net/entity/ORG-CMCC1-AP\n          Type: text/html\n          Href: http://www.apnic.net/db/dbcopyright.html\n    Notice: \n      Title: Whois Inaccuracy Reporting\n        Description: If you see inaccuracies in the results, please visit: \n        Link: \n          Rel: inaccuracy-report\n          Value: https://rdap.apnic.net/entity/ORG-CMCC1-AP\n          Type: text/html\n          Href: https://www.apnic.net/manage-ip/using-whois/abuse-and-spamming/invalid-contact-form\n    RDAP Conformance: \n      history_version_0\n      nro_rdap_profile_0\n      cidr0\n      rdap_level_0\n  Entity: \n    Handle: HL1318-AP\n    Role: \n      TECHNICAL\n    VCard: \n      Formatted Name: haijun li\n      Kind: individual\n      Address: \n          Street: 29 jinrong ave\n          Locale: xicheng district beijing\n          Postal Code: 100032\n          LABEL: 29,Jinrong Ave, Xicheng district,beijing,100032\n      Telephone: +86 1052686688\n          TYPE: voice\n      Telephone: +86 10 52616187\n          TYPE: fax\n      Email: hostmaster@chinamobile.com\n      Email: abuse@chinamobile.com\n          PREF: 1\n    Event: \n      Action: registration\n      Date: 2008-09-04T07:45:35Z\n    Event: \n      Action: last changed\n      Date: 2016-11-29T09:38:38Z\n    Link: \n      Rel: self\n      Value: https://rdap.apnic.net/entity/HL1318-AP\n      Type: application/rdap+json\n      Href: https://rdap.apnic.net/entity/HL1318-AP\n    Notice: \n      Title: Source\n      Description: \n        Objects returned came from source\n        APNIC\n    Notice: \n      Title: Terms and Conditions\n        Description: This is the APNIC WHOIS Database query service. The objects are in RDAP format.\n        Link: \n          Rel: terms-of-service\n          Value: https://rdap.apnic.net/entity/HL1318-AP\n          Type: text/html\n          Href: http://www.apnic.net/db/dbcopyright.html\n    Notice: \n      Title: Whois Inaccuracy Reporting\n        Description: If you see inaccuracies in the results, please visit: \n        Link: \n          Rel: inaccuracy-report\n          Value: https://rdap.apnic.net/entity/HL1318-AP\n          Type: text/html\n          Href: https://www.apnic.net/manage-ip/using-whois/abuse-and-spamming/invalid-contact-form\n    RDAP Conformance: \n      history_version_0\n      nro_rdap_profile_0\n      cidr0\n      rdap_level_0\n  Entity: \n    Handle: IRT-CHINAMOBILE2-CN\n    Role: \n      ABUSE\n    VCard: \n      Formatted Name: IRT-CHINAMOBILE2-CN\n      Kind: group\n      Address: \n          Street: china mobile communications corporation 29 jinrong ave.\n          Locale: xicheng district beijing\n          Postal Code: 100032\n        LABEL: \n          China Mobile Communications Corporation\n          29, Jinrong Ave., Xicheng District, Beijing, 100032\n      Email: abuse@chinamobile.com\n      Email: abuse@chinamobile.com\n          PREF: 1\n    Event: \n      Action: registration\n      Date: 2010-11-23T08:01:28Z\n    Event: \n      Action: last changed\n      Date: 2022-01-26T00:14:33Z\n    Entity: \n      Role: \n        TECHNICAL\n    Entity: \n      Handle: ct74-AP\n      Role: \n        ADMIN\n      VCard: \n        Formatted Name: chinamobile tech\n        Kind: group\n        Address: \n          LABEL: \n            29, Jinrong Ave.,Xicheng district\n            Beijing\n        Telephone: +86 5268 6688\n            TYPE: voice\n        Telephone: +86 5261 6187\n            TYPE: fax\n        Email: hostmaster@chinamobile.com\n        Email: abuse@chinamobile.com\n            PREF: 1\n      Event: \n        Action: registration\n        Date: 2008-09-04T07:54:17Z\n      Event: \n        Action: last changed\n        Date: 2016-11-29T09:37:27Z\n      Link: \n        Rel: self\n        Value: https://rdap.apnic.net/entity/IRT-CHINAMOBILE2-CN\n        Type: application/rdap+json\n        Href: https://rdap.apnic.net/entity/ct74-AP\n    Remark: \n      Title: remarks\n        Description: abuse@chinamobile.com was validated on 2022-01-26\n    Link: \n      Rel: self\n      Value: https://rdap.apnic.net/entity/IRT-CHINAMOBILE2-CN\n      Type: application/rdap+json\n      Href: https://rdap.apnic.net/entity/IRT-CHINAMOBILE2-CN\n    Notice: \n      Title: Source\n      Description: \n        Objects returned came from source\n        APNIC\n    Notice: \n      Title: Terms and Conditions\n        Description: This is the APNIC WHOIS Database query service. The objects are in RDAP format.\n        Link: \n          Rel: terms-of-service\n          Value: https://rdap.apnic.net/entity/IRT-CHINAMOBILE2-CN\n          Type: text/html\n          Href: http://www.apnic.net/db/dbcopyright.html\n    Notice: \n      Title: Whois Inaccuracy Reporting\n        Description: If you see inaccuracies in the results, please visit: \n        Link: \n          Rel: inaccuracy-report\n          Value: https://rdap.apnic.net/entity/IRT-CHINAMOBILE2-CN\n          Type: text/html\n          Href: https://www.apnic.net/manage-ip/using-whois/abuse-and-spamming/invalid-contact-form\n    RDAP Conformance: \n      history_version_0\n      nro_rdap_profile_0\n      cidr0\n      rdap_level_0\n  Entity: \n    Handle: ct74-AP\n    Role: \n      ADMIN\n    VCard: \n      Formatted Name: chinamobile tech\n      Kind: group\n      Address: \n          Street: 29 jinrong ave.\n          Locale: xicheng district beijing\n        LABEL: \n          29, Jinrong Ave.,Xicheng district\n          Beijing\n      Telephone: +86 5268 6688\n          TYPE: voice\n      Telephone: +86 5261 6187\n          TYPE: fax\n      Email: hostmaster@chinamobile.com\n      Email: abuse@chinamobile.com\n          PREF: 1\n    Event: \n      Action: registration\n      Date: 2008-09-04T07:54:17Z\n    Event: \n      Action: last changed\n      Date: 2016-11-29T09:37:27Z\n    Entity: \n      Handle: HL1318-AP\n      Role: \n        TECHNICAL\n        ADMIN\n      VCard: \n        Formatted Name: haijun li\n        Kind: individual\n        Address: \n            LABEL: 29,Jinrong Ave, Xicheng district,beijing,100032\n        Telephone: +86 1052686688\n            TYPE: voice\n        Telephone: +86 10 52616187\n            TYPE: fax\n        Email: hostmaster@chinamobile.com\n        Email: abuse@chinamobile.com\n            PREF: 1\n      Event: \n        Action: registration\n        Date: 2008-09-04T07:45:35Z\n      Event: \n        Action: last changed\n        Date: 2016-11-29T09:38:38Z\n      Link: \n        Rel: self\n        Value: https://rdap.apnic.net/entity/ct74-AP\n        Type: application/rdap+json\n        Href: https://rdap.apnic.net/entity/HL1318-AP\n    Link: \n      Rel: self\n      Value: https://rdap.apnic.net/entity/ct74-AP\n      Type: application/rdap+json\n      Href: https://rdap.apnic.net/entity/ct74-AP\n    Notice: \n      Title: Source\n      Description: \n        Objects returned came from source\n        APNIC\n    Notice: \n      Title: Terms and Conditions\n        Description: This is the APNIC WHOIS Database query service. The objects are in RDAP format.\n        Link: \n          Rel: terms-of-service\n          Value: https://rdap.apnic.net/entity/ct74-AP\n          Type: text/html\n          Href: http://www.apnic.net/db/dbcopyright.html\n    Notice: \n      Title: Whois Inaccuracy Reporting\n        Description: If you see inaccuracies in the results, please visit: \n        Link: \n          Rel: inaccuracy-report\n          Value: https://rdap.apnic.net/entity/ct74-AP\n          Type: text/html\n          Href: https://www.apnic.net/manage-ip/using-whois/abuse-and-spamming/invalid-contact-form\n    RDAP Conformance: \n      history_version_0\n      nro_rdap_profile_0\n      cidr0\n      rdap_level_0\n  Remark: \n    Title: description\n    Description: \n      China Mobile Communications Corporation\n      Mobile Communications Network Operator in China\n      Internet Service Provider in China\n  Remark: \n    Title: remarks\n    Description: \n      service provider\n      --------------------------------------------------------\n      To report network abuse, please contact mnt-irt\n      For troubleshooting, please contact tech-c and admin-c\n      Report invalid contact via www.apnic.net/invalidcontact\n      --------------------------------------------------------\n  Link: \n    Rel: self\n    Value: https://rdap.apnic.net/ip/112.27.80.120\n    Type: application/rdap+json\n    Href: https://rdap.apnic.net/ip/112.0.0.0/10\n  Link: \n    Rel: related\n    Value: https://rdap.apnic.net/ip/112.27.80.120\n    Type: text/html\n    Href: https://netox.apnic.net/search/112.0.0.0%2F10?utm_source=rdap&utm_medium=result&utm_campaign=rdap_result\n  Notice: \n    Title: Source\n    Description: \n      Objects returned came from source\n      APNIC\n  Notice: \n    Title: Terms and Conditions\n      Description: This is the APNIC WHOIS Database query service. The objects are in RDAP format.\n      Link: \n        Rel: terms-of-service\n        Value: https://rdap.apnic.net/ip/112.27.80.120\n        Type: text/html\n        Href: http://www.apnic.net/db/dbcopyright.html\n  Notice: \n    Title: Whois Inaccuracy Reporting\n      Description: If you see inaccuracies in the results, please visit: \n      Link: \n        Rel: inaccuracy-report\n        Value: https://rdap.apnic.net/ip/112.27.80.120\n        Type: text/html\n        Href: https://www.apnic.net/manage-ip/using-whois/abuse-and-spamming/invalid-contact-form\n  RDAP Conformance: \n    history_version_0\n    nro_rdap_profile_0\n    cidr0\n    rdap_level_0\n", "whoisRawID": 0, "source": "WHOIS_RDAP"}, "registrarUpdatedAt": 1608000947, "whoisID": 6800505882083444902, "registrarName": "APNIC", "admin": {"address": "29 jinrong ave.\nxicheng district beijing\n", "city": "xicheng district beijing", "phone": "+86 5268 6688", "whoisContactID": 0, "street": "29 jinrong ave.", "name": "chinamobile tech", "id": 0, "fax": "+86 5261 6187", "email": "hostmaster@chinamobile.com,abuse@chinamobile.com"}, "whoisServer": "rdap.apnic.net", "createdAt": 1621366949, "expired": false, "contactOrganizations": [], "registrarParseCode": 11553, "netRange": {"netName": "CMNET", "numericEnd": 1883242495, "netRange": "112.0.0.0 - 112.63.255.255", "originAS": "AS9808", "whoisNetRangeID": 0, "numericStart": 1879048192, "status": "INACTIVE", "ipStart": "112.0.0.0", "ipEnd": "112.63.255.255"}, "auditUpdatedAt": 1666802404, "id": 6800505882083444902, "updatedAt": 1666802404, "domainUnicode": "112.0.0.0", "auditCreatedAt": 1621366949, "contactCountries": [], "compositeParseCode": 11553, "contactEmails": ["hostmaster@chinamobile.com", "hostmaster@chinamobile.com,abuse@chinamobile.com", "abuse@chinamobile.com"], "domainStatus": "active", "tld": "ipv4", "domainAvailable": false, "registrarCreatedAt": 1229313915, "noRecord": false, "nameservers": [], "domain": "112.0.0.0", "registrant": {"address": "29 jinrong ave. xicheng\ndistrict\n", "city": "district", "phone": "+861052686688", "whoisContactID": 0, "street": "29 jinrong ave. xicheng", "name": "China Mobile Communications Corporation", "id": 0, "fax": "+861052616187", "email": "hostmaster@chinamobile.com"}, "contactNames": ["China Mobile Communications Corporation", "chinamobile tech", "haijun li", "IRT-CHINAMOBILE2-CN"], "contacts": [{"address": "29 jinrong ave. xicheng\ndistrict\n", "city": "district", "phone": "+861052686688", "whoisContactID": 0, "street": "29 jinrong ave. xicheng", "name": "China Mobile Communications Corporation", "id": 0, "fax": "+861052616187", "email": "hostmaster@chinamobile.com"}, {"address": "29 jinrong ave.\nxicheng district beijing\n", "city": "xicheng district beijing", "phone": "+86 5268 6688", "whoisContactID": 0, "street": "29 jinrong ave.", "name": "chinamobile tech", "id": 0, "fax": "+86 5261 6187", "email": "hostmaster@chinamobile.com,abuse@chinamobile.com"}, {"zip": "100032", "address": "29 jinrong ave\nxicheng district beijing\n100032\n", "city": "xicheng district beijing", "phone": "+86 1052686688", "whoisContactID": 0, "street": "29 jinrong ave", "name": "haijun li", "id": 0, "fax": "+86 10 52616187", "email": "hostmaster@chinamobile.com,abuse@chinamobile.com"}, {"zip": "100032", "address": "china mobile communications corporation 29 jinrong ave.\nxicheng district beijing\n100032\n", "city": "xicheng district beijing", "whoisContactID": 0, "street": "china mobile communications corporation 29 jinrong ave.", "name": "IRT-CHINAMOBILE2-CN", "id": 0, "email": "abuse@chinamobile.com"}], "status": "ACTIVE", "domainMd5": "af7ce139ebe6615d9579100b6bc83dba", "task_id": "b362c50d69774fab93c00ad834e39e7d"}, {"abuse": {"zip": "100032", "address": "china mobile communications corporation 29 jinrong ave.\nxicheng district beijing\n100032\n", "city": "xicheng district beijing", "whoisContactID": 0, "street": "china mobile communications corporation 29 jinrong ave.", "name": "IRT-CHINAMOBILE-CN", "id": 0, "email": "abuse@chinamobile.com"}, "rawResponse": {"domain": "112.0.0.0", "whoisID": 6779198303830567949, "unparsed": "{\"rdapConformance\":[\"history_version_0\",\"cidr0\",\"rdap_level_0\"],\"objectClassName\":\"ip network\",\"handle\":\"112.0.0.0 - 112.4.255.255\",\"port43\":\"whois.apnic.net\",\"lang\":null,\"events\":[],\"notices\":[{\"title\":\"Source\",\"type\":null,\"description\":[\"Objects returned came from source\",\"APNIC\"],\"links\":[]},{\"title\":\"Terms and Conditions\",\"type\":null,\"description\":[\"This is the APNIC WHOIS Database query service. The objects are in RDAP format.\"],\"links\":[{\"value\":\"https://rdap.apnic.net/ip/112.0.0.0\",\"rel\":\"terms-of-service\",\"href\":\"http://www.apnic.net/db/dbcopyright.html\",\"hreflang\":null,\"title\":null,\"media\":null,\"type\":\"text/html\"}]}],\"status\":[],\"entities\":[{\"rdapConformance\":[\"history_version_0\",\"cidr0\",\"rdap_level_0\"],\"objectClassName\":\"entity\",\"handle\":\"HL1318-AP\",\"port43\":\"whois.apnic.net\",\"lang\":null,\"events\":[{\"eventAction\":\"last changed\",\"eventDate\":\"2016-11-29T09:38:38Z\",\"eventActor\":null,\"status\":[]}],\"notices\":[{\"title\":\"Source\",\"type\":null,\"description\":[\"Objects returned came from source\",\"APNIC\"],\"links\":[]},{\"title\":\"Terms and Conditions\",\"type\":null,\"description\":[\"This is the APNIC WHOIS Database query service. The objects are in RDAP format.\"],\"links\":[{\"value\":\"https://rdap.apnic.net/entity/HL1318-AP\",\"rel\":\"terms-of-service\",\"href\":\"http://www.apnic.net/db/dbcopyright.html\",\"hreflang\":null,\"title\":null,\"media\":null,\"type\":\"text/html\"}]}],\"status\":[],\"entities\":[],\"remarks\":[],\"links\":[{\"value\":\"https://rdap.apnic.net/entity/HL1318-AP\",\"rel\":\"self\",\"href\":\"https://rdap.apnic.net/entity/HL1318-AP\",\"hreflang\":null,\"title\":null,\"media\":null,\"type\":\"application/rdap+json\"}],\"nameservers\":[],\"entity\":null,\"errorCode\":null,\"errorTitle\":null,\"errorDescription\":[],\"vcardArray\":[\"vcard\",[[\"version\",{},\"text\",\"4.0\"],[\"fn\",{},\"text\",\"haijun li\"],[\"kind\",{},\"text\",\"individual\"],[\"adr\",{\"label\":\"29,Jinrong Ave, Xicheng district,beijing,100032\"},\"text\",[\"\",\"\",\"29 jinrong ave\",\"xicheng district beijing\",\"\",\"100032\",\"\"]],[\"tel\",{\"type\":\"voice\"},\"text\",\"+86 1052686688\"],[\"tel\",{\"type\":\"fax\"},\"text\",\"+86 10 52616187\"],[\"email\",{},\"text\",\"hostmaster@chinamobile.com\"],[\"email\",{\"pref\":\"1\"},\"text\",\"abuse@chinamobile.com\"]]],\"roles\":[\"admin\"],\"publicIds\":[],\"legalRepresentative\":null,\"networks\":null,\"autnums\":null,\"nicbr_domainCount\":0,\"nicbr_inetCount\":0,\"nicbr_autnumCount\":0,\"contact_URI\":null},{\"rdapConformance\":[\"history_version_0\",\"cidr0\",\"rdap_level_0\"],\"objectClassName\":\"entity\",\"handle\":\"IRT-CHINAMOBILE-CN\",\"port43\":\"whois.apnic.net\",\"lang\":null,\"events\":[{\"eventAction\":\"last changed\",\"eventDate\":\"2021-01-20T01:06:54Z\",\"eventActor\":null,\"status\":[]}],\"notices\":[{\"title\":\"Source\",\"type\":null,\"description\":[\"Objects returned came from source\",\"APNIC\"],\"links\":[]},{\"title\":\"Terms and Conditions\",\"type\":null,\"description\":[\"This is the APNIC WHOIS Database query service. The objects are in RDAP format.\"],\"links\":[{\"value\":\"https://rdap.apnic.net/entity/IRT-CHINAMOBILE-CN\",\"rel\":\"terms-of-service\",\"href\":\"http://www.apnic.net/db/dbcopyright.html\",\"hreflang\":null,\"title\":null,\"media\":null,\"type\":\"text/html\"}]}],\"status\":[],\"entities\":[{\"rdapConformance\":[],\"objectClassName\":\"entity\",\"handle\":null,\"port43\":null,\"lang\":null,\"events\":[],\"notices\":[],\"status\":[],\"entities\":[],\"remarks\":[],\"links\":[],\"nameservers\":[],\"entity\":null,\"errorCode\":null,\"errorTitle\":null,\"errorDescription\":[],\"vcardArray\":null,\"roles\":[\"technical\",\"admin\"],\"publicIds\":[],\"legalRepresentative\":null,\"networks\":null,\"autnums\":null,\"nicbr_domainCount\":0,\"nicbr_inetCount\":0,\"nicbr_autnumCount\":0,\"contact_URI\":null}],\"remarks\":[{\"title\":\"remarks\",\"description\":[\"abuse@chinamobile.com was validated on 2021-01-20\"],\"type\":null,\"links\":null}],\"links\":[{\"value\":\"https://rdap.apnic.net/entity/IRT-CHINAMOBILE-CN\",\"rel\":\"self\",\"href\":\"https://rdap.apnic.net/entity/IRT-CHINAMOBILE-CN\",\"hreflang\":null,\"title\":null,\"media\":null,\"type\":\"application/rdap+json\"}],\"nameservers\":[],\"entity\":null,\"errorCode\":null,\"errorTitle\":null,\"errorDescription\":[],\"vcardArray\":[\"vcard\",[[\"version\",{},\"text\",\"4.0\"],[\"fn\",{},\"text\",\"IRT-CHINAMOBILE-CN\"],[\"kind\",{},\"text\",\"group\"],[\"adr\",{\"label\":\"China Mobile Communications Corporation\\n29, Jinrong Ave., Xicheng District, Beijing, 100032\"},\"text\",[\"\",\"\",\"china mobile communications corporation 29 jinrong ave.\",\"xicheng district beijing\",\"\",\"100032\",\"\"]],[\"email\",{},\"text\",\"abuse@chinamobile.com\"],[\"email\",{\"pref\":\"1\"},\"text\",\"abuse@chinamobile.com\"]]],\"roles\":[\"abuse\"],\"publicIds\":[],\"legalRepresentative\":null,\"networks\":null,\"autnums\":null,\"nicbr_domainCount\":0,\"nicbr_inetCount\":0,\"nicbr_autnumCount\":0,\"contact_URI\":null},{\"rdapConformance\":[],\"objectClassName\":\"entity\",\"handle\":null,\"port43\":null,\"lang\":null,\"events\":[],\"notices\":[],\"status\":[],\"entities\":[],\"remarks\":[],\"links\":[],\"nameservers\":[],\"entity\":null,\"errorCode\":null,\"errorTitle\":null,\"errorDescription\":[],\"vcardArray\":null,\"roles\":[\"technical\"],\"publicIds\":[],\"legalRepresentative\":null,\"networks\":null,\"autnums\":null,\"nicbr_domainCount\":0,\"nicbr_inetCount\":0,\"nicbr_autnumCount\":0,\"contact_URI\":null}],\"remarks\":[{\"title\":\"description\",\"description\":[\"China Mobile Communications Corporation\"],\"type\":null,\"links\":null}],\"links\":[{\"value\":\"https://rdap.apnic.net/ip/112.0.0.0\",\"rel\":\"self\",\"href\":\"https://rdap.apnic.net/ip/112.0.0.0/13\",\"hreflang\":null,\"title\":null,\"media\":null,\"type\":\"application/rdap+json\"},{\"value\":\"https://rdap.apnic.net/ip/112.0.0.0\",\"rel\":\"related\",\"href\":\"https://netox.apnic.net/search/112.4.0.0%2F16?utm_source=rdap&utm_medium=result&utm_campaign=rdap_result\",\"hreflang\":null,\"title\":null,\"media\":null,\"type\":\"text/html\"},{\"value\":\"https://rdap.apnic.net/ip/112.0.0.0\",\"rel\":\"related\",\"href\":\"https://netox.apnic.net/search/112.0.0.0%2F14?utm_source=rdap&utm_medium=result&utm_campaign=rdap_result\",\"hreflang\":null,\"title\":null,\"media\":null,\"type\":\"text/html\"}],\"nameservers\":[],\"entity\":null,\"errorCode\":null,\"errorTitle\":null,\"errorDescription\":[],\"startAddress\":\"112.0.0.0\",\"endAddress\":\"112.4.255.255\",\"ipVersion\":\"v4\",\"name\":\"CMNET-JIANGSU\",\"type\":\"ALLOCATED NON-PORTABLE\",\"country\":\"CN\",\"parentHandle\":null,\"cidr0_cidrs\":[{\"v4prefix\":\"112.4.0.0\",\"v6prefix\":null,\"length\":\"16\"},{\"v4prefix\":\"112.0.0.0\",\"v6prefix\":null,\"length\":\"14\"}],\"arin_originas0_originautnums\":[],\"lacnic_originAutnum\":null,\"lacnic_reverseDelegations\":[],\"lacnic_legalRepresentative\":null,\"nicbr_autnum\":null,\"nicbr_reverseDelegations\":[]}", "raw": "IP Network: \n  Handle: 112.0.0.0 - 112.4.255.255\n  Start Address: 112.0.0.0\n  End Address: 112.4.255.255\n  IP Version: v4\n  Name: CMNET-JIANGSU\n  Type: ALLOCATED NON-PORTABLE\n  Country: CN\n  Port43: whois.apnic.net\n\n  Cidr: \n    Prefix: 112.4.0.0\n    Length: 16\n  Cidr: \n    Prefix: 112.0.0.0\n    Length: 14\n  Entity: \n    Handle: HL1318-AP\n    Role: \n      ADMIN\n    VCard: \n      Formatted Name: haijun li\n      Kind: individual\n      Address: \n          Street: 29 jinrong ave\n          Locale: xicheng district beijing\n          Postal Code: 100032\n          LABEL: 29,Jinrong Ave, Xicheng district,beijing,100032\n      Telephone: +86 1052686688\n          TYPE: voice\n      Telephone: +86 10 52616187\n          TYPE: fax\n      Email: hostmaster@chinamobile.com\n      Email: abuse@chinamobile.com\n          PREF: 1\n    Event: \n      Action: last changed\n      Date: 2016-11-29T09:38:38Z\n    Link: \n      Rel: self\n      Value: https://rdap.apnic.net/entity/HL1318-AP\n      Type: application/rdap+json\n      Href: https://rdap.apnic.net/entity/HL1318-AP\n    Notice: \n      Title: Source\n      Description: \n        Objects returned came from source\n        APNIC\n    Notice: \n      Title: Terms and Conditions\n        Description: This is the APNIC WHOIS Database query service. The objects are in RDAP format.\n        Link: \n          Rel: terms-of-service\n          Value: https://rdap.apnic.net/entity/HL1318-AP\n          Type: text/html\n          Href: http://www.apnic.net/db/dbcopyright.html\n    RDAP Conformance: \n      history_version_0\n      cidr0\n      rdap_level_0\n  Entity: \n    Handle: IRT-CHINAMOBILE-CN\n    Role: \n      ABUSE\n    VCard: \n      Formatted Name: IRT-CHINAMOBILE-CN\n      Kind: group\n      Address: \n          Street: china mobile communications corporation 29 jinrong ave.\n          Locale: xicheng district beijing\n          Postal Code: 100032\n        LABEL: \n          China Mobile Communications Corporation\n          29, Jinrong Ave., Xicheng District, Beijing, 100032\n      Email: abuse@chinamobile.com\n      Email: abuse@chinamobile.com\n          PREF: 1\n    Event: \n      Action: last changed\n      Date: 2021-01-20T01:06:54Z\n    Entity: \n      Role: \n        TECHNICAL\n        ADMIN\n    Remark: \n      Title: remarks\n        Description: abuse@chinamobile.com was validated on 2021-01-20\n    Link: \n      Rel: self\n      Value: https://rdap.apnic.net/entity/IRT-CHINAMOBILE-CN\n      Type: application/rdap+json\n      Href: https://rdap.apnic.net/entity/IRT-CHINAMOBILE-CN\n    Notice: \n      Title: Source\n      Description: \n        Objects returned came from source\n        APNIC\n    Notice: \n      Title: Terms and Conditions\n        Description: This is the APNIC WHOIS Database query service. The objects are in RDAP format.\n        Link: \n          Rel: terms-of-service\n          Value: https://rdap.apnic.net/entity/IRT-CHINAMOBILE-CN\n          Type: text/html\n          Href: http://www.apnic.net/db/dbcopyright.html\n    RDAP Conformance: \n      history_version_0\n      cidr0\n      rdap_level_0\n  Entity: \n    Role: \n      TECHNICAL\n  Remark: \n    Title: description\n      Description: China Mobile Communications Corporation\n  Link: \n    Rel: self\n    Value: https://rdap.apnic.net/ip/112.0.0.0\n    Type: application/rdap+json\n    Href: https://rdap.apnic.net/ip/112.0.0.0/13\n  Link: \n    Rel: related\n    Value: https://rdap.apnic.net/ip/112.0.0.0\n    Type: text/html\n    Href: https://netox.apnic.net/search/112.4.0.0%2F16?utm_source=rdap&utm_medium=result&utm_campaign=rdap_result\n  Link: \n    Rel: related\n    Value: https://rdap.apnic.net/ip/112.0.0.0\n    Type: text/html\n    Href: https://netox.apnic.net/search/112.0.0.0%2F14?utm_source=rdap&utm_medium=result&utm_campaign=rdap_result\n  Notice: \n    Title: Source\n    Description: \n      Objects returned came from source\n      APNIC\n  Notice: \n    Title: Terms and Conditions\n      Description: This is the APNIC WHOIS Database query service. The objects are in RDAP format.\n      Link: \n        Rel: terms-of-service\n        Value: https://rdap.apnic.net/ip/112.0.0.0\n        Type: text/html\n        Href: http://www.apnic.net/db/dbcopyright.html\n  RDAP Conformance: \n    history_version_0\n    cidr0\n    rdap_level_0\n", "whoisRawID": 0, "source": "WHOIS_RDAP"}, "whoisID": 6779198303830567949, "registrarName": "APNIC", "admin": {"zip": "100032", "address": "29 jinrong ave\nxicheng district beijing\n100032\n", "city": "xicheng district beijing", "phone": "+86 1052686688", "whoisContactID": 0, "street": "29 jinrong ave", "name": "haijun li", "id": 0, "fax": "+86 10 52616187", "email": "hostmaster@chinamobile.com,abuse@chinamobile.com"}, "whoisServer": "rdap.apnic.net", "createdAt": 1616286827, "expired": false, "contactOrganizations": [], "registrarParseCode": 8448, "netRange": {"netName": "CMNET-JIANGSU", "numericEnd": 1879375871, "netRange": "112.0.0.0 - 112.4.255.255", "whoisNetRangeID": 0, "numericStart": 1879048192, "status": "INACTIVE", "ipStart": "112.0.0.0", "ipEnd": "112.4.255.255"}, "auditUpdatedAt": 1616286827, "id": 6779198303830567949, "updatedAt": 1621366949, "domainUnicode": "112.0.0.0", "auditCreatedAt": 1616286827, "contactCountries": [], "compositeParseCode": 8448, "contactEmails": ["hostmaster@chinamobile.com,abuse@chinamobile.com", "abuse@chinamobile.com"], "tld": "ipv4", "domainAvailable": false, "noRecord": false, "nameservers": [], "domain": "112.0.0.0", "contactNames": ["haijun li", "IRT-CHINAMOBILE-CN"], "contacts": [{"zip": "100032", "address": "29 jinrong ave\nxicheng district beijing\n100032\n", "city": "xicheng district beijing", "phone": "+86 1052686688", "whoisContactID": 0, "street": "29 jinrong ave", "name": "haijun li", "id": 0, "fax": "+86 10 52616187", "email": "hostmaster@chinamobile.com,abuse@chinamobile.com"}, {"zip": "100032", "address": "china mobile communications corporation 29 jinrong ave.\nxicheng district beijing\n100032\n", "city": "xicheng district beijing", "whoisContactID": 0, "street": "china mobile communications corporation 29 jinrong ave.", "name": "IRT-CHINAMOBILE-CN", "id": 0, "email": "abuse@chinamobile.com"}], "status": "INACTIVE", "domainMd5": "af7ce139ebe6615d9579100b6bc83dba", "task_id": "eb99cf4f25ea4f08aaf37aedacc9cb39"}, {"abuse": {"zip": "100032", "address": "china mobile communications corporation 29 jinrong ave.\nxicheng district beijing\n100032\n", "city": "xicheng district beijing", "whoisContactID": 0, "street": "china mobile communications corporation 29 jinrong ave.", "name": "IRT-CHINAMOBILE2-CN", "id": 0, "email": "abuse@chinamobile.com"}, "technical": {"zip": "100032", "address": "29 jinrong ave\nxicheng district beijing\n100032\n", "city": "xicheng district beijing", "phone": "+86 1052686688", "whoisContactID": 0, "street": "29 jinrong ave", "name": "haijun li", "id": 0, "fax": "+86 10 52616187", "email": "hostmaster@chinamobile.com,abuse@chinamobile.com"}, "rawResponse": {"domain": "112.0.0.0", "whoisID": 6775710672585776594, "unparsed": "{\"rdapConformance\":[\"history_version_0\",\"cidr0\",\"rdap_level_0\"],\"objectClassName\":\"ip network\",\"handle\":\"112.0.0.0 - 112.63.255.255\",\"port43\":\"whois.apnic.net\",\"lang\":null,\"events\":[{\"eventAction\":\"last changed\",\"eventDate\":\"2020-12-15T02:55:47Z\",\"eventActor\":null,\"status\":[]}],\"notices\":[{\"title\":\"Source\",\"type\":null,\"description\":[\"Objects returned came from source\",\"APNIC\"],\"links\":[]},{\"title\":\"Terms and Conditions\",\"type\":null,\"description\":[\"This is the APNIC WHOIS Database query service. The objects are in RDAP format.\"],\"links\":[{\"value\":\"https://rdap.apnic.net/ip/112.54.244.28\",\"rel\":\"terms-of-service\",\"href\":\"http://www.apnic.net/db/dbcopyright.html\",\"hreflang\":null,\"title\":null,\"media\":null,\"type\":\"text/html\"}]}],\"status\":[],\"entities\":[{\"rdapConformance\":[\"history_version_0\",\"cidr0\",\"rdap_level_0\"],\"objectClassName\":\"entity\",\"handle\":\"HL1318-AP\",\"port43\":\"whois.apnic.net\",\"lang\":null,\"events\":[{\"eventAction\":\"last changed\",\"eventDate\":\"2016-11-29T09:38:38Z\",\"eventActor\":null,\"status\":[]}],\"notices\":[{\"title\":\"Source\",\"type\":null,\"description\":[\"Objects returned came from source\",\"APNIC\"],\"links\":[]},{\"title\":\"Terms and Conditions\",\"type\":null,\"description\":[\"This is the APNIC WHOIS Database query service. The objects are in RDAP format.\"],\"links\":[{\"value\":\"https://rdap.apnic.net/entity/HL1318-AP\",\"rel\":\"terms-of-service\",\"href\":\"http://www.apnic.net/db/dbcopyright.html\",\"hreflang\":null,\"title\":null,\"media\":null,\"type\":\"text/html\"}]}],\"status\":[],\"entities\":[],\"remarks\":[],\"links\":[{\"value\":\"https://rdap.apnic.net/entity/HL1318-AP\",\"rel\":\"self\",\"href\":\"https://rdap.apnic.net/entity/HL1318-AP\",\"hreflang\":null,\"title\":null,\"media\":null,\"type\":\"application/rdap+json\"}],\"nameservers\":[],\"entity\":null,\"errorCode\":null,\"errorTitle\":null,\"errorDescription\":[],\"vcardArray\":[\"vcard\",[[\"version\",{},\"text\",\"4.0\"],[\"fn\",{},\"text\",\"haijun li\"],[\"kind\",{},\"text\",\"individual\"],[\"adr\",{\"label\":\"29,Jinrong Ave, Xicheng district,beijing,100032\"},\"text\",[\"\",\"\",\"29 jinrong ave\",\"xicheng district beijing\",\"\",\"100032\",\"\"]],[\"tel\",{\"type\":\"voice\"},\"text\",\"+86 1052686688\"],[\"tel\",{\"type\":\"fax\"},\"text\",\"+86 10 52616187\"],[\"email\",{},\"text\",\"hostmaster@chinamobile.com\"],[\"email\",{\"pref\":\"1\"},\"text\",\"abuse@chinamobile.com\"]]],\"roles\":[\"technical\"],\"publicIds\":[],\"legalRepresentative\":null,\"networks\":null,\"autnums\":null,\"nicbr_domainCount\":0,\"nicbr_inetCount\":0,\"nicbr_autnumCount\":0,\"contact_URI\":null},{\"rdapConformance\":[\"history_version_0\",\"cidr0\",\"rdap_level_0\"],\"objectClassName\":\"entity\",\"handle\":\"ct74-AP\",\"port43\":\"whois.apnic.net\",\"lang\":null,\"events\":[{\"eventAction\":\"last changed\",\"eventDate\":\"2016-11-29T09:37:27Z\",\"eventActor\":null,\"status\":[]}],\"notices\":[{\"title\":\"Source\",\"type\":null,\"description\":[\"Objects returned came from source\",\"APNIC\"],\"links\":[]},{\"title\":\"Terms and Conditions\",\"type\":null,\"description\":[\"This is the APNIC WHOIS Database query service. The objects are in RDAP format.\"],\"links\":[{\"value\":\"https://rdap.apnic.net/entity/ct74-AP\",\"rel\":\"terms-of-service\",\"href\":\"http://www.apnic.net/db/dbcopyright.html\",\"hreflang\":null,\"title\":null,\"media\":null,\"type\":\"text/html\"}]}],\"status\":[],\"entities\":[{\"rdapConformance\":[],\"objectClassName\":\"entity\",\"handle\":\"HL1318-AP\",\"port43\":null,\"lang\":null,\"events\":[{\"eventAction\":\"last changed\",\"eventDate\":\"2016-11-29T09:38:38Z\",\"eventActor\":null,\"status\":[]}],\"notices\":[],\"status\":[],\"entities\":[],\"remarks\":[],\"links\":[{\"value\":\"https://rdap.apnic.net/entity/ct74-AP\",\"rel\":\"self\",\"href\":\"https://rdap.apnic.net/entity/HL1318-AP\",\"hreflang\":null,\"title\":null,\"media\":null,\"type\":\"application/rdap+json\"}],\"nameservers\":[],\"entity\":null,\"errorCode\":null,\"errorTitle\":null,\"errorDescription\":[],\"vcardArray\":[\"vcard\",[[\"version\",{},\"text\",\"4.0\"],[\"fn\",{},\"text\",\"haijun li\"],[\"kind\",{},\"text\",\"individual\"],[\"adr\",{\"label\":\"29,Jinrong Ave, Xicheng district,beijing,100032\"},\"text\",[\"\",\"\",\"\",\"\",\"\",\"\",\"\"]],[\"tel\",{\"type\":\"voice\"},\"text\",\"+86 1052686688\"],[\"tel\",{\"type\":\"fax\"},\"text\",\"+86 10 52616187\"],[\"email\",{},\"text\",\"hostmaster@chinamobile.com\"],[\"email\",{\"pref\":\"1\"},\"text\",\"abuse@chinamobile.com\"]]],\"roles\":[\"admin\",\"technical\"],\"publicIds\":[],\"legalRepresentative\":null,\"networks\":null,\"autnums\":null,\"nicbr_domainCount\":0,\"nicbr_inetCount\":0,\"nicbr_autnumCount\":0,\"contact_URI\":null}],\"remarks\":[],\"links\":[{\"value\":\"https://rdap.apnic.net/entity/ct74-AP\",\"rel\":\"self\",\"href\":\"https://rdap.apnic.net/entity/ct74-AP\",\"hreflang\":null,\"title\":null,\"media\":null,\"type\":\"application/rdap+json\"}],\"nameservers\":[],\"entity\":null,\"errorCode\":null,\"errorTitle\":null,\"errorDescription\":[],\"vcardArray\":[\"vcard\",[[\"version\",{},\"text\",\"4.0\"],[\"fn\",{},\"text\",\"chinamobile tech\"],[\"kind\",{},\"text\",\"group\"],[\"adr\",{\"label\":\"29, Jinrong Ave.,Xicheng district\\nBeijing\"},\"text\",[\"\",\"\",\"29 jinrong ave.\",\"xicheng district beijing\",\"\",\"\",\"\"]],[\"tel\",{\"type\":\"voice\"},\"text\",\"+86 5268 6688\"],[\"tel\",{\"type\":\"fax\"},\"text\",\"+86 5261 6187\"],[\"email\",{},\"text\",\"hostmaster@chinamobile.com\"],[\"email\",{\"pref\":\"1\"},\"text\",\"abuse@chinamobile.com\"]]],\"roles\":[\"admin\"],\"publicIds\":[],\"legalRepresentative\":null,\"networks\":null,\"autnums\":null,\"nicbr_domainCount\":0,\"nicbr_inetCount\":0,\"nicbr_autnumCount\":0,\"contact_URI\":null},{\"rdapConformance\":[\"history_version_0\",\"cidr0\",\"rdap_level_0\"],\"objectClassName\":\"entity\",\"handle\":\"IRT-CHINAMOBILE2-CN\",\"port43\":\"whois.apnic.net\",\"lang\":null,\"events\":[{\"eventAction\":\"last changed\",\"eventDate\":\"2021-01-20T01:06:54Z\",\"eventActor\":null,\"status\":[]}],\"notices\":[{\"title\":\"Source\",\"type\":null,\"description\":[\"Objects returned came from source\",\"APNIC\"],\"links\":[]},{\"title\":\"Terms and Conditions\",\"type\":null,\"description\":[\"This is the APNIC WHOIS Database query service. The objects are in RDAP format.\"],\"links\":[{\"value\":\"https://rdap.apnic.net/entity/IRT-CHINAMOBILE2-CN\",\"rel\":\"terms-of-service\",\"href\":\"http://www.apnic.net/db/dbcopyright.html\",\"hreflang\":null,\"title\":null,\"media\":null,\"type\":\"text/html\"}]}],\"status\":[],\"entities\":[{\"rdapConformance\":[],\"objectClassName\":\"entity\",\"handle\":\"ct74-AP\",\"port43\":null,\"lang\":null,\"events\":[{\"eventAction\":\"last changed\",\"eventDate\":\"2016-11-29T09:37:27Z\",\"eventActor\":null,\"status\":[]}],\"notices\":[],\"status\":[],\"entities\":[],\"remarks\":[],\"links\":[{\"value\":\"https://rdap.apnic.net/entity/IRT-CHINAMOBILE2-CN\",\"rel\":\"self\",\"href\":\"https://rdap.apnic.net/entity/ct74-AP\",\"hreflang\":null,\"title\":null,\"media\":null,\"type\":\"application/rdap+json\"}],\"nameservers\":[],\"entity\":null,\"errorCode\":null,\"errorTitle\":null,\"errorDescription\":[],\"vcardArray\":[\"vcard\",[[\"version\",{},\"text\",\"4.0\"],[\"fn\",{},\"text\",\"chinamobile tech\"],[\"kind\",{},\"text\",\"group\"],[\"adr\",{\"label\":\"29, Jinrong Ave.,Xicheng district\\nBeijing\"},\"text\",[\"\",\"\",\"\",\"\",\"\",\"\",\"\"]],[\"tel\",{\"type\":\"voice\"},\"text\",\"+86 5268 6688\"],[\"tel\",{\"type\":\"fax\"},\"text\",\"+86 5261 6187\"],[\"email\",{},\"text\",\"hostmaster@chinamobile.com\"],[\"email\",{\"pref\":\"1\"},\"text\",\"abuse@chinamobile.com\"]]],\"roles\":[\"admin\"],\"publicIds\":[],\"legalRepresentative\":null,\"networks\":null,\"autnums\":null,\"nicbr_domainCount\":0,\"nicbr_inetCount\":0,\"nicbr_autnumCount\":0,\"contact_URI\":null},{\"rdapConformance\":[],\"objectClassName\":\"entity\",\"handle\":null,\"port43\":null,\"lang\":null,\"events\":[],\"notices\":[],\"status\":[],\"entities\":[],\"remarks\":[],\"links\":[],\"nameservers\":[],\"entity\":null,\"errorCode\":null,\"errorTitle\":null,\"errorDescription\":[],\"vcardArray\":null,\"roles\":[\"technical\"],\"publicIds\":[],\"legalRepresentative\":null,\"networks\":null,\"autnums\":null,\"nicbr_domainCount\":0,\"nicbr_inetCount\":0,\"nicbr_autnumCount\":0,\"contact_URI\":null}],\"remarks\":[{\"title\":\"remarks\",\"description\":[\"abuse@chinamobile.com was validated on 2021-01-20\"],\"type\":null,\"links\":null}],\"links\":[{\"value\":\"https://rdap.apnic.net/entity/IRT-CHINAMOBILE2-CN\",\"rel\":\"self\",\"href\":\"https://rdap.apnic.net/entity/IRT-CHINAMOBILE2-CN\",\"hreflang\":null,\"title\":null,\"media\":null,\"type\":\"application/rdap+json\"}],\"nameservers\":[],\"entity\":null,\"errorCode\":null,\"errorTitle\":null,\"errorDescription\":[],\"vcardArray\":[\"vcard\",[[\"version\",{},\"text\",\"4.0\"],[\"fn\",{},\"text\",\"IRT-CHINAMOBILE2-CN\"],[\"kind\",{},\"text\",\"group\"],[\"adr\",{\"label\":\"China Mobile Communications Corporation\\n29, Jinrong Ave., Xicheng District, Beijing, 100032\"},\"text\",[\"\",\"\",\"china mobile communications corporation 29 jinrong ave.\",\"xicheng district beijing\",\"\",\"100032\",\"\"]],[\"email\",{},\"text\",\"abuse@chinamobile.com\"],[\"email\",{\"pref\":\"1\"},\"text\",\"abuse@chinamobile.com\"]]],\"roles\":[\"abuse\"],\"publicIds\":[],\"legalRepresentative\":null,\"networks\":null,\"autnums\":null,\"nicbr_domainCount\":0,\"nicbr_inetCount\":0,\"nicbr_autnumCount\":0,\"contact_URI\":null}],\"remarks\":[{\"title\":\"description\",\"description\":[\"China Mobile Communications Corporation\",\"Mobile Communications Network Operator in China\",\"Internet Service Provider in China\"],\"type\":null,\"links\":null},{\"title\":\"remarks\",\"description\":[\"service provider\",\"--------------------------------------------------------\",\"To report network abuse, please contact mnt-irt\",\"For troubleshooting, please contact tech-c and admin-c\",\"Report invalid contact via www.apnic.net/invalidcontact\",\"--------------------------------------------------------\"],\"type\":null,\"links\":null}],\"links\":[{\"value\":\"https://rdap.apnic.net/ip/112.54.244.28\",\"rel\":\"self\",\"href\":\"https://rdap.apnic.net/ip/112.0.0.0/10\",\"hreflang\":null,\"title\":null,\"media\":null,\"type\":\"application/rdap+json\"},{\"value\":\"https://rdap.apnic.net/ip/112.54.244.28\",\"rel\":\"related\",\"href\":\"https://netox.apnic.net/search/112.0.0.0%2F10?utm_source=rdap&utm_medium=result&utm_campaign=rdap_result\",\"hreflang\":null,\"title\":null,\"media\":null,\"type\":\"text/html\"}],\"nameservers\":[],\"entity\":null,\"errorCode\":null,\"errorTitle\":null,\"errorDescription\":[],\"startAddress\":\"112.0.0.0\",\"endAddress\":\"112.63.255.255\",\"ipVersion\":\"v4\",\"name\":\"CMNET\",\"type\":\"ALLOCATED PORTABLE\",\"country\":\"CN\",\"parentHandle\":null,\"cidr0_cidrs\":[{\"v4prefix\":\"112.0.0.0\",\"v6prefix\":null,\"length\":\"10\"}],\"arin_originas0_originautnums\":[],\"lacnic_originAutnum\":null,\"lacnic_reverseDelegations\":[],\"lacnic_legalRepresentative\":null,\"nicbr_autnum\":null,\"nicbr_reverseDelegations\":[]}", "raw": "IP Network: \n  Handle: 112.0.0.0 - 112.63.255.255\n  Start Address: 112.0.0.0\n  End Address: 112.63.255.255\n  IP Version: v4\n  Name: CMNET\n  Type: ALLOCATED PORTABLE\n  Country: CN\n  Port43: whois.apnic.net\n\n  Cidr: \n    Prefix: 112.0.0.0\n    Length: 10\n  Event: \n    Action: last changed\n    Date: 2020-12-15T02:55:47Z\n  Entity: \n    Handle: HL1318-AP\n    Role: \n      TECHNICAL\n    VCard: \n      Formatted Name: haijun li\n      Kind: individual\n      Address: \n          Street: 29 jinrong ave\n          Locale: xicheng district beijing\n          Postal Code: 100032\n          LABEL: 29,Jinrong Ave, Xicheng district,beijing,100032\n      Telephone: +86 1052686688\n          TYPE: voice\n      Telephone: +86 10 52616187\n          TYPE: fax\n      Email: hostmaster@chinamobile.com\n      Email: abuse@chinamobile.com\n          PREF: 1\n    Event: \n      Action: last changed\n      Date: 2016-11-29T09:38:38Z\n    Link: \n      Rel: self\n      Value: https://rdap.apnic.net/entity/HL1318-AP\n      Type: application/rdap+json\n      Href: https://rdap.apnic.net/entity/HL1318-AP\n    Notice: \n      Title: Source\n      Description: \n        Objects returned came from source\n        APNIC\n    Notice: \n      Title: Terms and Conditions\n        Description: This is the APNIC WHOIS Database query service. The objects are in RDAP format.\n        Link: \n          Rel: terms-of-service\n          Value: https://rdap.apnic.net/entity/HL1318-AP\n          Type: text/html\n          Href: http://www.apnic.net/db/dbcopyright.html\n    RDAP Conformance: \n      history_version_0\n      cidr0\n      rdap_level_0\n  Entity: \n    Handle: ct74-AP\n    Role: \n      ADMIN\n    VCard: \n      Formatted Name: chinamobile tech\n      Kind: group\n      Address: \n          Street: 29 jinrong ave.\n          Locale: xicheng district beijing\n        LABEL: \n          29, Jinrong Ave.,Xicheng district\n          Beijing\n      Telephone: +86 5268 6688\n          TYPE: voice\n      Telephone: +86 5261 6187\n          TYPE: fax\n      Email: hostmaster@chinamobile.com\n      Email: abuse@chinamobile.com\n          PREF: 1\n    Event: \n      Action: last changed\n      Date: 2016-11-29T09:37:27Z\n    Entity: \n      Handle: HL1318-AP\n      Role: \n        ADMIN\n        TECHNICAL\n      VCard: \n        Formatted Name: haijun li\n        Kind: individual\n        Address: \n            LABEL: 29,Jinrong Ave, Xicheng district,beijing,100032\n        Telephone: +86 1052686688\n            TYPE: voice\n        Telephone: +86 10 52616187\n            TYPE: fax\n        Email: hostmaster@chinamobile.com\n        Email: abuse@chinamobile.com\n            PREF: 1\n      Event: \n        Action: last changed\n        Date: 2016-11-29T09:38:38Z\n      Link: \n        Rel: self\n        Value: https://rdap.apnic.net/entity/ct74-AP\n        Type: application/rdap+json\n        Href: https://rdap.apnic.net/entity/HL1318-AP\n    Link: \n      Rel: self\n      Value: https://rdap.apnic.net/entity/ct74-AP\n      Type: application/rdap+json\n      Href: https://rdap.apnic.net/entity/ct74-AP\n    Notice: \n      Title: Source\n      Description: \n        Objects returned came from source\n        APNIC\n    Notice: \n      Title: Terms and Conditions\n        Description: This is the APNIC WHOIS Database query service. The objects are in RDAP format.\n        Link: \n          Rel: terms-of-service\n          Value: https://rdap.apnic.net/entity/ct74-AP\n          Type: text/html\n          Href: http://www.apnic.net/db/dbcopyright.html\n    RDAP Conformance: \n      history_version_0\n      cidr0\n      rdap_level_0\n  Entity: \n    Handle: IRT-CHINAMOBILE2-CN\n    Role: \n      ABUSE\n    VCard: \n      Formatted Name: IRT-CHINAMOBILE2-CN\n      Kind: group\n      Address: \n          Street: china mobile communications corporation 29 jinrong ave.\n          Locale: xicheng district beijing\n          Postal Code: 100032\n        LABEL: \n          China Mobile Communications Corporation\n          29, Jinrong Ave., Xicheng District, Beijing, 100032\n      Email: abuse@chinamobile.com\n      Email: abuse@chinamobile.com\n          PREF: 1\n    Event: \n      Action: last changed\n      Date: 2021-01-20T01:06:54Z\n    Entity: \n      Handle: ct74-AP\n      Role: \n        ADMIN\n      VCard: \n        Formatted Name: chinamobile tech\n        Kind: group\n        Address: \n          LABEL: \n            29, Jinrong Ave.,Xicheng district\n            Beijing\n        Telephone: +86 5268 6688\n            TYPE: voice\n        Telephone: +86 5261 6187\n            TYPE: fax\n        Email: hostmaster@chinamobile.com\n        Email: abuse@chinamobile.com\n            PREF: 1\n      Event: \n        Action: last changed\n        Date: 2016-11-29T09:37:27Z\n      Link: \n        Rel: self\n        Value: https://rdap.apnic.net/entity/IRT-CHINAMOBILE2-CN\n        Type: application/rdap+json\n        Href: https://rdap.apnic.net/entity/ct74-AP\n    Entity: \n      Role: \n        TECHNICAL\n    Remark: \n      Title: remarks\n        Description: abuse@chinamobile.com was validated on 2021-01-20\n    Link: \n      Rel: self\n      Value: https://rdap.apnic.net/entity/IRT-CHINAMOBILE2-CN\n      Type: application/rdap+json\n      Href: https://rdap.apnic.net/entity/IRT-CHINAMOBILE2-CN\n    Notice: \n      Title: Source\n      Description: \n        Objects returned came from source\n        APNIC\n    Notice: \n      Title: Terms and Conditions\n        Description: This is the APNIC WHOIS Database query service. The objects are in RDAP format.\n        Link: \n          Rel: terms-of-service\n          Value: https://rdap.apnic.net/entity/IRT-CHINAMOBILE2-CN\n          Type: text/html\n          Href: http://www.apnic.net/db/dbcopyright.html\n    RDAP Conformance: \n      history_version_0\n      cidr0\n      rdap_level_0\n  Remark: \n    Title: description\n    Description: \n      China Mobile Communications Corporation\n      Mobile Communications Network Operator in China\n      Internet Service Provider in China\n  Remark: \n    Title: remarks\n    Description: \n      service provider\n      --------------------------------------------------------\n      To report network abuse, please contact mnt-irt\n      For troubleshooting, please contact tech-c and admin-c\n      Report invalid contact via www.apnic.net/invalidcontact\n      --------------------------------------------------------\n  Link: \n    Rel: self\n    Value: https://rdap.apnic.net/ip/112.54.244.28\n    Type: application/rdap+json\n    Href: https://rdap.apnic.net/ip/112.0.0.0/10\n  Link: \n    Rel: related\n    Value: https://rdap.apnic.net/ip/112.54.244.28\n    Type: text/html\n    Href: https://netox.apnic.net/search/112.0.0.0%2F10?utm_source=rdap&utm_medium=result&utm_campaign=rdap_result\n  Notice: \n    Title: Source\n    Description: \n      Objects returned came from source\n      APNIC\n  Notice: \n    Title: Terms and Conditions\n      Description: This is the APNIC WHOIS Database query service. The objects are in RDAP format.\n      Link: \n        Rel: terms-of-service\n        Value: https://rdap.apnic.net/ip/112.54.244.28\n        Type: text/html\n        Href: http://www.apnic.net/db/dbcopyright.html\n  RDAP Conformance: \n    history_version_0\n    cidr0\n    rdap_level_0\n", "whoisRawID": 0, "source": "WHOIS_RDAP"}, "registrarUpdatedAt": 1608000947, "whoisID": 6775710672585776594, "registrarName": "APNIC", "admin": {"address": "29 jinrong ave.\nxicheng district beijing\n", "city": "xicheng district beijing", "phone": "+86 5268 6688", "whoisContactID": 0, "street": "29 jinrong ave.", "name": "chinamobile tech", "id": 0, "fax": "+86 5261 6187", "email": "hostmaster@chinamobile.com,abuse@chinamobile.com"}, "whoisServer": "rdap.apnic.net", "createdAt": 1615455310, "expired": false, "contactOrganizations": [], "registrarParseCode": 10528, "netRange": {"netName": "CMNET", "numericEnd": 1883242495, "netRange": "112.0.0.0 - 112.63.255.255", "originAS": "AS9808", "whoisNetRangeID": 0, "numericStart": 1879048192, "status": "INACTIVE", "ipStart": "112.0.0.0", "ipEnd": "112.63.255.255"}, "auditUpdatedAt": 1615455310, "id": 6775710672585776594, "updatedAt": 1616286827, "domainUnicode": "112.0.0.0", "auditCreatedAt": 1615455310, "contactCountries": [], "compositeParseCode": 10528, "contactEmails": ["hostmaster@chinamobile.com,abuse@chinamobile.com", "abuse@chinamobile.com"], "tld": "ipv4", "domainAvailable": false, "noRecord": false, "nameservers": [], "domain": "112.0.0.0", "contactNames": ["chinamobile tech", "haijun li", "IRT-CHINAMOBILE2-CN"], "contacts": [{"address": "29 jinrong ave.\nxicheng district beijing\n", "city": "xicheng district beijing", "phone": "+86 5268 6688", "whoisContactID": 0, "street": "29 jinrong ave.", "name": "chinamobile tech", "id": 0, "fax": "+86 5261 6187", "email": "hostmaster@chinamobile.com,abuse@chinamobile.com"}, {"zip": "100032", "address": "29 jinrong ave\nxicheng district beijing\n100032\n", "city": "xicheng district beijing", "phone": "+86 1052686688", "whoisContactID": 0, "street": "29 jinrong ave", "name": "haijun li", "id": 0, "fax": "+86 10 52616187", "email": "hostmaster@chinamobile.com,abuse@chinamobile.com"}, {"zip": "100032", "address": "china mobile communications corporation 29 jinrong ave.\nxicheng district beijing\n100032\n", "city": "xicheng district beijing", "whoisContactID": 0, "street": "china mobile communications corporation 29 jinrong ave.", "name": "IRT-CHINAMOBILE2-CN", "id": 0, "email": "abuse@chinamobile.com"}], "status": "INACTIVE", "domainMd5": "af7ce139ebe6615d9579100b6bc83dba", "task_id": "b148b5c3ae8f42a381fcb193f5c97586"}, {"abuse": {"zip": "100032", "address": "china mobile communications corporation 29 jinrong ave.\nxicheng district beijing\n100032\n", "city": "xicheng district beijing", "whoisContactID": 0, "street": "china mobile communications corporation 29 jinrong ave.", "name": "IRT-CHINAMOBILE-CN", "id": 0, "email": "abuse@chinamobile.com"}, "rawResponse": {"domain": "112.0.0.0", "whoisID": 6755197288228631410, "unparsed": "{\"rdapConformance\":[\"history_version_0\",\"cidr0\",\"rdap_level_0\"],\"objectClassName\":\"ip network\",\"handle\":\"112.0.0.0 - 112.4.255.255\",\"port43\":\"whois.apnic.net\",\"lang\":null,\"events\":[],\"notices\":[{\"title\":\"Source\",\"type\":null,\"description\":[\"Objects returned came from source\",\"APNIC\"],\"links\":[]},{\"title\":\"Terms and Conditions\",\"type\":null,\"description\":[\"This is the APNIC WHOIS Database query service. The objects are in RDAP format.\"],\"links\":[{\"value\":\"https://rdap.apnic.net/ip/112.0.0.0\",\"rel\":\"terms-of-service\",\"href\":\"http://www.apnic.net/db/dbcopyright.html\",\"hreflang\":null,\"title\":null,\"media\":null,\"type\":\"text/html\"}]}],\"status\":[],\"entities\":[{\"rdapConformance\":[\"history_version_0\",\"cidr0\",\"rdap_level_0\"],\"objectClassName\":\"entity\",\"handle\":\"HL1318-AP\",\"port43\":\"whois.apnic.net\",\"lang\":null,\"events\":[{\"eventAction\":\"last changed\",\"eventDate\":\"2016-11-29T09:38:38Z\",\"eventActor\":null,\"status\":[]}],\"notices\":[{\"title\":\"Source\",\"type\":null,\"description\":[\"Objects returned came from source\",\"APNIC\"],\"links\":[]},{\"title\":\"Terms and Conditions\",\"type\":null,\"description\":[\"This is the APNIC WHOIS Database query service. The objects are in RDAP format.\"],\"links\":[{\"value\":\"https://rdap.apnic.net/entity/HL1318-AP\",\"rel\":\"terms-of-service\",\"href\":\"http://www.apnic.net/db/dbcopyright.html\",\"hreflang\":null,\"title\":null,\"media\":null,\"type\":\"text/html\"}]}],\"status\":[],\"entities\":[],\"remarks\":[],\"links\":[{\"value\":\"https://rdap.apnic.net/entity/HL1318-AP\",\"rel\":\"self\",\"href\":\"https://rdap.apnic.net/entity/HL1318-AP\",\"hreflang\":null,\"title\":null,\"media\":null,\"type\":\"application/rdap+json\"}],\"nameservers\":[],\"entity\":null,\"errorCode\":null,\"errorTitle\":null,\"errorDescription\":[],\"vcardArray\":[\"vcard\",[[\"version\",{},\"text\",\"4.0\"],[\"fn\",{},\"text\",\"haijun li\"],[\"kind\",{},\"text\",\"individual\"],[\"adr\",{\"label\":\"29,Jinrong Ave, Xicheng district,beijing,100032\"},\"text\",[\"\",\"\",\"29 jinrong ave\",\"xicheng district beijing\",\"\",\"100032\",\"\"]],[\"tel\",{\"type\":\"voice\"},\"text\",\"+86 1052686688\"],[\"tel\",{\"type\":\"fax\"},\"text\",\"+86 10 52616187\"],[\"email\",{},\"text\",\"hostmaster@chinamobile.com\"],[\"email\",{\"pref\":\"1\"},\"text\",\"abuse@chinamobile.com\"]]],\"roles\":[\"admin\"],\"publicIds\":[],\"legalRepresentative\":null,\"networks\":null,\"autnums\":null,\"nicbr_domainCount\":0,\"nicbr_inetCount\":0,\"nicbr_autnumCount\":0,\"contact_URI\":null},{\"rdapConformance\":[\"history_version_0\",\"cidr0\",\"rdap_level_0\"],\"objectClassName\":\"entity\",\"handle\":\"IRT-CHINAMOBILE-CN\",\"port43\":\"whois.apnic.net\",\"lang\":null,\"events\":[{\"eventAction\":\"last changed\",\"eventDate\":\"2020-07-16T05:55:01Z\",\"eventActor\":null,\"status\":[]}],\"notices\":[{\"title\":\"Source\",\"type\":null,\"description\":[\"Objects returned came from source\",\"APNIC\"],\"links\":[]},{\"title\":\"Terms and Conditions\",\"type\":null,\"description\":[\"This is the APNIC WHOIS Database query service. The objects are in RDAP format.\"],\"links\":[{\"value\":\"https://rdap.apnic.net/entity/IRT-CHINAMOBILE-CN\",\"rel\":\"terms-of-service\",\"href\":\"http://www.apnic.net/db/dbcopyright.html\",\"hreflang\":null,\"title\":null,\"media\":null,\"type\":\"text/html\"}]}],\"status\":[],\"entities\":[{\"rdapConformance\":[],\"objectClassName\":\"entity\",\"handle\":null,\"port43\":null,\"lang\":null,\"events\":[],\"notices\":[],\"status\":[],\"entities\":[],\"remarks\":[],\"links\":[],\"nameservers\":[],\"entity\":null,\"errorCode\":null,\"errorTitle\":null,\"errorDescription\":[],\"vcardArray\":null,\"roles\":[\"admin\",\"technical\"],\"publicIds\":[],\"legalRepresentative\":null,\"networks\":null,\"autnums\":null,\"nicbr_domainCount\":0,\"nicbr_inetCount\":0,\"nicbr_autnumCount\":0,\"contact_URI\":null}],\"remarks\":[{\"title\":\"remarks\",\"description\":[\"abuse@chinamobile.com was validated on 2020-07-16\"],\"type\":null,\"links\":null}],\"links\":[{\"value\":\"https://rdap.apnic.net/entity/IRT-CHINAMOBILE-CN\",\"rel\":\"self\",\"href\":\"https://rdap.apnic.net/entity/IRT-CHINAMOBILE-CN\",\"hreflang\":null,\"title\":null,\"media\":null,\"type\":\"application/rdap+json\"}],\"nameservers\":[],\"entity\":null,\"errorCode\":null,\"errorTitle\":null,\"errorDescription\":[],\"vcardArray\":[\"vcard\",[[\"version\",{},\"text\",\"4.0\"],[\"fn\",{},\"text\",\"IRT-CHINAMOBILE-CN\"],[\"kind\",{},\"text\",\"group\"],[\"adr\",{\"label\":\"China Mobile Communications Corporation\\n29, Jinrong Ave., Xicheng District, Beijing, 100032\"},\"text\",[\"\",\"\",\"china mobile communications corporation 29 jinrong ave.\",\"xicheng district beijing\",\"\",\"100032\",\"\"]],[\"email\",{},\"text\",\"abuse@chinamobile.com\"],[\"email\",{\"pref\":\"1\"},\"text\",\"abuse@chinamobile.com\"]]],\"roles\":[\"abuse\"],\"publicIds\":[],\"legalRepresentative\":null,\"networks\":null,\"autnums\":null,\"nicbr_domainCount\":0,\"nicbr_inetCount\":0,\"nicbr_autnumCount\":0,\"contact_URI\":null},{\"rdapConformance\":[],\"objectClassName\":\"entity\",\"handle\":null,\"port43\":null,\"lang\":null,\"events\":[],\"notices\":[],\"status\":[],\"entities\":[],\"remarks\":[],\"links\":[],\"nameservers\":[],\"entity\":null,\"errorCode\":null,\"errorTitle\":null,\"errorDescription\":[],\"vcardArray\":null,\"roles\":[\"technical\"],\"publicIds\":[],\"legalRepresentative\":null,\"networks\":null,\"autnums\":null,\"nicbr_domainCount\":0,\"nicbr_inetCount\":0,\"nicbr_autnumCount\":0,\"contact_URI\":null}],\"remarks\":[{\"title\":\"description\",\"description\":[\"China Mobile Communications Corporation\"],\"type\":null,\"links\":null}],\"links\":[{\"value\":\"https://rdap.apnic.net/ip/112.0.0.0\",\"rel\":\"self\",\"href\":\"https://rdap.apnic.net/ip/112.0.0.0/13\",\"hreflang\":null,\"title\":null,\"media\":null,\"type\":\"application/rdap+json\"},{\"value\":\"https://rdap.apnic.net/ip/112.0.0.0\",\"rel\":\"related\",\"href\":\"https://netox.apnic.net/search/112.4.0.0%2F16?utm_source=rdap&utm_medium=result&utm_campaign=rdap_result\",\"hreflang\":null,\"title\":null,\"media\":null,\"type\":\"text/html\"},{\"value\":\"https://rdap.apnic.net/ip/112.0.0.0\",\"rel\":\"related\",\"href\":\"https://netox.apnic.net/search/112.0.0.0%2F14?utm_source=rdap&utm_medium=result&utm_campaign=rdap_result\",\"hreflang\":null,\"title\":null,\"media\":null,\"type\":\"text/html\"}],\"nameservers\":[],\"entity\":null,\"errorCode\":null,\"errorTitle\":null,\"errorDescription\":[],\"startAddress\":\"112.0.0.0\",\"endAddress\":\"112.4.255.255\",\"ipVersion\":\"v4\",\"name\":\"CMNET-JIANGSU\",\"type\":\"ALLOCATED NON-PORTABLE\",\"country\":\"CN\",\"parentHandle\":null,\"cidr0_cidrs\":[{\"v4prefix\":\"112.4.0.0\",\"v6prefix\":null,\"length\":\"16\"},{\"v4prefix\":\"112.0.0.0\",\"v6prefix\":null,\"length\":\"14\"}],\"arin_originas0_originautnums\":[],\"lacnic_originAutnum\":null,\"lacnic_reverseDelegations\":[],\"lacnic_legalRepresentative\":null,\"nicbr_autnum\":null,\"nicbr_reverseDelegations\":[]}", "raw": "IP Network: \n  Handle: 112.0.0.0 - 112.4.255.255\n  Start Address: 112.0.0.0\n  End Address: 112.4.255.255\n  IP Version: v4\n  Name: CMNET-JIANGSU\n  Type: ALLOCATED NON-PORTABLE\n  Country: CN\n  Port43: whois.apnic.net\n\n  Cidr: \n    Prefix: 112.4.0.0\n    Length: 16\n  Cidr: \n    Prefix: 112.0.0.0\n    Length: 14\n  Entity: \n    Handle: HL1318-AP\n    Role: \n      ADMIN\n    VCard: \n      Formatted Name: haijun li\n      Kind: individual\n      Address: \n          Street: 29 jinrong ave\n          Locale: xicheng district beijing\n          Postal Code: 100032\n          LABEL: 29,Jinrong Ave, Xicheng district,beijing,100032\n      Telephone: +86 1052686688\n          TYPE: voice\n      Telephone: +86 10 52616187\n          TYPE: fax\n      Email: hostmaster@chinamobile.com\n      Email: abuse@chinamobile.com\n          PREF: 1\n    Event: \n      Action: last changed\n      Date: 2016-11-29T09:38:38Z\n    Link: \n      Rel: self\n      Value: https://rdap.apnic.net/entity/HL1318-AP\n      Type: application/rdap+json\n      Href: https://rdap.apnic.net/entity/HL1318-AP\n    Notice: \n      Title: Source\n      Description: \n        Objects returned came from source\n        APNIC\n    Notice: \n      Title: Terms and Conditions\n        Description: This is the APNIC WHOIS Database query service. The objects are in RDAP format.\n        Link: \n          Rel: terms-of-service\n          Value: https://rdap.apnic.net/entity/HL1318-AP\n          Type: text/html\n          Href: http://www.apnic.net/db/dbcopyright.html\n    RDAP Conformance: \n      history_version_0\n      cidr0\n      rdap_level_0\n  Entity: \n    Handle: IRT-CHINAMOBILE-CN\n    Role: \n      ABUSE\n    VCard: \n      Formatted Name: IRT-CHINAMOBILE-CN\n      Kind: group\n      Address: \n          Street: china mobile communications corporation 29 jinrong ave.\n          Locale: xicheng district beijing\n          Postal Code: 100032\n        LABEL: \n          China Mobile Communications Corporation\n          29, Jinrong Ave., Xicheng District, Beijing, 100032\n      Email: abuse@chinamobile.com\n      Email: abuse@chinamobile.com\n          PREF: 1\n    Event: \n      Action: last changed\n      Date: 2020-07-16T05:55:01Z\n    Entity: \n      Role: \n        ADMIN\n        TECHNICAL\n    Remark: \n      Title: remarks\n        Description: abuse@chinamobile.com was validated on 2020-07-16\n    Link: \n      Rel: self\n      Value: https://rdap.apnic.net/entity/IRT-CHINAMOBILE-CN\n      Type: application/rdap+json\n      Href: https://rdap.apnic.net/entity/IRT-CHINAMOBILE-CN\n    Notice: \n      Title: Source\n      Description: \n        Objects returned came from source\n        APNIC\n    Notice: \n      Title: Terms and Conditions\n        Description: This is the APNIC WHOIS Database query service. The objects are in RDAP format.\n        Link: \n          Rel: terms-of-service\n          Value: https://rdap.apnic.net/entity/IRT-CHINAMOBILE-CN\n          Type: text/html\n          Href: http://www.apnic.net/db/dbcopyright.html\n    RDAP Conformance: \n      history_version_0\n      cidr0\n      rdap_level_0\n  Entity: \n    Role: \n      TECHNICAL\n  Remark: \n    Title: description\n      Description: China Mobile Communications Corporation\n  Link: \n    Rel: self\n    Value: https://rdap.apnic.net/ip/112.0.0.0\n    Type: application/rdap+json\n    Href: https://rdap.apnic.net/ip/112.0.0.0/13\n  Link: \n    Rel: related\n    Value: https://rdap.apnic.net/ip/112.0.0.0\n    Type: text/html\n    Href: https://netox.apnic.net/search/112.4.0.0%2F16?utm_source=rdap&utm_medium=result&utm_campaign=rdap_result\n  Link: \n    Rel: related\n    Value: https://rdap.apnic.net/ip/112.0.0.0\n    Type: text/html\n    Href: https://netox.apnic.net/search/112.0.0.0%2F14?utm_source=rdap&utm_medium=result&utm_campaign=rdap_result\n  Notice: \n    Title: Source\n    Description: \n      Objects returned came from source\n      APNIC\n  Notice: \n    Title: Terms and Conditions\n      Description: This is the APNIC WHOIS Database query service. The objects are in RDAP format.\n      Link: \n        Rel: terms-of-service\n        Value: https://rdap.apnic.net/ip/112.0.0.0\n        Type: text/html\n        Href: http://www.apnic.net/db/dbcopyright.html\n  RDAP Conformance: \n    history_version_0\n    cidr0\n    rdap_level_0\n", "whoisRawID": 0, "source": "WHOIS_RDAP"}, "whoisID": 6755197288228631410, "registrarName": "APNIC", "admin": {"zip": "100032", "address": "29 jinrong ave\nxicheng district beijing\n100032\n", "city": "xicheng district beijing", "phone": "+86 1052686688", "whoisContactID": 0, "street": "29 jinrong ave", "name": "haijun li", "id": 0, "fax": "+86 10 52616187", "email": "hostmaster@chinamobile.com,abuse@chinamobile.com"}, "whoisServer": "rdap.apnic.net", "createdAt": 1610564539, "expired": false, "contactOrganizations": [], "registrarParseCode": 8448, "netRange": {"netName": "CMNET-JIANGSU", "numericEnd": 1879375871, "netRange": "112.0.0.0 - 112.4.255.255", "whoisNetRangeID": 0, "numericStart": 1879048192, "status": "INACTIVE", "ipStart": "112.0.0.0", "ipEnd": "112.4.255.255"}, "auditUpdatedAt": 1610564539, "id": 6755197288228631410, "updatedAt": 1615455310, "domainUnicode": "112.0.0.0", "auditCreatedAt": 1610564539, "contactCountries": [], "compositeParseCode": 8448, "contactEmails": ["hostmaster@chinamobile.com,abuse@chinamobile.com", "abuse@chinamobile.com"], "tld": "ipv4", "domainAvailable": false, "noRecord": false, "nameservers": [], "domain": "112.0.0.0", "contactNames": ["haijun li", "IRT-CHINAMOBILE-CN"], "contacts": [{"zip": "100032", "address": "29 jinrong ave\nxicheng district beijing\n100032\n", "city": "xicheng district beijing", "phone": "+86 1052686688", "whoisContactID": 0, "street": "29 jinrong ave", "name": "haijun li", "id": 0, "fax": "+86 10 52616187", "email": "hostmaster@chinamobile.com,abuse@chinamobile.com"}, {"zip": "100032", "address": "china mobile communications corporation 29 jinrong ave.\nxicheng district beijing\n100032\n", "city": "xicheng district beijing", "whoisContactID": 0, "street": "china mobile communications corporation 29 jinrong ave.", "name": "IRT-CHINAMOBILE-CN", "id": 0, "email": "abuse@chinamobile.com"}], "status": "INACTIVE", "domainMd5": "af7ce139ebe6615d9579100b6bc83dba", "task_id": "e21aadfc21c2415888edb8598acf472e"}, {"abuse": {"zip": "100032", "address": "china mobile communications corporation 29 jinrong ave.\nxicheng district beijing\n100032\n", "city": "xicheng district beijing", "whoisContactID": 0, "street": "china mobile communications corporation 29 jinrong ave.", "name": "IRT-CHINAMOBILE2-CN", "id": 0, "email": "abuse@chinamobile.com"}, "technical": {"zip": "100032", "address": "29 jinrong ave\nxicheng district beijing\n100032\n", "city": "xicheng district beijing", "phone": "+86 1052686688", "whoisContactID": 0, "street": "29 jinrong ave", "name": "haijun li", "id": 0, "fax": "+86 10 52616187", "email": "hostmaster@chinamobile.com,abuse@chinamobile.com"}, "rawResponse": {"domain": "112.0.0.0", "whoisID": 6744220653190136488, "unparsed": "{\"rdapConformance\":[\"history_version_0\",\"cidr0\",\"rdap_level_0\"],\"objectClassName\":\"ip network\",\"handle\":\"112.0.0.0 - 112.63.255.255\",\"port43\":\"whois.apnic.net\",\"lang\":null,\"events\":[{\"eventAction\":\"last changed\",\"eventDate\":\"2020-07-15T13:09:54Z\",\"eventActor\":null,\"status\":[]}],\"notices\":[{\"title\":\"Source\",\"type\":null,\"description\":[\"Objects returned came from source\",\"APNIC\"],\"links\":[]},{\"title\":\"Terms and Conditions\",\"type\":null,\"description\":[\"This is the APNIC WHOIS Database query service. The objects are in RDAP format.\"],\"links\":[{\"value\":\"https://rdap.apnic.net/ip/112.49.210.201\",\"rel\":\"terms-of-service\",\"href\":\"http://www.apnic.net/db/dbcopyright.html\",\"hreflang\":null,\"title\":null,\"media\":null,\"type\":\"text/html\"}]}],\"status\":[],\"entities\":[{\"rdapConformance\":[],\"objectClassName\":\"entity\",\"handle\":null,\"port43\":null,\"lang\":null,\"events\":[],\"notices\":[],\"status\":[],\"entities\":[],\"remarks\":[],\"links\":[],\"nameservers\":[],\"entity\":null,\"errorCode\":null,\"errorTitle\":null,\"errorDescription\":[],\"vcardArray\":null,\"roles\":[\"admin\"],\"publicIds\":[],\"legalRepresentative\":null,\"networks\":null,\"autnums\":null,\"nicbr_domainCount\":0,\"nicbr_inetCount\":0,\"nicbr_autnumCount\":0,\"contact_URI\":null},{\"rdapConformance\":[\"history_version_0\",\"cidr0\",\"rdap_level_0\"],\"objectClassName\":\"entity\",\"handle\":\"HL1318-AP\",\"port43\":\"whois.apnic.net\",\"lang\":null,\"events\":[{\"eventAction\":\"last changed\",\"eventDate\":\"2016-11-29T09:38:38Z\",\"eventActor\":null,\"status\":[]}],\"notices\":[{\"title\":\"Source\",\"type\":null,\"description\":[\"Objects returned came from source\",\"APNIC\"],\"links\":[]},{\"title\":\"Terms and Conditions\",\"type\":null,\"description\":[\"This is the APNIC WHOIS Database query service. The objects are in RDAP format.\"],\"links\":[{\"value\":\"https://rdap.apnic.net/entity/HL1318-AP\",\"rel\":\"terms-of-service\",\"href\":\"http://www.apnic.net/db/dbcopyright.html\",\"hreflang\":null,\"title\":null,\"media\":null,\"type\":\"text/html\"}]}],\"status\":[],\"entities\":[],\"remarks\":[],\"links\":[{\"value\":\"https://rdap.apnic.net/entity/HL1318-AP\",\"rel\":\"self\",\"href\":\"https://rdap.apnic.net/entity/HL1318-AP\",\"hreflang\":null,\"title\":null,\"media\":null,\"type\":\"application/rdap+json\"}],\"nameservers\":[],\"entity\":null,\"errorCode\":null,\"errorTitle\":null,\"errorDescription\":[],\"vcardArray\":[\"vcard\",[[\"version\",{},\"text\",\"4.0\"],[\"fn\",{},\"text\",\"haijun li\"],[\"kind\",{},\"text\",\"individual\"],[\"adr\",{\"label\":\"29,Jinrong Ave, Xicheng district,beijing,100032\"},\"text\",[\"\",\"\",\"29 jinrong ave\",\"xicheng district beijing\",\"\",\"100032\",\"\"]],[\"tel\",{\"type\":\"voice\"},\"text\",\"+86 1052686688\"],[\"tel\",{\"type\":\"fax\"},\"text\",\"+86 10 52616187\"],[\"email\",{},\"text\",\"hostmaster@chinamobile.com\"],[\"email\",{\"pref\":\"1\"},\"text\",\"abuse@chinamobile.com\"]]],\"roles\":[\"technical\"],\"publicIds\":[],\"legalRepresentative\":null,\"networks\":null,\"autnums\":null,\"nicbr_domainCount\":0,\"nicbr_inetCount\":0,\"nicbr_autnumCount\":0,\"contact_URI\":null},{\"rdapConformance\":[\"history_version_0\",\"cidr0\",\"rdap_level_0\"],\"objectClassName\":\"entity\",\"handle\":\"IRT-CHINAMOBILE2-CN\",\"port43\":\"whois.apnic.net\",\"lang\":null,\"events\":[{\"eventAction\":\"last changed\",\"eventDate\":\"2020-07-16T05:55:00Z\",\"eventActor\":null,\"status\":[]}],\"notices\":[{\"title\":\"Source\",\"type\":null,\"description\":[\"Objects returned came from source\",\"APNIC\"],\"links\":[]},{\"title\":\"Terms and Conditions\",\"type\":null,\"description\":[\"This is the APNIC WHOIS Database query service. The objects are in RDAP format.\"],\"links\":[{\"value\":\"https://rdap.apnic.net/entity/IRT-CHINAMOBILE2-CN\",\"rel\":\"terms-of-service\",\"href\":\"http://www.apnic.net/db/dbcopyright.html\",\"hreflang\":null,\"title\":null,\"media\":null,\"type\":\"text/html\"}]}],\"status\":[],\"entities\":[{\"rdapConformance\":[],\"objectClassName\":\"entity\",\"handle\":\"ct74-AP\",\"port43\":null,\"lang\":null,\"events\":[{\"eventAction\":\"last changed\",\"eventDate\":\"2016-11-29T09:37:27Z\",\"eventActor\":null,\"status\":[]}],\"notices\":[],\"status\":[],\"entities\":[],\"remarks\":[],\"links\":[{\"value\":\"https://rdap.apnic.net/entity/IRT-CHINAMOBILE2-CN\",\"rel\":\"self\",\"href\":\"https://rdap.apnic.net/entity/ct74-AP\",\"hreflang\":null,\"title\":null,\"media\":null,\"type\":\"application/rdap+json\"}],\"nameservers\":[],\"entity\":null,\"errorCode\":null,\"errorTitle\":null,\"errorDescription\":[],\"vcardArray\":[\"vcard\",[[\"version\",{},\"text\",\"4.0\"],[\"fn\",{},\"text\",\"chinamobile tech\"],[\"kind\",{},\"text\",\"group\"],[\"adr\",{\"label\":\"29, Jinrong Ave.,Xicheng district\\nBeijing\"},\"text\",[\"\",\"\",\"\",\"\",\"\",\"\",\"\"]],[\"tel\",{\"type\":\"voice\"},\"text\",\"+86 5268 6688\"],[\"tel\",{\"type\":\"fax\"},\"text\",\"+86 5261 6187\"],[\"email\",{},\"text\",\"hostmaster@chinamobile.com\"],[\"email\",{\"pref\":\"1\"},\"text\",\"abuse@chinamobile.com\"]]],\"roles\":[\"admin\"],\"publicIds\":[],\"legalRepresentative\":null,\"networks\":null,\"autnums\":null,\"nicbr_domainCount\":0,\"nicbr_inetCount\":0,\"nicbr_autnumCount\":0,\"contact_URI\":null},{\"rdapConformance\":[],\"objectClassName\":\"entity\",\"handle\":null,\"port43\":null,\"lang\":null,\"events\":[],\"notices\":[],\"status\":[],\"entities\":[],\"remarks\":[],\"links\":[],\"nameservers\":[],\"entity\":null,\"errorCode\":null,\"errorTitle\":null,\"errorDescription\":[],\"vcardArray\":null,\"roles\":[\"technical\"],\"publicIds\":[],\"legalRepresentative\":null,\"networks\":null,\"autnums\":null,\"nicbr_domainCount\":0,\"nicbr_inetCount\":0,\"nicbr_autnumCount\":0,\"contact_URI\":null}],\"remarks\":[{\"title\":\"remarks\",\"description\":[\"abuse@chinamobile.com was validated on 2020-07-16\"],\"type\":null,\"links\":null}],\"links\":[{\"value\":\"https://rdap.apnic.net/entity/IRT-CHINAMOBILE2-CN\",\"rel\":\"self\",\"href\":\"https://rdap.apnic.net/entity/IRT-CHINAMOBILE2-CN\",\"hreflang\":null,\"title\":null,\"media\":null,\"type\":\"application/rdap+json\"}],\"nameservers\":[],\"entity\":null,\"errorCode\":null,\"errorTitle\":null,\"errorDescription\":[],\"vcardArray\":[\"vcard\",[[\"version\",{},\"text\",\"4.0\"],[\"fn\",{},\"text\",\"IRT-CHINAMOBILE2-CN\"],[\"kind\",{},\"text\",\"group\"],[\"adr\",{\"label\":\"China Mobile Communications Corporation\\n29, Jinrong Ave., Xicheng District, Beijing, 100032\"},\"text\",[\"\",\"\",\"china mobile communications corporation 29 jinrong ave.\",\"xicheng district beijing\",\"\",\"100032\",\"\"]],[\"email\",{},\"text\",\"abuse@chinamobile.com\"],[\"email\",{\"pref\":\"1\"},\"text\",\"abuse@chinamobile.com\"]]],\"roles\":[\"abuse\"],\"publicIds\":[],\"legalRepresentative\":null,\"networks\":null,\"autnums\":null,\"nicbr_domainCount\":0,\"nicbr_inetCount\":0,\"nicbr_autnumCount\":0,\"contact_URI\":null}],\"remarks\":[{\"title\":\"description\",\"description\":[\"China Mobile Communications Corporation\",\"Mobile Communications Network Operator in China\",\"Internet Service Provider in China\"],\"type\":null,\"links\":null},{\"title\":\"remarks\",\"description\":[\"service provider\",\"--------------------------------------------------------\",\"To report network abuse, please contact mnt-irt\",\"For troubleshooting, please contact tech-c and admin-c\",\"Report invalid contact via www.apnic.net/invalidcontact\",\"--------------------------------------------------------\"],\"type\":null,\"links\":null}],\"links\":[{\"value\":\"https://rdap.apnic.net/ip/112.49.210.201\",\"rel\":\"self\",\"href\":\"https://rdap.apnic.net/ip/112.0.0.0/10\",\"hreflang\":null,\"title\":null,\"media\":null,\"type\":\"application/rdap+json\"},{\"value\":\"https://rdap.apnic.net/ip/112.49.210.201\",\"rel\":\"related\",\"href\":\"https://netox.apnic.net/search/112.0.0.0%2F10?utm_source=rdap&utm_medium=result&utm_campaign=rdap_result\",\"hreflang\":null,\"title\":null,\"media\":null,\"type\":\"text/html\"}],\"nameservers\":[],\"entity\":null,\"errorCode\":null,\"errorTitle\":null,\"errorDescription\":[],\"startAddress\":\"112.0.0.0\",\"endAddress\":\"112.63.255.255\",\"ipVersion\":\"v4\",\"name\":\"CMNET\",\"type\":\"ALLOCATED PORTABLE\",\"country\":\"CN\",\"parentHandle\":null,\"cidr0_cidrs\":[{\"v4prefix\":\"112.0.0.0\",\"v6prefix\":null,\"length\":\"10\"}],\"arin_originas0_originautnums\":[],\"lacnic_originAutnum\":null,\"lacnic_reverseDelegations\":[],\"lacnic_legalRepresentative\":null,\"nicbr_autnum\":null,\"nicbr_reverseDelegations\":[]}", "raw": "IP Network: \n  Handle: 112.0.0.0 - 112.63.255.255\n  Start Address: 112.0.0.0\n  End Address: 112.63.255.255\n  IP Version: v4\n  Name: CMNET\n  Type: ALLOCATED PORTABLE\n  Country: CN\n  Port43: whois.apnic.net\n\n  Cidr: \n    Prefix: 112.0.0.0\n    Length: 10\n  Event: \n    Action: last changed\n    Date: 2020-07-15T13:09:54Z\n  Entity: \n    Role: \n      ADMIN\n  Entity: \n    Handle: HL1318-AP\n    Role: \n      TECHNICAL\n    VCard: \n      Formatted Name: haijun li\n      Kind: individual\n      Address: \n          Street: 29 jinrong ave\n          Locale: xicheng district beijing\n          Postal Code: 100032\n          LABEL: 29,Jinrong Ave, Xicheng district,beijing,100032\n      Telephone: +86 1052686688\n          TYPE: voice\n      Telephone: +86 10 52616187\n          TYPE: fax\n      Email: hostmaster@chinamobile.com\n      Email: abuse@chinamobile.com\n          PREF: 1\n    Event: \n      Action: last changed\n      Date: 2016-11-29T09:38:38Z\n    Link: \n      Rel: self\n      Value: https://rdap.apnic.net/entity/HL1318-AP\n      Type: application/rdap+json\n      Href: https://rdap.apnic.net/entity/HL1318-AP\n    Notice: \n      Title: Source\n      Description: \n        Objects returned came from source\n        APNIC\n    Notice: \n      Title: Terms and Conditions\n        Description: This is the APNIC WHOIS Database query service. The objects are in RDAP format.\n        Link: \n          Rel: terms-of-service\n          Value: https://rdap.apnic.net/entity/HL1318-AP\n          Type: text/html\n          Href: http://www.apnic.net/db/dbcopyright.html\n    RDAP Conformance: \n      history_version_0\n      cidr0\n      rdap_level_0\n  Entity: \n    Handle: IRT-CHINAMOBILE2-CN\n    Role: \n      ABUSE\n    VCard: \n      Formatted Name: IRT-CHINAMOBILE2-CN\n      Kind: group\n      Address: \n          Street: china mobile communications corporation 29 jinrong ave.\n          Locale: xicheng district beijing\n          Postal Code: 100032\n        LABEL: \n          China Mobile Communications Corporation\n          29, Jinrong Ave., Xicheng District, Beijing, 100032\n      Email: abuse@chinamobile.com\n      Email: abuse@chinamobile.com\n          PREF: 1\n    Event: \n      Action: last changed\n      Date: 2020-07-16T05:55:00Z\n    Entity: \n      Handle: ct74-AP\n      Role: \n        ADMIN\n      VCard: \n        Formatted Name: chinamobile tech\n        Kind: group\n        Address: \n          LABEL: \n            29, Jinrong Ave.,Xicheng district\n            Beijing\n        Telephone: +86 5268 6688\n            TYPE: voice\n        Telephone: +86 5261 6187\n            TYPE: fax\n        Email: hostmaster@chinamobile.com\n        Email: abuse@chinamobile.com\n            PREF: 1\n      Event: \n        Action: last changed\n        Date: 2016-11-29T09:37:27Z\n      Link: \n        Rel: self\n        Value: https://rdap.apnic.net/entity/IRT-CHINAMOBILE2-CN\n        Type: application/rdap+json\n        Href: https://rdap.apnic.net/entity/ct74-AP\n    Entity: \n      Role: \n        TECHNICAL\n    Remark: \n      Title: remarks\n        Description: abuse@chinamobile.com was validated on 2020-07-16\n    Link: \n      Rel: self\n      Value: https://rdap.apnic.net/entity/IRT-CHINAMOBILE2-CN\n      Type: application/rdap+json\n      Href: https://rdap.apnic.net/entity/IRT-CHINAMOBILE2-CN\n    Notice: \n      Title: Source\n      Description: \n        Objects returned came from source\n        APNIC\n    Notice: \n      Title: Terms and Conditions\n        Description: This is the APNIC WHOIS Database query service. The objects are in RDAP format.\n        Link: \n          Rel: terms-of-service\n          Value: https://rdap.apnic.net/entity/IRT-CHINAMOBILE2-CN\n          Type: text/html\n          Href: http://www.apnic.net/db/dbcopyright.html\n    RDAP Conformance: \n      history_version_0\n      cidr0\n      rdap_level_0\n  Remark: \n    Title: description\n    Description: \n      China Mobile Communications Corporation\n      Mobile Communications Network Operator in China\n      Internet Service Provider in China\n  Remark: \n    Title: remarks\n    Description: \n      service provider\n      --------------------------------------------------------\n      To report network abuse, please contact mnt-irt\n      For troubleshooting, please contact tech-c and admin-c\n      Report invalid contact via www.apnic.net/invalidcontact\n      --------------------------------------------------------\n  Link: \n    Rel: self\n    Value: https://rdap.apnic.net/ip/112.49.210.201\n    Type: application/rdap+json\n    Href: https://rdap.apnic.net/ip/112.0.0.0/10\n  Link: \n    Rel: related\n    Value: https://rdap.apnic.net/ip/112.49.210.201\n    Type: text/html\n    Href: https://netox.apnic.net/search/112.0.0.0%2F10?utm_source=rdap&utm_medium=result&utm_campaign=rdap_result\n  Notice: \n    Title: Source\n    Description: \n      Objects returned came from source\n      APNIC\n  Notice: \n    Title: Terms and Conditions\n      Description: This is the APNIC WHOIS Database query service. The objects are in RDAP format.\n      Link: \n        Rel: terms-of-service\n        Value: https://rdap.apnic.net/ip/112.49.210.201\n        Type: text/html\n        Href: http://www.apnic.net/db/dbcopyright.html\n  RDAP Conformance: \n    history_version_0\n    cidr0\n    rdap_level_0\n", "whoisRawID": 0, "source": "WHOIS_RDAP"}, "registrarUpdatedAt": 1594818594, "whoisID": 6744220653190136488, "registrarName": "APNIC", "whoisServer": "rdap.apnic.net", "createdAt": 1607947505, "expired": false, "contactOrganizations": [], "registrarParseCode": 10272, "netRange": {"netName": "CMNET", "numericEnd": 1883242495, "netRange": "112.0.0.0 - 112.63.255.255", "originAS": "AS9808", "whoisNetRangeID": 0, "numericStart": 1879048192, "status": "INACTIVE", "ipStart": "112.0.0.0", "ipEnd": "112.63.255.255"}, "auditUpdatedAt": 1607947505, "id": 6744220653190136488, "updatedAt": 1610564539, "domainUnicode": "112.0.0.0", "auditCreatedAt": 1607947505, "contactCountries": [], "compositeParseCode": 10272, "contactEmails": ["hostmaster@chinamobile.com,abuse@chinamobile.com", "abuse@chinamobile.com"], "tld": "ipv4", "domainAvailable": false, "noRecord": false, "nameservers": [], "domain": "112.0.0.0", "contactNames": ["haijun li", "IRT-CHINAMOBILE2-CN"], "contacts": [{"zip": "100032", "address": "29 jinrong ave\nxicheng district beijing\n100032\n", "city": "xicheng district beijing", "phone": "+86 1052686688", "whoisContactID": 0, "street": "29 jinrong ave", "name": "haijun li", "id": 0, "fax": "+86 10 52616187", "email": "hostmaster@chinamobile.com,abuse@chinamobile.com"}, {"zip": "100032", "address": "china mobile communications corporation 29 jinrong ave.\nxicheng district beijing\n100032\n", "city": "xicheng district beijing", "whoisContactID": 0, "street": "china mobile communications corporation 29 jinrong ave.", "name": "IRT-CHINAMOBILE2-CN", "id": 0, "email": "abuse@chinamobile.com"}], "status": "INACTIVE", "domainMd5": "af7ce139ebe6615d9579100b6bc83dba", "task_id": "e1fb56e09f134cf6aa6a80d3f3621d7b"}, {"abuse": {"zip": "100032", "address": "china mobile communications corporation 29 jinrong ave.\nxicheng district beijing\n100032\n", "city": "xicheng district beijing", "whoisContactID": 0, "street": "china mobile communications corporation 29 jinrong ave.", "name": "IRT-CHINAMOBILE-CN", "id": 0, "email": "abuse@chinamobile.com"}, "rawResponse": {"domain": "112.0.0.0", "whoisID": 6740382278574515411, "unparsed": "{\"rdapConformance\":[\"history_version_0\",\"cidr0\",\"rdap_level_0\"],\"objectClassName\":\"ip network\",\"handle\":\"112.0.0.0 - 112.4.255.255\",\"port43\":\"whois.apnic.net\",\"lang\":null,\"events\":[],\"notices\":[{\"title\":\"Source\",\"type\":null,\"description\":[\"Objects returned came from source\",\"APNIC\"],\"links\":[]},{\"title\":\"Terms and Conditions\",\"type\":null,\"description\":[\"This is the APNIC WHOIS Database query service. The objects are in RDAP format.\"],\"links\":[{\"value\":\"https://rdap.apnic.net/ip/112.0.0.0\",\"rel\":\"terms-of-service\",\"href\":\"http://www.apnic.net/db/dbcopyright.html\",\"hreflang\":null,\"title\":null,\"media\":null,\"type\":\"text/html\"}]}],\"status\":[],\"entities\":[{\"rdapConformance\":[],\"objectClassName\":\"entity\",\"handle\":null,\"port43\":null,\"lang\":null,\"events\":[],\"notices\":[],\"status\":[],\"entities\":[],\"remarks\":[],\"links\":[],\"nameservers\":[],\"entity\":null,\"errorCode\":null,\"errorTitle\":null,\"errorDescription\":[],\"vcardArray\":null,\"roles\":[\"technical\"],\"publicIds\":[],\"legalRepresentative\":null,\"networks\":null,\"autnums\":null,\"nicbr_domainCount\":0,\"nicbr_inetCount\":0,\"nicbr_autnumCount\":0,\"contact_URI\":null},{\"rdapConformance\":[\"history_version_0\",\"cidr0\",\"rdap_level_0\"],\"objectClassName\":\"entity\",\"handle\":\"HL1318-AP\",\"port43\":\"whois.apnic.net\",\"lang\":null,\"events\":[{\"eventAction\":\"last changed\",\"eventDate\":\"2016-11-29T09:38:38Z\",\"eventActor\":null,\"status\":[]}],\"notices\":[{\"title\":\"Source\",\"type\":null,\"description\":[\"Objects returned came from source\",\"APNIC\"],\"links\":[]},{\"title\":\"Terms and Conditions\",\"type\":null,\"description\":[\"This is the APNIC WHOIS Database query service. The objects are in RDAP format.\"],\"links\":[{\"value\":\"https://rdap.apnic.net/entity/HL1318-AP\",\"rel\":\"terms-of-service\",\"href\":\"http://www.apnic.net/db/dbcopyright.html\",\"hreflang\":null,\"title\":null,\"media\":null,\"type\":\"text/html\"}]}],\"status\":[],\"entities\":[],\"remarks\":[],\"links\":[{\"value\":\"https://rdap.apnic.net/entity/HL1318-AP\",\"rel\":\"self\",\"href\":\"https://rdap.apnic.net/entity/HL1318-AP\",\"hreflang\":null,\"title\":null,\"media\":null,\"type\":\"application/rdap+json\"}],\"nameservers\":[],\"entity\":null,\"errorCode\":null,\"errorTitle\":null,\"errorDescription\":[],\"vcardArray\":[\"vcard\",[[\"version\",{},\"text\",\"4.0\"],[\"fn\",{},\"text\",\"haijun li\"],[\"kind\",{},\"text\",\"individual\"],[\"adr\",{\"label\":\"29,Jinrong Ave, Xicheng district,beijing,100032\"},\"text\",[\"\",\"\",\"29 jinrong ave\",\"xicheng district beijing\",\"\",\"100032\",\"\"]],[\"tel\",{\"type\":\"voice\"},\"text\",\"+86 1052686688\"],[\"tel\",{\"type\":\"fax\"},\"text\",\"+86 10 52616187\"],[\"email\",{},\"text\",\"hostmaster@chinamobile.com\"],[\"email\",{\"pref\":\"1\"},\"text\",\"abuse@chinamobile.com\"]]],\"roles\":[\"admin\"],\"publicIds\":[],\"legalRepresentative\":null,\"networks\":null,\"autnums\":null,\"nicbr_domainCount\":0,\"nicbr_inetCount\":0,\"nicbr_autnumCount\":0,\"contact_URI\":null},{\"rdapConformance\":[\"history_version_0\",\"cidr0\",\"rdap_level_0\"],\"objectClassName\":\"entity\",\"handle\":\"IRT-CHINAMOBILE-CN\",\"port43\":\"whois.apnic.net\",\"lang\":null,\"events\":[{\"eventAction\":\"last changed\",\"eventDate\":\"2020-07-16T05:55:01Z\",\"eventActor\":null,\"status\":[]}],\"notices\":[{\"title\":\"Source\",\"type\":null,\"description\":[\"Objects returned came from source\",\"APNIC\"],\"links\":[]},{\"title\":\"Terms and Conditions\",\"type\":null,\"description\":[\"This is the APNIC WHOIS Database query service. The objects are in RDAP format.\"],\"links\":[{\"value\":\"https://rdap.apnic.net/entity/IRT-CHINAMOBILE-CN\",\"rel\":\"terms-of-service\",\"href\":\"http://www.apnic.net/db/dbcopyright.html\",\"hreflang\":null,\"title\":null,\"media\":null,\"type\":\"text/html\"}]}],\"status\":[],\"entities\":[{\"rdapConformance\":[],\"objectClassName\":\"entity\",\"handle\":null,\"port43\":null,\"lang\":null,\"events\":[],\"notices\":[],\"status\":[],\"entities\":[],\"remarks\":[],\"links\":[],\"nameservers\":[],\"entity\":null,\"errorCode\":null,\"errorTitle\":null,\"errorDescription\":[],\"vcardArray\":null,\"roles\":[\"admin\",\"technical\"],\"publicIds\":[],\"legalRepresentative\":null,\"networks\":null,\"autnums\":null,\"nicbr_domainCount\":0,\"nicbr_inetCount\":0,\"nicbr_autnumCount\":0,\"contact_URI\":null}],\"remarks\":[{\"title\":\"remarks\",\"description\":[\"abuse@chinamobile.com was validated on 2020-07-16\"],\"type\":null,\"links\":null}],\"links\":[{\"value\":\"https://rdap.apnic.net/entity/IRT-CHINAMOBILE-CN\",\"rel\":\"self\",\"href\":\"https://rdap.apnic.net/entity/IRT-CHINAMOBILE-CN\",\"hreflang\":null,\"title\":null,\"media\":null,\"type\":\"application/rdap+json\"}],\"nameservers\":[],\"entity\":null,\"errorCode\":null,\"errorTitle\":null,\"errorDescription\":[],\"vcardArray\":[\"vcard\",[[\"version\",{},\"text\",\"4.0\"],[\"fn\",{},\"text\",\"IRT-CHINAMOBILE-CN\"],[\"kind\",{},\"text\",\"group\"],[\"adr\",{\"label\":\"China Mobile Communications Corporation\\n29, Jinrong Ave., Xicheng District, Beijing, 100032\"},\"text\",[\"\",\"\",\"china mobile communications corporation 29 jinrong ave.\",\"xicheng district beijing\",\"\",\"100032\",\"\"]],[\"email\",{},\"text\",\"abuse@chinamobile.com\"],[\"email\",{\"pref\":\"1\"},\"text\",\"abuse@chinamobile.com\"]]],\"roles\":[\"abuse\"],\"publicIds\":[],\"legalRepresentative\":null,\"networks\":null,\"autnums\":null,\"nicbr_domainCount\":0,\"nicbr_inetCount\":0,\"nicbr_autnumCount\":0,\"contact_URI\":null}],\"remarks\":[{\"title\":\"description\",\"description\":[\"China Mobile Communications Corporation\"],\"type\":null,\"links\":null}],\"links\":[{\"value\":\"https://rdap.apnic.net/ip/112.0.0.0\",\"rel\":\"self\",\"href\":\"https://rdap.apnic.net/ip/112.0.0.0/13\",\"hreflang\":null,\"title\":null,\"media\":null,\"type\":\"application/rdap+json\"},{\"value\":\"https://rdap.apnic.net/ip/112.0.0.0\",\"rel\":\"related\",\"href\":\"https://netox.apnic.net/search/112.0.0.0%2F14?utm_source=rdap&utm_medium=result&utm_campaign=rdap_result\",\"hreflang\":null,\"title\":null,\"media\":null,\"type\":\"text/html\"},{\"value\":\"https://rdap.apnic.net/ip/112.0.0.0\",\"rel\":\"related\",\"href\":\"https://netox.apnic.net/search/112.4.0.0%2F16?utm_source=rdap&utm_medium=result&utm_campaign=rdap_result\",\"hreflang\":null,\"title\":null,\"media\":null,\"type\":\"text/html\"}],\"nameservers\":[],\"entity\":null,\"errorCode\":null,\"errorTitle\":null,\"errorDescription\":[],\"startAddress\":\"112.0.0.0\",\"endAddress\":\"112.4.255.255\",\"ipVersion\":\"v4\",\"name\":\"CMNET-JIANGSU\",\"type\":\"ALLOCATED NON-PORTABLE\",\"country\":\"CN\",\"parentHandle\":null,\"cidr0_cidrs\":[{\"v4prefix\":\"112.4.0.0\",\"v6prefix\":null,\"length\":\"16\"},{\"v4prefix\":\"112.0.0.0\",\"v6prefix\":null,\"length\":\"14\"}],\"arin_originas0_originautnums\":[],\"lacnic_originAutnum\":null,\"lacnic_reverseDelegations\":[],\"lacnic_legalRepresentative\":null,\"nicbr_autnum\":null,\"nicbr_reverseDelegations\":[]}", "raw": "IP Network: \n  Handle: 112.0.0.0 - 112.4.255.255\n  Start Address: 112.0.0.0\n  End Address: 112.4.255.255\n  IP Version: v4\n  Name: CMNET-JIANGSU\n  Type: ALLOCATED NON-PORTABLE\n  Country: CN\n  Port43: whois.apnic.net\n\n  Cidr: \n    Prefix: 112.4.0.0\n    Length: 16\n  Cidr: \n    Prefix: 112.0.0.0\n    Length: 14\n  Entity: \n    Role: \n      TECHNICAL\n  Entity: \n    Handle: HL1318-AP\n    Role: \n      ADMIN\n    VCard: \n      Formatted Name: haijun li\n      Kind: individual\n      Address: \n          Street: 29 jinrong ave\n          Locale: xicheng district beijing\n          Postal Code: 100032\n          LABEL: 29,Jinrong Ave, Xicheng district,beijing,100032\n      Telephone: +86 1052686688\n          TYPE: voice\n      Telephone: +86 10 52616187\n          TYPE: fax\n      Email: hostmaster@chinamobile.com\n      Email: abuse@chinamobile.com\n          PREF: 1\n    Event: \n      Action: last changed\n      Date: 2016-11-29T09:38:38Z\n    Link: \n      Rel: self\n      Value: https://rdap.apnic.net/entity/HL1318-AP\n      Type: application/rdap+json\n      Href: https://rdap.apnic.net/entity/HL1318-AP\n    Notice: \n      Title: Source\n      Description: \n        Objects returned came from source\n        APNIC\n    Notice: \n      Title: Terms and Conditions\n        Description: This is the APNIC WHOIS Database query service. The objects are in RDAP format.\n        Link: \n          Rel: terms-of-service\n          Value: https://rdap.apnic.net/entity/HL1318-AP\n          Type: text/html\n          Href: http://www.apnic.net/db/dbcopyright.html\n    RDAP Conformance: \n      history_version_0\n      cidr0\n      rdap_level_0\n  Entity: \n    Handle: IRT-CHINAMOBILE-CN\n    Role: \n      ABUSE\n    VCard: \n      Formatted Name: IRT-CHINAMOBILE-CN\n      Kind: group\n      Address: \n          Street: china mobile communications corporation 29 jinrong ave.\n          Locale: xicheng district beijing\n          Postal Code: 100032\n        LABEL: \n          China Mobile Communications Corporation\n          29, Jinrong Ave., Xicheng District, Beijing, 100032\n      Email: abuse@chinamobile.com\n      Email: abuse@chinamobile.com\n          PREF: 1\n    Event: \n      Action: last changed\n      Date: 2020-07-16T05:55:01Z\n    Entity: \n      Role: \n        ADMIN\n        TECHNICAL\n    Remark: \n      Title: remarks\n        Description: abuse@chinamobile.com was validated on 2020-07-16\n    Link: \n      Rel: self\n      Value: https://rdap.apnic.net/entity/IRT-CHINAMOBILE-CN\n      Type: application/rdap+json\n      Href: https://rdap.apnic.net/entity/IRT-CHINAMOBILE-CN\n    Notice: \n      Title: Source\n      Description: \n        Objects returned came from source\n        APNIC\n    Notice: \n      Title: Terms and Conditions\n        Description: This is the APNIC WHOIS Database query service. The objects are in RDAP format.\n        Link: \n          Rel: terms-of-service\n          Value: https://rdap.apnic.net/entity/IRT-CHINAMOBILE-CN\n          Type: text/html\n          Href: http://www.apnic.net/db/dbcopyright.html\n    RDAP Conformance: \n      history_version_0\n      cidr0\n      rdap_level_0\n  Remark: \n    Title: description\n      Description: China Mobile Communications Corporation\n  Link: \n    Rel: self\n    Value: https://rdap.apnic.net/ip/112.0.0.0\n    Type: application/rdap+json\n    Href: https://rdap.apnic.net/ip/112.0.0.0/13\n  Link: \n    Rel: related\n    Value: https://rdap.apnic.net/ip/112.0.0.0\n    Type: text/html\n    Href: https://netox.apnic.net/search/112.0.0.0%2F14?utm_source=rdap&utm_medium=result&utm_campaign=rdap_result\n  Link: \n    Rel: related\n    Value: https://rdap.apnic.net/ip/112.0.0.0\n    Type: text/html\n    Href: https://netox.apnic.net/search/112.4.0.0%2F16?utm_source=rdap&utm_medium=result&utm_campaign=rdap_result\n  Notice: \n    Title: Source\n    Description: \n      Objects returned came from source\n      APNIC\n  Notice: \n    Title: Terms and Conditions\n      Description: This is the APNIC WHOIS Database query service. The objects are in RDAP format.\n      Link: \n        Rel: terms-of-service\n        Value: https://rdap.apnic.net/ip/112.0.0.0\n        Type: text/html\n        Href: http://www.apnic.net/db/dbcopyright.html\n  RDAP Conformance: \n    history_version_0\n    cidr0\n    rdap_level_0\n", "whoisRawID": 0, "source": "WHOIS_RDAP"}, "whoisID": 6740382278574515411, "registrarName": "APNIC", "admin": {"zip": "100032", "address": "29 jinrong ave\nxicheng district beijing\n100032\n", "city": "xicheng district beijing", "phone": "+86 1052686688", "whoisContactID": 0, "street": "29 jinrong ave", "name": "haijun li", "id": 0, "fax": "+86 10 52616187", "email": "hostmaster@chinamobile.com,abuse@chinamobile.com"}, "whoisServer": "rdap.apnic.net", "createdAt": 1607032365, "expired": false, "contactOrganizations": [], "registrarParseCode": 8448, "netRange": {"netName": "CMNET-JIANGSU", "numericEnd": 1879375871, "netRange": "112.0.0.0 - 112.4.255.255", "whoisNetRangeID": 0, "numericStart": 1879048192, "status": "INACTIVE", "ipStart": "112.0.0.0", "ipEnd": "112.4.255.255"}, "auditUpdatedAt": 1607032365, "id": 6740382278574515411, "updatedAt": 1607947505, "domainUnicode": "112.0.0.0", "auditCreatedAt": 1607032365, "contactCountries": [], "compositeParseCode": 8448, "contactEmails": ["hostmaster@chinamobile.com,abuse@chinamobile.com", "abuse@chinamobile.com"], "tld": "ipv4", "domainAvailable": false, "noRecord": false, "nameservers": [], "domain": "112.0.0.0", "contactNames": ["haijun li", "IRT-CHINAMOBILE-CN"], "contacts": [{"zip": "100032", "address": "29 jinrong ave\nxicheng district beijing\n100032\n", "city": "xicheng district beijing", "phone": "+86 1052686688", "whoisContactID": 0, "street": "29 jinrong ave", "name": "haijun li", "id": 0, "fax": "+86 10 52616187", "email": "hostmaster@chinamobile.com,abuse@chinamobile.com"}, {"zip": "100032", "address": "china mobile communications corporation 29 jinrong ave.\nxicheng district beijing\n100032\n", "city": "xicheng district beijing", "whoisContactID": 0, "street": "china mobile communications corporation 29 jinrong ave.", "name": "IRT-CHINAMOBILE-CN", "id": 0, "email": "abuse@chinamobile.com"}], "status": "INACTIVE", "domainMd5": "af7ce139ebe6615d9579100b6bc83dba", "task_id": "2bbc0e1f3d364eb4a7ee28ef930a3cfa"}, {"abuse": {"zip": "100032", "address": "china mobile communications corporation 29 jinrong ave.\nxicheng district beijing\n100032\n", "city": "xicheng district beijing", "whoisContactID": 0, "street": "china mobile communications corporation 29 jinrong ave.", "name": "IRT-CHINAMOBILE2-CN", "id": 0, "email": "abuse@chinamobile.com"}, "technical": {"zip": "100032", "address": "29 jinrong ave\nxicheng district beijing\n100032\n", "city": "xicheng district beijing", "phone": "+86 1052686688", "whoisContactID": 0, "street": "29 jinrong ave", "name": "haijun li", "id": 0, "fax": "+86 10 52616187", "email": "hostmaster@chinamobile.com,abuse@chinamobile.com"}, "rawResponse": {"domain": "112.0.0.0", "whoisID": 6727507388855738220, "unparsed": "{\"rdapConformance\":[\"history_version_0\",\"cidr0\",\"rdap_level_0\"],\"objectClassName\":\"ip network\",\"handle\":\"112.0.0.0 - 112.63.255.255\",\"port43\":\"whois.apnic.net\",\"lang\":null,\"events\":[{\"eventAction\":\"last changed\",\"eventDate\":\"2020-07-15T13:09:54Z\",\"eventActor\":null,\"status\":[]}],\"notices\":[{\"title\":\"Source\",\"type\":null,\"description\":[\"Objects returned came from source\",\"APNIC\"],\"links\":[]},{\"title\":\"Terms and Conditions\",\"type\":null,\"description\":[\"This is the APNIC WHOIS Database query service. The objects are in RDAP format.\"],\"links\":[{\"value\":\"https://rdap.apnic.net/ip/112.51.82.164\",\"rel\":\"terms-of-service\",\"href\":\"http://www.apnic.net/db/dbcopyright.html\",\"hreflang\":null,\"title\":null,\"media\":null,\"type\":\"text/html\"}]}],\"status\":[],\"entities\":[{\"rdapConformance\":[],\"objectClassName\":\"entity\",\"handle\":null,\"port43\":null,\"lang\":null,\"events\":[],\"notices\":[],\"status\":[],\"entities\":[],\"remarks\":[],\"links\":[],\"nameservers\":[],\"entity\":null,\"errorCode\":null,\"errorTitle\":null,\"errorDescription\":[],\"vcardArray\":null,\"roles\":[\"admin\"],\"publicIds\":[],\"legalRepresentative\":null,\"networks\":null,\"autnums\":null,\"nicbr_domainCount\":0,\"nicbr_inetCount\":0,\"nicbr_autnumCount\":0,\"contact_URI\":null},{\"rdapConformance\":[\"history_version_0\",\"cidr0\",\"rdap_level_0\"],\"objectClassName\":\"entity\",\"handle\":\"HL1318-AP\",\"port43\":\"whois.apnic.net\",\"lang\":null,\"events\":[{\"eventAction\":\"last changed\",\"eventDate\":\"2016-11-29T09:38:38Z\",\"eventActor\":null,\"status\":[]}],\"notices\":[{\"title\":\"Source\",\"type\":null,\"description\":[\"Objects returned came from source\",\"APNIC\"],\"links\":[]},{\"title\":\"Terms and Conditions\",\"type\":null,\"description\":[\"This is the APNIC WHOIS Database query service. The objects are in RDAP format.\"],\"links\":[{\"value\":\"https://rdap.apnic.net/entity/HL1318-AP\",\"rel\":\"terms-of-service\",\"href\":\"http://www.apnic.net/db/dbcopyright.html\",\"hreflang\":null,\"title\":null,\"media\":null,\"type\":\"text/html\"}]}],\"status\":[],\"entities\":[],\"remarks\":[],\"links\":[{\"value\":\"https://rdap.apnic.net/entity/HL1318-AP\",\"rel\":\"self\",\"href\":\"https://rdap.apnic.net/entity/HL1318-AP\",\"hreflang\":null,\"title\":null,\"media\":null,\"type\":\"application/rdap+json\"}],\"nameservers\":[],\"entity\":null,\"errorCode\":null,\"errorTitle\":null,\"errorDescription\":[],\"vcardArray\":[\"vcard\",[[\"version\",{},\"text\",\"4.0\"],[\"fn\",{},\"text\",\"haijun li\"],[\"kind\",{},\"text\",\"individual\"],[\"adr\",{\"label\":\"29,Jinrong Ave, Xicheng district,beijing,100032\"},\"text\",[\"\",\"\",\"29 jinrong ave\",\"xicheng district beijing\",\"\",\"100032\",\"\"]],[\"tel\",{\"type\":\"voice\"},\"text\",\"+86 1052686688\"],[\"tel\",{\"type\":\"fax\"},\"text\",\"+86 10 52616187\"],[\"email\",{},\"text\",\"hostmaster@chinamobile.com\"],[\"email\",{\"pref\":\"1\"},\"text\",\"abuse@chinamobile.com\"]]],\"roles\":[\"technical\"],\"publicIds\":[],\"legalRepresentative\":null,\"networks\":null,\"autnums\":null,\"nicbr_domainCount\":0,\"nicbr_inetCount\":0,\"nicbr_autnumCount\":0,\"contact_URI\":null},{\"rdapConformance\":[\"history_version_0\",\"cidr0\",\"rdap_level_0\"],\"objectClassName\":\"entity\",\"handle\":\"IRT-CHINAMOBILE2-CN\",\"port43\":\"whois.apnic.net\",\"lang\":null,\"events\":[{\"eventAction\":\"last changed\",\"eventDate\":\"2020-07-16T05:55:00Z\",\"eventActor\":null,\"status\":[]}],\"notices\":[{\"title\":\"Source\",\"type\":null,\"description\":[\"Objects returned came from source\",\"APNIC\"],\"links\":[]},{\"title\":\"Terms and Conditions\",\"type\":null,\"description\":[\"This is the APNIC WHOIS Database query service. The objects are in RDAP format.\"],\"links\":[{\"value\":\"https://rdap.apnic.net/entity/IRT-CHINAMOBILE2-CN\",\"rel\":\"terms-of-service\",\"href\":\"http://www.apnic.net/db/dbcopyright.html\",\"hreflang\":null,\"title\":null,\"media\":null,\"type\":\"text/html\"}]}],\"status\":[],\"entities\":[{\"rdapConformance\":[],\"objectClassName\":\"entity\",\"handle\":\"ct74-AP\",\"port43\":null,\"lang\":null,\"events\":[{\"eventAction\":\"last changed\",\"eventDate\":\"2016-11-29T09:37:27Z\",\"eventActor\":null,\"status\":[]}],\"notices\":[],\"status\":[],\"entities\":[],\"remarks\":[],\"links\":[{\"value\":\"https://rdap.apnic.net/entity/IRT-CHINAMOBILE2-CN\",\"rel\":\"self\",\"href\":\"https://rdap.apnic.net/entity/ct74-AP\",\"hreflang\":null,\"title\":null,\"media\":null,\"type\":\"application/rdap+json\"}],\"nameservers\":[],\"entity\":null,\"errorCode\":null,\"errorTitle\":null,\"errorDescription\":[],\"vcardArray\":[\"vcard\",[[\"version\",{},\"text\",\"4.0\"],[\"fn\",{},\"text\",\"chinamobile tech\"],[\"kind\",{},\"text\",\"group\"],[\"adr\",{\"label\":\"29, Jinrong Ave.,Xicheng district\\nBeijing\"},\"text\",[\"\",\"\",\"\",\"\",\"\",\"\",\"\"]],[\"tel\",{\"type\":\"voice\"},\"text\",\"+86 5268 6688\"],[\"tel\",{\"type\":\"fax\"},\"text\",\"+86 5261 6187\"],[\"email\",{},\"text\",\"hostmaster@chinamobile.com\"],[\"email\",{\"pref\":\"1\"},\"text\",\"abuse@chinamobile.com\"]]],\"roles\":[\"admin\"],\"publicIds\":[],\"legalRepresentative\":null,\"networks\":null,\"autnums\":null,\"nicbr_domainCount\":0,\"nicbr_inetCount\":0,\"nicbr_autnumCount\":0,\"contact_URI\":null},{\"rdapConformance\":[],\"objectClassName\":\"entity\",\"handle\":null,\"port43\":null,\"lang\":null,\"events\":[],\"notices\":[],\"status\":[],\"entities\":[],\"remarks\":[],\"links\":[],\"nameservers\":[],\"entity\":null,\"errorCode\":null,\"errorTitle\":null,\"errorDescription\":[],\"vcardArray\":null,\"roles\":[\"technical\"],\"publicIds\":[],\"legalRepresentative\":null,\"networks\":null,\"autnums\":null,\"nicbr_domainCount\":0,\"nicbr_inetCount\":0,\"nicbr_autnumCount\":0,\"contact_URI\":null}],\"remarks\":[{\"title\":\"remarks\",\"description\":[\"abuse@chinamobile.com was validated on 2020-07-16\"],\"type\":null,\"links\":null}],\"links\":[{\"value\":\"https://rdap.apnic.net/entity/IRT-CHINAMOBILE2-CN\",\"rel\":\"self\",\"href\":\"https://rdap.apnic.net/entity/IRT-CHINAMOBILE2-CN\",\"hreflang\":null,\"title\":null,\"media\":null,\"type\":\"application/rdap+json\"}],\"nameservers\":[],\"entity\":null,\"errorCode\":null,\"errorTitle\":null,\"errorDescription\":[],\"vcardArray\":[\"vcard\",[[\"version\",{},\"text\",\"4.0\"],[\"fn\",{},\"text\",\"IRT-CHINAMOBILE2-CN\"],[\"kind\",{},\"text\",\"group\"],[\"adr\",{\"label\":\"China Mobile Communications Corporation\\n29, Jinrong Ave., Xicheng District, Beijing, 100032\"},\"text\",[\"\",\"\",\"china mobile communications corporation 29 jinrong ave.\",\"xicheng district beijing\",\"\",\"100032\",\"\"]],[\"email\",{},\"text\",\"abuse@chinamobile.com\"],[\"email\",{\"pref\":\"1\"},\"text\",\"abuse@chinamobile.com\"]]],\"roles\":[\"abuse\"],\"publicIds\":[],\"legalRepresentative\":null,\"networks\":null,\"autnums\":null,\"nicbr_domainCount\":0,\"nicbr_inetCount\":0,\"nicbr_autnumCount\":0,\"contact_URI\":null}],\"remarks\":[{\"title\":\"description\",\"description\":[\"China Mobile Communications Corporation\",\"Mobile Communications Network Operator in China\",\"Internet Service Provider in China\"],\"type\":null,\"links\":null},{\"title\":\"remarks\",\"description\":[\"service provider\",\"--------------------------------------------------------\",\"To report network abuse, please contact mnt-irt\",\"For troubleshooting, please contact tech-c and admin-c\",\"Report invalid contact via www.apnic.net/invalidcontact\",\"--------------------------------------------------------\"],\"type\":null,\"links\":null}],\"links\":[{\"value\":\"https://rdap.apnic.net/ip/112.51.82.164\",\"rel\":\"self\",\"href\":\"https://rdap.apnic.net/ip/112.0.0.0/10\",\"hreflang\":null,\"title\":null,\"media\":null,\"type\":\"application/rdap+json\"}],\"nameservers\":[],\"entity\":null,\"errorCode\":null,\"errorTitle\":null,\"errorDescription\":[],\"startAddress\":\"112.0.0.0\",\"endAddress\":\"112.63.255.255\",\"ipVersion\":\"v4\",\"name\":\"CMNET\",\"type\":\"ALLOCATED PORTABLE\",\"country\":\"CN\",\"parentHandle\":null,\"cidr0_cidrs\":[{\"v4prefix\":\"112.0.0.0\",\"v6prefix\":null,\"length\":\"10\"}],\"arin_originas0_originautnums\":[],\"lacnic_originAutnum\":null,\"lacnic_reverseDelegations\":[],\"lacnic_legalRepresentative\":null,\"nicbr_autnum\":null,\"nicbr_reverseDelegations\":[]}", "raw": "IP Network: \n  Handle: 112.0.0.0 - 112.63.255.255\n  Start Address: 112.0.0.0\n  End Address: 112.63.255.255\n  IP Version: v4\n  Name: CMNET\n  Type: ALLOCATED PORTABLE\n  Country: CN\n  Port43: whois.apnic.net\n\n  Cidr: \n    Prefix: 112.0.0.0\n    Length: 10\n  Event: \n    Action: last changed\n    Date: 2020-07-15T13:09:54Z\n  Entity: \n    Role: \n      ADMIN\n  Entity: \n    Handle: HL1318-AP\n    Role: \n      TECHNICAL\n    VCard: \n      Formatted Name: haijun li\n      Kind: individual\n      Address: \n          Street: 29 jinrong ave\n          Locale: xicheng district beijing\n          Postal Code: 100032\n          LABEL: 29,Jinrong Ave, Xicheng district,beijing,100032\n      Telephone: +86 1052686688\n          TYPE: voice\n      Telephone: +86 10 52616187\n          TYPE: fax\n      Email: hostmaster@chinamobile.com\n      Email: abuse@chinamobile.com\n          PREF: 1\n    Event: \n      Action: last changed\n      Date: 2016-11-29T09:38:38Z\n    Link: \n      Rel: self\n      Value: https://rdap.apnic.net/entity/HL1318-AP\n      Type: application/rdap+json\n      Href: https://rdap.apnic.net/entity/HL1318-AP\n    Notice: \n      Title: Source\n      Description: \n        Objects returned came from source\n        APNIC\n    Notice: \n      Title: Terms and Conditions\n        Description: This is the APNIC WHOIS Database query service. The objects are in RDAP format.\n        Link: \n          Rel: terms-of-service\n          Value: https://rdap.apnic.net/entity/HL1318-AP\n          Type: text/html\n          Href: http://www.apnic.net/db/dbcopyright.html\n    RDAP Conformance: \n      history_version_0\n      cidr0\n      rdap_level_0\n  Entity: \n    Handle: IRT-CHINAMOBILE2-CN\n    Role: \n      ABUSE\n    VCard: \n      Formatted Name: IRT-CHINAMOBILE2-CN\n      Kind: group\n      Address: \n          Street: china mobile communications corporation 29 jinrong ave.\n          Locale: xicheng district beijing\n          Postal Code: 100032\n        LABEL: \n          China Mobile Communications Corporation\n          29, Jinrong Ave., Xicheng District, Beijing, 100032\n      Email: abuse@chinamobile.com\n      Email: abuse@chinamobile.com\n          PREF: 1\n    Event: \n      Action: last changed\n      Date: 2020-07-16T05:55:00Z\n    Entity: \n      Handle: ct74-AP\n      Role: \n        ADMIN\n      VCard: \n        Formatted Name: chinamobile tech\n        Kind: group\n        Address: \n          LABEL: \n            29, Jinrong Ave.,Xicheng district\n            Beijing\n        Telephone: +86 5268 6688\n            TYPE: voice\n        Telephone: +86 5261 6187\n            TYPE: fax\n        Email: hostmaster@chinamobile.com\n        Email: abuse@chinamobile.com\n            PREF: 1\n      Event: \n        Action: last changed\n        Date: 2016-11-29T09:37:27Z\n      Link: \n        Rel: self\n        Value: https://rdap.apnic.net/entity/IRT-CHINAMOBILE2-CN\n        Type: application/rdap+json\n        Href: https://rdap.apnic.net/entity/ct74-AP\n    Entity: \n      Role: \n        TECHNICAL\n    Remark: \n      Title: remarks\n        Description: abuse@chinamobile.com was validated on 2020-07-16\n    Link: \n      Rel: self\n      Value: https://rdap.apnic.net/entity/IRT-CHINAMOBILE2-CN\n      Type: application/rdap+json\n      Href: https://rdap.apnic.net/entity/IRT-CHINAMOBILE2-CN\n    Notice: \n      Title: Source\n      Description: \n        Objects returned came from source\n        APNIC\n    Notice: \n      Title: Terms and Conditions\n        Description: This is the APNIC WHOIS Database query service. The objects are in RDAP format.\n        Link: \n          Rel: terms-of-service\n          Value: https://rdap.apnic.net/entity/IRT-CHINAMOBILE2-CN\n          Type: text/html\n          Href: http://www.apnic.net/db/dbcopyright.html\n    RDAP Conformance: \n      history_version_0\n      cidr0\n      rdap_level_0\n  Remark: \n    Title: description\n    Description: \n      China Mobile Communications Corporation\n      Mobile Communications Network Operator in China\n      Internet Service Provider in China\n  Remark: \n    Title: remarks\n    Description: \n      service provider\n      --------------------------------------------------------\n      To report network abuse, please contact mnt-irt\n      For troubleshooting, please contact tech-c and admin-c\n      Report invalid contact via www.apnic.net/invalidcontact\n      --------------------------------------------------------\n  Link: \n    Rel: self\n    Value: https://rdap.apnic.net/ip/112.51.82.164\n    Type: application/rdap+json\n    Href: https://rdap.apnic.net/ip/112.0.0.0/10\n  Notice: \n    Title: Source\n    Description: \n      Objects returned came from source\n      APNIC\n  Notice: \n    Title: Terms and Conditions\n      Description: This is the APNIC WHOIS Database query service. The objects are in RDAP format.\n      Link: \n        Rel: terms-of-service\n        Value: https://rdap.apnic.net/ip/112.51.82.164\n        Type: text/html\n        Href: http://www.apnic.net/db/dbcopyright.html\n  RDAP Conformance: \n    history_version_0\n    cidr0\n    rdap_level_0\n", "whoisRawID": 0, "source": "WHOIS_RDAP"}, "registrarUpdatedAt": 1594818594, "whoisID": 6727507388855738220, "registrarName": "APNIC", "whoisServer": "rdap.apnic.net", "createdAt": 1603962752, "expired": false, "contactOrganizations": [], "registrarParseCode": 10272, "netRange": {"netName": "CMNET", "numericEnd": 1883242495, "netRange": "112.0.0.0 - 112.63.255.255", "originAS": "AS9808", "whoisNetRangeID": 0, "numericStart": 1879048192, "status": "INACTIVE", "ipStart": "112.0.0.0", "ipEnd": "112.63.255.255"}, "auditUpdatedAt": 1603962752, "id": 6727507388855738220, "updatedAt": 1607032365, "domainUnicode": "112.0.0.0", "auditCreatedAt": 1603962752, "contactCountries": [], "compositeParseCode": 10272, "contactEmails": ["hostmaster@chinamobile.com,abuse@chinamobile.com", "abuse@chinamobile.com"], "tld": "ipv4", "domainAvailable": false, "noRecord": false, "nameservers": [], "domain": "112.0.0.0", "contactNames": ["haijun li", "IRT-CHINAMOBILE2-CN"], "contacts": [{"zip": "100032", "address": "29 jinrong ave\nxicheng district beijing\n100032\n", "city": "xicheng district beijing", "phone": "+86 1052686688", "whoisContactID": 0, "street": "29 jinrong ave", "name": "haijun li", "id": 0, "fax": "+86 10 52616187", "email": "hostmaster@chinamobile.com,abuse@chinamobile.com"}, {"zip": "100032", "address": "china mobile communications corporation 29 jinrong ave.\nxicheng district beijing\n100032\n", "city": "xicheng district beijing", "whoisContactID": 0, "street": "china mobile communications corporation 29 jinrong ave.", "name": "IRT-CHINAMOBILE2-CN", "id": 0, "email": "abuse@chinamobile.com"}], "status": "INACTIVE", "domainMd5": "af7ce139ebe6615d9579100b6bc83dba", "task_id": "df510ddc56194bb2a1d6aecc8b470c67"}, {"abuse": {"zip": "100032", "address": "china mobile communications corporation 29 jinrong ave.\nxicheng district beijing\n100032\n", "city": "xicheng district beijing", "whoisContactID": 0, "street": "china mobile communications corporation 29 jinrong ave.", "name": "IRT-CHINAMOBILE-CN", "id": 0, "email": "abuse@chinamobile.com"}, "rawResponse": {"domain": "112.0.0.0", "whoisID": 6723059423336013747, "unparsed": "{\"rdapConformance\":[\"history_version_0\",\"cidr0\",\"rdap_level_0\"],\"objectClassName\":\"ip network\",\"handle\":\"112.0.0.0 - 112.4.255.255\",\"port43\":\"whois.apnic.net\",\"lang\":null,\"events\":[],\"notices\":[{\"title\":\"Source\",\"type\":null,\"description\":[\"Objects returned came from source\",\"APNIC\"],\"links\":[]},{\"title\":\"Terms and Conditions\",\"type\":null,\"description\":[\"This is the APNIC WHOIS Database query service. The objects are in RDAP format.\"],\"links\":[{\"value\":\"https://rdap.apnic.net/ip/112.0.0.0\",\"rel\":\"terms-of-service\",\"href\":\"http://www.apnic.net/db/dbcopyright.html\",\"hreflang\":null,\"title\":null,\"media\":null,\"type\":\"text/html\"}]}],\"status\":[],\"entities\":[{\"rdapConformance\":[\"history_version_0\",\"cidr0\",\"rdap_level_0\"],\"objectClassName\":\"entity\",\"handle\":\"HL1318-AP\",\"port43\":\"whois.apnic.net\",\"lang\":null,\"events\":[{\"eventAction\":\"last changed\",\"eventDate\":\"2016-11-29T09:38:38Z\",\"eventActor\":null,\"status\":[]}],\"notices\":[{\"title\":\"Source\",\"type\":null,\"description\":[\"Objects returned came from source\",\"APNIC\"],\"links\":[]},{\"title\":\"Terms and Conditions\",\"type\":null,\"description\":[\"This is the APNIC WHOIS Database query service. The objects are in RDAP format.\"],\"links\":[{\"value\":\"https://rdap.apnic.net/entity/HL1318-AP\",\"rel\":\"terms-of-service\",\"href\":\"http://www.apnic.net/db/dbcopyright.html\",\"hreflang\":null,\"title\":null,\"media\":null,\"type\":\"text/html\"}]}],\"status\":[],\"entities\":[],\"remarks\":[],\"links\":[{\"value\":\"https://rdap.apnic.net/entity/HL1318-AP\",\"rel\":\"self\",\"href\":\"https://rdap.apnic.net/entity/HL1318-AP\",\"hreflang\":null,\"title\":null,\"media\":null,\"type\":\"application/rdap+json\"}],\"nameservers\":[],\"entity\":null,\"errorCode\":null,\"errorTitle\":null,\"errorDescription\":[],\"vcardArray\":[\"vcard\",[[\"version\",{},\"text\",\"4.0\"],[\"fn\",{},\"text\",\"haijun li\"],[\"kind\",{},\"text\",\"individual\"],[\"adr\",{\"label\":\"29,Jinrong Ave, Xicheng district,beijing,100032\"},\"text\",[\"\",\"\",\"29 jinrong ave\",\"xicheng district beijing\",\"\",\"100032\",\"\"]],[\"tel\",{\"type\":\"voice\"},\"text\",\"+86 1052686688\"],[\"tel\",{\"type\":\"fax\"},\"text\",\"+86 10 52616187\"],[\"email\",{},\"text\",\"hostmaster@chinamobile.com\"],[\"email\",{\"pref\":\"1\"},\"text\",\"abuse@chinamobile.com\"]]],\"roles\":[\"admin\"],\"publicIds\":[],\"legalRepresentative\":null,\"networks\":null,\"autnums\":null,\"nicbr_domainCount\":0,\"nicbr_inetCount\":0,\"nicbr_autnumCount\":0,\"contact_URI\":null},{\"rdapConformance\":[],\"objectClassName\":\"entity\",\"handle\":null,\"port43\":null,\"lang\":null,\"events\":[],\"notices\":[],\"status\":[],\"entities\":[],\"remarks\":[],\"links\":[],\"nameservers\":[],\"entity\":null,\"errorCode\":null,\"errorTitle\":null,\"errorDescription\":[],\"vcardArray\":null,\"roles\":[\"technical\"],\"publicIds\":[],\"legalRepresentative\":null,\"networks\":null,\"autnums\":null,\"nicbr_domainCount\":0,\"nicbr_inetCount\":0,\"nicbr_autnumCount\":0,\"contact_URI\":null},{\"rdapConformance\":[\"history_version_0\",\"cidr0\",\"rdap_level_0\"],\"objectClassName\":\"entity\",\"handle\":\"IRT-CHINAMOBILE-CN\",\"port43\":\"whois.apnic.net\",\"lang\":null,\"events\":[{\"eventAction\":\"last changed\",\"eventDate\":\"2020-07-16T05:55:01Z\",\"eventActor\":null,\"status\":[]}],\"notices\":[{\"title\":\"Source\",\"type\":null,\"description\":[\"Objects returned came from source\",\"APNIC\"],\"links\":[]},{\"title\":\"Terms and Conditions\",\"type\":null,\"description\":[\"This is the APNIC WHOIS Database query service. The objects are in RDAP format.\"],\"links\":[{\"value\":\"https://rdap.apnic.net/entity/IRT-CHINAMOBILE-CN\",\"rel\":\"terms-of-service\",\"href\":\"http://www.apnic.net/db/dbcopyright.html\",\"hreflang\":null,\"title\":null,\"media\":null,\"type\":\"text/html\"}]}],\"status\":[],\"entities\":[{\"rdapConformance\":[],\"objectClassName\":\"entity\",\"handle\":null,\"port43\":null,\"lang\":null,\"events\":[],\"notices\":[],\"status\":[],\"entities\":[],\"remarks\":[],\"links\":[],\"nameservers\":[],\"entity\":null,\"errorCode\":null,\"errorTitle\":null,\"errorDescription\":[],\"vcardArray\":null,\"roles\":[\"admin\",\"technical\"],\"publicIds\":[],\"legalRepresentative\":null,\"networks\":null,\"autnums\":null,\"nicbr_domainCount\":0,\"nicbr_inetCount\":0,\"nicbr_autnumCount\":0,\"contact_URI\":null}],\"remarks\":[{\"title\":\"remarks\",\"description\":[\"abuse@chinamobile.com was validated on 2020-07-16\"],\"type\":null,\"links\":null}],\"links\":[{\"value\":\"https://rdap.apnic.net/entity/IRT-CHINAMOBILE-CN\",\"rel\":\"self\",\"href\":\"https://rdap.apnic.net/entity/IRT-CHINAMOBILE-CN\",\"hreflang\":null,\"title\":null,\"media\":null,\"type\":\"application/rdap+json\"}],\"nameservers\":[],\"entity\":null,\"errorCode\":null,\"errorTitle\":null,\"errorDescription\":[],\"vcardArray\":[\"vcard\",[[\"version\",{},\"text\",\"4.0\"],[\"fn\",{},\"text\",\"IRT-CHINAMOBILE-CN\"],[\"kind\",{},\"text\",\"group\"],[\"adr\",{\"label\":\"China Mobile Communications Corporation\\n29, Jinrong Ave., Xicheng District, Beijing, 100032\"},\"text\",[\"\",\"\",\"china mobile communications corporation 29 jinrong ave.\",\"xicheng district beijing\",\"\",\"100032\",\"\"]],[\"email\",{},\"text\",\"abuse@chinamobile.com\"],[\"email\",{\"pref\":\"1\"},\"text\",\"abuse@chinamobile.com\"]]],\"roles\":[\"abuse\"],\"publicIds\":[],\"legalRepresentative\":null,\"networks\":null,\"autnums\":null,\"nicbr_domainCount\":0,\"nicbr_inetCount\":0,\"nicbr_autnumCount\":0,\"contact_URI\":null}],\"remarks\":[{\"title\":\"description\",\"description\":[\"China Mobile Communications Corporation\"],\"type\":null,\"links\":null}],\"links\":[{\"value\":\"https://rdap.apnic.net/ip/112.0.0.0\",\"rel\":\"self\",\"href\":\"https://rdap.apnic.net/ip/112.0.0.0/13\",\"hreflang\":null,\"title\":null,\"media\":null,\"type\":\"application/rdap+json\"}],\"nameservers\":[],\"entity\":null,\"errorCode\":null,\"errorTitle\":null,\"errorDescription\":[],\"startAddress\":\"112.0.0.0\",\"endAddress\":\"112.4.255.255\",\"ipVersion\":\"v4\",\"name\":\"CMNET-JIANGSU\",\"type\":\"ALLOCATED NON-PORTABLE\",\"country\":\"CN\",\"parentHandle\":null,\"cidr0_cidrs\":[{\"v4prefix\":\"112.4.0.0\",\"v6prefix\":null,\"length\":\"16\"},{\"v4prefix\":\"112.0.0.0\",\"v6prefix\":null,\"length\":\"14\"}],\"arin_originas0_originautnums\":[],\"lacnic_originAutnum\":null,\"lacnic_reverseDelegations\":[],\"lacnic_legalRepresentative\":null,\"nicbr_autnum\":null,\"nicbr_reverseDelegations\":[]}", "raw": "IP Network: \n  Handle: 112.0.0.0 - 112.4.255.255\n  Start Address: 112.0.0.0\n  End Address: 112.4.255.255\n  IP Version: v4\n  Name: CMNET-JIANGSU\n  Type: ALLOCATED NON-PORTABLE\n  Country: CN\n  Port43: whois.apnic.net\n\n  Cidr: \n    Prefix: 112.4.0.0\n    Length: 16\n  Cidr: \n    Prefix: 112.0.0.0\n    Length: 14\n  Entity: \n    Handle: HL1318-AP\n    Role: \n      ADMIN\n    VCard: \n      Formatted Name: haijun li\n      Kind: individual\n      Address: \n          Street: 29 jinrong ave\n          Locale: xicheng district beijing\n          Postal Code: 100032\n          LABEL: 29,Jinrong Ave, Xicheng district,beijing,100032\n      Telephone: +86 1052686688\n          TYPE: voice\n      Telephone: +86 10 52616187\n          TYPE: fax\n      Email: hostmaster@chinamobile.com\n      Email: abuse@chinamobile.com\n          PREF: 1\n    Event: \n      Action: last changed\n      Date: 2016-11-29T09:38:38Z\n    Link: \n      Rel: self\n      Value: https://rdap.apnic.net/entity/HL1318-AP\n      Type: application/rdap+json\n      Href: https://rdap.apnic.net/entity/HL1318-AP\n    Notice: \n      Title: Source\n      Description: \n        Objects returned came from source\n        APNIC\n    Notice: \n      Title: Terms and Conditions\n        Description: This is the APNIC WHOIS Database query service. The objects are in RDAP format.\n        Link: \n          Rel: terms-of-service\n          Value: https://rdap.apnic.net/entity/HL1318-AP\n          Type: text/html\n          Href: http://www.apnic.net/db/dbcopyright.html\n    RDAP Conformance: \n      history_version_0\n      cidr0\n      rdap_level_0\n  Entity: \n    Role: \n      TECHNICAL\n  Entity: \n    Handle: IRT-CHINAMOBILE-CN\n    Role: \n      ABUSE\n    VCard: \n      Formatted Name: IRT-CHINAMOBILE-CN\n      Kind: group\n      Address: \n          Street: china mobile communications corporation 29 jinrong ave.\n          Locale: xicheng district beijing\n          Postal Code: 100032\n        LABEL: \n          China Mobile Communications Corporation\n          29, Jinrong Ave., Xicheng District, Beijing, 100032\n      Email: abuse@chinamobile.com\n      Email: abuse@chinamobile.com\n          PREF: 1\n    Event: \n      Action: last changed\n      Date: 2020-07-16T05:55:01Z\n    Entity: \n      Role: \n        ADMIN\n        TECHNICAL\n    Remark: \n      Title: remarks\n        Description: abuse@chinamobile.com was validated on 2020-07-16\n    Link: \n      Rel: self\n      Value: https://rdap.apnic.net/entity/IRT-CHINAMOBILE-CN\n      Type: application/rdap+json\n      Href: https://rdap.apnic.net/entity/IRT-CHINAMOBILE-CN\n    Notice: \n      Title: Source\n      Description: \n        Objects returned came from source\n        APNIC\n    Notice: \n      Title: Terms and Conditions\n        Description: This is the APNIC WHOIS Database query service. The objects are in RDAP format.\n        Link: \n          Rel: terms-of-service\n          Value: https://rdap.apnic.net/entity/IRT-CHINAMOBILE-CN\n          Type: text/html\n          Href: http://www.apnic.net/db/dbcopyright.html\n    RDAP Conformance: \n      history_version_0\n      cidr0\n      rdap_level_0\n  Remark: \n    Title: description\n      Description: China Mobile Communications Corporation\n  Link: \n    Rel: self\n    Value: https://rdap.apnic.net/ip/112.0.0.0\n    Type: application/rdap+json\n    Href: https://rdap.apnic.net/ip/112.0.0.0/13\n  Notice: \n    Title: Source\n    Description: \n      Objects returned came from source\n      APNIC\n  Notice: \n    Title: Terms and Conditions\n      Description: This is the APNIC WHOIS Database query service. The objects are in RDAP format.\n      Link: \n        Rel: terms-of-service\n        Value: https://rdap.apnic.net/ip/112.0.0.0\n        Type: text/html\n        Href: http://www.apnic.net/db/dbcopyright.html\n  RDAP Conformance: \n    history_version_0\n    cidr0\n    rdap_level_0\n", "whoisRawID": 0, "source": "WHOIS_RDAP"}, "whoisID": 6723059423336013747, "registrarName": "APNIC", "admin": {"zip": "100032", "address": "29 jinrong ave\nxicheng district beijing\n100032\n", "city": "xicheng district beijing", "phone": "+86 1052686688", "whoisContactID": 0, "street": "29 jinrong ave", "name": "haijun li", "id": 0, "fax": "+86 10 52616187", "email": "hostmaster@chinamobile.com,abuse@chinamobile.com"}, "whoisServer": "rdap.apnic.net", "createdAt": 1602902274, "expired": false, "contactOrganizations": [], "registrarParseCode": 8448, "netRange": {"netName": "CMNET-JIANGSU", "numericEnd": 1879375871, "netRange": "112.0.0.0 - 112.4.255.255", "whoisNetRangeID": 0, "numericStart": 1879048192, "status": "INACTIVE", "ipStart": "112.0.0.0", "ipEnd": "112.4.255.255"}, "auditUpdatedAt": 1602902274, "id": 6723059423336013747, "updatedAt": 1603962752, "domainUnicode": "112.0.0.0", "auditCreatedAt": 1602902274, "contactCountries": [], "compositeParseCode": 8448, "contactEmails": ["hostmaster@chinamobile.com,abuse@chinamobile.com", "abuse@chinamobile.com"], "tld": "ipv4", "domainAvailable": false, "noRecord": false, "nameservers": [], "domain": "112.0.0.0", "contactNames": ["haijun li", "IRT-CHINAMOBILE-CN"], "contacts": [{"zip": "100032", "address": "29 jinrong ave\nxicheng district beijing\n100032\n", "city": "xicheng district beijing", "phone": "+86 1052686688", "whoisContactID": 0, "street": "29 jinrong ave", "name": "haijun li", "id": 0, "fax": "+86 10 52616187", "email": "hostmaster@chinamobile.com,abuse@chinamobile.com"}, {"zip": "100032", "address": "china mobile communications corporation 29 jinrong ave.\nxicheng district beijing\n100032\n", "city": "xicheng district beijing", "whoisContactID": 0, "street": "china mobile communications corporation 29 jinrong ave.", "name": "IRT-CHINAMOBILE-CN", "id": 0, "email": "abuse@chinamobile.com"}], "status": "INACTIVE", "domainMd5": "af7ce139ebe6615d9579100b6bc83dba", "task_id": "387b3d70640f4f9f966412f9b38ebdd0"}, {"abuse": {"zip": "100032", "address": "china mobile communications corporation 29 jinrong ave.\nxicheng district beijing\n100032\n", "city": "xicheng district beijing", "whoisContactID": 0, "street": "china mobile communications corporation 29 jinrong ave.", "name": "IRT-CHINAMOBILE2-CN", "id": 0, "email": "abuse@chinamobile.com"}, "technical": {"zip": "100032", "address": "29 jinrong ave\nxicheng district beijing\n100032\n", "city": "xicheng district beijing", "phone": "+86 1052686688", "whoisContactID": 0, "street": "29 jinrong ave", "name": "haijun li", "id": 0, "fax": "+86 10 52616187", "email": "hostmaster@chinamobile.com,abuse@chinamobile.com"}, "rawResponse": {"domain": "112.0.0.0", "whoisID": 6711566326856894299, "unparsed": "{\"rdapConformance\":[\"history_version_0\",\"cidr0\",\"rdap_level_0\"],\"objectClassName\":\"ip network\",\"handle\":\"112.0.0.0 - 112.63.255.255\",\"port43\":\"whois.apnic.net\",\"lang\":null,\"events\":[{\"eventAction\":\"last changed\",\"eventDate\":\"2020-07-15T13:09:54Z\",\"eventActor\":null,\"status\":[]}],\"notices\":[{\"title\":\"Source\",\"type\":null,\"description\":[\"Objects returned came from source\",\"APNIC\"],\"links\":[]},{\"title\":\"Terms and Conditions\",\"type\":null,\"description\":[\"This is the APNIC WHOIS Database query service. The objects are in RDAP format.\"],\"links\":[{\"value\":\"https://rdap.apnic.net/ip/112.51.40.188\",\"rel\":\"terms-of-service\",\"href\":\"http://www.apnic.net/db/dbcopyright.html\",\"hreflang\":null,\"title\":null,\"media\":null,\"type\":\"text/html\"}]}],\"status\":[],\"entities\":[{\"rdapConformance\":[],\"objectClassName\":\"entity\",\"handle\":null,\"port43\":null,\"lang\":null,\"events\":[],\"notices\":[],\"status\":[],\"entities\":[],\"remarks\":[],\"links\":[],\"nameservers\":[],\"entity\":null,\"errorCode\":null,\"errorTitle\":null,\"errorDescription\":[],\"vcardArray\":null,\"roles\":[\"admin\"],\"publicIds\":[],\"legalRepresentative\":null,\"networks\":null,\"autnums\":null,\"nicbr_domainCount\":0,\"nicbr_inetCount\":0,\"nicbr_autnumCount\":0,\"contact_URI\":null},{\"rdapConformance\":[\"history_version_0\",\"cidr0\",\"rdap_level_0\"],\"objectClassName\":\"entity\",\"handle\":\"HL1318-AP\",\"port43\":\"whois.apnic.net\",\"lang\":null,\"events\":[{\"eventAction\":\"last changed\",\"eventDate\":\"2016-11-29T09:38:38Z\",\"eventActor\":null,\"status\":[]}],\"notices\":[{\"title\":\"Source\",\"type\":null,\"description\":[\"Objects returned came from source\",\"APNIC\"],\"links\":[]},{\"title\":\"Terms and Conditions\",\"type\":null,\"description\":[\"This is the APNIC WHOIS Database query service. The objects are in RDAP format.\"],\"links\":[{\"value\":\"https://rdap.apnic.net/entity/HL1318-AP\",\"rel\":\"terms-of-service\",\"href\":\"http://www.apnic.net/db/dbcopyright.html\",\"hreflang\":null,\"title\":null,\"media\":null,\"type\":\"text/html\"}]}],\"status\":[],\"entities\":[],\"remarks\":[],\"links\":[{\"value\":\"https://rdap.apnic.net/entity/HL1318-AP\",\"rel\":\"self\",\"href\":\"https://rdap.apnic.net/entity/HL1318-AP\",\"hreflang\":null,\"title\":null,\"media\":null,\"type\":\"application/rdap+json\"}],\"nameservers\":[],\"entity\":null,\"errorCode\":null,\"errorTitle\":null,\"errorDescription\":[],\"vcardArray\":[\"vcard\",[[\"version\",{},\"text\",\"4.0\"],[\"fn\",{},\"text\",\"haijun li\"],[\"kind\",{},\"text\",\"individual\"],[\"adr\",{\"label\":\"29,Jinrong Ave, Xicheng district,beijing,100032\"},\"text\",[\"\",\"\",\"29 jinrong ave\",\"xicheng district beijing\",\"\",\"100032\",\"\"]],[\"tel\",{\"type\":\"voice\"},\"text\",\"+86 1052686688\"],[\"tel\",{\"type\":\"fax\"},\"text\",\"+86 10 52616187\"],[\"email\",{},\"text\",\"hostmaster@chinamobile.com\"],[\"email\",{\"pref\":\"1\"},\"text\",\"abuse@chinamobile.com\"]]],\"roles\":[\"technical\"],\"publicIds\":[],\"legalRepresentative\":null,\"networks\":null,\"autnums\":null,\"nicbr_domainCount\":0,\"nicbr_inetCount\":0,\"nicbr_autnumCount\":0,\"contact_URI\":null},{\"rdapConformance\":[\"history_version_0\",\"cidr0\",\"rdap_level_0\"],\"objectClassName\":\"entity\",\"handle\":\"IRT-CHINAMOBILE2-CN\",\"port43\":\"whois.apnic.net\",\"lang\":null,\"events\":[{\"eventAction\":\"last changed\",\"eventDate\":\"2020-07-16T05:55:00Z\",\"eventActor\":null,\"status\":[]}],\"notices\":[{\"title\":\"Source\",\"type\":null,\"description\":[\"Objects returned came from source\",\"APNIC\"],\"links\":[]},{\"title\":\"Terms and Conditions\",\"type\":null,\"description\":[\"This is the APNIC WHOIS Database query service. The objects are in RDAP format.\"],\"links\":[{\"value\":\"https://rdap.apnic.net/entity/IRT-CHINAMOBILE2-CN\",\"rel\":\"terms-of-service\",\"href\":\"http://www.apnic.net/db/dbcopyright.html\",\"hreflang\":null,\"title\":null,\"media\":null,\"type\":\"text/html\"}]}],\"status\":[],\"entities\":[{\"rdapConformance\":[],\"objectClassName\":\"entity\",\"handle\":\"ct74-AP\",\"port43\":null,\"lang\":null,\"events\":[{\"eventAction\":\"last changed\",\"eventDate\":\"2016-11-29T09:37:27Z\",\"eventActor\":null,\"status\":[]}],\"notices\":[],\"status\":[],\"entities\":[],\"remarks\":[],\"links\":[{\"value\":\"https://rdap.apnic.net/entity/IRT-CHINAMOBILE2-CN\",\"rel\":\"self\",\"href\":\"https://rdap.apnic.net/entity/ct74-AP\",\"hreflang\":null,\"title\":null,\"media\":null,\"type\":\"application/rdap+json\"}],\"nameservers\":[],\"entity\":null,\"errorCode\":null,\"errorTitle\":null,\"errorDescription\":[],\"vcardArray\":[\"vcard\",[[\"version\",{},\"text\",\"4.0\"],[\"fn\",{},\"text\",\"chinamobile tech\"],[\"kind\",{},\"text\",\"group\"],[\"adr\",{\"label\":\"29, Jinrong Ave.,Xicheng district\\nBeijing\"},\"text\",[\"\",\"\",\"\",\"\",\"\",\"\",\"\"]],[\"tel\",{\"type\":\"voice\"},\"text\",\"+86 5268 6688\"],[\"tel\",{\"type\":\"fax\"},\"text\",\"+86 5261 6187\"],[\"email\",{},\"text\",\"hostmaster@chinamobile.com\"],[\"email\",{\"pref\":\"1\"},\"text\",\"abuse@chinamobile.com\"]]],\"roles\":[\"admin\"],\"publicIds\":[],\"legalRepresentative\":null,\"networks\":null,\"autnums\":null,\"nicbr_domainCount\":0,\"nicbr_inetCount\":0,\"nicbr_autnumCount\":0,\"contact_URI\":null},{\"rdapConformance\":[],\"objectClassName\":\"entity\",\"handle\":null,\"port43\":null,\"lang\":null,\"events\":[],\"notices\":[],\"status\":[],\"entities\":[],\"remarks\":[],\"links\":[],\"nameservers\":[],\"entity\":null,\"errorCode\":null,\"errorTitle\":null,\"errorDescription\":[],\"vcardArray\":null,\"roles\":[\"technical\"],\"publicIds\":[],\"legalRepresentative\":null,\"networks\":null,\"autnums\":null,\"nicbr_domainCount\":0,\"nicbr_inetCount\":0,\"nicbr_autnumCount\":0,\"contact_URI\":null}],\"remarks\":[{\"title\":\"remarks\",\"description\":[\"abuse@chinamobile.com was validated on 2020-07-16\"],\"type\":null,\"links\":null}],\"links\":[{\"value\":\"https://rdap.apnic.net/entity/IRT-CHINAMOBILE2-CN\",\"rel\":\"self\",\"href\":\"https://rdap.apnic.net/entity/IRT-CHINAMOBILE2-CN\",\"hreflang\":null,\"title\":null,\"media\":null,\"type\":\"application/rdap+json\"}],\"nameservers\":[],\"entity\":null,\"errorCode\":null,\"errorTitle\":null,\"errorDescription\":[],\"vcardArray\":[\"vcard\",[[\"version\",{},\"text\",\"4.0\"],[\"fn\",{},\"text\",\"IRT-CHINAMOBILE2-CN\"],[\"kind\",{},\"text\",\"group\"],[\"adr\",{\"label\":\"China Mobile Communications Corporation\\n29, Jinrong Ave., Xicheng District, Beijing, 100032\"},\"text\",[\"\",\"\",\"china mobile communications corporation 29 jinrong ave.\",\"xicheng district beijing\",\"\",\"100032\",\"\"]],[\"email\",{},\"text\",\"abuse@chinamobile.com\"],[\"email\",{\"pref\":\"1\"},\"text\",\"abuse@chinamobile.com\"]]],\"roles\":[\"abuse\"],\"publicIds\":[],\"legalRepresentative\":null,\"networks\":null,\"autnums\":null,\"nicbr_domainCount\":0,\"nicbr_inetCount\":0,\"nicbr_autnumCount\":0,\"contact_URI\":null}],\"remarks\":[{\"title\":\"description\",\"description\":[\"China Mobile Communications Corporation\",\"Mobile Communications Network Operator in China\",\"Internet Service Provider in China\"],\"type\":null,\"links\":null},{\"title\":\"remarks\",\"description\":[\"service provider\",\"--------------------------------------------------------\",\"To report network abuse, please contact mnt-irt\",\"For troubleshooting, please contact tech-c and admin-c\",\"Report invalid contact via www.apnic.net/invalidcontact\",\"--------------------------------------------------------\"],\"type\":null,\"links\":null}],\"links\":[{\"value\":\"https://rdap.apnic.net/ip/112.51.40.188\",\"rel\":\"self\",\"href\":\"https://rdap.apnic.net/ip/112.0.0.0/10\",\"hreflang\":null,\"title\":null,\"media\":null,\"type\":\"application/rdap+json\"}],\"nameservers\":[],\"entity\":null,\"errorCode\":null,\"errorTitle\":null,\"errorDescription\":[],\"startAddress\":\"112.0.0.0\",\"endAddress\":\"112.63.255.255\",\"ipVersion\":\"v4\",\"name\":\"CMNET\",\"type\":\"ALLOCATED PORTABLE\",\"country\":\"CN\",\"parentHandle\":null,\"cidr0_cidrs\":[{\"v4prefix\":\"112.0.0.0\",\"v6prefix\":null,\"length\":\"10\"}],\"arin_originas0_originautnums\":[],\"lacnic_originAutnum\":null,\"lacnic_reverseDelegations\":[],\"lacnic_legalRepresentative\":null,\"nicbr_autnum\":null,\"nicbr_reverseDelegations\":[]}", "raw": "IP Network: \n  Handle: 112.0.0.0 - 112.63.255.255\n  Start Address: 112.0.0.0\n  End Address: 112.63.255.255\n  IP Version: v4\n  Name: CMNET\n  Type: ALLOCATED PORTABLE\n  Country: CN\n  Port43: whois.apnic.net\n\n  Cidr: \n    Prefix: 112.0.0.0\n    Length: 10\n  Event: \n    Action: last changed\n    Date: 2020-07-15T13:09:54Z\n  Entity: \n    Role: \n      ADMIN\n  Entity: \n    Handle: HL1318-AP\n    Role: \n      TECHNICAL\n    VCard: \n      Formatted Name: haijun li\n      Kind: individual\n      Address: \n          Street: 29 jinrong ave\n          Locale: xicheng district beijing\n          Postal Code: 100032\n          LABEL: 29,Jinrong Ave, Xicheng district,beijing,100032\n      Telephone: +86 1052686688\n          TYPE: voice\n      Telephone: +86 10 52616187\n          TYPE: fax\n      Email: hostmaster@chinamobile.com\n      Email: abuse@chinamobile.com\n          PREF: 1\n    Event: \n      Action: last changed\n      Date: 2016-11-29T09:38:38Z\n    Link: \n      Rel: self\n      Value: https://rdap.apnic.net/entity/HL1318-AP\n      Type: application/rdap+json\n      Href: https://rdap.apnic.net/entity/HL1318-AP\n    Notice: \n      Title: Source\n      Description: \n        Objects returned came from source\n        APNIC\n    Notice: \n      Title: Terms and Conditions\n        Description: This is the APNIC WHOIS Database query service. The objects are in RDAP format.\n        Link: \n          Rel: terms-of-service\n          Value: https://rdap.apnic.net/entity/HL1318-AP\n          Type: text/html\n          Href: http://www.apnic.net/db/dbcopyright.html\n    RDAP Conformance: \n      history_version_0\n      cidr0\n      rdap_level_0\n  Entity: \n    Handle: IRT-CHINAMOBILE2-CN\n    Role: \n      ABUSE\n    VCard: \n      Formatted Name: IRT-CHINAMOBILE2-CN\n      Kind: group\n      Address: \n          Street: china mobile communications corporation 29 jinrong ave.\n          Locale: xicheng district beijing\n          Postal Code: 100032\n        LABEL: \n          China Mobile Communications Corporation\n          29, Jinrong Ave., Xicheng District, Beijing, 100032\n      Email: abuse@chinamobile.com\n      Email: abuse@chinamobile.com\n          PREF: 1\n    Event: \n      Action: last changed\n      Date: 2020-07-16T05:55:00Z\n    Entity: \n      Handle: ct74-AP\n      Role: \n        ADMIN\n      VCard: \n        Formatted Name: chinamobile tech\n        Kind: group\n        Address: \n          LABEL: \n            29, Jinrong Ave.,Xicheng district\n            Beijing\n        Telephone: +86 5268 6688\n            TYPE: voice\n        Telephone: +86 5261 6187\n            TYPE: fax\n        Email: hostmaster@chinamobile.com\n        Email: abuse@chinamobile.com\n            PREF: 1\n      Event: \n        Action: last changed\n        Date: 2016-11-29T09:37:27Z\n      Link: \n        Rel: self\n        Value: https://rdap.apnic.net/entity/IRT-CHINAMOBILE2-CN\n        Type: application/rdap+json\n        Href: https://rdap.apnic.net/entity/ct74-AP\n    Entity: \n      Role: \n        TECHNICAL\n    Remark: \n      Title: remarks\n        Description: abuse@chinamobile.com was validated on 2020-07-16\n    Link: \n      Rel: self\n      Value: https://rdap.apnic.net/entity/IRT-CHINAMOBILE2-CN\n      Type: application/rdap+json\n      Href: https://rdap.apnic.net/entity/IRT-CHINAMOBILE2-CN\n    Notice: \n      Title: Source\n      Description: \n        Objects returned came from source\n        APNIC\n    Notice: \n      Title: Terms and Conditions\n        Description: This is the APNIC WHOIS Database query service. The objects are in RDAP format.\n        Link: \n          Rel: terms-of-service\n          Value: https://rdap.apnic.net/entity/IRT-CHINAMOBILE2-CN\n          Type: text/html\n          Href: http://www.apnic.net/db/dbcopyright.html\n    RDAP Conformance: \n      history_version_0\n      cidr0\n      rdap_level_0\n  Remark: \n    Title: description\n    Description: \n      China Mobile Communications Corporation\n      Mobile Communications Network Operator in China\n      Internet Service Provider in China\n  Remark: \n    Title: remarks\n    Description: \n      service provider\n      --------------------------------------------------------\n      To report network abuse, please contact mnt-irt\n      For troubleshooting, please contact tech-c and admin-c\n      Report invalid contact via www.apnic.net/invalidcontact\n      --------------------------------------------------------\n  Link: \n    Rel: self\n    Value: https://rdap.apnic.net/ip/112.51.40.188\n    Type: application/rdap+json\n    Href: https://rdap.apnic.net/ip/112.0.0.0/10\n  Notice: \n    Title: Source\n    Description: \n      Objects returned came from source\n      APNIC\n  Notice: \n    Title: Terms and Conditions\n      Description: This is the APNIC WHOIS Database query service. The objects are in RDAP format.\n      Link: \n        Rel: terms-of-service\n        Value: https://rdap.apnic.net/ip/112.51.40.188\n        Type: text/html\n        Href: http://www.apnic.net/db/dbcopyright.html\n  RDAP Conformance: \n    history_version_0\n    cidr0\n    rdap_level_0\n", "whoisRawID": 0, "source": "WHOIS_RDAP"}, "registrarUpdatedAt": 1594818594, "whoisID": 6711566326856894299, "registrarName": "APNIC", "whoisServer": "rdap.apnic.net", "createdAt": 1600162107, "expired": false, "contactOrganizations": [], "registrarParseCode": 10272, "netRange": {"netName": "CMNET", "numericEnd": 1883242495, "netRange": "112.0.0.0 - 112.63.255.255", "originAS": "AS9808", "whoisNetRangeID": 0, "numericStart": 1879048192, "status": "INACTIVE", "ipStart": "112.0.0.0", "ipEnd": "112.63.255.255"}, "auditUpdatedAt": 1600162107, "id": 6711566326856894299, "updatedAt": 1602902274, "domainUnicode": "112.0.0.0", "auditCreatedAt": 1600162107, "contactCountries": [], "compositeParseCode": 10272, "contactEmails": ["hostmaster@chinamobile.com,abuse@chinamobile.com", "abuse@chinamobile.com"], "tld": "ipv4", "domainAvailable": false, "noRecord": false, "nameservers": [], "domain": "112.0.0.0", "contactNames": ["haijun li", "IRT-CHINAMOBILE2-CN"], "contacts": [{"zip": "100032", "address": "29 jinrong ave\nxicheng district beijing\n100032\n", "city": "xicheng district beijing", "phone": "+86 1052686688", "whoisContactID": 0, "street": "29 jinrong ave", "name": "haijun li", "id": 0, "fax": "+86 10 52616187", "email": "hostmaster@chinamobile.com,abuse@chinamobile.com"}, {"zip": "100032", "address": "china mobile communications corporation 29 jinrong ave.\nxicheng district beijing\n100032\n", "city": "xicheng district beijing", "whoisContactID": 0, "street": "china mobile communications corporation 29 jinrong ave.", "name": "IRT-CHINAMOBILE2-CN", "id": 0, "email": "abuse@chinamobile.com"}], "status": "INACTIVE", "domainMd5": "af7ce139ebe6615d9579100b6bc83dba", "task_id": "eb4092b8c39543aebb6f46c12b1b93fc"}, {"abuse": {"zip": "100032", "address": "china mobile communications corporation 29 jinrong ave.\nxicheng district beijing\n100032\n", "city": "xicheng district beijing", "whoisContactID": 0, "street": "china mobile communications corporation 29 jinrong ave.", "name": "IRT-CHINAMOBILE-CN", "id": 0, "email": "abuse@chinamobile.com"}, "rawResponse": {"domain": "112.0.0.0", "whoisID": 6702650781415605426, "unparsed": "{\"rdapConformance\":[\"history_version_0\",\"cidr0\",\"rdap_level_0\"],\"objectClassName\":\"ip network\",\"handle\":\"112.0.0.0 - 112.4.255.255\",\"port43\":\"whois.apnic.net\",\"lang\":null,\"events\":[],\"notices\":[{\"title\":\"Source\",\"type\":null,\"description\":[\"Objects returned came from source\",\"APNIC\"],\"links\":[]},{\"title\":\"Terms and Conditions\",\"type\":null,\"description\":[\"This is the APNIC WHOIS Database query service. The objects are in RDAP format.\"],\"links\":[{\"value\":\"https://rdap.apnic.net/ip/112.0.0.0\",\"rel\":\"terms-of-service\",\"href\":\"http://www.apnic.net/db/dbcopyright.html\",\"hreflang\":null,\"title\":null,\"media\":null,\"type\":\"text/html\"}]}],\"status\":[],\"entities\":[{\"rdapConformance\":[\"history_version_0\",\"cidr0\",\"rdap_level_0\"],\"objectClassName\":\"entity\",\"handle\":\"HL1318-AP\",\"port43\":\"whois.apnic.net\",\"lang\":null,\"events\":[{\"eventAction\":\"last changed\",\"eventDate\":\"2016-11-29T09:38:38Z\",\"eventActor\":null,\"status\":[]}],\"notices\":[{\"title\":\"Source\",\"type\":null,\"description\":[\"Objects returned came from source\",\"APNIC\"],\"links\":[]},{\"title\":\"Terms and Conditions\",\"type\":null,\"description\":[\"This is the APNIC WHOIS Database query service. The objects are in RDAP format.\"],\"links\":[{\"value\":\"https://rdap.apnic.net/entity/HL1318-AP\",\"rel\":\"terms-of-service\",\"href\":\"http://www.apnic.net/db/dbcopyright.html\",\"hreflang\":null,\"title\":null,\"media\":null,\"type\":\"text/html\"}]}],\"status\":[],\"entities\":[],\"remarks\":[],\"links\":[{\"value\":\"https://rdap.apnic.net/entity/HL1318-AP\",\"rel\":\"self\",\"href\":\"https://rdap.apnic.net/entity/HL1318-AP\",\"hreflang\":null,\"title\":null,\"media\":null,\"type\":\"application/rdap+json\"}],\"nameservers\":[],\"entity\":null,\"errorCode\":null,\"errorTitle\":null,\"errorDescription\":[],\"vcardArray\":[\"vcard\",[[\"version\",{},\"text\",\"4.0\"],[\"fn\",{},\"text\",\"haijun li\"],[\"kind\",{},\"text\",\"individual\"],[\"adr\",{\"label\":\"29,Jinrong Ave, Xicheng district,beijing,100032\"},\"text\",[\"\",\"\",\"29 jinrong ave\",\"xicheng district beijing\",\"\",\"100032\",\"\"]],[\"tel\",{\"type\":\"voice\"},\"text\",\"+86 1052686688\"],[\"tel\",{\"type\":\"fax\"},\"text\",\"+86 10 52616187\"],[\"email\",{},\"text\",\"hostmaster@chinamobile.com\"],[\"email\",{\"pref\":\"1\"},\"text\",\"abuse@chinamobile.com\"]]],\"roles\":[\"admin\"],\"publicIds\":[],\"legalRepresentative\":null,\"networks\":null,\"autnums\":null,\"nicbr_domainCount\":0,\"nicbr_inetCount\":0,\"nicbr_autnumCount\":0,\"contact_URI\":null},{\"rdapConformance\":[],\"objectClassName\":\"entity\",\"handle\":null,\"port43\":null,\"lang\":null,\"events\":[],\"notices\":[],\"status\":[],\"entities\":[],\"remarks\":[],\"links\":[],\"nameservers\":[],\"entity\":null,\"errorCode\":null,\"errorTitle\":null,\"errorDescription\":[],\"vcardArray\":null,\"roles\":[\"technical\"],\"publicIds\":[],\"legalRepresentative\":null,\"networks\":null,\"autnums\":null,\"nicbr_domainCount\":0,\"nicbr_inetCount\":0,\"nicbr_autnumCount\":0,\"contact_URI\":null},{\"rdapConformance\":[\"history_version_0\",\"cidr0\",\"rdap_level_0\"],\"objectClassName\":\"entity\",\"handle\":\"IRT-CHINAMOBILE-CN\",\"port43\":\"whois.apnic.net\",\"lang\":null,\"events\":[{\"eventAction\":\"last changed\",\"eventDate\":\"2020-07-16T05:55:01Z\",\"eventActor\":null,\"status\":[]}],\"notices\":[{\"title\":\"Source\",\"type\":null,\"description\":[\"Objects returned came from source\",\"APNIC\"],\"links\":[]},{\"title\":\"Terms and Conditions\",\"type\":null,\"description\":[\"This is the APNIC WHOIS Database query service. The objects are in RDAP format.\"],\"links\":[{\"value\":\"https://rdap.apnic.net/entity/IRT-CHINAMOBILE-CN\",\"rel\":\"terms-of-service\",\"href\":\"http://www.apnic.net/db/dbcopyright.html\",\"hreflang\":null,\"title\":null,\"media\":null,\"type\":\"text/html\"}]}],\"status\":[],\"entities\":[{\"rdapConformance\":[],\"objectClassName\":\"entity\",\"handle\":null,\"port43\":null,\"lang\":null,\"events\":[],\"notices\":[],\"status\":[],\"entities\":[],\"remarks\":[],\"links\":[],\"nameservers\":[],\"entity\":null,\"errorCode\":null,\"errorTitle\":null,\"errorDescription\":[],\"vcardArray\":null,\"roles\":[\"technical\",\"admin\"],\"publicIds\":[],\"legalRepresentative\":null,\"networks\":null,\"autnums\":null,\"nicbr_domainCount\":0,\"nicbr_inetCount\":0,\"nicbr_autnumCount\":0,\"contact_URI\":null}],\"remarks\":[{\"title\":\"remarks\",\"description\":[\"abuse@chinamobile.com was validated on 2020-07-16\"],\"type\":null,\"links\":null}],\"links\":[{\"value\":\"https://rdap.apnic.net/entity/IRT-CHINAMOBILE-CN\",\"rel\":\"self\",\"href\":\"https://rdap.apnic.net/entity/IRT-CHINAMOBILE-CN\",\"hreflang\":null,\"title\":null,\"media\":null,\"type\":\"application/rdap+json\"}],\"nameservers\":[],\"entity\":null,\"errorCode\":null,\"errorTitle\":null,\"errorDescription\":[],\"vcardArray\":[\"vcard\",[[\"version\",{},\"text\",\"4.0\"],[\"fn\",{},\"text\",\"IRT-CHINAMOBILE-CN\"],[\"kind\",{},\"text\",\"group\"],[\"adr\",{\"label\":\"China Mobile Communications Corporation\\n29, Jinrong Ave., Xicheng District, Beijing, 100032\"},\"text\",[\"\",\"\",\"china mobile communications corporation 29 jinrong ave.\",\"xicheng district beijing\",\"\",\"100032\",\"\"]],[\"email\",{},\"text\",\"abuse@chinamobile.com\"],[\"email\",{\"pref\":\"1\"},\"text\",\"abuse@chinamobile.com\"]]],\"roles\":[\"abuse\"],\"publicIds\":[],\"legalRepresentative\":null,\"networks\":null,\"autnums\":null,\"nicbr_domainCount\":0,\"nicbr_inetCount\":0,\"nicbr_autnumCount\":0,\"contact_URI\":null}],\"remarks\":[{\"title\":\"description\",\"description\":[\"China Mobile Communications Corporation\"],\"type\":null,\"links\":null}],\"links\":[{\"value\":\"https://rdap.apnic.net/ip/112.0.0.0\",\"rel\":\"self\",\"href\":\"https://rdap.apnic.net/ip/112.0.0.0/13\",\"hreflang\":null,\"title\":null,\"media\":null,\"type\":\"application/rdap+json\"}],\"nameservers\":[],\"entity\":null,\"errorCode\":null,\"errorTitle\":null,\"errorDescription\":[],\"startAddress\":\"112.0.0.0\",\"endAddress\":\"112.4.255.255\",\"ipVersion\":\"v4\",\"name\":\"CMNET-JIANGSU\",\"type\":\"ALLOCATED NON-PORTABLE\",\"country\":\"CN\",\"parentHandle\":null,\"cidr0_cidrs\":[{\"v4prefix\":\"112.0.0.0\",\"v6prefix\":null,\"length\":\"14\"},{\"v4prefix\":\"112.4.0.0\",\"v6prefix\":null,\"length\":\"16\"}],\"arin_originas0_originautnums\":[],\"lacnic_originAutnum\":null,\"lacnic_reverseDelegations\":[],\"lacnic_legalRepresentative\":null,\"nicbr_autnum\":null,\"nicbr_reverseDelegations\":[]}", "raw": "IP Network: \n  Handle: 112.0.0.0 - 112.4.255.255\n  Start Address: 112.0.0.0\n  End Address: 112.4.255.255\n  IP Version: v4\n  Name: CMNET-JIANGSU\n  Type: ALLOCATED NON-PORTABLE\n  Country: CN\n  Port43: whois.apnic.net\n\n  Cidr: \n    Prefix: 112.0.0.0\n    Length: 14\n  Cidr: \n    Prefix: 112.4.0.0\n    Length: 16\n  Entity: \n    Handle: HL1318-AP\n    Role: \n      ADMIN\n    VCard: \n      Formatted Name: haijun li\n      Kind: individual\n      Address: \n          Street: 29 jinrong ave\n          Locale: xicheng district beijing\n          Postal Code: 100032\n          LABEL: 29,Jinrong Ave, Xicheng district,beijing,100032\n      Telephone: +86 1052686688\n          TYPE: voice\n      Telephone: +86 10 52616187\n          TYPE: fax\n      Email: hostmaster@chinamobile.com\n      Email: abuse@chinamobile.com\n          PREF: 1\n    Event: \n      Action: last changed\n      Date: 2016-11-29T09:38:38Z\n    Link: \n      Rel: self\n      Value: https://rdap.apnic.net/entity/HL1318-AP\n      Type: application/rdap+json\n      Href: https://rdap.apnic.net/entity/HL1318-AP\n    Notice: \n      Title: Source\n      Description: \n        Objects returned came from source\n        APNIC\n    Notice: \n      Title: Terms and Conditions\n        Description: This is the APNIC WHOIS Database query service. The objects are in RDAP format.\n        Link: \n          Rel: terms-of-service\n          Value: https://rdap.apnic.net/entity/HL1318-AP\n          Type: text/html\n          Href: http://www.apnic.net/db/dbcopyright.html\n    RDAP Conformance: \n      history_version_0\n      cidr0\n      rdap_level_0\n  Entity: \n    Role: \n      TECHNICAL\n  Entity: \n    Handle: IRT-CHINAMOBILE-CN\n    Role: \n      ABUSE\n    VCard: \n      Formatted Name: IRT-CHINAMOBILE-CN\n      Kind: group\n      Address: \n          Street: china mobile communications corporation 29 jinrong ave.\n          Locale: xicheng district beijing\n          Postal Code: 100032\n        LABEL: \n          China Mobile Communications Corporation\n          29, Jinrong Ave., Xicheng District, Beijing, 100032\n      Email: abuse@chinamobile.com\n      Email: abuse@chinamobile.com\n          PREF: 1\n    Event: \n      Action: last changed\n      Date: 2020-07-16T05:55:01Z\n    Entity: \n      Role: \n        TECHNICAL\n        ADMIN\n    Remark: \n      Title: remarks\n        Description: abuse@chinamobile.com was validated on 2020-07-16\n    Link: \n      Rel: self\n      Value: https://rdap.apnic.net/entity/IRT-CHINAMOBILE-CN\n      Type: application/rdap+json\n      Href: https://rdap.apnic.net/entity/IRT-CHINAMOBILE-CN\n    Notice: \n      Title: Source\n      Description: \n        Objects returned came from source\n        APNIC\n    Notice: \n      Title: Terms and Conditions\n        Description: This is the APNIC WHOIS Database query service. The objects are in RDAP format.\n        Link: \n          Rel: terms-of-service\n          Value: https://rdap.apnic.net/entity/IRT-CHINAMOBILE-CN\n          Type: text/html\n          Href: http://www.apnic.net/db/dbcopyright.html\n    RDAP Conformance: \n      history_version_0\n      cidr0\n      rdap_level_0\n  Remark: \n    Title: description\n      Description: China Mobile Communications Corporation\n  Link: \n    Rel: self\n    Value: https://rdap.apnic.net/ip/112.0.0.0\n    Type: application/rdap+json\n    Href: https://rdap.apnic.net/ip/112.0.0.0/13\n  Notice: \n    Title: Source\n    Description: \n      Objects returned came from source\n      APNIC\n  Notice: \n    Title: Terms and Conditions\n      Description: This is the APNIC WHOIS Database query service. The objects are in RDAP format.\n      Link: \n        Rel: terms-of-service\n        Value: https://rdap.apnic.net/ip/112.0.0.0\n        Type: text/html\n        Href: http://www.apnic.net/db/dbcopyright.html\n  RDAP Conformance: \n    history_version_0\n    cidr0\n    rdap_level_0\n", "whoisRawID": 0, "source": "WHOIS_RDAP"}, "whoisID": 6702650781415605426, "registrarName": "APNIC", "admin": {"zip": "100032", "address": "29 jinrong ave\nxicheng district beijing\n100032\n", "city": "xicheng district beijing", "phone": "+86 1052686688", "whoisContactID": 0, "street": "29 jinrong ave", "name": "haijun li", "id": 0, "fax": "+86 10 52616187", "email": "hostmaster@chinamobile.com,abuse@chinamobile.com"}, "whoisServer": "rdap.apnic.net", "createdAt": 1598036475, "expired": false, "contactOrganizations": [], "registrarParseCode": 8448, "netRange": {"netName": "CMNET-JIANGSU", "numericEnd": 1879375871, "netRange": "112.0.0.0 - 112.4.255.255", "whoisNetRangeID": 0, "numericStart": 1879048192, "status": "INACTIVE", "ipStart": "112.0.0.0", "ipEnd": "112.4.255.255"}, "auditUpdatedAt": 1598036475, "id": 6702650781415605426, "updatedAt": 1600162107, "domainUnicode": "112.0.0.0", "auditCreatedAt": 1598036475, "contactCountries": [], "compositeParseCode": 8448, "contactEmails": ["hostmaster@chinamobile.com,abuse@chinamobile.com", "abuse@chinamobile.com"], "tld": "ipv4", "domainAvailable": false, "noRecord": false, "nameservers": [], "domain": "112.0.0.0", "contactNames": ["haijun li", "IRT-CHINAMOBILE-CN"], "contacts": [{"zip": "100032", "address": "29 jinrong ave\nxicheng district beijing\n100032\n", "city": "xicheng district beijing", "phone": "+86 1052686688", "whoisContactID": 0, "street": "29 jinrong ave", "name": "haijun li", "id": 0, "fax": "+86 10 52616187", "email": "hostmaster@chinamobile.com,abuse@chinamobile.com"}, {"zip": "100032", "address": "china mobile communications corporation 29 jinrong ave.\nxicheng district beijing\n100032\n", "city": "xicheng district beijing", "whoisContactID": 0, "street": "china mobile communications corporation 29 jinrong ave.", "name": "IRT-CHINAMOBILE-CN", "id": 0, "email": "abuse@chinamobile.com"}], "status": "INACTIVE", "domainMd5": "af7ce139ebe6615d9579100b6bc83dba", "task_id": "52bcde37b42e4018871c3f8dd1cd7a00"}]}