{"scan_time": 1658375406, "url": "https://cybertotal.cycarrier.com/app/intelligence/e2da9b7c40264bd3989e52470919d830", "whois": [{"abuse": {"address": "", "phone": "+1.2086851750", "whoisContactID": 0, "id": 0, "email": "abusecomplaints@markmonitor.com"}, "technical": {"country": "US", "address": "VA\nUS\n", "whoisContactID": 0, "state": "VA", "id": 0}, "registrar": {"zip": "83646", "country": "US", "address": "3540 E Longwing Ln\nMeridian\n83646\nID\nUS\n", "city": "Meridian", "whoisContactID": 0, "street": "3540 E Longwing Ln", "organization": "MarkMonitor Inc.", "state": "ID", "id": 0}, "rawResponse": {"domain": "yahoo.com", "whoisID": 6932769212394200506, "unparsed": "{\"rdapConformance\":[\"rdap_level_0\",\"icann_rdap_technical_implementation_guide_0\",\"icann_rdap_response_profile_0\"],\"objectClassName\":\"domain\",\"handle\":\"3643624_DOMAIN_COM-VRSN\",\"port43\":null,\"lang\":null,\"events\":[{\"eventAction\":\"registration\",\"eventDate\":\"1995-01-18T05:00:00Z\",\"eventActor\":null,\"status\":[]},{\"eventAction\":\"expiration\",\"eventDate\":\"2023-01-19T05:00:00Z\",\"eventActor\":null,\"status\":[]},{\"eventAction\":\"last changed\",\"eventDate\":\"2022-03-09T21:10:09Z\",\"eventActor\":null,\"status\":[]},{\"eventAction\":\"last update of RDAP database\",\"eventDate\":\"2022-05-18T23:09:14Z\",\"eventActor\":null,\"status\":[]}],\"notices\":[{\"title\":\"Terms of Use\",\"type\":null,\"description\":[\"Service subject to Terms of Use.\"],\"links\":[{\"value\":null,\"rel\":null,\"href\":\"https://www.verisign.com/domain-names/registration-data-access-protocol/terms-service/index.xhtml\",\"hreflang\":null,\"title\":null,\"media\":null,\"type\":\"text/html\"}]},{\"title\":\"Status Codes\",\"type\":null,\"description\":[\"For more information on domain status codes, please visit https://icann.org/epp\"],\"links\":[{\"value\":null,\"rel\":null,\"href\":\"https://icann.org/epp\",\"hreflang\":null,\"title\":null,\"media\":null,\"type\":\"text/html\"}]},{\"title\":\"RDDS Inaccuracy Complaint Form\",\"type\":null,\"description\":[\"URL of the ICANN RDDS Inaccuracy Complaint Form: https://icann.org/wicf\"],\"links\":[{\"value\":null,\"rel\":null,\"href\":\"https://icann.org/wicf\",\"hreflang\":null,\"title\":null,\"media\":null,\"type\":\"text/html\"}]}],\"status\":[\"client delete prohibited\",\"client transfer prohibited\",\"client update prohibited\",\"server delete prohibited\",\"server transfer prohibited\",\"server update prohibited\"],\"entities\":[{\"rdapConformance\":[],\"objectClassName\":\"entity\",\"handle\":\"292\",\"port43\":null,\"lang\":null,\"events\":[],\"notices\":[],\"status\":[],\"entities\":[{\"rdapConformance\":[],\"objectClassName\":\"entity\",\"handle\":null,\"port43\":null,\"lang\":null,\"events\":[],\"notices\":[],\"status\":[],\"entities\":[],\"remarks\":[],\"links\":[],\"nameservers\":[],\"entity\":null,\"legalRepresentative\":null,\"errorCode\":null,\"errorTitle\":null,\"errorDescription\":[],\"vcardArray\":[\"vcard\",[[\"version\",{},\"text\",\"4.0\"],[\"fn\",{},\"text\",\"\"],[\"tel\",{\"type\":\"voice\"},\"uri\",\"tel:+1.2086851750\"],[\"email\",{},\"text\",\"abusecomplaints@markmonitor.com\"]]],\"roles\":[\"abuse\"],\"publicIds\":[],\"networks\":null,\"autnums\":null,\"nicbr_domainCount\":0,\"nicbr_inetCount\":0,\"nicbr_autnumCount\":0,\"url\":null,\"contact_URI\":null}],\"remarks\":[],\"links\":[],\"nameservers\":[],\"entity\":null,\"legalRepresentative\":null,\"errorCode\":null,\"errorTitle\":null,\"errorDescription\":[],\"vcardArray\":[\"vcard\",[[\"version\",{},\"text\",\"4.0\"],[\"fn\",{},\"text\",\"MarkMonitor Inc.\"]]],\"roles\":[\"registrar\"],\"publicIds\":[{\"type\":\"IANA Registrar ID\",\"identifier\":\"292\"}],\"networks\":null,\"autnums\":null,\"nicbr_domainCount\":0,\"nicbr_inetCount\":0,\"nicbr_autnumCount\":0,\"url\":null,\"contact_URI\":null}],\"remarks\":[],\"links\":[{\"value\":\"https://rdap.verisign.com/com/v1/domain/YAHOO.COM\",\"rel\":\"self\",\"href\":\"https://rdap.verisign.com/com/v1/domain/YAHOO.COM\",\"hreflang\":null,\"title\":null,\"media\":null,\"type\":\"application/rdap+json\"},{\"value\":\"https://rdap.markmonitor.com/rdap/domain/YAHOO.COM\",\"rel\":\"related\",\"href\":\"https://rdap.markmonitor.com/rdap/domain/YAHOO.COM\",\"hreflang\":null,\"title\":null,\"media\":null,\"type\":\"application/rdap+json\"}],\"nameservers\":[{\"rdapConformance\":[],\"objectClassName\":\"nameserver\",\"handle\":null,\"port43\":null,\"lang\":null,\"events\":[],\"notices\":[],\"status\":[],\"entities\":[],\"remarks\":[],\"links\":[],\"nameservers\":[],\"entity\":null,\"legalRepresentative\":null,\"errorCode\":null,\"errorTitle\":null,\"errorDescription\":[],\"ldhName\":\"NS1.YAHOO.COM\",\"unicodeName\":null,\"variants\":[],\"secureDNS\":null,\"publicIds\":[],\"network\":null,\"nicbr_arbitration\":false,\"delegate\":null,\"ipAddresses\":null,\"switch_name\":null,\"switch_aceString\":null},{\"rdapConformance\":[],\"objectClassName\":\"nameserver\",\"handle\":null,\"port43\":null,\"lang\":null,\"events\":[],\"notices\":[],\"status\":[],\"entities\":[],\"remarks\":[],\"links\":[],\"nameservers\":[],\"entity\":null,\"legalRepresentative\":null,\"errorCode\":null,\"errorTitle\":null,\"errorDescription\":[],\"ldhName\":\"NS2.YAHOO.COM\",\"unicodeName\":null,\"variants\":[],\"secureDNS\":null,\"publicIds\":[],\"network\":null,\"nicbr_arbitration\":false,\"delegate\":null,\"ipAddresses\":null,\"switch_name\":null,\"switch_aceString\":null},{\"rdapConformance\":[],\"objectClassName\":\"nameserver\",\"handle\":null,\"port43\":null,\"lang\":null,\"events\":[],\"notices\":[],\"status\":[],\"entities\":[],\"remarks\":[],\"links\":[],\"nameservers\":[],\"entity\":null,\"legalRepresentative\":null,\"errorCode\":null,\"errorTitle\":null,\"errorDescription\":[],\"ldhName\":\"NS3.YAHOO.COM\",\"unicodeName\":null,\"variants\":[],\"secureDNS\":null,\"publicIds\":[],\"network\":null,\"nicbr_arbitration\":false,\"delegate\":null,\"ipAddresses\":null,\"switch_name\":null,\"switch_aceString\":null},{\"rdapConformance\":[],\"objectClassName\":\"nameserver\",\"handle\":null,\"port43\":null,\"lang\":null,\"events\":[],\"notices\":[],\"status\":[],\"entities\":[],\"remarks\":[],\"links\":[],\"nameservers\":[],\"entity\":null,\"legalRepresentative\":null,\"errorCode\":null,\"errorTitle\":null,\"errorDescription\":[],\"ldhName\":\"NS4.YAHOO.COM\",\"unicodeName\":null,\"variants\":[],\"secureDNS\":null,\"publicIds\":[],\"network\":null,\"nicbr_arbitration\":false,\"delegate\":null,\"ipAddresses\":null,\"switch_name\":null,\"switch_aceString\":null},{\"rdapConformance\":[],\"objectClassName\":\"nameserver\",\"handle\":null,\"port43\":null,\"lang\":null,\"events\":[],\"notices\":[],\"status\":[],\"entities\":[],\"remarks\":[],\"links\":[],\"nameservers\":[],\"entity\":null,\"legalRepresentative\":null,\"errorCode\":null,\"errorTitle\":null,\"errorDescription\":[],\"ldhName\":\"NS5.YAHOO.COM\",\"unicodeName\":null,\"variants\":[],\"secureDNS\":null,\"publicIds\":[],\"network\":null,\"nicbr_arbitration\":false,\"delegate\":null,\"ipAddresses\":null,\"switch_name\":null,\"switch_aceString\":null}],\"entity\":null,\"legalRepresentative\":null,\"errorCode\":null,\"errorTitle\":null,\"errorDescription\":[],\"ldhName\":\"YAHOO.COM\",\"unicodeName\":null,\"variants\":[],\"secureDNS\":{\"zoneSigned\":null,\"delegationSigned\":false,\"maxSigLife\":null,\"dsData\":[],\"keyData\":[]},\"publicIds\":[],\"network\":null,\"nicbr_arbitration\":false,\"delegate\":{\"rdapConformance\":[\"rdap_level_0\",\"icann_rdap_technical_implementation_guide_0\",\"icann_rdap_response_profile_0\"],\"objectClassName\":\"domain\",\"handle\":\"3643624_DOMAIN_COM-VRSN\",\"port43\":\"whois.markmonitor.com\",\"lang\":null,\"events\":[{\"eventAction\":\"expiration\",\"eventDate\":\"2023-01-19T05:00:00Z\",\"eventActor\":null,\"status\":[]},{\"eventAction\":\"registration\",\"eventDate\":\"1995-01-18T08:00:00Z\",\"eventActor\":null,\"status\":[]},{\"eventAction\":\"last update\",\"eventDate\":\"2022-03-09T15:51:45Z\",\"eventActor\":null,\"status\":[]},{\"eventAction\":\"last update of RDAP database\",\"eventDate\":\"2022-05-18T19:09:38Z\",\"eventActor\":null,\"status\":[]}],\"notices\":[{\"title\":\"Terms of Use\",\"type\":null,\"description\":[\"By submitting an RDAP query, you agree that you will use this data only for\",\"lawful purposes and that, under no circumstances will you use this data to:\",\"(1) allow, enable, or otherwise support the transmission by email, telephone,\",\"or facsimile of mass, unsolicited, commercial advertising, or spam; or\",\"(2) enable high volume, automated, or electronic processes that send queries,\",\"data, or email to MarkMonitor (or its systems) or the domain name contacts (or\",\"its systems).\",\"MarkMonitor reserves the right to modify these terms at any time.\",\"By submitting this query, you agree to abide by this policy.\",\"MarkMonitor Domain Management(TM)\",\"Protecting companies and consumers in a digital world.\",\"Visit MarkMonitor at https://www.markmonitor.com\",\"Contact us at +1.8007459229\",\"In Europe, at +44.02032062220\"],\"links\":[{\"value\":\"https://www.markmonitor.com/legal/domain-management-terms-and-conditions\",\"rel\":\"related\",\"href\":\"https://www.markmonitor.com/legal/domain-management-terms-and-conditions\",\"hreflang\":null,\"title\":null,\"media\":null,\"type\":\"text/html\"}]},{\"title\":\"Status Codes\",\"type\":null,\"description\":[\"For more information on domain status codes, please visit https://icann.org/epp.\"],\"links\":[{\"value\":\"https://icann.org/epp\",\"rel\":\"related\",\"href\":\"https://icann.org/epp\",\"hreflang\":null,\"title\":null,\"media\":null,\"type\":\"text/html\"}]},{\"title\":\"RDDS Inaccuracy Complaint Form\",\"type\":null,\"description\":[\"URL of the ICANN RDDS Inaccuracy Complaint Form: https://www.icann.org/wicf.\"],\"links\":[{\"value\":\"https://www.icann.org/wicf\",\"rel\":\"related\",\"href\":\"https://www.icann.org/wicf\",\"hreflang\":null,\"title\":null,\"media\":null,\"type\":\"text/html\"}]}],\"status\":[\"client update prohibited\",\"client transfer prohibited\",\"client delete prohibited\",\"server update prohibited\",\"server transfer prohibited\",\"server delete prohibited\"],\"entities\":[{\"rdapConformance\":[],\"objectClassName\":\"entity\",\"handle\":null,\"port43\":null,\"lang\":null,\"events\":[{\"eventAction\":\"last update\",\"eventDate\":\"2021-10-19T23:52:48Z\",\"eventActor\":null,\"status\":[]}],\"notices\":[],\"status\":[],\"entities\":[],\"remarks\":[{\"title\":\"REDACTED FOR PRIVACY\",\"description\":[\"Some of the data in this object has been removed.\"],\"type\":\"Object truncated due to authorization\",\"links\":null}],\"links\":[],\"nameservers\":[],\"entity\":null,\"legalRepresentative\":null,\"errorCode\":null,\"errorTitle\":null,\"errorDescription\":[],\"vcardArray\":[\"vcard\",[[\"version\",{},\"text\",\"4.0\"],[\"adr\",{},\"text\",[\"\",\"\",\"\",\"\",\"VA\",\"\",\"US\"]]]],\"roles\":[\"admin\"],\"publicIds\":[],\"networks\":null,\"autnums\":null,\"nicbr_domainCount\":0,\"nicbr_inetCount\":0,\"nicbr_autnumCount\":0,\"url\":null,\"contact_URI\":\"https://domains.markmonitor.com/whois/\"},{\"rdapConformance\":[],\"objectClassName\":\"entity\",\"handle\":null,\"port43\":null,\"lang\":null,\"events\":[{\"eventAction\":\"last update\",\"eventDate\":\"2021-10-19T23:52:48Z\",\"eventActor\":null,\"status\":[]}],\"notices\":[],\"status\":[],\"entities\":[],\"remarks\":[{\"title\":\"REDACTED FOR PRIVACY\",\"description\":[\"Some of the data in this object has been removed.\"],\"type\":\"Object truncated due to authorization\",\"links\":null}],\"links\":[],\"nameservers\":[],\"entity\":null,\"legalRepresentative\":null,\"errorCode\":null,\"errorTitle\":null,\"errorDescription\":[],\"vcardArray\":[\"vcard\",[[\"version\",{},\"text\",\"4.0\"],[\"org\",{\"type\":\"work\"},\"text\",\"Yahoo Assets LLC\"],[\"adr\",{},\"text\",[\"\",\"\",\"\",\"\",\"VA\",\"\",\"US\"]]]],\"roles\":[\"registrant\"],\"publicIds\":[],\"networks\":null,\"autnums\":null,\"nicbr_domainCount\":0,\"nicbr_inetCount\":0,\"nicbr_autnumCount\":0,\"url\":null,\"contact_URI\":\"https://domains.markmonitor.com/whois/\"},{\"rdapConformance\":[],\"objectClassName\":\"entity\",\"handle\":null,\"port43\":null,\"lang\":null,\"events\":[{\"eventAction\":\"last update\",\"eventDate\":\"2021-10-19T23:52:48Z\",\"eventActor\":null,\"status\":[]}],\"notices\":[],\"status\":[],\"entities\":[],\"remarks\":[{\"title\":\"REDACTED FOR PRIVACY\",\"description\":[\"Some of the data in this object has been removed.\"],\"type\":\"Object truncated due to authorization\",\"links\":null}],\"links\":[],\"nameservers\":[],\"entity\":null,\"legalRepresentative\":null,\"errorCode\":null,\"errorTitle\":null,\"errorDescription\":[],\"vcardArray\":[\"vcard\",[[\"version\",{},\"text\",\"4.0\"],[\"adr\",{},\"text\",[\"\",\"\",\"\",\"\",\"VA\",\"\",\"US\"]]]],\"roles\":[\"technical\"],\"publicIds\":[],\"networks\":null,\"autnums\":null,\"nicbr_domainCount\":0,\"nicbr_inetCount\":0,\"nicbr_autnumCount\":0,\"url\":null,\"contact_URI\":\"https://domains.markmonitor.com/whois/\"},{\"rdapConformance\":[],\"objectClassName\":\"entity\",\"handle\":\"292\",\"port43\":null,\"lang\":null,\"events\":[{\"eventAction\":\"registrar expiration\",\"eventDate\":\"2020-09-14T04:00:00Z\",\"eventActor\":null,\"status\":[]}],\"notices\":[],\"status\":[],\"entities\":[{\"rdapConformance\":[],\"objectClassName\":\"entity\",\"handle\":null,\"port43\":null,\"lang\":null,\"events\":[],\"notices\":[],\"status\":[],\"entities\":[],\"remarks\":[],\"links\":[],\"nameservers\":[],\"entity\":null,\"legalRepresentative\":null,\"errorCode\":null,\"errorTitle\":null,\"errorDescription\":[],\"vcardArray\":[\"vcard\",[[\"version\",{},\"text\",\"4.0\"],[\"email\",{\"type\":\"work\"},\"text\",\"abusecomplaints@markmonitor.com\"],[\"tel\",{\"type\":\"voice\"},\"text\",\"+1.2086851750\"]]],\"roles\":[\"abuse\"],\"publicIds\":[],\"networks\":null,\"autnums\":null,\"nicbr_domainCount\":0,\"nicbr_inetCount\":0,\"nicbr_autnumCount\":0,\"url\":null,\"contact_URI\":null}],\"remarks\":[],\"links\":[],\"nameservers\":[],\"entity\":null,\"legalRepresentative\":null,\"errorCode\":null,\"errorTitle\":null,\"errorDescription\":[],\"vcardArray\":[\"vcard\",[[\"version\",{},\"text\",\"4.0\"],[\"org\",{\"type\":\"work\"},\"text\",\"MarkMonitor Inc.\"],[\"adr\",{},\"text\",[\"\",\"\",\"3540 E Longwing Ln\",\"Meridian\",\"ID\",\"83646\",\"US\"]]]],\"roles\":[\"registrar\"],\"publicIds\":[{\"type\":\"IANA Registrar ID\",\"identifier\":\"292\"}],\"networks\":null,\"autnums\":null,\"nicbr_domainCount\":0,\"nicbr_inetCount\":0,\"nicbr_autnumCount\":0,\"url\":null,\"contact_URI\":null}],\"remarks\":[],\"links\":[{\"value\":\"https://rdap.markmonitor.com/rdap/domain/yahoo.com\",\"rel\":\"self\",\"href\":\"https://rdap.markmonitor.com/rdap/domain/yahoo.com\",\"hreflang\":null,\"title\":null,\"media\":null,\"type\":\"application/rdap+json\"}],\"nameservers\":[{\"rdapConformance\":[],\"objectClassName\":\"nameserver\",\"handle\":null,\"port43\":null,\"lang\":null,\"events\":[{\"eventAction\":\"last changed\",\"eventDate\":\"2013-07-11T16:30:20Z\",\"eventActor\":null,\"status\":[]}],\"notices\":[],\"status\":[\"active\"],\"entities\":[],\"remarks\":[],\"links\":[],\"nameservers\":[],\"entity\":null,\"legalRepresentative\":null,\"errorCode\":null,\"errorTitle\":null,\"errorDescription\":[],\"ldhName\":\"ns1.yahoo.com\",\"unicodeName\":null,\"variants\":[],\"secureDNS\":null,\"publicIds\":[],\"network\":null,\"nicbr_arbitration\":false,\"delegate\":null,\"ipAddresses\":null,\"switch_name\":null,\"switch_aceString\":null},{\"rdapConformance\":[],\"objectClassName\":\"nameserver\",\"handle\":null,\"port43\":null,\"lang\":null,\"events\":[{\"eventAction\":\"last changed\",\"eventDate\":\"2013-07-11T16:30:20Z\",\"eventActor\":null,\"status\":[]}],\"notices\":[],\"status\":[\"active\"],\"entities\":[],\"remarks\":[],\"links\":[],\"nameservers\":[],\"entity\":null,\"legalRepresentative\":null,\"errorCode\":null,\"errorTitle\":null,\"errorDescription\":[],\"ldhName\":\"ns2.yahoo.com\",\"unicodeName\":null,\"variants\":[],\"secureDNS\":null,\"publicIds\":[],\"network\":null,\"nicbr_arbitration\":false,\"delegate\":null,\"ipAddresses\":null,\"switch_name\":null,\"switch_aceString\":null},{\"rdapConformance\":[],\"objectClassName\":\"nameserver\",\"handle\":null,\"port43\":null,\"lang\":null,\"events\":[{\"eventAction\":\"last changed\",\"eventDate\":\"2013-07-11T16:30:20Z\",\"eventActor\":null,\"status\":[]}],\"notices\":[],\"status\":[\"active\"],\"entities\":[],\"remarks\":[],\"links\":[],\"nameservers\":[],\"entity\":null,\"legalRepresentative\":null,\"errorCode\":null,\"errorTitle\":null,\"errorDescription\":[],\"ldhName\":\"ns3.yahoo.com\",\"unicodeName\":null,\"variants\":[],\"secureDNS\":null,\"publicIds\":[],\"network\":null,\"nicbr_arbitration\":false,\"delegate\":null,\"ipAddresses\":null,\"switch_name\":null,\"switch_aceString\":null},{\"rdapConformance\":[],\"objectClassName\":\"nameserver\",\"handle\":null,\"port43\":null,\"lang\":null,\"events\":[{\"eventAction\":\"last changed\",\"eventDate\":\"2013-07-11T16:30:20Z\",\"eventActor\":null,\"status\":[]}],\"notices\":[],\"status\":[\"active\"],\"entities\":[],\"remarks\":[],\"links\":[],\"nameservers\":[],\"entity\":null,\"legalRepresentative\":null,\"errorCode\":null,\"errorTitle\":null,\"errorDescription\":[],\"ldhName\":\"ns4.yahoo.com\",\"unicodeName\":null,\"variants\":[],\"secureDNS\":null,\"publicIds\":[],\"network\":null,\"nicbr_arbitration\":false,\"delegate\":null,\"ipAddresses\":null,\"switch_name\":null,\"switch_aceString\":null},{\"rdapConformance\":[],\"objectClassName\":\"nameserver\",\"handle\":null,\"port43\":null,\"lang\":null,\"events\":[{\"eventAction\":\"last changed\",\"eventDate\":\"2013-07-11T16:30:20Z\",\"eventActor\":null,\"status\":[]}],\"notices\":[],\"status\":[\"active\"],\"entities\":[],\"remarks\":[],\"links\":[],\"nameservers\":[],\"entity\":null,\"legalRepresentative\":null,\"errorCode\":null,\"errorTitle\":null,\"errorDescription\":[],\"ldhName\":\"ns5.yahoo.com\",\"unicodeName\":null,\"variants\":[],\"secureDNS\":null,\"publicIds\":[],\"network\":null,\"nicbr_arbitration\":false,\"delegate\":null,\"ipAddresses\":null,\"switch_name\":null,\"switch_aceString\":null}],\"entity\":null,\"legalRepresentative\":null,\"errorCode\":null,\"errorTitle\":null,\"errorDescription\":[],\"ldhName\":\"yahoo.com\",\"unicodeName\":null,\"variants\":[],\"secureDNS\":{\"zoneSigned\":null,\"delegationSigned\":false,\"maxSigLife\":null,\"dsData\":[],\"keyData\":[]},\"publicIds\":[],\"network\":null,\"nicbr_arbitration\":false,\"delegate\":null,\"switch_name\":null,\"switch_aceString\":null},\"switch_name\":null,\"switch_aceString\":null}", "raw": "Registrar: \n  Handle: 3643624_DOMAIN_COM-VRSN\n  LDH Name: yahoo.com\n  Nameserver: \n    LDH Name: ns1.yahoo.com\n    Event: \n      Action: last changed\n      Date: 2013-07-11T16:30:20Z\n      Status: active\n  Nameserver: \n    LDH Name: ns2.yahoo.com\n    Event: \n      Action: last changed\n      Date: 2013-07-11T16:30:20Z\n      Status: active\n  Nameserver: \n    LDH Name: ns3.yahoo.com\n    Event: \n      Action: last changed\n      Date: 2013-07-11T16:30:20Z\n      Status: active\n  Nameserver: \n    LDH Name: ns4.yahoo.com\n    Event: \n      Action: last changed\n      Date: 2013-07-11T16:30:20Z\n      Status: active\n  Nameserver: \n    LDH Name: ns5.yahoo.com\n    Event: \n      Action: last changed\n      Date: 2013-07-11T16:30:20Z\n      Status: active\n  SecureDNS: \n    Delegation Signed: false\n  Event: \n    Action: expiration\n    Date: 2023-01-19T05:00:00Z\n  Event: \n    Action: registration\n    Date: 1995-01-18T08:00:00Z\n  Event: \n    Action: last update\n    Date: 2022-03-09T15:51:45Z\n  Event: \n    Action: last update of RDAP database\n    Date: 2022-05-18T19:09:38Z\n  Status: \n    client update prohibited\n    client transfer prohibited\n    client delete prohibited\n    server update prohibited\n    server transfer prohibited\n    server delete prohibited\n  Entity: \n    Role: \n      ADMIN\n    VCard: \n      Address: \n          Region: VA\n          Country: US\n    Event: \n      Action: last update\n      Date: 2021-10-19T23:52:48Z\n    Remark: \n      Title: REDACTED FOR PRIVACY\n      Type: Object truncated due to authorization\n        Description: Some of the data in this object has been removed.\n  Entity: \n    Role: \n      REGISTRANT\n    VCard: \n          Organization: Yahoo Assets LLC\n          TYPE: work\n      Address: \n          Region: VA\n          Country: US\n    Event: \n      Action: last update\n      Date: 2021-10-19T23:52:48Z\n    Remark: \n      Title: REDACTED FOR PRIVACY\n      Type: Object truncated due to authorization\n        Description: Some of the data in this object has been removed.\n  Entity: \n    Role: \n      TECHNICAL\n    VCard: \n      Address: \n          Region: VA\n          Country: US\n    Event: \n      Action: last update\n      Date: 2021-10-19T23:52:48Z\n    Remark: \n      Title: REDACTED FOR PRIVACY\n      Type: Object truncated due to authorization\n        Description: Some of the data in this object has been removed.\n  Entity: \n    Handle: 292\n    Role: \n      REGISTRAR\n    VCard: \n          Organization: MarkMonitor Inc.\n          TYPE: work\n      Address: \n          Street: 3540 E Longwing Ln\n          Locale: Meridian\n          Region: ID\n          Postal Code: 83646\n          Country: US\n    Event: \n      Action: registrar expiration\n      Date: 2020-09-14T04:00:00Z\n    Entity: \n      Role: \n        ABUSE\n      VCard: \n        Email: abusecomplaints@markmonitor.com\n            TYPE: work\n        Telephone: +1.2086851750\n            TYPE: voice\n  Link: \n    Rel: self\n    Value: https://rdap.markmonitor.com/rdap/domain/yahoo.com\n    Type: application/rdap+json\n    Href: https://rdap.markmonitor.com/rdap/domain/yahoo.com\n  Notice: \n    Title: Terms of Use\n    Description: \n      By submitting an RDAP query, you agree that you will use this data only for\n      lawful purposes and that, under no circumstances will you use this data to:\n      (1) allow, enable, or otherwise support the transmission by email, telephone,\n      or facsimile of mass, unsolicited, commercial advertising, or spam; or\n      (2) enable high volume, automated, or electronic processes that send queries,\n      data, or email to MarkMonitor (or its systems) or the domain name contacts (or\n      its systems).\n      MarkMonitor reserves the right to modify these terms at any time.\n      By submitting this query, you agree to abide by this policy.\n      MarkMonitor Domain Management(TM)\n      Protecting companies and consumers in a digital world.\n      Visit MarkMonitor at https://www.markmonitor.com\n      Contact us at +1.8007459229\n      In Europe, at +44.02032062220\n      Link: \n        Rel: related\n        Value: https://www.markmonitor.com/legal/domain-management-terms-and-conditions\n        Type: text/html\n        Href: https://www.markmonitor.com/legal/domain-management-terms-and-conditions\n  Notice: \n    Title: Status Codes\n      Description: For more information on domain status codes, please visit https://icann.org/epp.\n      Link: \n        Rel: related\n        Value: https://icann.org/epp\n        Type: text/html\n        Href: https://icann.org/epp\n  Notice: \n    Title: RDDS Inaccuracy Complaint Form\n      Description: URL of the ICANN RDDS Inaccuracy Complaint Form: https://www.icann.org/wicf.\n      Link: \n        Rel: related\n        Value: https://www.icann.org/wicf\n        Type: text/html\n        Href: https://www.icann.org/wicf\n  RDAP Conformance: \n    rdap_level_0\n    icann_rdap_technical_implementation_guide_0\n    icann_rdap_response_profile_0\n\n\n  Registry: \n    Handle: 3643624_DOMAIN_COM-VRSN\n    LDH Name: YAHOO.COM\n    Nameserver: \n      LDH Name: NS1.YAHOO.COM\n    Nameserver: \n      LDH Name: NS2.YAHOO.COM\n    Nameserver: \n      LDH Name: NS3.YAHOO.COM\n    Nameserver: \n      LDH Name: NS4.YAHOO.COM\n    Nameserver: \n      LDH Name: NS5.YAHOO.COM\n    SecureDNS: \n      Delegation Signed: false\n    Event: \n      Action: registration\n      Date: 1995-01-18T05:00:00Z\n    Event: \n      Action: expiration\n      Date: 2023-01-19T05:00:00Z\n    Event: \n      Action: last changed\n      Date: 2022-03-09T21:10:09Z\n    Event: \n      Action: last update of RDAP database\n      Date: 2022-05-18T23:09:14Z\n    Status: \n      client delete prohibited\n      client transfer prohibited\n      client update prohibited\n      server delete prohibited\n      server transfer prohibited\n      server update prohibited\n    Entity: \n      Handle: 292\n      Role: \n        REGISTRAR\n      VCard: \n        Formatted Name: MarkMonitor Inc.\n      Entity: \n        Role: \n          ABUSE\n        VCard: \n          Formatted Name: \n              TYPE: voice\n          Email: abusecomplaints@markmonitor.com\n    Link: \n      Rel: self\n      Value: https://rdap.verisign.com/com/v1/domain/YAHOO.COM\n      Type: application/rdap+json\n      Href: https://rdap.verisign.com/com/v1/domain/YAHOO.COM\n    Link: \n      Rel: related\n      Value: https://rdap.markmonitor.com/rdap/domain/YAHOO.COM\n      Type: application/rdap+json\n      Href: https://rdap.markmonitor.com/rdap/domain/YAHOO.COM\n    Notice: \n      Title: Terms of Use\n        Description: Service subject to Terms of Use.\n        Link: \n          Type: text/html\n          Href: https://www.verisign.com/domain-names/registration-data-access-protocol/terms-service/index.xhtml\n    Notice: \n      Title: Status Codes\n        Description: For more information on domain status codes, please visit https://icann.org/epp\n        Link: \n          Type: text/html\n          Href: https://icann.org/epp\n    Notice: \n      Title: RDDS Inaccuracy Complaint Form\n        Description: URL of the ICANN RDDS Inaccuracy Complaint Form: https://icann.org/wicf\n        Link: \n          Type: text/html\n          Href: https://icann.org/wicf\n    RDAP Conformance: \n      rdap_level_0\n      icann_rdap_technical_implementation_guide_0\n      icann_rdap_response_profile_0\n", "whoisRawID": 0, "source": "WHOIS_RDAP", "match_whitelist": {"domain": true}}, "registrarUpdatedAt": 1646841105, "whoisID": 6932769212394200506, "registrarIanaID": 292, "registrarName": "MarkMonitor Inc.", "admin": {"country": "US", "address": "VA\nUS\n", "whoisContactID": 0, "state": "VA", "id": 0}, "whoisServer": "rdap.markmonitor.com", "createdAt": 1652900984, "expired": false, "contactOrganizations": ["Yahoo Assets LLC", "MarkMonitor Inc."], "registrarParseCode": 44323, "auditUpdatedAt": 1657546488, "id": 6932769212394200506, "registrarPhone": "+1.2086851750", "updatedAt": 1657546488, "domainUnicode": "yahoo.com", "auditCreatedAt": 1652900984, "registrarExpiresAt": 1674104400, "contactCountries": ["US"], "compositeParseCode": 44323, "contactEmails": ["abusecomplaints@markmonitor.com"], "registrarEmail": "abusecomplaints@markmonitor.com", "domainStatus": "client update prohibited,client transfer prohibited,client delete prohibited,server update prohibited,server transfer prohibited,server delete prohibited", "tld": "com", "domainAvailable": false, "registrarCreatedAt": 790416000, "noRecord": false, "nameservers": ["ns1.yahoo.com", "ns2.yahoo.com", "ns3.yahoo.com", "ns4.yahoo.com", "ns5.yahoo.com"], "domain": "yahoo.com", "registrant": {"country": "US", "address": "VA\nUS\n", "whoisContactID": 0, "organization": "Yahoo Assets LLC", "state": "VA", "id": 0}, "contactNames": [], "contacts": [{"country": "US", "address": "VA\nUS\n", "whoisContactID": 0, "organization": "Yahoo Assets LLC", "state": "VA", "id": 0}, {"country": "US", "address": "VA\nUS\n", "whoisContactID": 0, "state": "VA", "id": 0}, {"zip": "83646", "country": "US", "address": "3540 E Longwing Ln\nMeridian\n83646\nID\nUS\n", "city": "Meridian", "whoisContactID": 0, "street": "3540 E Longwing Ln", "organization": "MarkMonitor Inc.", "state": "ID", "id": 0}, {"address": "", "phone": "+1.2086851750", "whoisContactID": 0, "id": 0, "email": "abusecomplaints@markmonitor.com"}], "status": "ACTIVE", "domainMd5": "50cd1a9a183758039b0841aa738c3f0b", "task_id": "68fc716a61a54e7997aeb1dc964eb2a4", "match_whitelist": {"domain": true}}, {"abuse": {"address": "", "phone": "+1.2083895770", "whoisContactID": 0, "id": 0, "email": "abusecomplaints@markmonitor.com"}, "technical": {"country": "US", "address": "VA\nUS\n", "whoisContactID": 0, "state": "VA", "id": 0}, "registrar": {"zip": "83646", "country": "US", "address": "3540 E Longwing Ln\nMeridian\n83646\nID\nUS\n", "city": "Meridian", "whoisContactID": 0, "street": "3540 E Longwing Ln", "organization": "MarkMonitor Inc.", "state": "ID", "id": 0}, "rawResponse": {"domain": "yahoo.com", "whoisID": 6917176221516824590, "unparsed": "{\"rdapConformance\":[\"rdap_level_0\",\"icann_rdap_technical_implementation_guide_0\",\"icann_rdap_response_profile_0\"],\"objectClassName\":\"domain\",\"handle\":\"3643624_DOMAIN_COM-VRSN\",\"port43\":null,\"lang\":null,\"events\":[{\"eventAction\":\"registration\",\"eventDate\":\"1995-01-18T05:00:00Z\",\"eventActor\":null,\"status\":[]},{\"eventAction\":\"expiration\",\"eventDate\":\"2023-01-19T05:00:00Z\",\"eventActor\":null,\"status\":[]},{\"eventAction\":\"last changed\",\"eventDate\":\"2022-03-09T21:10:09Z\",\"eventActor\":null,\"status\":[]},{\"eventAction\":\"last update of RDAP database\",\"eventDate\":\"2022-04-05T22:28:18Z\",\"eventActor\":null,\"status\":[]}],\"notices\":[{\"title\":\"Terms of Use\",\"type\":null,\"description\":[\"Service subject to Terms of Use.\"],\"links\":[{\"value\":null,\"rel\":null,\"href\":\"https://www.verisign.com/domain-names/registration-data-access-protocol/terms-service/index.xhtml\",\"hreflang\":null,\"title\":null,\"media\":null,\"type\":\"text/html\"}]},{\"title\":\"Status Codes\",\"type\":null,\"description\":[\"For more information on domain status codes, please visit https://icann.org/epp\"],\"links\":[{\"value\":null,\"rel\":null,\"href\":\"https://icann.org/epp\",\"hreflang\":null,\"title\":null,\"media\":null,\"type\":\"text/html\"}]},{\"title\":\"RDDS Inaccuracy Complaint Form\",\"type\":null,\"description\":[\"URL of the ICANN RDDS Inaccuracy Complaint Form: https://icann.org/wicf\"],\"links\":[{\"value\":null,\"rel\":null,\"href\":\"https://icann.org/wicf\",\"hreflang\":null,\"title\":null,\"media\":null,\"type\":\"text/html\"}]}],\"status\":[\"client delete prohibited\",\"client transfer prohibited\",\"client update prohibited\",\"server delete prohibited\",\"server transfer prohibited\",\"server update prohibited\"],\"entities\":[{\"rdapConformance\":[],\"objectClassName\":\"entity\",\"handle\":\"292\",\"port43\":null,\"lang\":null,\"events\":[],\"notices\":[],\"status\":[],\"entities\":[{\"rdapConformance\":[],\"objectClassName\":\"entity\",\"handle\":null,\"port43\":null,\"lang\":null,\"events\":[],\"notices\":[],\"status\":[],\"entities\":[],\"remarks\":[],\"links\":[],\"nameservers\":[],\"entity\":null,\"legalRepresentative\":null,\"errorCode\":null,\"errorTitle\":null,\"errorDescription\":[],\"vcardArray\":[\"vcard\",[[\"version\",{},\"text\",\"4.0\"],[\"fn\",{},\"text\",\"\"],[\"tel\",{\"type\":\"voice\"},\"uri\",\"tel:+1.2083895740\"],[\"email\",{},\"text\",\"abusecomplaints@markmonitor.com\"]]],\"roles\":[\"abuse\"],\"publicIds\":[],\"networks\":null,\"autnums\":null,\"nicbr_domainCount\":0,\"nicbr_inetCount\":0,\"nicbr_autnumCount\":0,\"url\":null,\"contact_URI\":null}],\"remarks\":[],\"links\":[],\"nameservers\":[],\"entity\":null,\"legalRepresentative\":null,\"errorCode\":null,\"errorTitle\":null,\"errorDescription\":[],\"vcardArray\":[\"vcard\",[[\"version\",{},\"text\",\"4.0\"],[\"fn\",{},\"text\",\"MarkMonitor Inc.\"]]],\"roles\":[\"registrar\"],\"publicIds\":[{\"type\":\"IANA Registrar ID\",\"identifier\":\"292\"}],\"networks\":null,\"autnums\":null,\"nicbr_domainCount\":0,\"nicbr_inetCount\":0,\"nicbr_autnumCount\":0,\"url\":null,\"contact_URI\":null}],\"remarks\":[],\"links\":[{\"value\":\"https://rdap.verisign.com/com/v1/domain/YAHOO.COM\",\"rel\":\"self\",\"href\":\"https://rdap.verisign.com/com/v1/domain/YAHOO.COM\",\"hreflang\":null,\"title\":null,\"media\":null,\"type\":\"application/rdap+json\"},{\"value\":\"https://rdap.markmonitor.com/rdap/domain/YAHOO.COM\",\"rel\":\"related\",\"href\":\"https://rdap.markmonitor.com/rdap/domain/YAHOO.COM\",\"hreflang\":null,\"title\":null,\"media\":null,\"type\":\"application/rdap+json\"}],\"nameservers\":[{\"rdapConformance\":[],\"objectClassName\":\"nameserver\",\"handle\":null,\"port43\":null,\"lang\":null,\"events\":[],\"notices\":[],\"status\":[],\"entities\":[],\"remarks\":[],\"links\":[],\"nameservers\":[],\"entity\":null,\"legalRepresentative\":null,\"errorCode\":null,\"errorTitle\":null,\"errorDescription\":[],\"ldhName\":\"NS1.YAHOO.COM\",\"unicodeName\":null,\"variants\":[],\"secureDNS\":null,\"publicIds\":[],\"network\":null,\"nicbr_arbitration\":false,\"delegate\":null,\"ipAddresses\":null,\"switch_name\":null,\"switch_aceString\":null},{\"rdapConformance\":[],\"objectClassName\":\"nameserver\",\"handle\":null,\"port43\":null,\"lang\":null,\"events\":[],\"notices\":[],\"status\":[],\"entities\":[],\"remarks\":[],\"links\":[],\"nameservers\":[],\"entity\":null,\"legalRepresentative\":null,\"errorCode\":null,\"errorTitle\":null,\"errorDescription\":[],\"ldhName\":\"NS2.YAHOO.COM\",\"unicodeName\":null,\"variants\":[],\"secureDNS\":null,\"publicIds\":[],\"network\":null,\"nicbr_arbitration\":false,\"delegate\":null,\"ipAddresses\":null,\"switch_name\":null,\"switch_aceString\":null},{\"rdapConformance\":[],\"objectClassName\":\"nameserver\",\"handle\":null,\"port43\":null,\"lang\":null,\"events\":[],\"notices\":[],\"status\":[],\"entities\":[],\"remarks\":[],\"links\":[],\"nameservers\":[],\"entity\":null,\"legalRepresentative\":null,\"errorCode\":null,\"errorTitle\":null,\"errorDescription\":[],\"ldhName\":\"NS3.YAHOO.COM\",\"unicodeName\":null,\"variants\":[],\"secureDNS\":null,\"publicIds\":[],\"network\":null,\"nicbr_arbitration\":false,\"delegate\":null,\"ipAddresses\":null,\"switch_name\":null,\"switch_aceString\":null},{\"rdapConformance\":[],\"objectClassName\":\"nameserver\",\"handle\":null,\"port43\":null,\"lang\":null,\"events\":[],\"notices\":[],\"status\":[],\"entities\":[],\"remarks\":[],\"links\":[],\"nameservers\":[],\"entity\":null,\"legalRepresentative\":null,\"errorCode\":null,\"errorTitle\":null,\"errorDescription\":[],\"ldhName\":\"NS4.YAHOO.COM\",\"unicodeName\":null,\"variants\":[],\"secureDNS\":null,\"publicIds\":[],\"network\":null,\"nicbr_arbitration\":false,\"delegate\":null,\"ipAddresses\":null,\"switch_name\":null,\"switch_aceString\":null},{\"rdapConformance\":[],\"objectClassName\":\"nameserver\",\"handle\":null,\"port43\":null,\"lang\":null,\"events\":[],\"notices\":[],\"status\":[],\"entities\":[],\"remarks\":[],\"links\":[],\"nameservers\":[],\"entity\":null,\"legalRepresentative\":null,\"errorCode\":null,\"errorTitle\":null,\"errorDescription\":[],\"ldhName\":\"NS5.YAHOO.COM\",\"unicodeName\":null,\"variants\":[],\"secureDNS\":null,\"publicIds\":[],\"network\":null,\"nicbr_arbitration\":false,\"delegate\":null,\"ipAddresses\":null,\"switch_name\":null,\"switch_aceString\":null}],\"entity\":null,\"legalRepresentative\":null,\"errorCode\":null,\"errorTitle\":null,\"errorDescription\":[],\"ldhName\":\"YAHOO.COM\",\"unicodeName\":null,\"variants\":[],\"secureDNS\":{\"zoneSigned\":null,\"delegationSigned\":false,\"maxSigLife\":null,\"dsData\":[],\"keyData\":[]},\"publicIds\":[],\"network\":null,\"nicbr_arbitration\":false,\"delegate\":{\"rdapConformance\":[\"rdap_level_0\",\"icann_rdap_technical_implementation_guide_0\",\"icann_rdap_response_profile_0\"],\"objectClassName\":\"domain\",\"handle\":\"3643624_DOMAIN_COM-VRSN\",\"port43\":\"whois.markmonitor.com\",\"lang\":null,\"events\":[{\"eventAction\":\"expiration\",\"eventDate\":\"2023-01-19T05:00:00Z\",\"eventActor\":null,\"status\":[]},{\"eventAction\":\"registration\",\"eventDate\":\"1995-01-18T08:00:00Z\",\"eventActor\":null,\"status\":[]},{\"eventAction\":\"last update\",\"eventDate\":\"2022-03-09T15:51:45Z\",\"eventActor\":null,\"status\":[]},{\"eventAction\":\"last update of RDAP database\",\"eventDate\":\"2022-04-05T18:28:44Z\",\"eventActor\":null,\"status\":[]}],\"notices\":[{\"title\":\"Terms of Use\",\"type\":null,\"description\":[\"By submitting an RDAP query, you agree that you will use this data only for\",\"lawful purposes and that, under no circumstances will you use this data to:\",\"(1) allow, enable, or otherwise support the transmission by email, telephone,\",\"or facsimile of mass, unsolicited, commercial advertising, or spam; or\",\"(2) enable high volume, automated, or electronic processes that send queries,\",\"data, or email to MarkMonitor (or its systems) or the domain name contacts (or\",\"its systems).\",\"MarkMonitor reserves the right to modify these terms at any time.\",\"By submitting this query, you agree to abide by this policy.\",\"MarkMonitor Domain Management(TM)\",\"Protecting companies and consumers in a digital world.\",\"Visit MarkMonitor at https://www.markmonitor.com\",\"Contact us at +1.8007459229\",\"In Europe, at +44.02032062220\"],\"links\":[{\"value\":\"https://www.markmonitor.com/legal/domain-management-terms-and-conditions\",\"rel\":\"related\",\"href\":\"https://www.markmonitor.com/legal/domain-management-terms-and-conditions\",\"hreflang\":null,\"title\":null,\"media\":null,\"type\":\"text/html\"}]},{\"title\":\"Status Codes\",\"type\":null,\"description\":[\"For more information on domain status codes, please visit https://icann.org/epp.\"],\"links\":[{\"value\":\"https://icann.org/epp\",\"rel\":\"related\",\"href\":\"https://icann.org/epp\",\"hreflang\":null,\"title\":null,\"media\":null,\"type\":\"text/html\"}]},{\"title\":\"RDDS Inaccuracy Complaint Form\",\"type\":null,\"description\":[\"URL of the ICANN RDDS Inaccuracy Complaint Form: https://www.icann.org/wicf.\"],\"links\":[{\"value\":\"https://www.icann.org/wicf\",\"rel\":\"related\",\"href\":\"https://www.icann.org/wicf\",\"hreflang\":null,\"title\":null,\"media\":null,\"type\":\"text/html\"}]}],\"status\":[\"client update prohibited\",\"client transfer prohibited\",\"client delete prohibited\",\"server update prohibited\",\"server transfer prohibited\",\"server delete prohibited\"],\"entities\":[{\"rdapConformance\":[],\"objectClassName\":\"entity\",\"handle\":null,\"port43\":null,\"lang\":null,\"events\":[{\"eventAction\":\"last update\",\"eventDate\":\"2021-10-19T23:52:48Z\",\"eventActor\":null,\"status\":[]}],\"notices\":[],\"status\":[],\"entities\":[],\"remarks\":[{\"title\":\"REDACTED FOR PRIVACY\",\"description\":[\"Some of the data in this object has been removed.\"],\"type\":\"Object truncated due to authorization\",\"links\":null}],\"links\":[],\"nameservers\":[],\"entity\":null,\"legalRepresentative\":null,\"errorCode\":null,\"errorTitle\":null,\"errorDescription\":[],\"vcardArray\":[\"vcard\",[[\"version\",{},\"text\",\"4.0\"],[\"adr\",{},\"text\",[\"\",\"\",\"\",\"\",\"VA\",\"\",\"US\"]]]],\"roles\":[\"admin\"],\"publicIds\":[],\"networks\":null,\"autnums\":null,\"nicbr_domainCount\":0,\"nicbr_inetCount\":0,\"nicbr_autnumCount\":0,\"url\":null,\"contact_URI\":\"https://domains.markmonitor.com/whois/\"},{\"rdapConformance\":[],\"objectClassName\":\"entity\",\"handle\":null,\"port43\":null,\"lang\":null,\"events\":[{\"eventAction\":\"last update\",\"eventDate\":\"2021-10-19T23:52:48Z\",\"eventActor\":null,\"status\":[]}],\"notices\":[],\"status\":[],\"entities\":[],\"remarks\":[{\"title\":\"REDACTED FOR PRIVACY\",\"description\":[\"Some of the data in this object has been removed.\"],\"type\":\"Object truncated due to authorization\",\"links\":null}],\"links\":[],\"nameservers\":[],\"entity\":null,\"legalRepresentative\":null,\"errorCode\":null,\"errorTitle\":null,\"errorDescription\":[],\"vcardArray\":[\"vcard\",[[\"version\",{},\"text\",\"4.0\"],[\"org\",{\"type\":\"work\"},\"text\",\"Yahoo Assets LLC\"],[\"adr\",{},\"text\",[\"\",\"\",\"\",\"\",\"VA\",\"\",\"US\"]]]],\"roles\":[\"registrant\"],\"publicIds\":[],\"networks\":null,\"autnums\":null,\"nicbr_domainCount\":0,\"nicbr_inetCount\":0,\"nicbr_autnumCount\":0,\"url\":null,\"contact_URI\":\"https://domains.markmonitor.com/whois/\"},{\"rdapConformance\":[],\"objectClassName\":\"entity\",\"handle\":null,\"port43\":null,\"lang\":null,\"events\":[{\"eventAction\":\"last update\",\"eventDate\":\"2021-10-19T23:52:48Z\",\"eventActor\":null,\"status\":[]}],\"notices\":[],\"status\":[],\"entities\":[],\"remarks\":[{\"title\":\"REDACTED FOR PRIVACY\",\"description\":[\"Some of the data in this object has been removed.\"],\"type\":\"Object truncated due to authorization\",\"links\":null}],\"links\":[],\"nameservers\":[],\"entity\":null,\"legalRepresentative\":null,\"errorCode\":null,\"errorTitle\":null,\"errorDescription\":[],\"vcardArray\":[\"vcard\",[[\"version\",{},\"text\",\"4.0\"],[\"adr\",{},\"text\",[\"\",\"\",\"\",\"\",\"VA\",\"\",\"US\"]]]],\"roles\":[\"technical\"],\"publicIds\":[],\"networks\":null,\"autnums\":null,\"nicbr_domainCount\":0,\"nicbr_inetCount\":0,\"nicbr_autnumCount\":0,\"url\":null,\"contact_URI\":\"https://domains.markmonitor.com/whois/\"},{\"rdapConformance\":[],\"objectClassName\":\"entity\",\"handle\":\"292\",\"port43\":null,\"lang\":null,\"events\":[{\"eventAction\":\"registrar expiration\",\"eventDate\":\"2020-09-14T04:00:00Z\",\"eventActor\":null,\"status\":[]}],\"notices\":[],\"status\":[],\"entities\":[{\"rdapConformance\":[],\"objectClassName\":\"entity\",\"handle\":null,\"port43\":null,\"lang\":null,\"events\":[],\"notices\":[],\"status\":[],\"entities\":[],\"remarks\":[],\"links\":[],\"nameservers\":[],\"entity\":null,\"legalRepresentative\":null,\"errorCode\":null,\"errorTitle\":null,\"errorDescription\":[],\"vcardArray\":[\"vcard\",[[\"version\",{},\"text\",\"4.0\"],[\"email\",{\"type\":\"work\"},\"text\",\"abusecomplaints@markmonitor.com\"],[\"tel\",{\"type\":\"voice\"},\"text\",\"+1.2083895770\"]]],\"roles\":[\"abuse\"],\"publicIds\":[],\"networks\":null,\"autnums\":null,\"nicbr_domainCount\":0,\"nicbr_inetCount\":0,\"nicbr_autnumCount\":0,\"url\":null,\"contact_URI\":null}],\"remarks\":[],\"links\":[],\"nameservers\":[],\"entity\":null,\"legalRepresentative\":null,\"errorCode\":null,\"errorTitle\":null,\"errorDescription\":[],\"vcardArray\":[\"vcard\",[[\"version\",{},\"text\",\"4.0\"],[\"org\",{\"type\":\"work\"},\"text\",\"MarkMonitor Inc.\"],[\"adr\",{},\"text\",[\"\",\"\",\"3540 E Longwing Ln\",\"Meridian\",\"ID\",\"83646\",\"US\"]]]],\"roles\":[\"registrar\"],\"publicIds\":[{\"type\":\"IANA Registrar ID\",\"identifier\":\"292\"}],\"networks\":null,\"autnums\":null,\"nicbr_domainCount\":0,\"nicbr_inetCount\":0,\"nicbr_autnumCount\":0,\"url\":null,\"contact_URI\":null}],\"remarks\":[],\"links\":[{\"value\":\"https://rdap.markmonitor.com/rdap/domain/yahoo.com\",\"rel\":\"self\",\"href\":\"https://rdap.markmonitor.com/rdap/domain/yahoo.com\",\"hreflang\":null,\"title\":null,\"media\":null,\"type\":\"application/rdap+json\"}],\"nameservers\":[{\"rdapConformance\":[],\"objectClassName\":\"nameserver\",\"handle\":null,\"port43\":null,\"lang\":null,\"events\":[{\"eventAction\":\"last changed\",\"eventDate\":\"2013-07-11T16:30:20Z\",\"eventActor\":null,\"status\":[]}],\"notices\":[],\"status\":[\"active\"],\"entities\":[],\"remarks\":[],\"links\":[],\"nameservers\":[],\"entity\":null,\"legalRepresentative\":null,\"errorCode\":null,\"errorTitle\":null,\"errorDescription\":[],\"ldhName\":\"ns1.yahoo.com\",\"unicodeName\":null,\"variants\":[],\"secureDNS\":null,\"publicIds\":[],\"network\":null,\"nicbr_arbitration\":false,\"delegate\":null,\"ipAddresses\":null,\"switch_name\":null,\"switch_aceString\":null},{\"rdapConformance\":[],\"objectClassName\":\"nameserver\",\"handle\":null,\"port43\":null,\"lang\":null,\"events\":[{\"eventAction\":\"last changed\",\"eventDate\":\"2013-07-11T16:30:20Z\",\"eventActor\":null,\"status\":[]}],\"notices\":[],\"status\":[\"active\"],\"entities\":[],\"remarks\":[],\"links\":[],\"nameservers\":[],\"entity\":null,\"legalRepresentative\":null,\"errorCode\":null,\"errorTitle\":null,\"errorDescription\":[],\"ldhName\":\"ns2.yahoo.com\",\"unicodeName\":null,\"variants\":[],\"secureDNS\":null,\"publicIds\":[],\"network\":null,\"nicbr_arbitration\":false,\"delegate\":null,\"ipAddresses\":null,\"switch_name\":null,\"switch_aceString\":null},{\"rdapConformance\":[],\"objectClassName\":\"nameserver\",\"handle\":null,\"port43\":null,\"lang\":null,\"events\":[{\"eventAction\":\"last changed\",\"eventDate\":\"2013-07-11T16:30:20Z\",\"eventActor\":null,\"status\":[]}],\"notices\":[],\"status\":[\"active\"],\"entities\":[],\"remarks\":[],\"links\":[],\"nameservers\":[],\"entity\":null,\"legalRepresentative\":null,\"errorCode\":null,\"errorTitle\":null,\"errorDescription\":[],\"ldhName\":\"ns3.yahoo.com\",\"unicodeName\":null,\"variants\":[],\"secureDNS\":null,\"publicIds\":[],\"network\":null,\"nicbr_arbitration\":false,\"delegate\":null,\"ipAddresses\":null,\"switch_name\":null,\"switch_aceString\":null},{\"rdapConformance\":[],\"objectClassName\":\"nameserver\",\"handle\":null,\"port43\":null,\"lang\":null,\"events\":[{\"eventAction\":\"last changed\",\"eventDate\":\"2013-07-11T16:30:20Z\",\"eventActor\":null,\"status\":[]}],\"notices\":[],\"status\":[\"active\"],\"entities\":[],\"remarks\":[],\"links\":[],\"nameservers\":[],\"entity\":null,\"legalRepresentative\":null,\"errorCode\":null,\"errorTitle\":null,\"errorDescription\":[],\"ldhName\":\"ns4.yahoo.com\",\"unicodeName\":null,\"variants\":[],\"secureDNS\":null,\"publicIds\":[],\"network\":null,\"nicbr_arbitration\":false,\"delegate\":null,\"ipAddresses\":null,\"switch_name\":null,\"switch_aceString\":null},{\"rdapConformance\":[],\"objectClassName\":\"nameserver\",\"handle\":null,\"port43\":null,\"lang\":null,\"events\":[{\"eventAction\":\"last changed\",\"eventDate\":\"2013-07-11T16:30:20Z\",\"eventActor\":null,\"status\":[]}],\"notices\":[],\"status\":[\"active\"],\"entities\":[],\"remarks\":[],\"links\":[],\"nameservers\":[],\"entity\":null,\"legalRepresentative\":null,\"errorCode\":null,\"errorTitle\":null,\"errorDescription\":[],\"ldhName\":\"ns5.yahoo.com\",\"unicodeName\":null,\"variants\":[],\"secureDNS\":null,\"publicIds\":[],\"network\":null,\"nicbr_arbitration\":false,\"delegate\":null,\"ipAddresses\":null,\"switch_name\":null,\"switch_aceString\":null}],\"entity\":null,\"legalRepresentative\":null,\"errorCode\":null,\"errorTitle\":null,\"errorDescription\":[],\"ldhName\":\"yahoo.com\",\"unicodeName\":null,\"variants\":[],\"secureDNS\":{\"zoneSigned\":null,\"delegationSigned\":false,\"maxSigLife\":null,\"dsData\":[],\"keyData\":[]},\"publicIds\":[],\"network\":null,\"nicbr_arbitration\":false,\"delegate\":null,\"switch_name\":null,\"switch_aceString\":null},\"switch_name\":null,\"switch_aceString\":null}", "raw": "Registrar: \n  Handle: 3643624_DOMAIN_COM-VRSN\n  LDH Name: yahoo.com\n  Nameserver: \n    LDH Name: ns1.yahoo.com\n    Event: \n      Action: last changed\n      Date: 2013-07-11T16:30:20Z\n      Status: active\n  Nameserver: \n    LDH Name: ns2.yahoo.com\n    Event: \n      Action: last changed\n      Date: 2013-07-11T16:30:20Z\n      Status: active\n  Nameserver: \n    LDH Name: ns3.yahoo.com\n    Event: \n      Action: last changed\n      Date: 2013-07-11T16:30:20Z\n      Status: active\n  Nameserver: \n    LDH Name: ns4.yahoo.com\n    Event: \n      Action: last changed\n      Date: 2013-07-11T16:30:20Z\n      Status: active\n  Nameserver: \n    LDH Name: ns5.yahoo.com\n    Event: \n      Action: last changed\n      Date: 2013-07-11T16:30:20Z\n      Status: active\n  SecureDNS: \n    Delegation Signed: false\n  Event: \n    Action: expiration\n    Date: 2023-01-19T05:00:00Z\n  Event: \n    Action: registration\n    Date: 1995-01-18T08:00:00Z\n  Event: \n    Action: last update\n    Date: 2022-03-09T15:51:45Z\n  Event: \n    Action: last update of RDAP database\n    Date: 2022-04-05T18:28:44Z\n  Status: \n    client update prohibited\n    client transfer prohibited\n    client delete prohibited\n    server update prohibited\n    server transfer prohibited\n    server delete prohibited\n  Entity: \n    Role: \n      ADMIN\n    VCard: \n      Address: \n          Region: VA\n          Country: US\n    Event: \n      Action: last update\n      Date: 2021-10-19T23:52:48Z\n    Remark: \n      Title: REDACTED FOR PRIVACY\n      Type: Object truncated due to authorization\n        Description: Some of the data in this object has been removed.\n  Entity: \n    Role: \n      REGISTRANT\n    VCard: \n          Organization: Yahoo Assets LLC\n          TYPE: work\n      Address: \n          Region: VA\n          Country: US\n    Event: \n      Action: last update\n      Date: 2021-10-19T23:52:48Z\n    Remark: \n      Title: REDACTED FOR PRIVACY\n      Type: Object truncated due to authorization\n        Description: Some of the data in this object has been removed.\n  Entity: \n    Role: \n      TECHNICAL\n    VCard: \n      Address: \n          Region: VA\n          Country: US\n    Event: \n      Action: last update\n      Date: 2021-10-19T23:52:48Z\n    Remark: \n      Title: REDACTED FOR PRIVACY\n      Type: Object truncated due to authorization\n        Description: Some of the data in this object has been removed.\n  Entity: \n    Handle: 292\n    Role: \n      REGISTRAR\n    VCard: \n          Organization: MarkMonitor Inc.\n          TYPE: work\n      Address: \n          Street: 3540 E Longwing Ln\n          Locale: Meridian\n          Region: ID\n          Postal Code: 83646\n          Country: US\n    Event: \n      Action: registrar expiration\n      Date: 2020-09-14T04:00:00Z\n    Entity: \n      Role: \n        ABUSE\n      VCard: \n        Email: abusecomplaints@markmonitor.com\n            TYPE: work\n        Telephone: +1.2083895770\n            TYPE: voice\n  Link: \n    Rel: self\n    Value: https://rdap.markmonitor.com/rdap/domain/yahoo.com\n    Type: application/rdap+json\n    Href: https://rdap.markmonitor.com/rdap/domain/yahoo.com\n  Notice: \n    Title: Terms of Use\n    Description: \n      By submitting an RDAP query, you agree that you will use this data only for\n      lawful purposes and that, under no circumstances will you use this data to:\n      (1) allow, enable, or otherwise support the transmission by email, telephone,\n      or facsimile of mass, unsolicited, commercial advertising, or spam; or\n      (2) enable high volume, automated, or electronic processes that send queries,\n      data, or email to MarkMonitor (or its systems) or the domain name contacts (or\n      its systems).\n      MarkMonitor reserves the right to modify these terms at any time.\n      By submitting this query, you agree to abide by this policy.\n      MarkMonitor Domain Management(TM)\n      Protecting companies and consumers in a digital world.\n      Visit MarkMonitor at https://www.markmonitor.com\n      Contact us at +1.8007459229\n      In Europe, at +44.02032062220\n      Link: \n        Rel: related\n        Value: https://www.markmonitor.com/legal/domain-management-terms-and-conditions\n        Type: text/html\n        Href: https://www.markmonitor.com/legal/domain-management-terms-and-conditions\n  Notice: \n    Title: Status Codes\n      Description: For more information on domain status codes, please visit https://icann.org/epp.\n      Link: \n        Rel: related\n        Value: https://icann.org/epp\n        Type: text/html\n        Href: https://icann.org/epp\n  Notice: \n    Title: RDDS Inaccuracy Complaint Form\n      Description: URL of the ICANN RDDS Inaccuracy Complaint Form: https://www.icann.org/wicf.\n      Link: \n        Rel: related\n        Value: https://www.icann.org/wicf\n        Type: text/html\n        Href: https://www.icann.org/wicf\n  RDAP Conformance: \n    rdap_level_0\n    icann_rdap_technical_implementation_guide_0\n    icann_rdap_response_profile_0\n\n\n  Registry: \n    Handle: 3643624_DOMAIN_COM-VRSN\n    LDH Name: YAHOO.COM\n    Nameserver: \n      LDH Name: NS1.YAHOO.COM\n    Nameserver: \n      LDH Name: NS2.YAHOO.COM\n    Nameserver: \n      LDH Name: NS3.YAHOO.COM\n    Nameserver: \n      LDH Name: NS4.YAHOO.COM\n    Nameserver: \n      LDH Name: NS5.YAHOO.COM\n    SecureDNS: \n      Delegation Signed: false\n    Event: \n      Action: registration\n      Date: 1995-01-18T05:00:00Z\n    Event: \n      Action: expiration\n      Date: 2023-01-19T05:00:00Z\n    Event: \n      Action: last changed\n      Date: 2022-03-09T21:10:09Z\n    Event: \n      Action: last update of RDAP database\n      Date: 2022-04-05T22:28:18Z\n    Status: \n      client delete prohibited\n      client transfer prohibited\n      client update prohibited\n      server delete prohibited\n      server transfer prohibited\n      server update prohibited\n    Entity: \n      Handle: 292\n      Role: \n        REGISTRAR\n      VCard: \n        Formatted Name: MarkMonitor Inc.\n      Entity: \n        Role: \n          ABUSE\n        VCard: \n          Formatted Name: \n              TYPE: voice\n          Email: abusecomplaints@markmonitor.com\n    Link: \n      Rel: self\n      Value: https://rdap.verisign.com/com/v1/domain/YAHOO.COM\n      Type: application/rdap+json\n      Href: https://rdap.verisign.com/com/v1/domain/YAHOO.COM\n    Link: \n      Rel: related\n      Value: https://rdap.markmonitor.com/rdap/domain/YAHOO.COM\n      Type: application/rdap+json\n      Href: https://rdap.markmonitor.com/rdap/domain/YAHOO.COM\n    Notice: \n      Title: Terms of Use\n        Description: Service subject to Terms of Use.\n        Link: \n          Type: text/html\n          Href: https://www.verisign.com/domain-names/registration-data-access-protocol/terms-service/index.xhtml\n    Notice: \n      Title: Status Codes\n        Description: For more information on domain status codes, please visit https://icann.org/epp\n        Link: \n          Type: text/html\n          Href: https://icann.org/epp\n    Notice: \n      Title: RDDS Inaccuracy Complaint Form\n        Description: URL of the ICANN RDDS Inaccuracy Complaint Form: https://icann.org/wicf\n        Link: \n          Type: text/html\n          Href: https://icann.org/wicf\n    RDAP Conformance: \n      rdap_level_0\n      icann_rdap_technical_implementation_guide_0\n      icann_rdap_response_profile_0\n", "whoisRawID": 0, "source": "WHOIS_RDAP", "match_whitelist": {"domain": true}}, "registrarUpdatedAt": 1646841105, "whoisID": 6917176221516824590, "registrarIanaID": 292, "registrarName": "MarkMonitor Inc.", "admin": {"country": "US", "address": "VA\nUS\n", "whoisContactID": 0, "state": "VA", "id": 0}, "whoisServer": "rdap.markmonitor.com", "createdAt": 1649183326, "expired": false, "contactOrganizations": ["Yahoo Assets LLC", "MarkMonitor Inc."], "registrarParseCode": 44323, "auditUpdatedAt": 1650284834, "id": 6917176221516824590, "registrarPhone": "+1.2083895740", "updatedAt": 1652900984, "domainUnicode": "yahoo.com", "auditCreatedAt": 1649183326, "registrarExpiresAt": 1674104400, "contactCountries": ["US"], "compositeParseCode": 44323, "contactEmails": ["abusecomplaints@markmonitor.com"], "registrarEmail": "abusecomplaints@markmonitor.com", "domainStatus": "client update prohibited,client transfer prohibited,client delete prohibited,server update prohibited,server transfer prohibited,server delete prohibited", "tld": "com", "domainAvailable": false, "registrarCreatedAt": 790416000, "noRecord": false, "nameservers": ["ns1.yahoo.com", "ns2.yahoo.com", "ns3.yahoo.com", "ns4.yahoo.com", "ns5.yahoo.com"], "domain": "yahoo.com", "registrant": {"country": "US", "address": "VA\nUS\n", "whoisContactID": 0, "organization": "Yahoo Assets LLC", "state": "VA", "id": 0}, "contactNames": [], "contacts": [{"country": "US", "address": "VA\nUS\n", "whoisContactID": 0, "organization": "Yahoo Assets LLC", "state": "VA", "id": 0}, {"country": "US", "address": "VA\nUS\n", "whoisContactID": 0, "state": "VA", "id": 0}, {"zip": "83646", "country": "US", "address": "3540 E Longwing Ln\nMeridian\n83646\nID\nUS\n", "city": "Meridian", "whoisContactID": 0, "street": "3540 E Longwing Ln", "organization": "MarkMonitor Inc.", "state": "ID", "id": 0}, {"address": "", "phone": "+1.2083895770", "whoisContactID": 0, "id": 0, "email": "abusecomplaints@markmonitor.com"}], "status": "INACTIVE", "domainMd5": "50cd1a9a183758039b0841aa738c3f0b", "task_id": "2580d6217fc74e4bbed1050786242465", "match_whitelist": {"domain": true}}, {"abuse": {"address": "", "phone": "+1.2083895770", "whoisContactID": 0, "id": 0, "email": "abusecomplaints@markmonitor.com"}, "technical": {"country": "US", "address": "VA\nUS\n", "whoisContactID": 0, "state": "VA", "id": 0}, "registrar": {"zip": "83646", "country": "US", "address": "3540 E Longwing Ln\nMeridian\n83646\nID\nUS\n", "city": "Meridian", "whoisContactID": 0, "street": "3540 E Longwing Ln", "organization": "MarkMonitor Inc.", "state": "ID", "id": 0}, "rawResponse": {"domain": "yahoo.com", "whoisID": 6882506946143499933, "unparsed": "{\"rdapConformance\":[\"rdap_level_0\",\"icann_rdap_technical_implementation_guide_0\",\"icann_rdap_response_profile_0\"],\"objectClassName\":\"domain\",\"handle\":\"3643624_DOMAIN_COM-VRSN\",\"port43\":null,\"lang\":null,\"events\":[{\"eventAction\":\"registration\",\"eventDate\":\"1995-01-18T05:00:00Z\",\"eventActor\":null,\"status\":[]},{\"eventAction\":\"expiration\",\"eventDate\":\"2023-01-19T05:00:00Z\",\"eventActor\":null,\"status\":[]},{\"eventAction\":\"last update of RDAP database\",\"eventDate\":\"2021-12-30T11:22:56Z\",\"eventActor\":null,\"status\":[]}],\"notices\":[{\"title\":\"Terms of Use\",\"type\":null,\"description\":[\"Service subject to Terms of Use.\"],\"links\":[{\"value\":null,\"rel\":null,\"href\":\"https://www.verisign.com/domain-names/registration-data-access-protocol/terms-service/index.xhtml\",\"hreflang\":null,\"title\":null,\"media\":null,\"type\":\"text/html\"}]},{\"title\":\"Status Codes\",\"type\":null,\"description\":[\"For more information on domain status codes, please visit https://icann.org/epp\"],\"links\":[{\"value\":null,\"rel\":null,\"href\":\"https://icann.org/epp\",\"hreflang\":null,\"title\":null,\"media\":null,\"type\":\"text/html\"}]},{\"title\":\"RDDS Inaccuracy Complaint Form\",\"type\":null,\"description\":[\"URL of the ICANN RDDS Inaccuracy Complaint Form: https://icann.org/wicf\"],\"links\":[{\"value\":null,\"rel\":null,\"href\":\"https://icann.org/wicf\",\"hreflang\":null,\"title\":null,\"media\":null,\"type\":\"text/html\"}]}],\"status\":[\"client delete prohibited\",\"client transfer prohibited\",\"client update prohibited\",\"server delete prohibited\",\"server transfer prohibited\",\"server update prohibited\"],\"entities\":[{\"rdapConformance\":[],\"objectClassName\":\"entity\",\"handle\":\"292\",\"port43\":null,\"lang\":null,\"events\":[],\"notices\":[],\"status\":[],\"entities\":[{\"rdapConformance\":[],\"objectClassName\":\"entity\",\"handle\":null,\"port43\":null,\"lang\":null,\"events\":[],\"notices\":[],\"status\":[],\"entities\":[],\"remarks\":[],\"links\":[],\"nameservers\":[],\"entity\":null,\"legalRepresentative\":null,\"errorCode\":null,\"errorTitle\":null,\"errorDescription\":[],\"vcardArray\":[\"vcard\",[[\"version\",{},\"text\",\"4.0\"],[\"fn\",{},\"text\",\"\"],[\"tel\",{\"type\":\"voice\"},\"uri\",\"tel:+1.2083895740\"],[\"email\",{},\"text\",\"abusecomplaints@markmonitor.com\"]]],\"roles\":[\"abuse\"],\"publicIds\":[],\"networks\":null,\"autnums\":null,\"nicbr_domainCount\":0,\"nicbr_inetCount\":0,\"nicbr_autnumCount\":0,\"url\":null,\"contact_URI\":null}],\"remarks\":[],\"links\":[],\"nameservers\":[],\"entity\":null,\"legalRepresentative\":null,\"errorCode\":null,\"errorTitle\":null,\"errorDescription\":[],\"vcardArray\":[\"vcard\",[[\"version\",{},\"text\",\"4.0\"],[\"fn\",{},\"text\",\"MarkMonitor Inc.\"]]],\"roles\":[\"registrar\"],\"publicIds\":[{\"type\":\"IANA Registrar ID\",\"identifier\":\"292\"}],\"networks\":null,\"autnums\":null,\"nicbr_domainCount\":0,\"nicbr_inetCount\":0,\"nicbr_autnumCount\":0,\"url\":null,\"contact_URI\":null}],\"remarks\":[],\"links\":[{\"value\":\"https://rdap.verisign.com/com/v1/domain/YAHOO.COM\",\"rel\":\"self\",\"href\":\"https://rdap.verisign.com/com/v1/domain/YAHOO.COM\",\"hreflang\":null,\"title\":null,\"media\":null,\"type\":\"application/rdap+json\"},{\"value\":\"https://rdap.markmonitor.com/rdap/domain/YAHOO.COM\",\"rel\":\"related\",\"href\":\"https://rdap.markmonitor.com/rdap/domain/YAHOO.COM\",\"hreflang\":null,\"title\":null,\"media\":null,\"type\":\"application/rdap+json\"}],\"nameservers\":[{\"rdapConformance\":[],\"objectClassName\":\"nameserver\",\"handle\":null,\"port43\":null,\"lang\":null,\"events\":[],\"notices\":[],\"status\":[],\"entities\":[],\"remarks\":[],\"links\":[],\"nameservers\":[],\"entity\":null,\"legalRepresentative\":null,\"errorCode\":null,\"errorTitle\":null,\"errorDescription\":[],\"ldhName\":\"NS1.YAHOO.COM\",\"unicodeName\":null,\"variants\":[],\"secureDNS\":null,\"publicIds\":[],\"network\":null,\"nicbr_arbitration\":false,\"delegate\":null,\"ipAddresses\":null,\"switch_name\":null,\"switch_aceString\":null},{\"rdapConformance\":[],\"objectClassName\":\"nameserver\",\"handle\":null,\"port43\":null,\"lang\":null,\"events\":[],\"notices\":[],\"status\":[],\"entities\":[],\"remarks\":[],\"links\":[],\"nameservers\":[],\"entity\":null,\"legalRepresentative\":null,\"errorCode\":null,\"errorTitle\":null,\"errorDescription\":[],\"ldhName\":\"NS2.YAHOO.COM\",\"unicodeName\":null,\"variants\":[],\"secureDNS\":null,\"publicIds\":[],\"network\":null,\"nicbr_arbitration\":false,\"delegate\":null,\"ipAddresses\":null,\"switch_name\":null,\"switch_aceString\":null},{\"rdapConformance\":[],\"objectClassName\":\"nameserver\",\"handle\":null,\"port43\":null,\"lang\":null,\"events\":[],\"notices\":[],\"status\":[],\"entities\":[],\"remarks\":[],\"links\":[],\"nameservers\":[],\"entity\":null,\"legalRepresentative\":null,\"errorCode\":null,\"errorTitle\":null,\"errorDescription\":[],\"ldhName\":\"NS3.YAHOO.COM\",\"unicodeName\":null,\"variants\":[],\"secureDNS\":null,\"publicIds\":[],\"network\":null,\"nicbr_arbitration\":false,\"delegate\":null,\"ipAddresses\":null,\"switch_name\":null,\"switch_aceString\":null},{\"rdapConformance\":[],\"objectClassName\":\"nameserver\",\"handle\":null,\"port43\":null,\"lang\":null,\"events\":[],\"notices\":[],\"status\":[],\"entities\":[],\"remarks\":[],\"links\":[],\"nameservers\":[],\"entity\":null,\"legalRepresentative\":null,\"errorCode\":null,\"errorTitle\":null,\"errorDescription\":[],\"ldhName\":\"NS4.YAHOO.COM\",\"unicodeName\":null,\"variants\":[],\"secureDNS\":null,\"publicIds\":[],\"network\":null,\"nicbr_arbitration\":false,\"delegate\":null,\"ipAddresses\":null,\"switch_name\":null,\"switch_aceString\":null},{\"rdapConformance\":[],\"objectClassName\":\"nameserver\",\"handle\":null,\"port43\":null,\"lang\":null,\"events\":[],\"notices\":[],\"status\":[],\"entities\":[],\"remarks\":[],\"links\":[],\"nameservers\":[],\"entity\":null,\"legalRepresentative\":null,\"errorCode\":null,\"errorTitle\":null,\"errorDescription\":[],\"ldhName\":\"NS5.YAHOO.COM\",\"unicodeName\":null,\"variants\":[],\"secureDNS\":null,\"publicIds\":[],\"network\":null,\"nicbr_arbitration\":false,\"delegate\":null,\"ipAddresses\":null,\"switch_name\":null,\"switch_aceString\":null}],\"entity\":null,\"legalRepresentative\":null,\"errorCode\":null,\"errorTitle\":null,\"errorDescription\":[],\"ldhName\":\"YAHOO.COM\",\"unicodeName\":null,\"variants\":[],\"secureDNS\":{\"zoneSigned\":null,\"delegationSigned\":false,\"maxSigLife\":null,\"dsData\":[],\"keyData\":[]},\"publicIds\":[],\"network\":null,\"nicbr_arbitration\":false,\"delegate\":{\"rdapConformance\":[\"rdap_level_0\",\"icann_rdap_technical_implementation_guide_0\",\"icann_rdap_response_profile_0\"],\"objectClassName\":\"domain\",\"handle\":\"3643624_DOMAIN_COM-VRSN\",\"port43\":\"whois.markmonitor.com\",\"lang\":null,\"events\":[{\"eventAction\":\"expiration\",\"eventDate\":\"2023-01-19T05:00:00Z\",\"eventActor\":null,\"status\":[]},{\"eventAction\":\"registration\",\"eventDate\":\"1995-01-18T08:00:00Z\",\"eventActor\":null,\"status\":[]},{\"eventAction\":\"last update\",\"eventDate\":\"2021-12-17T00:12:57Z\",\"eventActor\":null,\"status\":[]},{\"eventAction\":\"last update of RDAP database\",\"eventDate\":\"2021-12-31T02:24:28Z\",\"eventActor\":null,\"status\":[]}],\"notices\":[{\"title\":\"Terms of Use\",\"type\":null,\"description\":[\"By submitting an RDAP query, you agree that you will use this data only for\",\"lawful purposes and that, under no circumstances will you use this data to:\",\"(1) allow, enable, or otherwise support the transmission by email, telephone,\",\"or facsimile of mass, unsolicited, commercial advertising, or spam; or\",\"(2) enable high volume, automated, or electronic processes that send queries,\",\"data, or email to MarkMonitor (or its systems) or the domain name contacts (or\",\"its systems).\",\"MarkMonitor reserves the right to modify these terms at any time.\",\"By submitting this query, you agree to abide by this policy.\",\"MarkMonitor Domain Management(TM)\",\"Protecting companies and consumers in a digital world.\",\"Visit MarkMonitor at https://www.markmonitor.com\",\"Contact us at +1.8007459229\",\"In Europe, at +44.02032062220\"],\"links\":[{\"value\":\"https://www.markmonitor.com/legal/domain-management-terms-and-conditions\",\"rel\":\"related\",\"href\":\"https://www.markmonitor.com/legal/domain-management-terms-and-conditions\",\"hreflang\":null,\"title\":null,\"media\":null,\"type\":\"text/html\"}]},{\"title\":\"Status Codes\",\"type\":null,\"description\":[\"For more information on domain status codes, please visit https://icann.org/epp.\"],\"links\":[{\"value\":\"https://icann.org/epp\",\"rel\":\"related\",\"href\":\"https://icann.org/epp\",\"hreflang\":null,\"title\":null,\"media\":null,\"type\":\"text/html\"}]},{\"title\":\"RDDS Inaccuracy Complaint Form\",\"type\":null,\"description\":[\"URL of the ICANN RDDS Inaccuracy Complaint Form: https://www.icann.org/wicf.\"],\"links\":[{\"value\":\"https://www.icann.org/wicf\",\"rel\":\"related\",\"href\":\"https://www.icann.org/wicf\",\"hreflang\":null,\"title\":null,\"media\":null,\"type\":\"text/html\"}]}],\"status\":[\"client update prohibited\",\"client transfer prohibited\",\"client delete prohibited\",\"server update prohibited\",\"server transfer prohibited\",\"server delete prohibited\"],\"entities\":[{\"rdapConformance\":[],\"objectClassName\":\"entity\",\"handle\":null,\"port43\":null,\"lang\":null,\"events\":[{\"eventAction\":\"last update\",\"eventDate\":\"2021-10-19T23:52:48Z\",\"eventActor\":null,\"status\":[]}],\"notices\":[],\"status\":[],\"entities\":[],\"remarks\":[{\"title\":\"REDACTED FOR PRIVACY\",\"description\":[\"Some of the data in this object has been removed.\"],\"type\":\"Object truncated due to authorization\",\"links\":null}],\"links\":[],\"nameservers\":[],\"entity\":null,\"legalRepresentative\":null,\"errorCode\":null,\"errorTitle\":null,\"errorDescription\":[],\"vcardArray\":[\"vcard\",[[\"version\",{},\"text\",\"4.0\"],[\"adr\",{},\"text\",[\"\",\"\",\"\",\"\",\"VA\",\"\",\"US\"]]]],\"roles\":[\"admin\"],\"publicIds\":[],\"networks\":null,\"autnums\":null,\"nicbr_domainCount\":0,\"nicbr_inetCount\":0,\"nicbr_autnumCount\":0,\"url\":null,\"contact_URI\":\"https://domains.markmonitor.com/whois/\"},{\"rdapConformance\":[],\"objectClassName\":\"entity\",\"handle\":null,\"port43\":null,\"lang\":null,\"events\":[{\"eventAction\":\"last update\",\"eventDate\":\"2021-10-19T23:52:48Z\",\"eventActor\":null,\"status\":[]}],\"notices\":[],\"status\":[],\"entities\":[],\"remarks\":[{\"title\":\"REDACTED FOR PRIVACY\",\"description\":[\"Some of the data in this object has been removed.\"],\"type\":\"Object truncated due to authorization\",\"links\":null}],\"links\":[],\"nameservers\":[],\"entity\":null,\"legalRepresentative\":null,\"errorCode\":null,\"errorTitle\":null,\"errorDescription\":[],\"vcardArray\":[\"vcard\",[[\"version\",{},\"text\",\"4.0\"],[\"org\",{\"type\":\"work\"},\"text\",\"Yahoo Assets LLC\"],[\"adr\",{},\"text\",[\"\",\"\",\"\",\"\",\"VA\",\"\",\"US\"]]]],\"roles\":[\"registrant\"],\"publicIds\":[],\"networks\":null,\"autnums\":null,\"nicbr_domainCount\":0,\"nicbr_inetCount\":0,\"nicbr_autnumCount\":0,\"url\":null,\"contact_URI\":\"https://domains.markmonitor.com/whois/\"},{\"rdapConformance\":[],\"objectClassName\":\"entity\",\"handle\":null,\"port43\":null,\"lang\":null,\"events\":[{\"eventAction\":\"last update\",\"eventDate\":\"2021-10-19T23:52:48Z\",\"eventActor\":null,\"status\":[]}],\"notices\":[],\"status\":[],\"entities\":[],\"remarks\":[{\"title\":\"REDACTED FOR PRIVACY\",\"description\":[\"Some of the data in this object has been removed.\"],\"type\":\"Object truncated due to authorization\",\"links\":null}],\"links\":[],\"nameservers\":[],\"entity\":null,\"legalRepresentative\":null,\"errorCode\":null,\"errorTitle\":null,\"errorDescription\":[],\"vcardArray\":[\"vcard\",[[\"version\",{},\"text\",\"4.0\"],[\"adr\",{},\"text\",[\"\",\"\",\"\",\"\",\"VA\",\"\",\"US\"]]]],\"roles\":[\"technical\"],\"publicIds\":[],\"networks\":null,\"autnums\":null,\"nicbr_domainCount\":0,\"nicbr_inetCount\":0,\"nicbr_autnumCount\":0,\"url\":null,\"contact_URI\":\"https://domains.markmonitor.com/whois/\"},{\"rdapConformance\":[],\"objectClassName\":\"entity\",\"handle\":\"292\",\"port43\":null,\"lang\":null,\"events\":[{\"eventAction\":\"registrar expiration\",\"eventDate\":\"2020-09-14T04:00:00Z\",\"eventActor\":null,\"status\":[]}],\"notices\":[],\"status\":[],\"entities\":[{\"rdapConformance\":[],\"objectClassName\":\"entity\",\"handle\":null,\"port43\":null,\"lang\":null,\"events\":[],\"notices\":[],\"status\":[],\"entities\":[],\"remarks\":[],\"links\":[],\"nameservers\":[],\"entity\":null,\"legalRepresentative\":null,\"errorCode\":null,\"errorTitle\":null,\"errorDescription\":[],\"vcardArray\":[\"vcard\",[[\"version\",{},\"text\",\"4.0\"],[\"email\",{\"type\":\"work\"},\"text\",\"abusecomplaints@markmonitor.com\"],[\"tel\",{\"type\":\"voice\"},\"text\",\"+1.2083895770\"]]],\"roles\":[\"abuse\"],\"publicIds\":[],\"networks\":null,\"autnums\":null,\"nicbr_domainCount\":0,\"nicbr_inetCount\":0,\"nicbr_autnumCount\":0,\"url\":null,\"contact_URI\":null}],\"remarks\":[],\"links\":[],\"nameservers\":[],\"entity\":null,\"legalRepresentative\":null,\"errorCode\":null,\"errorTitle\":null,\"errorDescription\":[],\"vcardArray\":[\"vcard\",[[\"version\",{},\"text\",\"4.0\"],[\"org\",{\"type\":\"work\"},\"text\",\"MarkMonitor Inc.\"],[\"adr\",{},\"text\",[\"\",\"\",\"3540 E Longwing Ln\",\"Meridian\",\"ID\",\"83646\",\"US\"]]]],\"roles\":[\"registrar\"],\"publicIds\":[{\"type\":\"IANA Registrar ID\",\"identifier\":\"292\"}],\"networks\":null,\"autnums\":null,\"nicbr_domainCount\":0,\"nicbr_inetCount\":0,\"nicbr_autnumCount\":0,\"url\":null,\"contact_URI\":null}],\"remarks\":[],\"links\":[{\"value\":\"https://rdap.markmonitor.com/rdap/domain/yahoo.com\",\"rel\":\"self\",\"href\":\"https://rdap.markmonitor.com/rdap/domain/yahoo.com\",\"hreflang\":null,\"title\":null,\"media\":null,\"type\":\"application/rdap+json\"}],\"nameservers\":[{\"rdapConformance\":[],\"objectClassName\":\"nameserver\",\"handle\":null,\"port43\":null,\"lang\":null,\"events\":[{\"eventAction\":\"last changed\",\"eventDate\":\"2013-07-11T16:30:20Z\",\"eventActor\":null,\"status\":[]}],\"notices\":[],\"status\":[\"active\"],\"entities\":[],\"remarks\":[],\"links\":[],\"nameservers\":[],\"entity\":null,\"legalRepresentative\":null,\"errorCode\":null,\"errorTitle\":null,\"errorDescription\":[],\"ldhName\":\"ns1.yahoo.com\",\"unicodeName\":null,\"variants\":[],\"secureDNS\":null,\"publicIds\":[],\"network\":null,\"nicbr_arbitration\":false,\"delegate\":null,\"ipAddresses\":null,\"switch_name\":null,\"switch_aceString\":null},{\"rdapConformance\":[],\"objectClassName\":\"nameserver\",\"handle\":null,\"port43\":null,\"lang\":null,\"events\":[{\"eventAction\":\"last changed\",\"eventDate\":\"2013-07-11T16:30:20Z\",\"eventActor\":null,\"status\":[]}],\"notices\":[],\"status\":[\"active\"],\"entities\":[],\"remarks\":[],\"links\":[],\"nameservers\":[],\"entity\":null,\"legalRepresentative\":null,\"errorCode\":null,\"errorTitle\":null,\"errorDescription\":[],\"ldhName\":\"ns2.yahoo.com\",\"unicodeName\":null,\"variants\":[],\"secureDNS\":null,\"publicIds\":[],\"network\":null,\"nicbr_arbitration\":false,\"delegate\":null,\"ipAddresses\":null,\"switch_name\":null,\"switch_aceString\":null},{\"rdapConformance\":[],\"objectClassName\":\"nameserver\",\"handle\":null,\"port43\":null,\"lang\":null,\"events\":[{\"eventAction\":\"last changed\",\"eventDate\":\"2013-07-11T16:30:20Z\",\"eventActor\":null,\"status\":[]}],\"notices\":[],\"status\":[\"active\"],\"entities\":[],\"remarks\":[],\"links\":[],\"nameservers\":[],\"entity\":null,\"legalRepresentative\":null,\"errorCode\":null,\"errorTitle\":null,\"errorDescription\":[],\"ldhName\":\"ns3.yahoo.com\",\"unicodeName\":null,\"variants\":[],\"secureDNS\":null,\"publicIds\":[],\"network\":null,\"nicbr_arbitration\":false,\"delegate\":null,\"ipAddresses\":null,\"switch_name\":null,\"switch_aceString\":null},{\"rdapConformance\":[],\"objectClassName\":\"nameserver\",\"handle\":null,\"port43\":null,\"lang\":null,\"events\":[{\"eventAction\":\"last changed\",\"eventDate\":\"2013-07-11T16:30:20Z\",\"eventActor\":null,\"status\":[]}],\"notices\":[],\"status\":[\"active\"],\"entities\":[],\"remarks\":[],\"links\":[],\"nameservers\":[],\"entity\":null,\"legalRepresentative\":null,\"errorCode\":null,\"errorTitle\":null,\"errorDescription\":[],\"ldhName\":\"ns4.yahoo.com\",\"unicodeName\":null,\"variants\":[],\"secureDNS\":null,\"publicIds\":[],\"network\":null,\"nicbr_arbitration\":false,\"delegate\":null,\"ipAddresses\":null,\"switch_name\":null,\"switch_aceString\":null},{\"rdapConformance\":[],\"objectClassName\":\"nameserver\",\"handle\":null,\"port43\":null,\"lang\":null,\"events\":[{\"eventAction\":\"last changed\",\"eventDate\":\"2013-07-11T16:30:20Z\",\"eventActor\":null,\"status\":[]}],\"notices\":[],\"status\":[\"active\"],\"entities\":[],\"remarks\":[],\"links\":[],\"nameservers\":[],\"entity\":null,\"legalRepresentative\":null,\"errorCode\":null,\"errorTitle\":null,\"errorDescription\":[],\"ldhName\":\"ns5.yahoo.com\",\"unicodeName\":null,\"variants\":[],\"secureDNS\":null,\"publicIds\":[],\"network\":null,\"nicbr_arbitration\":false,\"delegate\":null,\"ipAddresses\":null,\"switch_name\":null,\"switch_aceString\":null}],\"entity\":null,\"legalRepresentative\":null,\"errorCode\":null,\"errorTitle\":null,\"errorDescription\":[],\"ldhName\":\"yahoo.com\",\"unicodeName\":null,\"variants\":[],\"secureDNS\":{\"zoneSigned\":null,\"delegationSigned\":false,\"maxSigLife\":null,\"dsData\":[],\"keyData\":[]},\"publicIds\":[],\"network\":null,\"nicbr_arbitration\":false,\"delegate\":null,\"switch_name\":null,\"switch_aceString\":null},\"switch_name\":null,\"switch_aceString\":null}", "raw": "Registrar: \n  Handle: 3643624_DOMAIN_COM-VRSN\n  LDH Name: yahoo.com\n  Nameserver: \n    LDH Name: ns1.yahoo.com\n    Event: \n      Action: last changed\n      Date: 2013-07-11T16:30:20Z\n      Status: active\n  Nameserver: \n    LDH Name: ns2.yahoo.com\n    Event: \n      Action: last changed\n      Date: 2013-07-11T16:30:20Z\n      Status: active\n  Nameserver: \n    LDH Name: ns3.yahoo.com\n    Event: \n      Action: last changed\n      Date: 2013-07-11T16:30:20Z\n      Status: active\n  Nameserver: \n    LDH Name: ns4.yahoo.com\n    Event: \n      Action: last changed\n      Date: 2013-07-11T16:30:20Z\n      Status: active\n  Nameserver: \n    LDH Name: ns5.yahoo.com\n    Event: \n      Action: last changed\n      Date: 2013-07-11T16:30:20Z\n      Status: active\n  SecureDNS: \n    Delegation Signed: false\n  Event: \n    Action: expiration\n    Date: 2023-01-19T05:00:00Z\n  Event: \n    Action: registration\n    Date: 1995-01-18T08:00:00Z\n  Event: \n    Action: last update\n    Date: 2021-12-17T00:12:57Z\n  Event: \n    Action: last update of RDAP database\n    Date: 2021-12-31T02:24:28Z\n  Status: \n    client update prohibited\n    client transfer prohibited\n    client delete prohibited\n    server update prohibited\n    server transfer prohibited\n    server delete prohibited\n  Entity: \n    Role: \n      ADMIN\n    VCard: \n      Address: \n          Region: VA\n          Country: US\n    Event: \n      Action: last update\n      Date: 2021-10-19T23:52:48Z\n    Remark: \n      Title: REDACTED FOR PRIVACY\n      Type: Object truncated due to authorization\n        Description: Some of the data in this object has been removed.\n  Entity: \n    Role: \n      REGISTRANT\n    VCard: \n          Organization: Yahoo Assets LLC\n          TYPE: work\n      Address: \n          Region: VA\n          Country: US\n    Event: \n      Action: last update\n      Date: 2021-10-19T23:52:48Z\n    Remark: \n      Title: REDACTED FOR PRIVACY\n      Type: Object truncated due to authorization\n        Description: Some of the data in this object has been removed.\n  Entity: \n    Role: \n      TECHNICAL\n    VCard: \n      Address: \n          Region: VA\n          Country: US\n    Event: \n      Action: last update\n      Date: 2021-10-19T23:52:48Z\n    Remark: \n      Title: REDACTED FOR PRIVACY\n      Type: Object truncated due to authorization\n        Description: Some of the data in this object has been removed.\n  Entity: \n    Handle: 292\n    Role: \n      REGISTRAR\n    VCard: \n          Organization: MarkMonitor Inc.\n          TYPE: work\n      Address: \n          Street: 3540 E Longwing Ln\n          Locale: Meridian\n          Region: ID\n          Postal Code: 83646\n          Country: US\n    Event: \n      Action: registrar expiration\n      Date: 2020-09-14T04:00:00Z\n    Entity: \n      Role: \n        ABUSE\n      VCard: \n        Email: abusecomplaints@markmonitor.com\n            TYPE: work\n        Telephone: +1.2083895770\n            TYPE: voice\n  Link: \n    Rel: self\n    Value: https://rdap.markmonitor.com/rdap/domain/yahoo.com\n    Type: application/rdap+json\n    Href: https://rdap.markmonitor.com/rdap/domain/yahoo.com\n  Notice: \n    Title: Terms of Use\n    Description: \n      By submitting an RDAP query, you agree that you will use this data only for\n      lawful purposes and that, under no circumstances will you use this data to:\n      (1) allow, enable, or otherwise support the transmission by email, telephone,\n      or facsimile of mass, unsolicited, commercial advertising, or spam; or\n      (2) enable high volume, automated, or electronic processes that send queries,\n      data, or email to MarkMonitor (or its systems) or the domain name contacts (or\n      its systems).\n      MarkMonitor reserves the right to modify these terms at any time.\n      By submitting this query, you agree to abide by this policy.\n      MarkMonitor Domain Management(TM)\n      Protecting companies and consumers in a digital world.\n      Visit MarkMonitor at https://www.markmonitor.com\n      Contact us at +1.8007459229\n      In Europe, at +44.02032062220\n      Link: \n        Rel: related\n        Value: https://www.markmonitor.com/legal/domain-management-terms-and-conditions\n        Type: text/html\n        Href: https://www.markmonitor.com/legal/domain-management-terms-and-conditions\n  Notice: \n    Title: Status Codes\n      Description: For more information on domain status codes, please visit https://icann.org/epp.\n      Link: \n        Rel: related\n        Value: https://icann.org/epp\n        Type: text/html\n        Href: https://icann.org/epp\n  Notice: \n    Title: RDDS Inaccuracy Complaint Form\n      Description: URL of the ICANN RDDS Inaccuracy Complaint Form: https://www.icann.org/wicf.\n      Link: \n        Rel: related\n        Value: https://www.icann.org/wicf\n        Type: text/html\n        Href: https://www.icann.org/wicf\n  RDAP Conformance: \n    rdap_level_0\n    icann_rdap_technical_implementation_guide_0\n    icann_rdap_response_profile_0\n\n\n  Registry: \n    Handle: 3643624_DOMAIN_COM-VRSN\n    LDH Name: YAHOO.COM\n    Nameserver: \n      LDH Name: NS1.YAHOO.COM\n    Nameserver: \n      LDH Name: NS2.YAHOO.COM\n    Nameserver: \n      LDH Name: NS3.YAHOO.COM\n    Nameserver: \n      LDH Name: NS4.YAHOO.COM\n    Nameserver: \n      LDH Name: NS5.YAHOO.COM\n    SecureDNS: \n      Delegation Signed: false\n    Event: \n      Action: registration\n      Date: 1995-01-18T05:00:00Z\n    Event: \n      Action: expiration\n      Date: 2023-01-19T05:00:00Z\n    Event: \n      Action: last update of RDAP database\n      Date: 2021-12-30T11:22:56Z\n    Status: \n      client delete prohibited\n      client transfer prohibited\n      client update prohibited\n      server delete prohibited\n      server transfer prohibited\n      server update prohibited\n    Entity: \n      Handle: 292\n      Role: \n        REGISTRAR\n      VCard: \n        Formatted Name: MarkMonitor Inc.\n      Entity: \n        Role: \n          ABUSE\n        VCard: \n          Formatted Name: \n              TYPE: voice\n          Email: abusecomplaints@markmonitor.com\n    Link: \n      Rel: self\n      Value: https://rdap.verisign.com/com/v1/domain/YAHOO.COM\n      Type: application/rdap+json\n      Href: https://rdap.verisign.com/com/v1/domain/YAHOO.COM\n    Link: \n      Rel: related\n      Value: https://rdap.markmonitor.com/rdap/domain/YAHOO.COM\n      Type: application/rdap+json\n      Href: https://rdap.markmonitor.com/rdap/domain/YAHOO.COM\n    Notice: \n      Title: Terms of Use\n        Description: Service subject to Terms of Use.\n        Link: \n          Type: text/html\n          Href: https://www.verisign.com/domain-names/registration-data-access-protocol/terms-service/index.xhtml\n    Notice: \n      Title: Status Codes\n        Description: For more information on domain status codes, please visit https://icann.org/epp\n        Link: \n          Type: text/html\n          Href: https://icann.org/epp\n    Notice: \n      Title: RDDS Inaccuracy Complaint Form\n        Description: URL of the ICANN RDDS Inaccuracy Complaint Form: https://icann.org/wicf\n        Link: \n          Type: text/html\n          Href: https://icann.org/wicf\n    RDAP Conformance: \n      rdap_level_0\n      icann_rdap_technical_implementation_guide_0\n      icann_rdap_response_profile_0\n", "whoisRawID": 0, "source": "WHOIS_RDAP", "match_whitelist": {"domain": true}}, "registrarUpdatedAt": 1639699977, "whoisID": 6882506946143499933, "registrarIanaID": 292, "registrarName": "MarkMonitor Inc.", "admin": {"country": "US", "address": "VA\nUS\n", "whoisContactID": 0, "state": "VA", "id": 0}, "whoisServer": "rdap.markmonitor.com", "createdAt": 1640917526, "expired": false, "contactOrganizations": ["Yahoo Assets LLC", "MarkMonitor Inc."], "registrarParseCode": 44323, "auditUpdatedAt": 1646549504, "id": 6882506946143499933, "registrarPhone": "+1.2083895740", "updatedAt": 1649183326, "domainUnicode": "yahoo.com", "auditCreatedAt": 1640917526, "registrarExpiresAt": 1674104400, "contactCountries": ["US"], "compositeParseCode": 44323, "contactEmails": ["abusecomplaints@markmonitor.com"], "registrarEmail": "abusecomplaints@markmonitor.com", "domainStatus": "client update prohibited,client transfer prohibited,client delete prohibited,server update prohibited,server transfer prohibited,server delete prohibited", "tld": "com", "domainAvailable": false, "registrarCreatedAt": 790416000, "noRecord": false, "nameservers": ["ns1.yahoo.com", "ns2.yahoo.com", "ns3.yahoo.com", "ns4.yahoo.com", "ns5.yahoo.com"], "domain": "yahoo.com", "registrant": {"country": "US", "address": "VA\nUS\n", "whoisContactID": 0, "organization": "Yahoo Assets LLC", "state": "VA", "id": 0}, "contactNames": [], "contacts": [{"country": "US", "address": "VA\nUS\n", "whoisContactID": 0, "organization": "Yahoo Assets LLC", "state": "VA", "id": 0}, {"country": "US", "address": "VA\nUS\n", "whoisContactID": 0, "state": "VA", "id": 0}, {"zip": "83646", "country": "US", "address": "3540 E Longwing Ln\nMeridian\n83646\nID\nUS\n", "city": "Meridian", "whoisContactID": 0, "street": "3540 E Longwing Ln", "organization": "MarkMonitor Inc.", "state": "ID", "id": 0}, {"address": "", "phone": "+1.2083895770", "whoisContactID": 0, "id": 0, "email": "abusecomplaints@markmonitor.com"}], "status": "INACTIVE", "domainMd5": "50cd1a9a183758039b0841aa738c3f0b", "task_id": "37f441a44c8a45ea9dfae9c8823690ed", "match_whitelist": {"domain": true}}, {"abuse": {"address": "", "phone": "+1.2083895770", "whoisContactID": 0, "id": 0, "email": "abusecomplaints@markmonitor.com"}, "technical": {"country": "US", "address": "VA\nUS\n", "whoisContactID": 0, "state": "VA", "id": 0}, "registrar": {"zip": "83646", "country": "US", "address": "3540 E Longwing Ln\nMeridian\n83646\nID\nUS\n", "city": "Meridian", "whoisContactID": 0, "street": "3540 E Longwing Ln", "organization": "MarkMonitor Inc.", "state": "ID", "id": 0}, "rawResponse": {"domain": "yahoo.com", "whoisID": 6860101631334753875, "unparsed": "{\"rdapConformance\":[\"rdap_level_0\",\"icann_rdap_technical_implementation_guide_0\",\"icann_rdap_response_profile_0\"],\"objectClassName\":\"domain\",\"handle\":\"3643624_DOMAIN_COM-VRSN\",\"port43\":null,\"lang\":null,\"events\":[{\"eventAction\":\"registration\",\"eventDate\":\"1995-01-18T05:00:00Z\",\"eventActor\":null,\"status\":[]},{\"eventAction\":\"expiration\",\"eventDate\":\"2023-01-19T05:00:00Z\",\"eventActor\":null,\"status\":[]},{\"eventAction\":\"last update of RDAP database\",\"eventDate\":\"2021-10-30T09:21:44Z\",\"eventActor\":null,\"status\":[]}],\"notices\":[{\"title\":\"Terms of Use\",\"type\":null,\"description\":[\"Service subject to Terms of Use.\"],\"links\":[{\"value\":null,\"rel\":null,\"href\":\"https://www.verisign.com/domain-names/registration-data-access-protocol/terms-service/index.xhtml\",\"hreflang\":null,\"title\":null,\"media\":null,\"type\":\"text/html\"}]},{\"title\":\"Status Codes\",\"type\":null,\"description\":[\"For more information on domain status codes, please visit https://icann.org/epp\"],\"links\":[{\"value\":null,\"rel\":null,\"href\":\"https://icann.org/epp\",\"hreflang\":null,\"title\":null,\"media\":null,\"type\":\"text/html\"}]},{\"title\":\"RDDS Inaccuracy Complaint Form\",\"type\":null,\"description\":[\"URL of the ICANN RDDS Inaccuracy Complaint Form: https://icann.org/wicf\"],\"links\":[{\"value\":null,\"rel\":null,\"href\":\"https://icann.org/wicf\",\"hreflang\":null,\"title\":null,\"media\":null,\"type\":\"text/html\"}]}],\"status\":[\"client delete prohibited\",\"client transfer prohibited\",\"client update prohibited\",\"server delete prohibited\",\"server transfer prohibited\",\"server update prohibited\"],\"entities\":[{\"rdapConformance\":[],\"objectClassName\":\"entity\",\"handle\":\"292\",\"port43\":null,\"lang\":null,\"events\":[],\"notices\":[],\"status\":[],\"entities\":[{\"rdapConformance\":[],\"objectClassName\":\"entity\",\"handle\":null,\"port43\":null,\"lang\":null,\"events\":[],\"notices\":[],\"status\":[],\"entities\":[],\"remarks\":[],\"links\":[],\"nameservers\":[],\"entity\":null,\"legalRepresentative\":null,\"errorCode\":null,\"errorTitle\":null,\"errorDescription\":[],\"vcardArray\":[\"vcard\",[[\"version\",{},\"text\",\"4.0\"],[\"fn\",{},\"text\",\"\"],[\"tel\",{\"type\":\"voice\"},\"uri\",\"tel:+1.2083895740\"],[\"email\",{},\"text\",\"abusecomplaints@markmonitor.com\"]]],\"roles\":[\"abuse\"],\"publicIds\":[],\"networks\":null,\"autnums\":null,\"nicbr_domainCount\":0,\"nicbr_inetCount\":0,\"nicbr_autnumCount\":0,\"url\":null,\"contact_URI\":null}],\"remarks\":[],\"links\":[],\"nameservers\":[],\"entity\":null,\"legalRepresentative\":null,\"errorCode\":null,\"errorTitle\":null,\"errorDescription\":[],\"vcardArray\":[\"vcard\",[[\"version\",{},\"text\",\"4.0\"],[\"fn\",{},\"text\",\"MarkMonitor Inc.\"]]],\"roles\":[\"registrar\"],\"publicIds\":[{\"type\":\"IANA Registrar ID\",\"identifier\":\"292\"}],\"networks\":null,\"autnums\":null,\"nicbr_domainCount\":0,\"nicbr_inetCount\":0,\"nicbr_autnumCount\":0,\"url\":null,\"contact_URI\":null}],\"remarks\":[],\"links\":[{\"value\":\"https://rdap.verisign.com/com/v1/domain/YAHOO.COM\",\"rel\":\"self\",\"href\":\"https://rdap.verisign.com/com/v1/domain/YAHOO.COM\",\"hreflang\":null,\"title\":null,\"media\":null,\"type\":\"application/rdap+json\"},{\"value\":\"https://rdap.markmonitor.com/rdap/domain/YAHOO.COM\",\"rel\":\"related\",\"href\":\"https://rdap.markmonitor.com/rdap/domain/YAHOO.COM\",\"hreflang\":null,\"title\":null,\"media\":null,\"type\":\"application/rdap+json\"}],\"nameservers\":[{\"rdapConformance\":[],\"objectClassName\":\"nameserver\",\"handle\":null,\"port43\":null,\"lang\":null,\"events\":[],\"notices\":[],\"status\":[],\"entities\":[],\"remarks\":[],\"links\":[],\"nameservers\":[],\"entity\":null,\"legalRepresentative\":null,\"errorCode\":null,\"errorTitle\":null,\"errorDescription\":[],\"ldhName\":\"NS1.YAHOO.COM\",\"unicodeName\":null,\"variants\":[],\"secureDNS\":null,\"publicIds\":[],\"network\":null,\"nicbr_arbitration\":false,\"delegate\":null,\"ipAddresses\":null,\"switch_name\":null,\"switch_aceString\":null},{\"rdapConformance\":[],\"objectClassName\":\"nameserver\",\"handle\":null,\"port43\":null,\"lang\":null,\"events\":[],\"notices\":[],\"status\":[],\"entities\":[],\"remarks\":[],\"links\":[],\"nameservers\":[],\"entity\":null,\"legalRepresentative\":null,\"errorCode\":null,\"errorTitle\":null,\"errorDescription\":[],\"ldhName\":\"NS2.YAHOO.COM\",\"unicodeName\":null,\"variants\":[],\"secureDNS\":null,\"publicIds\":[],\"network\":null,\"nicbr_arbitration\":false,\"delegate\":null,\"ipAddresses\":null,\"switch_name\":null,\"switch_aceString\":null},{\"rdapConformance\":[],\"objectClassName\":\"nameserver\",\"handle\":null,\"port43\":null,\"lang\":null,\"events\":[],\"notices\":[],\"status\":[],\"entities\":[],\"remarks\":[],\"links\":[],\"nameservers\":[],\"entity\":null,\"legalRepresentative\":null,\"errorCode\":null,\"errorTitle\":null,\"errorDescription\":[],\"ldhName\":\"NS3.YAHOO.COM\",\"unicodeName\":null,\"variants\":[],\"secureDNS\":null,\"publicIds\":[],\"network\":null,\"nicbr_arbitration\":false,\"delegate\":null,\"ipAddresses\":null,\"switch_name\":null,\"switch_aceString\":null},{\"rdapConformance\":[],\"objectClassName\":\"nameserver\",\"handle\":null,\"port43\":null,\"lang\":null,\"events\":[],\"notices\":[],\"status\":[],\"entities\":[],\"remarks\":[],\"links\":[],\"nameservers\":[],\"entity\":null,\"legalRepresentative\":null,\"errorCode\":null,\"errorTitle\":null,\"errorDescription\":[],\"ldhName\":\"NS4.YAHOO.COM\",\"unicodeName\":null,\"variants\":[],\"secureDNS\":null,\"publicIds\":[],\"network\":null,\"nicbr_arbitration\":false,\"delegate\":null,\"ipAddresses\":null,\"switch_name\":null,\"switch_aceString\":null},{\"rdapConformance\":[],\"objectClassName\":\"nameserver\",\"handle\":null,\"port43\":null,\"lang\":null,\"events\":[],\"notices\":[],\"status\":[],\"entities\":[],\"remarks\":[],\"links\":[],\"nameservers\":[],\"entity\":null,\"legalRepresentative\":null,\"errorCode\":null,\"errorTitle\":null,\"errorDescription\":[],\"ldhName\":\"NS5.YAHOO.COM\",\"unicodeName\":null,\"variants\":[],\"secureDNS\":null,\"publicIds\":[],\"network\":null,\"nicbr_arbitration\":false,\"delegate\":null,\"ipAddresses\":null,\"switch_name\":null,\"switch_aceString\":null}],\"entity\":null,\"legalRepresentative\":null,\"errorCode\":null,\"errorTitle\":null,\"errorDescription\":[],\"ldhName\":\"YAHOO.COM\",\"unicodeName\":null,\"variants\":[],\"secureDNS\":{\"zoneSigned\":null,\"delegationSigned\":false,\"maxSigLife\":null,\"dsData\":[],\"keyData\":[]},\"publicIds\":[],\"network\":null,\"nicbr_arbitration\":false,\"delegate\":{\"rdapConformance\":[\"rdap_level_0\",\"icann_rdap_technical_implementation_guide_0\",\"icann_rdap_response_profile_0\"],\"objectClassName\":\"domain\",\"handle\":\"3643624_DOMAIN_COM-VRSN\",\"port43\":\"whois.markmonitor.com\",\"lang\":null,\"events\":[{\"eventAction\":\"expiration\",\"eventDate\":\"2023-01-19T05:00:00Z\",\"eventActor\":null,\"status\":[]},{\"eventAction\":\"registration\",\"eventDate\":\"1995-01-18T08:00:00Z\",\"eventActor\":null,\"status\":[]},{\"eventAction\":\"last update\",\"eventDate\":\"2021-10-29T18:27:20Z\",\"eventActor\":null,\"status\":[]},{\"eventAction\":\"last update of RDAP database\",\"eventDate\":\"2021-10-30T06:33:48Z\",\"eventActor\":null,\"status\":[]}],\"notices\":[{\"title\":\"Terms of Use\",\"type\":null,\"description\":[\"By submitting an RDAP query, you agree that you will use this data only for\",\"lawful purposes and that, under no circumstances will you use this data to:\",\"(1) allow, enable, or otherwise support the transmission by email, telephone,\",\"or facsimile of mass, unsolicited, commercial advertising, or spam; or\",\"(2) enable high volume, automated, or electronic processes that send queries,\",\"data, or email to MarkMonitor (or its systems) or the domain name contacts (or\",\"its systems).\",\"MarkMonitor reserves the right to modify these terms at any time.\",\"By submitting this query, you agree to abide by this policy.\",\"MarkMonitor Domain Management(TM)\",\"Protecting companies and consumers in a digital world.\",\"Visit MarkMonitor at https://www.markmonitor.com\",\"Contact us at +1.8007459229\",\"In Europe, at +44.02032062220\"],\"links\":[{\"value\":\"https://www.markmonitor.com/legal/domain-management-terms-and-conditions\",\"rel\":\"related\",\"href\":\"https://www.markmonitor.com/legal/domain-management-terms-and-conditions\",\"hreflang\":null,\"title\":null,\"media\":null,\"type\":\"text/html\"}]},{\"title\":\"Status Codes\",\"type\":null,\"description\":[\"For more information on domain status codes, please visit https://icann.org/epp.\"],\"links\":[{\"value\":\"https://icann.org/epp\",\"rel\":\"related\",\"href\":\"https://icann.org/epp\",\"hreflang\":null,\"title\":null,\"media\":null,\"type\":\"text/html\"}]},{\"title\":\"RDDS Inaccuracy Complaint Form\",\"type\":null,\"description\":[\"URL of the ICANN RDDS Inaccuracy Complaint Form: https://www.icann.org/wicf.\"],\"links\":[{\"value\":\"https://www.icann.org/wicf\",\"rel\":\"related\",\"href\":\"https://www.icann.org/wicf\",\"hreflang\":null,\"title\":null,\"media\":null,\"type\":\"text/html\"}]}],\"status\":[\"client update prohibited\",\"client transfer prohibited\",\"client delete prohibited\",\"server update prohibited\",\"server transfer prohibited\",\"server delete prohibited\"],\"entities\":[{\"rdapConformance\":[],\"objectClassName\":\"entity\",\"handle\":null,\"port43\":null,\"lang\":null,\"events\":[{\"eventAction\":\"last update\",\"eventDate\":\"2020-02-10T16:17:04Z\",\"eventActor\":null,\"status\":[]}],\"notices\":[],\"status\":[],\"entities\":[],\"remarks\":[{\"title\":\"REDACTED FOR PRIVACY\",\"description\":[\"Some of the data in this object has been removed.\"],\"type\":\"Object truncated due to authorization\",\"links\":null}],\"links\":[],\"nameservers\":[],\"entity\":null,\"legalRepresentative\":null,\"errorCode\":null,\"errorTitle\":null,\"errorDescription\":[],\"vcardArray\":[\"vcard\",[[\"version\",{},\"text\",\"4.0\"],[\"adr\",{},\"text\",[\"\",\"\",\"\",\"\",\"VA\",\"\",\"US\"]]]],\"roles\":[\"admin\"],\"publicIds\":[],\"networks\":null,\"autnums\":null,\"nicbr_domainCount\":0,\"nicbr_inetCount\":0,\"nicbr_autnumCount\":0,\"url\":null,\"contact_URI\":\"https://domains.markmonitor.com/whois/\"},{\"rdapConformance\":[],\"objectClassName\":\"entity\",\"handle\":null,\"port43\":null,\"lang\":null,\"events\":[{\"eventAction\":\"last update\",\"eventDate\":\"2020-02-10T16:17:04Z\",\"eventActor\":null,\"status\":[]}],\"notices\":[],\"status\":[],\"entities\":[],\"remarks\":[{\"title\":\"REDACTED FOR PRIVACY\",\"description\":[\"Some of the data in this object has been removed.\"],\"type\":\"Object truncated due to authorization\",\"links\":null}],\"links\":[],\"nameservers\":[],\"entity\":null,\"legalRepresentative\":null,\"errorCode\":null,\"errorTitle\":null,\"errorDescription\":[],\"vcardArray\":[\"vcard\",[[\"version\",{},\"text\",\"4.0\"],[\"org\",{\"type\":\"work\"},\"text\",\"Verizon Media Inc.\"],[\"adr\",{},\"text\",[\"\",\"\",\"\",\"\",\"VA\",\"\",\"US\"]]]],\"roles\":[\"registrant\"],\"publicIds\":[],\"networks\":null,\"autnums\":null,\"nicbr_domainCount\":0,\"nicbr_inetCount\":0,\"nicbr_autnumCount\":0,\"url\":null,\"contact_URI\":\"https://domains.markmonitor.com/whois/\"},{\"rdapConformance\":[],\"objectClassName\":\"entity\",\"handle\":null,\"port43\":null,\"lang\":null,\"events\":[{\"eventAction\":\"last update\",\"eventDate\":\"2020-02-10T16:17:04Z\",\"eventActor\":null,\"status\":[]}],\"notices\":[],\"status\":[],\"entities\":[],\"remarks\":[{\"title\":\"REDACTED FOR PRIVACY\",\"description\":[\"Some of the data in this object has been removed.\"],\"type\":\"Object truncated due to authorization\",\"links\":null}],\"links\":[],\"nameservers\":[],\"entity\":null,\"legalRepresentative\":null,\"errorCode\":null,\"errorTitle\":null,\"errorDescription\":[],\"vcardArray\":[\"vcard\",[[\"version\",{},\"text\",\"4.0\"],[\"adr\",{},\"text\",[\"\",\"\",\"\",\"\",\"VA\",\"\",\"US\"]]]],\"roles\":[\"technical\"],\"publicIds\":[],\"networks\":null,\"autnums\":null,\"nicbr_domainCount\":0,\"nicbr_inetCount\":0,\"nicbr_autnumCount\":0,\"url\":null,\"contact_URI\":\"https://domains.markmonitor.com/whois/\"},{\"rdapConformance\":[],\"objectClassName\":\"entity\",\"handle\":\"292\",\"port43\":null,\"lang\":null,\"events\":[{\"eventAction\":\"registrar expiration\",\"eventDate\":\"2020-09-14T04:00:00Z\",\"eventActor\":null,\"status\":[]}],\"notices\":[],\"status\":[],\"entities\":[{\"rdapConformance\":[],\"objectClassName\":\"entity\",\"handle\":null,\"port43\":null,\"lang\":null,\"events\":[],\"notices\":[],\"status\":[],\"entities\":[],\"remarks\":[],\"links\":[],\"nameservers\":[],\"entity\":null,\"legalRepresentative\":null,\"errorCode\":null,\"errorTitle\":null,\"errorDescription\":[],\"vcardArray\":[\"vcard\",[[\"version\",{},\"text\",\"4.0\"],[\"email\",{\"type\":\"work\"},\"text\",\"abusecomplaints@markmonitor.com\"],[\"tel\",{\"type\":\"voice\"},\"text\",\"+1.2083895770\"]]],\"roles\":[\"abuse\"],\"publicIds\":[],\"networks\":null,\"autnums\":null,\"nicbr_domainCount\":0,\"nicbr_inetCount\":0,\"nicbr_autnumCount\":0,\"url\":null,\"contact_URI\":null}],\"remarks\":[],\"links\":[],\"nameservers\":[],\"entity\":null,\"legalRepresentative\":null,\"errorCode\":null,\"errorTitle\":null,\"errorDescription\":[],\"vcardArray\":[\"vcard\",[[\"version\",{},\"text\",\"4.0\"],[\"org\",{\"type\":\"work\"},\"text\",\"MarkMonitor Inc.\"],[\"adr\",{},\"text\",[\"\",\"\",\"3540 E Longwing Ln\",\"Meridian\",\"ID\",\"83646\",\"US\"]]]],\"roles\":[\"registrar\"],\"publicIds\":[{\"type\":\"IANA Registrar ID\",\"identifier\":\"292\"}],\"networks\":null,\"autnums\":null,\"nicbr_domainCount\":0,\"nicbr_inetCount\":0,\"nicbr_autnumCount\":0,\"url\":null,\"contact_URI\":null}],\"remarks\":[],\"links\":[{\"value\":\"https://rdap.markmonitor.com/rdap/domain/yahoo.com\",\"rel\":\"self\",\"href\":\"https://rdap.markmonitor.com/rdap/domain/yahoo.com\",\"hreflang\":null,\"title\":null,\"media\":null,\"type\":\"application/rdap+json\"}],\"nameservers\":[{\"rdapConformance\":[],\"objectClassName\":\"nameserver\",\"handle\":null,\"port43\":null,\"lang\":null,\"events\":[{\"eventAction\":\"last changed\",\"eventDate\":\"2013-07-11T16:30:20Z\",\"eventActor\":null,\"status\":[]}],\"notices\":[],\"status\":[\"active\"],\"entities\":[],\"remarks\":[],\"links\":[],\"nameservers\":[],\"entity\":null,\"legalRepresentative\":null,\"errorCode\":null,\"errorTitle\":null,\"errorDescription\":[],\"ldhName\":\"ns1.yahoo.com\",\"unicodeName\":null,\"variants\":[],\"secureDNS\":null,\"publicIds\":[],\"network\":null,\"nicbr_arbitration\":false,\"delegate\":null,\"ipAddresses\":null,\"switch_name\":null,\"switch_aceString\":null},{\"rdapConformance\":[],\"objectClassName\":\"nameserver\",\"handle\":null,\"port43\":null,\"lang\":null,\"events\":[{\"eventAction\":\"last changed\",\"eventDate\":\"2013-07-11T16:30:20Z\",\"eventActor\":null,\"status\":[]}],\"notices\":[],\"status\":[\"active\"],\"entities\":[],\"remarks\":[],\"links\":[],\"nameservers\":[],\"entity\":null,\"legalRepresentative\":null,\"errorCode\":null,\"errorTitle\":null,\"errorDescription\":[],\"ldhName\":\"ns2.yahoo.com\",\"unicodeName\":null,\"variants\":[],\"secureDNS\":null,\"publicIds\":[],\"network\":null,\"nicbr_arbitration\":false,\"delegate\":null,\"ipAddresses\":null,\"switch_name\":null,\"switch_aceString\":null},{\"rdapConformance\":[],\"objectClassName\":\"nameserver\",\"handle\":null,\"port43\":null,\"lang\":null,\"events\":[{\"eventAction\":\"last changed\",\"eventDate\":\"2013-07-11T16:30:20Z\",\"eventActor\":null,\"status\":[]}],\"notices\":[],\"status\":[\"active\"],\"entities\":[],\"remarks\":[],\"links\":[],\"nameservers\":[],\"entity\":null,\"legalRepresentative\":null,\"errorCode\":null,\"errorTitle\":null,\"errorDescription\":[],\"ldhName\":\"ns3.yahoo.com\",\"unicodeName\":null,\"variants\":[],\"secureDNS\":null,\"publicIds\":[],\"network\":null,\"nicbr_arbitration\":false,\"delegate\":null,\"ipAddresses\":null,\"switch_name\":null,\"switch_aceString\":null},{\"rdapConformance\":[],\"objectClassName\":\"nameserver\",\"handle\":null,\"port43\":null,\"lang\":null,\"events\":[{\"eventAction\":\"last changed\",\"eventDate\":\"2013-07-11T16:30:20Z\",\"eventActor\":null,\"status\":[]}],\"notices\":[],\"status\":[\"active\"],\"entities\":[],\"remarks\":[],\"links\":[],\"nameservers\":[],\"entity\":null,\"legalRepresentative\":null,\"errorCode\":null,\"errorTitle\":null,\"errorDescription\":[],\"ldhName\":\"ns4.yahoo.com\",\"unicodeName\":null,\"variants\":[],\"secureDNS\":null,\"publicIds\":[],\"network\":null,\"nicbr_arbitration\":false,\"delegate\":null,\"ipAddresses\":null,\"switch_name\":null,\"switch_aceString\":null},{\"rdapConformance\":[],\"objectClassName\":\"nameserver\",\"handle\":null,\"port43\":null,\"lang\":null,\"events\":[{\"eventAction\":\"last changed\",\"eventDate\":\"2013-07-11T16:30:20Z\",\"eventActor\":null,\"status\":[]}],\"notices\":[],\"status\":[\"active\"],\"entities\":[],\"remarks\":[],\"links\":[],\"nameservers\":[],\"entity\":null,\"legalRepresentative\":null,\"errorCode\":null,\"errorTitle\":null,\"errorDescription\":[],\"ldhName\":\"ns5.yahoo.com\",\"unicodeName\":null,\"variants\":[],\"secureDNS\":null,\"publicIds\":[],\"network\":null,\"nicbr_arbitration\":false,\"delegate\":null,\"ipAddresses\":null,\"switch_name\":null,\"switch_aceString\":null}],\"entity\":null,\"legalRepresentative\":null,\"errorCode\":null,\"errorTitle\":null,\"errorDescription\":[],\"ldhName\":\"yahoo.com\",\"unicodeName\":null,\"variants\":[],\"secureDNS\":{\"zoneSigned\":null,\"delegationSigned\":false,\"maxSigLife\":null,\"dsData\":[],\"keyData\":[]},\"publicIds\":[],\"network\":null,\"nicbr_arbitration\":false,\"delegate\":null,\"switch_name\":null,\"switch_aceString\":null},\"switch_name\":null,\"switch_aceString\":null}", "raw": "Registrar: \n  Handle: 3643624_DOMAIN_COM-VRSN\n  LDH Name: yahoo.com\n  Nameserver: \n    LDH Name: ns1.yahoo.com\n    Event: \n      Action: last changed\n      Date: 2013-07-11T16:30:20Z\n      Status: active\n  Nameserver: \n    LDH Name: ns2.yahoo.com\n    Event: \n      Action: last changed\n      Date: 2013-07-11T16:30:20Z\n      Status: active\n  Nameserver: \n    LDH Name: ns3.yahoo.com\n    Event: \n      Action: last changed\n      Date: 2013-07-11T16:30:20Z\n      Status: active\n  Nameserver: \n    LDH Name: ns4.yahoo.com\n    Event: \n      Action: last changed\n      Date: 2013-07-11T16:30:20Z\n      Status: active\n  Nameserver: \n    LDH Name: ns5.yahoo.com\n    Event: \n      Action: last changed\n      Date: 2013-07-11T16:30:20Z\n      Status: active\n  SecureDNS: \n    Delegation Signed: false\n  Event: \n    Action: expiration\n    Date: 2023-01-19T05:00:00Z\n  Event: \n    Action: registration\n    Date: 1995-01-18T08:00:00Z\n  Event: \n    Action: last update\n    Date: 2021-10-29T18:27:20Z\n  Event: \n    Action: last update of RDAP database\n    Date: 2021-10-30T06:33:48Z\n  Status: \n    client update prohibited\n    client transfer prohibited\n    client delete prohibited\n    server update prohibited\n    server transfer prohibited\n    server delete prohibited\n  Entity: \n    Role: \n      ADMIN\n    VCard: \n      Address: \n          Region: VA\n          Country: US\n    Event: \n      Action: last update\n      Date: 2020-02-10T16:17:04Z\n    Remark: \n      Title: REDACTED FOR PRIVACY\n      Type: Object truncated due to authorization\n        Description: Some of the data in this object has been removed.\n  Entity: \n    Role: \n      REGISTRANT\n    VCard: \n          Organization: Verizon Media Inc.\n          TYPE: work\n      Address: \n          Region: VA\n          Country: US\n    Event: \n      Action: last update\n      Date: 2020-02-10T16:17:04Z\n    Remark: \n      Title: REDACTED FOR PRIVACY\n      Type: Object truncated due to authorization\n        Description: Some of the data in this object has been removed.\n  Entity: \n    Role: \n      TECHNICAL\n    VCard: \n      Address: \n          Region: VA\n          Country: US\n    Event: \n      Action: last update\n      Date: 2020-02-10T16:17:04Z\n    Remark: \n      Title: REDACTED FOR PRIVACY\n      Type: Object truncated due to authorization\n        Description: Some of the data in this object has been removed.\n  Entity: \n    Handle: 292\n    Role: \n      REGISTRAR\n    VCard: \n          Organization: MarkMonitor Inc.\n          TYPE: work\n      Address: \n          Street: 3540 E Longwing Ln\n          Locale: Meridian\n          Region: ID\n          Postal Code: 83646\n          Country: US\n    Event: \n      Action: registrar expiration\n      Date: 2020-09-14T04:00:00Z\n    Entity: \n      Role: \n        ABUSE\n      VCard: \n        Email: abusecomplaints@markmonitor.com\n            TYPE: work\n        Telephone: +1.2083895770\n            TYPE: voice\n  Link: \n    Rel: self\n    Value: https://rdap.markmonitor.com/rdap/domain/yahoo.com\n    Type: application/rdap+json\n    Href: https://rdap.markmonitor.com/rdap/domain/yahoo.com\n  Notice: \n    Title: Terms of Use\n    Description: \n      By submitting an RDAP query, you agree that you will use this data only for\n      lawful purposes and that, under no circumstances will you use this data to:\n      (1) allow, enable, or otherwise support the transmission by email, telephone,\n      or facsimile of mass, unsolicited, commercial advertising, or spam; or\n      (2) enable high volume, automated, or electronic processes that send queries,\n      data, or email to MarkMonitor (or its systems) or the domain name contacts (or\n      its systems).\n      MarkMonitor reserves the right to modify these terms at any time.\n      By submitting this query, you agree to abide by this policy.\n      MarkMonitor Domain Management(TM)\n      Protecting companies and consumers in a digital world.\n      Visit MarkMonitor at https://www.markmonitor.com\n      Contact us at +1.8007459229\n      In Europe, at +44.02032062220\n      Link: \n        Rel: related\n        Value: https://www.markmonitor.com/legal/domain-management-terms-and-conditions\n        Type: text/html\n        Href: https://www.markmonitor.com/legal/domain-management-terms-and-conditions\n  Notice: \n    Title: Status Codes\n      Description: For more information on domain status codes, please visit https://icann.org/epp.\n      Link: \n        Rel: related\n        Value: https://icann.org/epp\n        Type: text/html\n        Href: https://icann.org/epp\n  Notice: \n    Title: RDDS Inaccuracy Complaint Form\n      Description: URL of the ICANN RDDS Inaccuracy Complaint Form: https://www.icann.org/wicf.\n      Link: \n        Rel: related\n        Value: https://www.icann.org/wicf\n        Type: text/html\n        Href: https://www.icann.org/wicf\n  RDAP Conformance: \n    rdap_level_0\n    icann_rdap_technical_implementation_guide_0\n    icann_rdap_response_profile_0\n\n\n  Registry: \n    Handle: 3643624_DOMAIN_COM-VRSN\n    LDH Name: YAHOO.COM\n    Nameserver: \n      LDH Name: NS1.YAHOO.COM\n    Nameserver: \n      LDH Name: NS2.YAHOO.COM\n    Nameserver: \n      LDH Name: NS3.YAHOO.COM\n    Nameserver: \n      LDH Name: NS4.YAHOO.COM\n    Nameserver: \n      LDH Name: NS5.YAHOO.COM\n    SecureDNS: \n      Delegation Signed: false\n    Event: \n      Action: registration\n      Date: 1995-01-18T05:00:00Z\n    Event: \n      Action: expiration\n      Date: 2023-01-19T05:00:00Z\n    Event: \n      Action: last update of RDAP database\n      Date: 2021-10-30T09:21:44Z\n    Status: \n      client delete prohibited\n      client transfer prohibited\n      client update prohibited\n      server delete prohibited\n      server transfer prohibited\n      server update prohibited\n    Entity: \n      Handle: 292\n      Role: \n        REGISTRAR\n      VCard: \n        Formatted Name: MarkMonitor Inc.\n      Entity: \n        Role: \n          ABUSE\n        VCard: \n          Formatted Name: \n              TYPE: voice\n          Email: abusecomplaints@markmonitor.com\n    Link: \n      Rel: self\n      Value: https://rdap.verisign.com/com/v1/domain/YAHOO.COM\n      Type: application/rdap+json\n      Href: https://rdap.verisign.com/com/v1/domain/YAHOO.COM\n    Link: \n      Rel: related\n      Value: https://rdap.markmonitor.com/rdap/domain/YAHOO.COM\n      Type: application/rdap+json\n      Href: https://rdap.markmonitor.com/rdap/domain/YAHOO.COM\n    Notice: \n      Title: Terms of Use\n        Description: Service subject to Terms of Use.\n        Link: \n          Type: text/html\n          Href: https://www.verisign.com/domain-names/registration-data-access-protocol/terms-service/index.xhtml\n    Notice: \n      Title: Status Codes\n        Description: For more information on domain status codes, please visit https://icann.org/epp\n        Link: \n          Type: text/html\n          Href: https://icann.org/epp\n    Notice: \n      Title: RDDS Inaccuracy Complaint Form\n        Description: URL of the ICANN RDDS Inaccuracy Complaint Form: https://icann.org/wicf\n        Link: \n          Type: text/html\n          Href: https://icann.org/wicf\n    RDAP Conformance: \n      rdap_level_0\n      icann_rdap_technical_implementation_guide_0\n      icann_rdap_response_profile_0\n", "whoisRawID": 0, "source": "WHOIS_RDAP", "match_whitelist": {"domain": true}}, "registrarUpdatedAt": 1635532040, "whoisID": 6860101631334753875, "registrarIanaID": 292, "registrarName": "MarkMonitor Inc.", "admin": {"country": "US", "address": "VA\nUS\n", "whoisContactID": 0, "state": "VA", "id": 0}, "whoisServer": "rdap.markmonitor.com", "createdAt": 1635575683, "expired": false, "contactOrganizations": ["Verizon Media Inc.", "MarkMonitor Inc."], "registrarParseCode": 44323, "auditUpdatedAt": 1638650271, "id": 6860101631334753875, "registrarPhone": "+1.2083895740", "updatedAt": 1640917526, "domainUnicode": "yahoo.com", "auditCreatedAt": 1635575683, "registrarExpiresAt": 1674104400, "contactCountries": ["US"], "compositeParseCode": 44323, "contactEmails": ["abusecomplaints@markmonitor.com"], "registrarEmail": "abusecomplaints@markmonitor.com", "domainStatus": "client update prohibited,client transfer prohibited,client delete prohibited,server update prohibited,server transfer prohibited,server delete prohibited", "tld": "com", "domainAvailable": false, "registrarCreatedAt": 790416000, "noRecord": false, "nameservers": ["ns1.yahoo.com", "ns2.yahoo.com", "ns3.yahoo.com", "ns4.yahoo.com", "ns5.yahoo.com"], "domain": "yahoo.com", "registrant": {"country": "US", "address": "VA\nUS\n", "whoisContactID": 0, "organization": "Verizon Media Inc.", "state": "VA", "id": 0}, "contactNames": [], "contacts": [{"country": "US", "address": "VA\nUS\n", "whoisContactID": 0, "organization": "Verizon Media Inc.", "state": "VA", "id": 0}, {"country": "US", "address": "VA\nUS\n", "whoisContactID": 0, "state": "VA", "id": 0}, {"zip": "83646", "country": "US", "address": "3540 E Longwing Ln\nMeridian\n83646\nID\nUS\n", "city": "Meridian", "whoisContactID": 0, "street": "3540 E Longwing Ln", "organization": "MarkMonitor Inc.", "state": "ID", "id": 0}, {"address": "", "phone": "+1.2083895770", "whoisContactID": 0, "id": 0, "email": "abusecomplaints@markmonitor.com"}], "status": "INACTIVE", "domainMd5": "50cd1a9a183758039b0841aa738c3f0b", "task_id": "5a2b314bf3a840738832c07a2ab90a9a", "match_whitelist": {"domain": true}}, {"abuse": {"address": "", "phone": "+1.2083895770", "whoisContactID": 0, "id": 0, "email": "abusecomplaints@markmonitor.com"}, "technical": {"country": "US", "address": "VA\nUS\n", "whoisContactID": 0, "state": "VA", "id": 0}, "registrar": {"zip": "83646", "country": "US", "address": "3540 E Longwing Ln\nMeridian\n83646\nID\nUS\n", "city": "Meridian", "whoisContactID": 0, "street": "3540 E Longwing Ln", "organization": "MarkMonitor Inc.", "state": "ID", "id": 0}, "rawResponse": {"domain": "yahoo.com", "whoisID": 6851230467762048625, "unparsed": "{\"rdapConformance\":[\"rdap_level_0\",\"icann_rdap_technical_implementation_guide_0\",\"icann_rdap_response_profile_0\"],\"objectClassName\":\"domain\",\"handle\":\"3643624_DOMAIN_COM-VRSN\",\"port43\":null,\"lang\":null,\"events\":[{\"eventAction\":\"registration\",\"eventDate\":\"1995-01-18T05:00:00Z\",\"eventActor\":null,\"status\":[]},{\"eventAction\":\"expiration\",\"eventDate\":\"2023-01-19T05:00:00Z\",\"eventActor\":null,\"status\":[]},{\"eventAction\":\"last update of RDAP database\",\"eventDate\":\"2021-10-05T09:39:28Z\",\"eventActor\":null,\"status\":[]}],\"notices\":[{\"title\":\"Terms of Use\",\"type\":null,\"description\":[\"Service subject to Terms of Use.\"],\"links\":[{\"value\":null,\"rel\":null,\"href\":\"https://www.verisign.com/domain-names/registration-data-access-protocol/terms-service/index.xhtml\",\"hreflang\":null,\"title\":null,\"media\":null,\"type\":\"text/html\"}]},{\"title\":\"Status Codes\",\"type\":null,\"description\":[\"For more information on domain status codes, please visit https://icann.org/epp\"],\"links\":[{\"value\":null,\"rel\":null,\"href\":\"https://icann.org/epp\",\"hreflang\":null,\"title\":null,\"media\":null,\"type\":\"text/html\"}]},{\"title\":\"RDDS Inaccuracy Complaint Form\",\"type\":null,\"description\":[\"URL of the ICANN RDDS Inaccuracy Complaint Form: https://icann.org/wicf\"],\"links\":[{\"value\":null,\"rel\":null,\"href\":\"https://icann.org/wicf\",\"hreflang\":null,\"title\":null,\"media\":null,\"type\":\"text/html\"}]}],\"status\":[\"client delete prohibited\",\"client transfer prohibited\",\"client update prohibited\",\"server delete prohibited\",\"server transfer prohibited\",\"server update prohibited\"],\"entities\":[{\"rdapConformance\":[],\"objectClassName\":\"entity\",\"handle\":\"292\",\"port43\":null,\"lang\":null,\"events\":[],\"notices\":[],\"status\":[],\"entities\":[{\"rdapConformance\":[],\"objectClassName\":\"entity\",\"handle\":null,\"port43\":null,\"lang\":null,\"events\":[],\"notices\":[],\"status\":[],\"entities\":[],\"remarks\":[],\"links\":[],\"nameservers\":[],\"entity\":null,\"legalRepresentative\":null,\"errorCode\":null,\"errorTitle\":null,\"errorDescription\":[],\"vcardArray\":[\"vcard\",[[\"version\",{},\"text\",\"4.0\"],[\"fn\",{},\"text\",\"\"],[\"tel\",{\"type\":\"voice\"},\"uri\",\"tel:+1.2083895740\"],[\"email\",{},\"text\",\"abusecomplaints@markmonitor.com\"]]],\"roles\":[\"abuse\"],\"publicIds\":[],\"networks\":null,\"autnums\":null,\"nicbr_domainCount\":0,\"nicbr_inetCount\":0,\"nicbr_autnumCount\":0,\"url\":null,\"contact_URI\":null}],\"remarks\":[],\"links\":[],\"nameservers\":[],\"entity\":null,\"legalRepresentative\":null,\"errorCode\":null,\"errorTitle\":null,\"errorDescription\":[],\"vcardArray\":[\"vcard\",[[\"version\",{},\"text\",\"4.0\"],[\"fn\",{},\"text\",\"MarkMonitor Inc.\"]]],\"roles\":[\"registrar\"],\"publicIds\":[{\"type\":\"IANA Registrar ID\",\"identifier\":\"292\"}],\"networks\":null,\"autnums\":null,\"nicbr_domainCount\":0,\"nicbr_inetCount\":0,\"nicbr_autnumCount\":0,\"url\":null,\"contact_URI\":null}],\"remarks\":[],\"links\":[{\"value\":\"https://rdap.verisign.com/com/v1/domain/YAHOO.COM\",\"rel\":\"self\",\"href\":\"https://rdap.verisign.com/com/v1/domain/YAHOO.COM\",\"hreflang\":null,\"title\":null,\"media\":null,\"type\":\"application/rdap+json\"},{\"value\":\"https://rdap.markmonitor.com/rdap/domain/YAHOO.COM\",\"rel\":\"related\",\"href\":\"https://rdap.markmonitor.com/rdap/domain/YAHOO.COM\",\"hreflang\":null,\"title\":null,\"media\":null,\"type\":\"application/rdap+json\"}],\"nameservers\":[{\"rdapConformance\":[],\"objectClassName\":\"nameserver\",\"handle\":null,\"port43\":null,\"lang\":null,\"events\":[],\"notices\":[],\"status\":[],\"entities\":[],\"remarks\":[],\"links\":[],\"nameservers\":[],\"entity\":null,\"legalRepresentative\":null,\"errorCode\":null,\"errorTitle\":null,\"errorDescription\":[],\"ldhName\":\"NS1.YAHOO.COM\",\"unicodeName\":null,\"variants\":[],\"secureDNS\":null,\"publicIds\":[],\"network\":null,\"nicbr_arbitration\":false,\"delegate\":null,\"ipAddresses\":null,\"switch_name\":null,\"switch_aceString\":null},{\"rdapConformance\":[],\"objectClassName\":\"nameserver\",\"handle\":null,\"port43\":null,\"lang\":null,\"events\":[],\"notices\":[],\"status\":[],\"entities\":[],\"remarks\":[],\"links\":[],\"nameservers\":[],\"entity\":null,\"legalRepresentative\":null,\"errorCode\":null,\"errorTitle\":null,\"errorDescription\":[],\"ldhName\":\"NS2.YAHOO.COM\",\"unicodeName\":null,\"variants\":[],\"secureDNS\":null,\"publicIds\":[],\"network\":null,\"nicbr_arbitration\":false,\"delegate\":null,\"ipAddresses\":null,\"switch_name\":null,\"switch_aceString\":null},{\"rdapConformance\":[],\"objectClassName\":\"nameserver\",\"handle\":null,\"port43\":null,\"lang\":null,\"events\":[],\"notices\":[],\"status\":[],\"entities\":[],\"remarks\":[],\"links\":[],\"nameservers\":[],\"entity\":null,\"legalRepresentative\":null,\"errorCode\":null,\"errorTitle\":null,\"errorDescription\":[],\"ldhName\":\"NS3.YAHOO.COM\",\"unicodeName\":null,\"variants\":[],\"secureDNS\":null,\"publicIds\":[],\"network\":null,\"nicbr_arbitration\":false,\"delegate\":null,\"ipAddresses\":null,\"switch_name\":null,\"switch_aceString\":null},{\"rdapConformance\":[],\"objectClassName\":\"nameserver\",\"handle\":null,\"port43\":null,\"lang\":null,\"events\":[],\"notices\":[],\"status\":[],\"entities\":[],\"remarks\":[],\"links\":[],\"nameservers\":[],\"entity\":null,\"legalRepresentative\":null,\"errorCode\":null,\"errorTitle\":null,\"errorDescription\":[],\"ldhName\":\"NS4.YAHOO.COM\",\"unicodeName\":null,\"variants\":[],\"secureDNS\":null,\"publicIds\":[],\"network\":null,\"nicbr_arbitration\":false,\"delegate\":null,\"ipAddresses\":null,\"switch_name\":null,\"switch_aceString\":null},{\"rdapConformance\":[],\"objectClassName\":\"nameserver\",\"handle\":null,\"port43\":null,\"lang\":null,\"events\":[],\"notices\":[],\"status\":[],\"entities\":[],\"remarks\":[],\"links\":[],\"nameservers\":[],\"entity\":null,\"legalRepresentative\":null,\"errorCode\":null,\"errorTitle\":null,\"errorDescription\":[],\"ldhName\":\"NS5.YAHOO.COM\",\"unicodeName\":null,\"variants\":[],\"secureDNS\":null,\"publicIds\":[],\"network\":null,\"nicbr_arbitration\":false,\"delegate\":null,\"ipAddresses\":null,\"switch_name\":null,\"switch_aceString\":null}],\"entity\":null,\"legalRepresentative\":null,\"errorCode\":null,\"errorTitle\":null,\"errorDescription\":[],\"ldhName\":\"YAHOO.COM\",\"unicodeName\":null,\"variants\":[],\"secureDNS\":{\"zoneSigned\":null,\"delegationSigned\":false,\"maxSigLife\":null,\"dsData\":[],\"keyData\":[]},\"publicIds\":[],\"network\":null,\"nicbr_arbitration\":false,\"delegate\":{\"rdapConformance\":[\"rdap_level_0\",\"icann_rdap_technical_implementation_guide_0\",\"icann_rdap_response_profile_0\"],\"objectClassName\":\"domain\",\"handle\":\"3643624_DOMAIN_COM-VRSN\",\"port43\":\"whois.markmonitor.com\",\"lang\":null,\"events\":[{\"eventAction\":\"expiration\",\"eventDate\":\"2023-01-19T05:00:00Z\",\"eventActor\":null,\"status\":[]},{\"eventAction\":\"registration\",\"eventDate\":\"1995-01-18T08:00:00Z\",\"eventActor\":null,\"status\":[]},{\"eventAction\":\"last update\",\"eventDate\":\"2021-09-28T14:28:27Z\",\"eventActor\":null,\"status\":[]},{\"eventAction\":\"last update of RDAP database\",\"eventDate\":\"2021-10-05T19:03:26Z\",\"eventActor\":null,\"status\":[]}],\"notices\":[{\"title\":\"Terms of Use\",\"type\":null,\"description\":[\"By submitting an RDAP query, you agree that you will use this data only for\",\"lawful purposes and that, under no circumstances will you use this data to:\",\"(1) allow, enable, or otherwise support the transmission by email, telephone,\",\"or facsimile of mass, unsolicited, commercial advertising, or spam; or\",\"(2) enable high volume, automated, or electronic processes that send queries,\",\"data, or email to MarkMonitor (or its systems) or the domain name contacts (or\",\"its systems).\",\"MarkMonitor reserves the right to modify these terms at any time.\",\"By submitting this query, you agree to abide by this policy.\",\"MarkMonitor Domain Management(TM)\",\"Protecting companies and consumers in a digital world.\",\"Visit MarkMonitor at https://www.markmonitor.com\",\"Contact us at +1.8007459229\",\"In Europe, at +44.02032062220\"],\"links\":[{\"value\":\"https://www.markmonitor.com/legal/domain-management-terms-and-conditions\",\"rel\":\"related\",\"href\":\"https://www.markmonitor.com/legal/domain-management-terms-and-conditions\",\"hreflang\":null,\"title\":null,\"media\":null,\"type\":\"text/html\"}]},{\"title\":\"Status Codes\",\"type\":null,\"description\":[\"For more information on domain status codes, please visit https://icann.org/epp.\"],\"links\":[{\"value\":\"https://icann.org/epp\",\"rel\":\"related\",\"href\":\"https://icann.org/epp\",\"hreflang\":null,\"title\":null,\"media\":null,\"type\":\"text/html\"}]},{\"title\":\"RDDS Inaccuracy Complaint Form\",\"type\":null,\"description\":[\"URL of the ICANN RDDS Inaccuracy Complaint Form: https://www.icann.org/wicf.\"],\"links\":[{\"value\":\"https://www.icann.org/wicf\",\"rel\":\"related\",\"href\":\"https://www.icann.org/wicf\",\"hreflang\":null,\"title\":null,\"media\":null,\"type\":\"text/html\"}]}],\"status\":[\"client update prohibited\",\"client transfer prohibited\",\"client delete prohibited\",\"server update prohibited\",\"server transfer prohibited\",\"server delete prohibited\"],\"entities\":[{\"rdapConformance\":[],\"objectClassName\":\"entity\",\"handle\":null,\"port43\":null,\"lang\":null,\"events\":[{\"eventAction\":\"last update\",\"eventDate\":\"2020-02-10T16:17:04Z\",\"eventActor\":null,\"status\":[]}],\"notices\":[],\"status\":[],\"entities\":[],\"remarks\":[{\"title\":\"REDACTED FOR PRIVACY\",\"description\":[\"Some of the data in this object has been removed.\"],\"type\":\"Object truncated due to authorization\",\"links\":null}],\"links\":[],\"nameservers\":[],\"entity\":null,\"legalRepresentative\":null,\"errorCode\":null,\"errorTitle\":null,\"errorDescription\":[],\"vcardArray\":[\"vcard\",[[\"version\",{},\"text\",\"4.0\"],[\"adr\",{},\"text\",[\"\",\"\",\"\",\"\",\"VA\",\"\",\"US\"]]]],\"roles\":[\"admin\"],\"publicIds\":[],\"networks\":null,\"autnums\":null,\"nicbr_domainCount\":0,\"nicbr_inetCount\":0,\"nicbr_autnumCount\":0,\"url\":null,\"contact_URI\":\"https://domains.markmonitor.com/whois/\"},{\"rdapConformance\":[],\"objectClassName\":\"entity\",\"handle\":null,\"port43\":null,\"lang\":null,\"events\":[{\"eventAction\":\"last update\",\"eventDate\":\"2020-02-10T16:17:04Z\",\"eventActor\":null,\"status\":[]}],\"notices\":[],\"status\":[],\"entities\":[],\"remarks\":[{\"title\":\"REDACTED FOR PRIVACY\",\"description\":[\"Some of the data in this object has been removed.\"],\"type\":\"Object truncated due to authorization\",\"links\":null}],\"links\":[],\"nameservers\":[],\"entity\":null,\"legalRepresentative\":null,\"errorCode\":null,\"errorTitle\":null,\"errorDescription\":[],\"vcardArray\":[\"vcard\",[[\"version\",{},\"text\",\"4.0\"],[\"org\",{\"type\":\"work\"},\"text\",\"Verizon Media Inc.\"],[\"adr\",{},\"text\",[\"\",\"\",\"\",\"\",\"VA\",\"\",\"US\"]]]],\"roles\":[\"registrant\"],\"publicIds\":[],\"networks\":null,\"autnums\":null,\"nicbr_domainCount\":0,\"nicbr_inetCount\":0,\"nicbr_autnumCount\":0,\"url\":null,\"contact_URI\":\"https://domains.markmonitor.com/whois/\"},{\"rdapConformance\":[],\"objectClassName\":\"entity\",\"handle\":null,\"port43\":null,\"lang\":null,\"events\":[{\"eventAction\":\"last update\",\"eventDate\":\"2020-02-10T16:17:04Z\",\"eventActor\":null,\"status\":[]}],\"notices\":[],\"status\":[],\"entities\":[],\"remarks\":[{\"title\":\"REDACTED FOR PRIVACY\",\"description\":[\"Some of the data in this object has been removed.\"],\"type\":\"Object truncated due to authorization\",\"links\":null}],\"links\":[],\"nameservers\":[],\"entity\":null,\"legalRepresentative\":null,\"errorCode\":null,\"errorTitle\":null,\"errorDescription\":[],\"vcardArray\":[\"vcard\",[[\"version\",{},\"text\",\"4.0\"],[\"adr\",{},\"text\",[\"\",\"\",\"\",\"\",\"VA\",\"\",\"US\"]]]],\"roles\":[\"technical\"],\"publicIds\":[],\"networks\":null,\"autnums\":null,\"nicbr_domainCount\":0,\"nicbr_inetCount\":0,\"nicbr_autnumCount\":0,\"url\":null,\"contact_URI\":\"https://domains.markmonitor.com/whois/\"},{\"rdapConformance\":[],\"objectClassName\":\"entity\",\"handle\":\"292\",\"port43\":null,\"lang\":null,\"events\":[{\"eventAction\":\"registrar expiration\",\"eventDate\":\"2020-09-14T04:00:00Z\",\"eventActor\":null,\"status\":[]}],\"notices\":[],\"status\":[],\"entities\":[{\"rdapConformance\":[],\"objectClassName\":\"entity\",\"handle\":null,\"port43\":null,\"lang\":null,\"events\":[],\"notices\":[],\"status\":[],\"entities\":[],\"remarks\":[],\"links\":[],\"nameservers\":[],\"entity\":null,\"legalRepresentative\":null,\"errorCode\":null,\"errorTitle\":null,\"errorDescription\":[],\"vcardArray\":[\"vcard\",[[\"version\",{},\"text\",\"4.0\"],[\"email\",{\"type\":\"work\"},\"text\",\"abusecomplaints@markmonitor.com\"],[\"tel\",{\"type\":\"voice\"},\"text\",\"+1.2083895770\"]]],\"roles\":[\"abuse\"],\"publicIds\":[],\"networks\":null,\"autnums\":null,\"nicbr_domainCount\":0,\"nicbr_inetCount\":0,\"nicbr_autnumCount\":0,\"url\":null,\"contact_URI\":null}],\"remarks\":[],\"links\":[],\"nameservers\":[],\"entity\":null,\"legalRepresentative\":null,\"errorCode\":null,\"errorTitle\":null,\"errorDescription\":[],\"vcardArray\":[\"vcard\",[[\"version\",{},\"text\",\"4.0\"],[\"org\",{\"type\":\"work\"},\"text\",\"MarkMonitor Inc.\"],[\"adr\",{},\"text\",[\"\",\"\",\"3540 E Longwing Ln\",\"Meridian\",\"ID\",\"83646\",\"US\"]]]],\"roles\":[\"registrar\"],\"publicIds\":[{\"type\":\"IANA Registrar ID\",\"identifier\":\"292\"}],\"networks\":null,\"autnums\":null,\"nicbr_domainCount\":0,\"nicbr_inetCount\":0,\"nicbr_autnumCount\":0,\"url\":null,\"contact_URI\":null}],\"remarks\":[],\"links\":[{\"value\":\"https://rdap.markmonitor.com/rdap/domain/yahoo.com\",\"rel\":\"self\",\"href\":\"https://rdap.markmonitor.com/rdap/domain/yahoo.com\",\"hreflang\":null,\"title\":null,\"media\":null,\"type\":\"application/rdap+json\"}],\"nameservers\":[{\"rdapConformance\":[],\"objectClassName\":\"nameserver\",\"handle\":null,\"port43\":null,\"lang\":null,\"events\":[{\"eventAction\":\"last changed\",\"eventDate\":\"2013-07-11T16:30:20Z\",\"eventActor\":null,\"status\":[]}],\"notices\":[],\"status\":[\"active\"],\"entities\":[],\"remarks\":[],\"links\":[],\"nameservers\":[],\"entity\":null,\"legalRepresentative\":null,\"errorCode\":null,\"errorTitle\":null,\"errorDescription\":[],\"ldhName\":\"ns1.yahoo.com\",\"unicodeName\":null,\"variants\":[],\"secureDNS\":null,\"publicIds\":[],\"network\":null,\"nicbr_arbitration\":false,\"delegate\":null,\"ipAddresses\":null,\"switch_name\":null,\"switch_aceString\":null},{\"rdapConformance\":[],\"objectClassName\":\"nameserver\",\"handle\":null,\"port43\":null,\"lang\":null,\"events\":[{\"eventAction\":\"last changed\",\"eventDate\":\"2013-07-11T16:30:20Z\",\"eventActor\":null,\"status\":[]}],\"notices\":[],\"status\":[\"active\"],\"entities\":[],\"remarks\":[],\"links\":[],\"nameservers\":[],\"entity\":null,\"legalRepresentative\":null,\"errorCode\":null,\"errorTitle\":null,\"errorDescription\":[],\"ldhName\":\"ns2.yahoo.com\",\"unicodeName\":null,\"variants\":[],\"secureDNS\":null,\"publicIds\":[],\"network\":null,\"nicbr_arbitration\":false,\"delegate\":null,\"ipAddresses\":null,\"switch_name\":null,\"switch_aceString\":null},{\"rdapConformance\":[],\"objectClassName\":\"nameserver\",\"handle\":null,\"port43\":null,\"lang\":null,\"events\":[{\"eventAction\":\"last changed\",\"eventDate\":\"2013-07-11T16:30:20Z\",\"eventActor\":null,\"status\":[]}],\"notices\":[],\"status\":[\"active\"],\"entities\":[],\"remarks\":[],\"links\":[],\"nameservers\":[],\"entity\":null,\"legalRepresentative\":null,\"errorCode\":null,\"errorTitle\":null,\"errorDescription\":[],\"ldhName\":\"ns3.yahoo.com\",\"unicodeName\":null,\"variants\":[],\"secureDNS\":null,\"publicIds\":[],\"network\":null,\"nicbr_arbitration\":false,\"delegate\":null,\"ipAddresses\":null,\"switch_name\":null,\"switch_aceString\":null},{\"rdapConformance\":[],\"objectClassName\":\"nameserver\",\"handle\":null,\"port43\":null,\"lang\":null,\"events\":[{\"eventAction\":\"last changed\",\"eventDate\":\"2013-07-11T16:30:20Z\",\"eventActor\":null,\"status\":[]}],\"notices\":[],\"status\":[\"active\"],\"entities\":[],\"remarks\":[],\"links\":[],\"nameservers\":[],\"entity\":null,\"legalRepresentative\":null,\"errorCode\":null,\"errorTitle\":null,\"errorDescription\":[],\"ldhName\":\"ns4.yahoo.com\",\"unicodeName\":null,\"variants\":[],\"secureDNS\":null,\"publicIds\":[],\"network\":null,\"nicbr_arbitration\":false,\"delegate\":null,\"ipAddresses\":null,\"switch_name\":null,\"switch_aceString\":null},{\"rdapConformance\":[],\"objectClassName\":\"nameserver\",\"handle\":null,\"port43\":null,\"lang\":null,\"events\":[{\"eventAction\":\"last changed\",\"eventDate\":\"2013-07-11T16:30:20Z\",\"eventActor\":null,\"status\":[]}],\"notices\":[],\"status\":[\"active\"],\"entities\":[],\"remarks\":[],\"links\":[],\"nameservers\":[],\"entity\":null,\"legalRepresentative\":null,\"errorCode\":null,\"errorTitle\":null,\"errorDescription\":[],\"ldhName\":\"ns5.yahoo.com\",\"unicodeName\":null,\"variants\":[],\"secureDNS\":null,\"publicIds\":[],\"network\":null,\"nicbr_arbitration\":false,\"delegate\":null,\"ipAddresses\":null,\"switch_name\":null,\"switch_aceString\":null}],\"entity\":null,\"legalRepresentative\":null,\"errorCode\":null,\"errorTitle\":null,\"errorDescription\":[],\"ldhName\":\"yahoo.com\",\"unicodeName\":null,\"variants\":[],\"secureDNS\":{\"zoneSigned\":null,\"delegationSigned\":false,\"maxSigLife\":null,\"dsData\":[],\"keyData\":[]},\"publicIds\":[],\"network\":null,\"nicbr_arbitration\":false,\"delegate\":null,\"switch_name\":null,\"switch_aceString\":null},\"switch_name\":null,\"switch_aceString\":null}", "raw": "Registrar: \n  Handle: 3643624_DOMAIN_COM-VRSN\n  LDH Name: yahoo.com\n  Nameserver: \n    LDH Name: ns1.yahoo.com\n    Event: \n      Action: last changed\n      Date: 2013-07-11T16:30:20Z\n      Status: active\n  Nameserver: \n    LDH Name: ns2.yahoo.com\n    Event: \n      Action: last changed\n      Date: 2013-07-11T16:30:20Z\n      Status: active\n  Nameserver: \n    LDH Name: ns3.yahoo.com\n    Event: \n      Action: last changed\n      Date: 2013-07-11T16:30:20Z\n      Status: active\n  Nameserver: \n    LDH Name: ns4.yahoo.com\n    Event: \n      Action: last changed\n      Date: 2013-07-11T16:30:20Z\n      Status: active\n  Nameserver: \n    LDH Name: ns5.yahoo.com\n    Event: \n      Action: last changed\n      Date: 2013-07-11T16:30:20Z\n      Status: active\n  SecureDNS: \n    Delegation Signed: false\n  Event: \n    Action: expiration\n    Date: 2023-01-19T05:00:00Z\n  Event: \n    Action: registration\n    Date: 1995-01-18T08:00:00Z\n  Event: \n    Action: last update\n    Date: 2021-09-28T14:28:27Z\n  Event: \n    Action: last update of RDAP database\n    Date: 2021-10-05T19:03:26Z\n  Status: \n    client update prohibited\n    client transfer prohibited\n    client delete prohibited\n    server update prohibited\n    server transfer prohibited\n    server delete prohibited\n  Entity: \n    Role: \n      ADMIN\n    VCard: \n      Address: \n          Region: VA\n          Country: US\n    Event: \n      Action: last update\n      Date: 2020-02-10T16:17:04Z\n    Remark: \n      Title: REDACTED FOR PRIVACY\n      Type: Object truncated due to authorization\n        Description: Some of the data in this object has been removed.\n  Entity: \n    Role: \n      REGISTRANT\n    VCard: \n          Organization: Verizon Media Inc.\n          TYPE: work\n      Address: \n          Region: VA\n          Country: US\n    Event: \n      Action: last update\n      Date: 2020-02-10T16:17:04Z\n    Remark: \n      Title: REDACTED FOR PRIVACY\n      Type: Object truncated due to authorization\n        Description: Some of the data in this object has been removed.\n  Entity: \n    Role: \n      TECHNICAL\n    VCard: \n      Address: \n          Region: VA\n          Country: US\n    Event: \n      Action: last update\n      Date: 2020-02-10T16:17:04Z\n    Remark: \n      Title: REDACTED FOR PRIVACY\n      Type: Object truncated due to authorization\n        Description: Some of the data in this object has been removed.\n  Entity: \n    Handle: 292\n    Role: \n      REGISTRAR\n    VCard: \n          Organization: MarkMonitor Inc.\n          TYPE: work\n      Address: \n          Street: 3540 E Longwing Ln\n          Locale: Meridian\n          Region: ID\n          Postal Code: 83646\n          Country: US\n    Event: \n      Action: registrar expiration\n      Date: 2020-09-14T04:00:00Z\n    Entity: \n      Role: \n        ABUSE\n      VCard: \n        Email: abusecomplaints@markmonitor.com\n            TYPE: work\n        Telephone: +1.2083895770\n            TYPE: voice\n  Link: \n    Rel: self\n    Value: https://rdap.markmonitor.com/rdap/domain/yahoo.com\n    Type: application/rdap+json\n    Href: https://rdap.markmonitor.com/rdap/domain/yahoo.com\n  Notice: \n    Title: Terms of Use\n    Description: \n      By submitting an RDAP query, you agree that you will use this data only for\n      lawful purposes and that, under no circumstances will you use this data to:\n      (1) allow, enable, or otherwise support the transmission by email, telephone,\n      or facsimile of mass, unsolicited, commercial advertising, or spam; or\n      (2) enable high volume, automated, or electronic processes that send queries,\n      data, or email to MarkMonitor (or its systems) or the domain name contacts (or\n      its systems).\n      MarkMonitor reserves the right to modify these terms at any time.\n      By submitting this query, you agree to abide by this policy.\n      MarkMonitor Domain Management(TM)\n      Protecting companies and consumers in a digital world.\n      Visit MarkMonitor at https://www.markmonitor.com\n      Contact us at +1.8007459229\n      In Europe, at +44.02032062220\n      Link: \n        Rel: related\n        Value: https://www.markmonitor.com/legal/domain-management-terms-and-conditions\n        Type: text/html\n        Href: https://www.markmonitor.com/legal/domain-management-terms-and-conditions\n  Notice: \n    Title: Status Codes\n      Description: For more information on domain status codes, please visit https://icann.org/epp.\n      Link: \n        Rel: related\n        Value: https://icann.org/epp\n        Type: text/html\n        Href: https://icann.org/epp\n  Notice: \n    Title: RDDS Inaccuracy Complaint Form\n      Description: URL of the ICANN RDDS Inaccuracy Complaint Form: https://www.icann.org/wicf.\n      Link: \n        Rel: related\n        Value: https://www.icann.org/wicf\n        Type: text/html\n        Href: https://www.icann.org/wicf\n  RDAP Conformance: \n    rdap_level_0\n    icann_rdap_technical_implementation_guide_0\n    icann_rdap_response_profile_0\n\n\n  Registry: \n    Handle: 3643624_DOMAIN_COM-VRSN\n    LDH Name: YAHOO.COM\n    Nameserver: \n      LDH Name: NS1.YAHOO.COM\n    Nameserver: \n      LDH Name: NS2.YAHOO.COM\n    Nameserver: \n      LDH Name: NS3.YAHOO.COM\n    Nameserver: \n      LDH Name: NS4.YAHOO.COM\n    Nameserver: \n      LDH Name: NS5.YAHOO.COM\n    SecureDNS: \n      Delegation Signed: false\n    Event: \n      Action: registration\n      Date: 1995-01-18T05:00:00Z\n    Event: \n      Action: expiration\n      Date: 2023-01-19T05:00:00Z\n    Event: \n      Action: last update of RDAP database\n      Date: 2021-10-05T09:39:28Z\n    Status: \n      client delete prohibited\n      client transfer prohibited\n      client update prohibited\n      server delete prohibited\n      server transfer prohibited\n      server update prohibited\n    Entity: \n      Handle: 292\n      Role: \n        REGISTRAR\n      VCard: \n        Formatted Name: MarkMonitor Inc.\n      Entity: \n        Role: \n          ABUSE\n        VCard: \n          Formatted Name: \n              TYPE: voice\n          Email: abusecomplaints@markmonitor.com\n    Link: \n      Rel: self\n      Value: https://rdap.verisign.com/com/v1/domain/YAHOO.COM\n      Type: application/rdap+json\n      Href: https://rdap.verisign.com/com/v1/domain/YAHOO.COM\n    Link: \n      Rel: related\n      Value: https://rdap.markmonitor.com/rdap/domain/YAHOO.COM\n      Type: application/rdap+json\n      Href: https://rdap.markmonitor.com/rdap/domain/YAHOO.COM\n    Notice: \n      Title: Terms of Use\n        Description: Service subject to Terms of Use.\n        Link: \n          Type: text/html\n          Href: https://www.verisign.com/domain-names/registration-data-access-protocol/terms-service/index.xhtml\n    Notice: \n      Title: Status Codes\n        Description: For more information on domain status codes, please visit https://icann.org/epp\n        Link: \n          Type: text/html\n          Href: https://icann.org/epp\n    Notice: \n      Title: RDDS Inaccuracy Complaint Form\n        Description: URL of the ICANN RDDS Inaccuracy Complaint Form: https://icann.org/wicf\n        Link: \n          Type: text/html\n          Href: https://icann.org/wicf\n    RDAP Conformance: \n      rdap_level_0\n      icann_rdap_technical_implementation_guide_0\n      icann_rdap_response_profile_0\n", "whoisRawID": 0, "source": "WHOIS_RDAP", "match_whitelist": {"domain": true}}, "registrarUpdatedAt": 1632839307, "whoisID": 6851230467762048625, "registrarIanaID": 292, "registrarName": "MarkMonitor Inc.", "admin": {"country": "US", "address": "VA\nUS\n", "whoisContactID": 0, "state": "VA", "id": 0}, "whoisServer": "rdap.markmonitor.com", "createdAt": 1633460633, "expired": false, "contactOrganizations": ["Verizon Media Inc.", "MarkMonitor Inc."], "registrarParseCode": 44323, "auditUpdatedAt": 1634173941, "id": 6851230467762048625, "registrarPhone": "+1.2083895740", "updatedAt": 1635575683, "domainUnicode": "yahoo.com", "auditCreatedAt": 1633460633, "registrarExpiresAt": 1674104400, "contactCountries": ["US"], "compositeParseCode": 44323, "contactEmails": ["abusecomplaints@markmonitor.com"], "registrarEmail": "abusecomplaints@markmonitor.com", "domainStatus": "client update prohibited,client transfer prohibited,client delete prohibited,server update prohibited,server transfer prohibited,server delete prohibited", "tld": "com", "domainAvailable": false, "registrarCreatedAt": 790416000, "noRecord": false, "nameservers": ["ns1.yahoo.com", "ns2.yahoo.com", "ns3.yahoo.com", "ns4.yahoo.com", "ns5.yahoo.com"], "domain": "yahoo.com", "registrant": {"country": "US", "address": "VA\nUS\n", "whoisContactID": 0, "organization": "Verizon Media Inc.", "state": "VA", "id": 0}, "contactNames": [], "contacts": [{"country": "US", "address": "VA\nUS\n", "whoisContactID": 0, "organization": "Verizon Media Inc.", "state": "VA", "id": 0}, {"country": "US", "address": "VA\nUS\n", "whoisContactID": 0, "state": "VA", "id": 0}, {"zip": "83646", "country": "US", "address": "3540 E Longwing Ln\nMeridian\n83646\nID\nUS\n", "city": "Meridian", "whoisContactID": 0, "street": "3540 E Longwing Ln", "organization": "MarkMonitor Inc.", "state": "ID", "id": 0}, {"address": "", "phone": "+1.2083895770", "whoisContactID": 0, "id": 0, "email": "abusecomplaints@markmonitor.com"}], "status": "INACTIVE", "domainMd5": "50cd1a9a183758039b0841aa738c3f0b", "task_id": "f8781f7f6a2f4c7cb051e726ff818ad9", "match_whitelist": {"domain": true}}, {"abuse": {"address": "", "phone": "+1.2083895770", "whoisContactID": 0, "id": 0, "email": "abusecomplaints@markmonitor.com"}, "technical": {"country": "US", "address": "VA\nUS\n", "whoisContactID": 0, "state": "VA", "id": 0}, "registrar": {"zip": "83646", "country": "US", "address": "3540 E Longwing Ln\nMeridian\n83646\nID\nUS\n", "city": "Meridian", "whoisContactID": 0, "street": "3540 E Longwing Ln", "organization": "MarkMonitor Inc.", "state": "ID", "id": 0}, "rawResponse": {"domain": "yahoo.com", "whoisID": 6847634372883914188, "unparsed": "{\"rdapConformance\":[\"rdap_level_0\",\"icann_rdap_technical_implementation_guide_0\",\"icann_rdap_response_profile_0\"],\"objectClassName\":\"domain\",\"handle\":\"3643624_DOMAIN_COM-VRSN\",\"port43\":null,\"lang\":null,\"events\":[{\"eventAction\":\"registration\",\"eventDate\":\"1995-01-18T05:00:00Z\",\"eventActor\":null,\"status\":[]},{\"eventAction\":\"expiration\",\"eventDate\":\"2023-01-19T05:00:00Z\",\"eventActor\":null,\"status\":[]},{\"eventAction\":\"last update of RDAP database\",\"eventDate\":\"2021-09-25T09:21:47Z\",\"eventActor\":null,\"status\":[]}],\"notices\":[{\"title\":\"Terms of Use\",\"type\":null,\"description\":[\"Service subject to Terms of Use.\"],\"links\":[{\"value\":null,\"rel\":null,\"href\":\"https://www.verisign.com/domain-names/registration-data-access-protocol/terms-service/index.xhtml\",\"hreflang\":null,\"title\":null,\"media\":null,\"type\":\"text/html\"}]},{\"title\":\"Status Codes\",\"type\":null,\"description\":[\"For more information on domain status codes, please visit https://icann.org/epp\"],\"links\":[{\"value\":null,\"rel\":null,\"href\":\"https://icann.org/epp\",\"hreflang\":null,\"title\":null,\"media\":null,\"type\":\"text/html\"}]},{\"title\":\"RDDS Inaccuracy Complaint Form\",\"type\":null,\"description\":[\"URL of the ICANN RDDS Inaccuracy Complaint Form: https://icann.org/wicf\"],\"links\":[{\"value\":null,\"rel\":null,\"href\":\"https://icann.org/wicf\",\"hreflang\":null,\"title\":null,\"media\":null,\"type\":\"text/html\"}]}],\"status\":[\"client delete prohibited\",\"client transfer prohibited\",\"client update prohibited\",\"server delete prohibited\",\"server transfer prohibited\",\"server update prohibited\"],\"entities\":[{\"rdapConformance\":[],\"objectClassName\":\"entity\",\"handle\":\"292\",\"port43\":null,\"lang\":null,\"events\":[],\"notices\":[],\"status\":[],\"entities\":[{\"rdapConformance\":[],\"objectClassName\":\"entity\",\"handle\":null,\"port43\":null,\"lang\":null,\"events\":[],\"notices\":[],\"status\":[],\"entities\":[],\"remarks\":[],\"links\":[],\"nameservers\":[],\"entity\":null,\"legalRepresentative\":null,\"errorCode\":null,\"errorTitle\":null,\"errorDescription\":[],\"vcardArray\":[\"vcard\",[[\"version\",{},\"text\",\"4.0\"],[\"fn\",{},\"text\",\"\"],[\"tel\",{\"type\":\"voice\"},\"uri\",\"tel:+1.2083895740\"],[\"email\",{},\"text\",\"abusecomplaints@markmonitor.com\"]]],\"roles\":[\"abuse\"],\"publicIds\":[],\"networks\":null,\"autnums\":null,\"nicbr_domainCount\":0,\"nicbr_inetCount\":0,\"nicbr_autnumCount\":0,\"url\":null,\"contact_URI\":null}],\"remarks\":[],\"links\":[],\"nameservers\":[],\"entity\":null,\"legalRepresentative\":null,\"errorCode\":null,\"errorTitle\":null,\"errorDescription\":[],\"vcardArray\":[\"vcard\",[[\"version\",{},\"text\",\"4.0\"],[\"fn\",{},\"text\",\"MarkMonitor Inc.\"]]],\"roles\":[\"registrar\"],\"publicIds\":[{\"type\":\"IANA Registrar ID\",\"identifier\":\"292\"}],\"networks\":null,\"autnums\":null,\"nicbr_domainCount\":0,\"nicbr_inetCount\":0,\"nicbr_autnumCount\":0,\"url\":null,\"contact_URI\":null}],\"remarks\":[],\"links\":[{\"value\":\"https://rdap.verisign.com/com/v1/domain/YAHOO.COM\",\"rel\":\"self\",\"href\":\"https://rdap.verisign.com/com/v1/domain/YAHOO.COM\",\"hreflang\":null,\"title\":null,\"media\":null,\"type\":\"application/rdap+json\"},{\"value\":\"https://rdap.markmonitor.com/rdap/domain/YAHOO.COM\",\"rel\":\"related\",\"href\":\"https://rdap.markmonitor.com/rdap/domain/YAHOO.COM\",\"hreflang\":null,\"title\":null,\"media\":null,\"type\":\"application/rdap+json\"}],\"nameservers\":[{\"rdapConformance\":[],\"objectClassName\":\"nameserver\",\"handle\":null,\"port43\":null,\"lang\":null,\"events\":[],\"notices\":[],\"status\":[],\"entities\":[],\"remarks\":[],\"links\":[],\"nameservers\":[],\"entity\":null,\"legalRepresentative\":null,\"errorCode\":null,\"errorTitle\":null,\"errorDescription\":[],\"ldhName\":\"NS1.YAHOO.COM\",\"unicodeName\":null,\"variants\":[],\"secureDNS\":null,\"publicIds\":[],\"network\":null,\"nicbr_arbitration\":false,\"delegate\":null,\"ipAddresses\":null,\"switch_name\":null,\"switch_aceString\":null},{\"rdapConformance\":[],\"objectClassName\":\"nameserver\",\"handle\":null,\"port43\":null,\"lang\":null,\"events\":[],\"notices\":[],\"status\":[],\"entities\":[],\"remarks\":[],\"links\":[],\"nameservers\":[],\"entity\":null,\"legalRepresentative\":null,\"errorCode\":null,\"errorTitle\":null,\"errorDescription\":[],\"ldhName\":\"NS2.YAHOO.COM\",\"unicodeName\":null,\"variants\":[],\"secureDNS\":null,\"publicIds\":[],\"network\":null,\"nicbr_arbitration\":false,\"delegate\":null,\"ipAddresses\":null,\"switch_name\":null,\"switch_aceString\":null},{\"rdapConformance\":[],\"objectClassName\":\"nameserver\",\"handle\":null,\"port43\":null,\"lang\":null,\"events\":[],\"notices\":[],\"status\":[],\"entities\":[],\"remarks\":[],\"links\":[],\"nameservers\":[],\"entity\":null,\"legalRepresentative\":null,\"errorCode\":null,\"errorTitle\":null,\"errorDescription\":[],\"ldhName\":\"NS3.YAHOO.COM\",\"unicodeName\":null,\"variants\":[],\"secureDNS\":null,\"publicIds\":[],\"network\":null,\"nicbr_arbitration\":false,\"delegate\":null,\"ipAddresses\":null,\"switch_name\":null,\"switch_aceString\":null},{\"rdapConformance\":[],\"objectClassName\":\"nameserver\",\"handle\":null,\"port43\":null,\"lang\":null,\"events\":[],\"notices\":[],\"status\":[],\"entities\":[],\"remarks\":[],\"links\":[],\"nameservers\":[],\"entity\":null,\"legalRepresentative\":null,\"errorCode\":null,\"errorTitle\":null,\"errorDescription\":[],\"ldhName\":\"NS4.YAHOO.COM\",\"unicodeName\":null,\"variants\":[],\"secureDNS\":null,\"publicIds\":[],\"network\":null,\"nicbr_arbitration\":false,\"delegate\":null,\"ipAddresses\":null,\"switch_name\":null,\"switch_aceString\":null},{\"rdapConformance\":[],\"objectClassName\":\"nameserver\",\"handle\":null,\"port43\":null,\"lang\":null,\"events\":[],\"notices\":[],\"status\":[],\"entities\":[],\"remarks\":[],\"links\":[],\"nameservers\":[],\"entity\":null,\"legalRepresentative\":null,\"errorCode\":null,\"errorTitle\":null,\"errorDescription\":[],\"ldhName\":\"NS5.YAHOO.COM\",\"unicodeName\":null,\"variants\":[],\"secureDNS\":null,\"publicIds\":[],\"network\":null,\"nicbr_arbitration\":false,\"delegate\":null,\"ipAddresses\":null,\"switch_name\":null,\"switch_aceString\":null}],\"entity\":null,\"legalRepresentative\":null,\"errorCode\":null,\"errorTitle\":null,\"errorDescription\":[],\"ldhName\":\"YAHOO.COM\",\"unicodeName\":null,\"variants\":[],\"secureDNS\":{\"zoneSigned\":null,\"delegationSigned\":false,\"maxSigLife\":null,\"dsData\":[],\"keyData\":[]},\"publicIds\":[],\"network\":null,\"nicbr_arbitration\":false,\"delegate\":{\"rdapConformance\":[\"rdap_level_0\",\"icann_rdap_technical_implementation_guide_0\",\"icann_rdap_response_profile_0\"],\"objectClassName\":\"domain\",\"handle\":\"3643624_DOMAIN_COM-VRSN\",\"port43\":\"whois.markmonitor.com\",\"lang\":null,\"events\":[{\"eventAction\":\"expiration\",\"eventDate\":\"2023-01-19T05:00:00Z\",\"eventActor\":null,\"status\":[]},{\"eventAction\":\"registration\",\"eventDate\":\"1995-01-18T08:00:00Z\",\"eventActor\":null,\"status\":[]},{\"eventAction\":\"last update\",\"eventDate\":\"2021-09-21T05:40:44Z\",\"eventActor\":null,\"status\":[]},{\"eventAction\":\"last update of RDAP database\",\"eventDate\":\"2021-09-25T20:53:15Z\",\"eventActor\":null,\"status\":[]}],\"notices\":[{\"title\":\"Terms of Use\",\"type\":null,\"description\":[\"By submitting an RDAP query, you agree that you will use this data only for\",\"lawful purposes and that, under no circumstances will you use this data to:\",\"(1) allow, enable, or otherwise support the transmission by email, telephone,\",\"or facsimile of mass, unsolicited, commercial advertising, or spam; or\",\"(2) enable high volume, automated, or electronic processes that send queries,\",\"data, or email to MarkMonitor (or its systems) or the domain name contacts (or\",\"its systems).\",\"MarkMonitor reserves the right to modify these terms at any time.\",\"By submitting this query, you agree to abide by this policy.\",\"MarkMonitor Domain Management(TM)\",\"Protecting companies and consumers in a digital world.\",\"Visit MarkMonitor at https://www.markmonitor.com\",\"Contact us at +1.8007459229\",\"In Europe, at +44.02032062220\"],\"links\":[{\"value\":\"https://www.markmonitor.com/legal/domain-management-terms-and-conditions\",\"rel\":\"related\",\"href\":\"https://www.markmonitor.com/legal/domain-management-terms-and-conditions\",\"hreflang\":null,\"title\":null,\"media\":null,\"type\":\"text/html\"}]},{\"title\":\"Status Codes\",\"type\":null,\"description\":[\"For more information on domain status codes, please visit https://icann.org/epp.\"],\"links\":[{\"value\":\"https://icann.org/epp\",\"rel\":\"related\",\"href\":\"https://icann.org/epp\",\"hreflang\":null,\"title\":null,\"media\":null,\"type\":\"text/html\"}]},{\"title\":\"RDDS Inaccuracy Complaint Form\",\"type\":null,\"description\":[\"URL of the ICANN RDDS Inaccuracy Complaint Form: https://www.icann.org/wicf.\"],\"links\":[{\"value\":\"https://www.icann.org/wicf\",\"rel\":\"related\",\"href\":\"https://www.icann.org/wicf\",\"hreflang\":null,\"title\":null,\"media\":null,\"type\":\"text/html\"}]}],\"status\":[\"client update prohibited\",\"client transfer prohibited\",\"client delete prohibited\",\"server update prohibited\",\"server transfer prohibited\",\"server delete prohibited\"],\"entities\":[{\"rdapConformance\":[],\"objectClassName\":\"entity\",\"handle\":null,\"port43\":null,\"lang\":null,\"events\":[{\"eventAction\":\"last update\",\"eventDate\":\"2020-02-10T16:17:04Z\",\"eventActor\":null,\"status\":[]}],\"notices\":[],\"status\":[],\"entities\":[],\"remarks\":[{\"title\":\"REDACTED FOR PRIVACY\",\"description\":[\"Some of the data in this object has been removed.\"],\"type\":\"Object truncated due to authorization\",\"links\":null}],\"links\":[],\"nameservers\":[],\"entity\":null,\"legalRepresentative\":null,\"errorCode\":null,\"errorTitle\":null,\"errorDescription\":[],\"vcardArray\":[\"vcard\",[[\"version\",{},\"text\",\"4.0\"],[\"adr\",{},\"text\",[\"\",\"\",\"\",\"\",\"VA\",\"\",\"US\"]]]],\"roles\":[\"admin\"],\"publicIds\":[],\"networks\":null,\"autnums\":null,\"nicbr_domainCount\":0,\"nicbr_inetCount\":0,\"nicbr_autnumCount\":0,\"url\":null,\"contact_URI\":\"https://domains.markmonitor.com/whois/\"},{\"rdapConformance\":[],\"objectClassName\":\"entity\",\"handle\":null,\"port43\":null,\"lang\":null,\"events\":[{\"eventAction\":\"last update\",\"eventDate\":\"2020-02-10T16:17:04Z\",\"eventActor\":null,\"status\":[]}],\"notices\":[],\"status\":[],\"entities\":[],\"remarks\":[{\"title\":\"REDACTED FOR PRIVACY\",\"description\":[\"Some of the data in this object has been removed.\"],\"type\":\"Object truncated due to authorization\",\"links\":null}],\"links\":[],\"nameservers\":[],\"entity\":null,\"legalRepresentative\":null,\"errorCode\":null,\"errorTitle\":null,\"errorDescription\":[],\"vcardArray\":[\"vcard\",[[\"version\",{},\"text\",\"4.0\"],[\"org\",{\"type\":\"work\"},\"text\",\"Verizon Media Inc.\"],[\"adr\",{},\"text\",[\"\",\"\",\"\",\"\",\"VA\",\"\",\"US\"]]]],\"roles\":[\"registrant\"],\"publicIds\":[],\"networks\":null,\"autnums\":null,\"nicbr_domainCount\":0,\"nicbr_inetCount\":0,\"nicbr_autnumCount\":0,\"url\":null,\"contact_URI\":\"https://domains.markmonitor.com/whois/\"},{\"rdapConformance\":[],\"objectClassName\":\"entity\",\"handle\":null,\"port43\":null,\"lang\":null,\"events\":[{\"eventAction\":\"last update\",\"eventDate\":\"2020-02-10T16:17:04Z\",\"eventActor\":null,\"status\":[]}],\"notices\":[],\"status\":[],\"entities\":[],\"remarks\":[{\"title\":\"REDACTED FOR PRIVACY\",\"description\":[\"Some of the data in this object has been removed.\"],\"type\":\"Object truncated due to authorization\",\"links\":null}],\"links\":[],\"nameservers\":[],\"entity\":null,\"legalRepresentative\":null,\"errorCode\":null,\"errorTitle\":null,\"errorDescription\":[],\"vcardArray\":[\"vcard\",[[\"version\",{},\"text\",\"4.0\"],[\"adr\",{},\"text\",[\"\",\"\",\"\",\"\",\"VA\",\"\",\"US\"]]]],\"roles\":[\"technical\"],\"publicIds\":[],\"networks\":null,\"autnums\":null,\"nicbr_domainCount\":0,\"nicbr_inetCount\":0,\"nicbr_autnumCount\":0,\"url\":null,\"contact_URI\":\"https://domains.markmonitor.com/whois/\"},{\"rdapConformance\":[],\"objectClassName\":\"entity\",\"handle\":\"292\",\"port43\":null,\"lang\":null,\"events\":[{\"eventAction\":\"registrar expiration\",\"eventDate\":\"2020-09-14T04:00:00Z\",\"eventActor\":null,\"status\":[]}],\"notices\":[],\"status\":[],\"entities\":[{\"rdapConformance\":[],\"objectClassName\":\"entity\",\"handle\":null,\"port43\":null,\"lang\":null,\"events\":[],\"notices\":[],\"status\":[],\"entities\":[],\"remarks\":[],\"links\":[],\"nameservers\":[],\"entity\":null,\"legalRepresentative\":null,\"errorCode\":null,\"errorTitle\":null,\"errorDescription\":[],\"vcardArray\":[\"vcard\",[[\"version\",{},\"text\",\"4.0\"],[\"email\",{\"type\":\"work\"},\"text\",\"abusecomplaints@markmonitor.com\"],[\"tel\",{\"type\":\"voice\"},\"text\",\"+1.2083895770\"]]],\"roles\":[\"abuse\"],\"publicIds\":[],\"networks\":null,\"autnums\":null,\"nicbr_domainCount\":0,\"nicbr_inetCount\":0,\"nicbr_autnumCount\":0,\"url\":null,\"contact_URI\":null}],\"remarks\":[],\"links\":[],\"nameservers\":[],\"entity\":null,\"legalRepresentative\":null,\"errorCode\":null,\"errorTitle\":null,\"errorDescription\":[],\"vcardArray\":[\"vcard\",[[\"version\",{},\"text\",\"4.0\"],[\"org\",{\"type\":\"work\"},\"text\",\"MarkMonitor Inc.\"],[\"adr\",{},\"text\",[\"\",\"\",\"3540 E Longwing Ln\",\"Meridian\",\"ID\",\"83646\",\"US\"]]]],\"roles\":[\"registrar\"],\"publicIds\":[{\"type\":\"IANA Registrar ID\",\"identifier\":\"292\"}],\"networks\":null,\"autnums\":null,\"nicbr_domainCount\":0,\"nicbr_inetCount\":0,\"nicbr_autnumCount\":0,\"url\":null,\"contact_URI\":null}],\"remarks\":[],\"links\":[{\"value\":\"https://rdap.markmonitor.com/rdap/domain/yahoo.com\",\"rel\":\"self\",\"href\":\"https://rdap.markmonitor.com/rdap/domain/yahoo.com\",\"hreflang\":null,\"title\":null,\"media\":null,\"type\":\"application/rdap+json\"}],\"nameservers\":[{\"rdapConformance\":[],\"objectClassName\":\"nameserver\",\"handle\":null,\"port43\":null,\"lang\":null,\"events\":[{\"eventAction\":\"last changed\",\"eventDate\":\"2013-07-11T16:30:20Z\",\"eventActor\":null,\"status\":[]}],\"notices\":[],\"status\":[\"active\"],\"entities\":[],\"remarks\":[],\"links\":[],\"nameservers\":[],\"entity\":null,\"legalRepresentative\":null,\"errorCode\":null,\"errorTitle\":null,\"errorDescription\":[],\"ldhName\":\"ns1.yahoo.com\",\"unicodeName\":null,\"variants\":[],\"secureDNS\":null,\"publicIds\":[],\"network\":null,\"nicbr_arbitration\":false,\"delegate\":null,\"ipAddresses\":null,\"switch_name\":null,\"switch_aceString\":null},{\"rdapConformance\":[],\"objectClassName\":\"nameserver\",\"handle\":null,\"port43\":null,\"lang\":null,\"events\":[{\"eventAction\":\"last changed\",\"eventDate\":\"2013-07-11T16:30:20Z\",\"eventActor\":null,\"status\":[]}],\"notices\":[],\"status\":[\"active\"],\"entities\":[],\"remarks\":[],\"links\":[],\"nameservers\":[],\"entity\":null,\"legalRepresentative\":null,\"errorCode\":null,\"errorTitle\":null,\"errorDescription\":[],\"ldhName\":\"ns2.yahoo.com\",\"unicodeName\":null,\"variants\":[],\"secureDNS\":null,\"publicIds\":[],\"network\":null,\"nicbr_arbitration\":false,\"delegate\":null,\"ipAddresses\":null,\"switch_name\":null,\"switch_aceString\":null},{\"rdapConformance\":[],\"objectClassName\":\"nameserver\",\"handle\":null,\"port43\":null,\"lang\":null,\"events\":[{\"eventAction\":\"last changed\",\"eventDate\":\"2013-07-11T16:30:20Z\",\"eventActor\":null,\"status\":[]}],\"notices\":[],\"status\":[\"active\"],\"entities\":[],\"remarks\":[],\"links\":[],\"nameservers\":[],\"entity\":null,\"legalRepresentative\":null,\"errorCode\":null,\"errorTitle\":null,\"errorDescription\":[],\"ldhName\":\"ns3.yahoo.com\",\"unicodeName\":null,\"variants\":[],\"secureDNS\":null,\"publicIds\":[],\"network\":null,\"nicbr_arbitration\":false,\"delegate\":null,\"ipAddresses\":null,\"switch_name\":null,\"switch_aceString\":null},{\"rdapConformance\":[],\"objectClassName\":\"nameserver\",\"handle\":null,\"port43\":null,\"lang\":null,\"events\":[{\"eventAction\":\"last changed\",\"eventDate\":\"2013-07-11T16:30:20Z\",\"eventActor\":null,\"status\":[]}],\"notices\":[],\"status\":[\"active\"],\"entities\":[],\"remarks\":[],\"links\":[],\"nameservers\":[],\"entity\":null,\"legalRepresentative\":null,\"errorCode\":null,\"errorTitle\":null,\"errorDescription\":[],\"ldhName\":\"ns4.yahoo.com\",\"unicodeName\":null,\"variants\":[],\"secureDNS\":null,\"publicIds\":[],\"network\":null,\"nicbr_arbitration\":false,\"delegate\":null,\"ipAddresses\":null,\"switch_name\":null,\"switch_aceString\":null},{\"rdapConformance\":[],\"objectClassName\":\"nameserver\",\"handle\":null,\"port43\":null,\"lang\":null,\"events\":[{\"eventAction\":\"last changed\",\"eventDate\":\"2013-07-11T16:30:20Z\",\"eventActor\":null,\"status\":[]}],\"notices\":[],\"status\":[\"active\"],\"entities\":[],\"remarks\":[],\"links\":[],\"nameservers\":[],\"entity\":null,\"legalRepresentative\":null,\"errorCode\":null,\"errorTitle\":null,\"errorDescription\":[],\"ldhName\":\"ns5.yahoo.com\",\"unicodeName\":null,\"variants\":[],\"secureDNS\":null,\"publicIds\":[],\"network\":null,\"nicbr_arbitration\":false,\"delegate\":null,\"ipAddresses\":null,\"switch_name\":null,\"switch_aceString\":null}],\"entity\":null,\"legalRepresentative\":null,\"errorCode\":null,\"errorTitle\":null,\"errorDescription\":[],\"ldhName\":\"yahoo.com\",\"unicodeName\":null,\"variants\":[],\"secureDNS\":{\"zoneSigned\":null,\"delegationSigned\":false,\"maxSigLife\":null,\"dsData\":[],\"keyData\":[]},\"publicIds\":[],\"network\":null,\"nicbr_arbitration\":false,\"delegate\":null,\"switch_name\":null,\"switch_aceString\":null},\"switch_name\":null,\"switch_aceString\":null}", "raw": "Registrar: \n  Handle: 3643624_DOMAIN_COM-VRSN\n  LDH Name: yahoo.com\n  Nameserver: \n    LDH Name: ns1.yahoo.com\n    Event: \n      Action: last changed\n      Date: 2013-07-11T16:30:20Z\n      Status: active\n  Nameserver: \n    LDH Name: ns2.yahoo.com\n    Event: \n      Action: last changed\n      Date: 2013-07-11T16:30:20Z\n      Status: active\n  Nameserver: \n    LDH Name: ns3.yahoo.com\n    Event: \n      Action: last changed\n      Date: 2013-07-11T16:30:20Z\n      Status: active\n  Nameserver: \n    LDH Name: ns4.yahoo.com\n    Event: \n      Action: last changed\n      Date: 2013-07-11T16:30:20Z\n      Status: active\n  Nameserver: \n    LDH Name: ns5.yahoo.com\n    Event: \n      Action: last changed\n      Date: 2013-07-11T16:30:20Z\n      Status: active\n  SecureDNS: \n    Delegation Signed: false\n  Event: \n    Action: expiration\n    Date: 2023-01-19T05:00:00Z\n  Event: \n    Action: registration\n    Date: 1995-01-18T08:00:00Z\n  Event: \n    Action: last update\n    Date: 2021-09-21T05:40:44Z\n  Event: \n    Action: last update of RDAP database\n    Date: 2021-09-25T20:53:15Z\n  Status: \n    client update prohibited\n    client transfer prohibited\n    client delete prohibited\n    server update prohibited\n    server transfer prohibited\n    server delete prohibited\n  Entity: \n    Role: \n      ADMIN\n    VCard: \n      Address: \n          Region: VA\n          Country: US\n    Event: \n      Action: last update\n      Date: 2020-02-10T16:17:04Z\n    Remark: \n      Title: REDACTED FOR PRIVACY\n      Type: Object truncated due to authorization\n        Description: Some of the data in this object has been removed.\n  Entity: \n    Role: \n      REGISTRANT\n    VCard: \n          Organization: Verizon Media Inc.\n          TYPE: work\n      Address: \n          Region: VA\n          Country: US\n    Event: \n      Action: last update\n      Date: 2020-02-10T16:17:04Z\n    Remark: \n      Title: REDACTED FOR PRIVACY\n      Type: Object truncated due to authorization\n        Description: Some of the data in this object has been removed.\n  Entity: \n    Role: \n      TECHNICAL\n    VCard: \n      Address: \n          Region: VA\n          Country: US\n    Event: \n      Action: last update\n      Date: 2020-02-10T16:17:04Z\n    Remark: \n      Title: REDACTED FOR PRIVACY\n      Type: Object truncated due to authorization\n        Description: Some of the data in this object has been removed.\n  Entity: \n    Handle: 292\n    Role: \n      REGISTRAR\n    VCard: \n          Organization: MarkMonitor Inc.\n          TYPE: work\n      Address: \n          Street: 3540 E Longwing Ln\n          Locale: Meridian\n          Region: ID\n          Postal Code: 83646\n          Country: US\n    Event: \n      Action: registrar expiration\n      Date: 2020-09-14T04:00:00Z\n    Entity: \n      Role: \n        ABUSE\n      VCard: \n        Email: abusecomplaints@markmonitor.com\n            TYPE: work\n        Telephone: +1.2083895770\n            TYPE: voice\n  Link: \n    Rel: self\n    Value: https://rdap.markmonitor.com/rdap/domain/yahoo.com\n    Type: application/rdap+json\n    Href: https://rdap.markmonitor.com/rdap/domain/yahoo.com\n  Notice: \n    Title: Terms of Use\n    Description: \n      By submitting an RDAP query, you agree that you will use this data only for\n      lawful purposes and that, under no circumstances will you use this data to:\n      (1) allow, enable, or otherwise support the transmission by email, telephone,\n      or facsimile of mass, unsolicited, commercial advertising, or spam; or\n      (2) enable high volume, automated, or electronic processes that send queries,\n      data, or email to MarkMonitor (or its systems) or the domain name contacts (or\n      its systems).\n      MarkMonitor reserves the right to modify these terms at any time.\n      By submitting this query, you agree to abide by this policy.\n      MarkMonitor Domain Management(TM)\n      Protecting companies and consumers in a digital world.\n      Visit MarkMonitor at https://www.markmonitor.com\n      Contact us at +1.8007459229\n      In Europe, at +44.02032062220\n      Link: \n        Rel: related\n        Value: https://www.markmonitor.com/legal/domain-management-terms-and-conditions\n        Type: text/html\n        Href: https://www.markmonitor.com/legal/domain-management-terms-and-conditions\n  Notice: \n    Title: Status Codes\n      Description: For more information on domain status codes, please visit https://icann.org/epp.\n      Link: \n        Rel: related\n        Value: https://icann.org/epp\n        Type: text/html\n        Href: https://icann.org/epp\n  Notice: \n    Title: RDDS Inaccuracy Complaint Form\n      Description: URL of the ICANN RDDS Inaccuracy Complaint Form: https://www.icann.org/wicf.\n      Link: \n        Rel: related\n        Value: https://www.icann.org/wicf\n        Type: text/html\n        Href: https://www.icann.org/wicf\n  RDAP Conformance: \n    rdap_level_0\n    icann_rdap_technical_implementation_guide_0\n    icann_rdap_response_profile_0\n\n\n  Registry: \n    Handle: 3643624_DOMAIN_COM-VRSN\n    LDH Name: YAHOO.COM\n    Nameserver: \n      LDH Name: NS1.YAHOO.COM\n    Nameserver: \n      LDH Name: NS2.YAHOO.COM\n    Nameserver: \n      LDH Name: NS3.YAHOO.COM\n    Nameserver: \n      LDH Name: NS4.YAHOO.COM\n    Nameserver: \n      LDH Name: NS5.YAHOO.COM\n    SecureDNS: \n      Delegation Signed: false\n    Event: \n      Action: registration\n      Date: 1995-01-18T05:00:00Z\n    Event: \n      Action: expiration\n      Date: 2023-01-19T05:00:00Z\n    Event: \n      Action: last update of RDAP database\n      Date: 2021-09-25T09:21:47Z\n    Status: \n      client delete prohibited\n      client transfer prohibited\n      client update prohibited\n      server delete prohibited\n      server transfer prohibited\n      server update prohibited\n    Entity: \n      Handle: 292\n      Role: \n        REGISTRAR\n      VCard: \n        Formatted Name: MarkMonitor Inc.\n      Entity: \n        Role: \n          ABUSE\n        VCard: \n          Formatted Name: \n              TYPE: voice\n          Email: abusecomplaints@markmonitor.com\n    Link: \n      Rel: self\n      Value: https://rdap.verisign.com/com/v1/domain/YAHOO.COM\n      Type: application/rdap+json\n      Href: https://rdap.verisign.com/com/v1/domain/YAHOO.COM\n    Link: \n      Rel: related\n      Value: https://rdap.markmonitor.com/rdap/domain/YAHOO.COM\n      Type: application/rdap+json\n      Href: https://rdap.markmonitor.com/rdap/domain/YAHOO.COM\n    Notice: \n      Title: Terms of Use\n        Description: Service subject to Terms of Use.\n        Link: \n          Type: text/html\n          Href: https://www.verisign.com/domain-names/registration-data-access-protocol/terms-service/index.xhtml\n    Notice: \n      Title: Status Codes\n        Description: For more information on domain status codes, please visit https://icann.org/epp\n        Link: \n          Type: text/html\n          Href: https://icann.org/epp\n    Notice: \n      Title: RDDS Inaccuracy Complaint Form\n        Description: URL of the ICANN RDDS Inaccuracy Complaint Form: https://icann.org/wicf\n        Link: \n          Type: text/html\n          Href: https://icann.org/wicf\n    RDAP Conformance: \n      rdap_level_0\n      icann_rdap_technical_implementation_guide_0\n      icann_rdap_response_profile_0\n", "whoisRawID": 0, "source": "WHOIS_RDAP", "match_whitelist": {"domain": true}}, "registrarUpdatedAt": 1632202844, "whoisID": 6847634372883914188, "registrarIanaID": 292, "registrarName": "MarkMonitor Inc.", "admin": {"country": "US", "address": "VA\nUS\n", "whoisContactID": 0, "state": "VA", "id": 0}, "whoisServer": "rdap.markmonitor.com", "createdAt": 1632603257, "expired": false, "contactOrganizations": ["Verizon Media Inc.", "MarkMonitor Inc."], "registrarParseCode": 44323, "auditUpdatedAt": 1632689078, "id": 6847634372883914188, "registrarPhone": "+1.2083895740", "updatedAt": 1633460633, "domainUnicode": "yahoo.com", "auditCreatedAt": 1632603257, "registrarExpiresAt": 1674104400, "contactCountries": ["US"], "compositeParseCode": 44323, "contactEmails": ["abusecomplaints@markmonitor.com"], "registrarEmail": "abusecomplaints@markmonitor.com", "domainStatus": "client update prohibited,client transfer prohibited,client delete prohibited,server update prohibited,server transfer prohibited,server delete prohibited", "tld": "com", "domainAvailable": false, "registrarCreatedAt": 790416000, "noRecord": false, "nameservers": ["ns1.yahoo.com", "ns2.yahoo.com", "ns3.yahoo.com", "ns4.yahoo.com", "ns5.yahoo.com"], "domain": "yahoo.com", "registrant": {"country": "US", "address": "VA\nUS\n", "whoisContactID": 0, "organization": "Verizon Media Inc.", "state": "VA", "id": 0}, "contactNames": [], "contacts": [{"country": "US", "address": "VA\nUS\n", "whoisContactID": 0, "organization": "Verizon Media Inc.", "state": "VA", "id": 0}, {"country": "US", "address": "VA\nUS\n", "whoisContactID": 0, "state": "VA", "id": 0}, {"zip": "83646", "country": "US", "address": "3540 E Longwing Ln\nMeridian\n83646\nID\nUS\n", "city": "Meridian", "whoisContactID": 0, "street": "3540 E Longwing Ln", "organization": "MarkMonitor Inc.", "state": "ID", "id": 0}, {"address": "", "phone": "+1.2083895770", "whoisContactID": 0, "id": 0, "email": "abusecomplaints@markmonitor.com"}], "status": "INACTIVE", "domainMd5": "50cd1a9a183758039b0841aa738c3f0b", "task_id": "29893111acfb4f17a5dcb38d96a3f17a", "match_whitelist": {"domain": true}}, {"abuse": {"address": "", "phone": "+1.2083895740", "whoisContactID": 0, "id": 0, "email": "abusecomplaints@markmonitor.com"}, "registrar": {"address": "", "whoisContactID": 0, "name": "MarkMonitor Inc.", "id": 0}, "rawResponse": {"domain": "yahoo.com", "whoisID": 6843256398458657049, "unparsed": "{\"rdapConformance\":[\"rdap_level_0\",\"icann_rdap_technical_implementation_guide_0\",\"icann_rdap_response_profile_0\"],\"objectClassName\":\"domain\",\"handle\":\"3643624_DOMAIN_COM-VRSN\",\"port43\":null,\"lang\":null,\"events\":[{\"eventAction\":\"registration\",\"eventDate\":\"1995-01-18T05:00:00Z\",\"eventActor\":null,\"status\":[]},{\"eventAction\":\"expiration\",\"eventDate\":\"2023-01-19T05:00:00Z\",\"eventActor\":null,\"status\":[]},{\"eventAction\":\"last update of RDAP database\",\"eventDate\":\"2021-09-13T09:24:32Z\",\"eventActor\":null,\"status\":[]}],\"notices\":[{\"title\":\"Terms of Use\",\"type\":null,\"description\":[\"Service subject to Terms of Use.\"],\"links\":[{\"value\":null,\"rel\":null,\"href\":\"https://www.verisign.com/domain-names/registration-data-access-protocol/terms-service/index.xhtml\",\"hreflang\":null,\"title\":null,\"media\":null,\"type\":\"text/html\"}]},{\"title\":\"Status Codes\",\"type\":null,\"description\":[\"For more information on domain status codes, please visit https://icann.org/epp\"],\"links\":[{\"value\":null,\"rel\":null,\"href\":\"https://icann.org/epp\",\"hreflang\":null,\"title\":null,\"media\":null,\"type\":\"text/html\"}]},{\"title\":\"RDDS Inaccuracy Complaint Form\",\"type\":null,\"description\":[\"URL of the ICANN RDDS Inaccuracy Complaint Form: https://icann.org/wicf\"],\"links\":[{\"value\":null,\"rel\":null,\"href\":\"https://icann.org/wicf\",\"hreflang\":null,\"title\":null,\"media\":null,\"type\":\"text/html\"}]}],\"status\":[\"client delete prohibited\",\"client transfer prohibited\",\"client update prohibited\",\"server delete prohibited\",\"server transfer prohibited\",\"server update prohibited\"],\"entities\":[{\"rdapConformance\":[],\"objectClassName\":\"entity\",\"handle\":\"292\",\"port43\":null,\"lang\":null,\"events\":[],\"notices\":[],\"status\":[],\"entities\":[{\"rdapConformance\":[],\"objectClassName\":\"entity\",\"handle\":null,\"port43\":null,\"lang\":null,\"events\":[],\"notices\":[],\"status\":[],\"entities\":[],\"remarks\":[],\"links\":[],\"nameservers\":[],\"entity\":null,\"errorCode\":null,\"errorTitle\":null,\"errorDescription\":[],\"vcardArray\":[\"vcard\",[[\"version\",{},\"text\",\"4.0\"],[\"fn\",{},\"text\",\"\"],[\"tel\",{\"type\":\"voice\"},\"uri\",\"tel:+1.2083895740\"],[\"email\",{},\"text\",\"abusecomplaints@markmonitor.com\"]]],\"roles\":[\"abuse\"],\"publicIds\":[],\"legalRepresentative\":null,\"networks\":null,\"autnums\":null,\"nicbr_domainCount\":0,\"nicbr_inetCount\":0,\"nicbr_autnumCount\":0,\"url\":null,\"contact_URI\":null}],\"remarks\":[],\"links\":[],\"nameservers\":[],\"entity\":null,\"errorCode\":null,\"errorTitle\":null,\"errorDescription\":[],\"vcardArray\":[\"vcard\",[[\"version\",{},\"text\",\"4.0\"],[\"fn\",{},\"text\",\"MarkMonitor Inc.\"]]],\"roles\":[\"registrar\"],\"publicIds\":[{\"type\":\"IANA Registrar ID\",\"identifier\":\"292\"}],\"legalRepresentative\":null,\"networks\":null,\"autnums\":null,\"nicbr_domainCount\":0,\"nicbr_inetCount\":0,\"nicbr_autnumCount\":0,\"url\":null,\"contact_URI\":null}],\"remarks\":[],\"links\":[{\"value\":\"https://rdap.verisign.com/com/v1/domain/YAHOO.COM\",\"rel\":\"self\",\"href\":\"https://rdap.verisign.com/com/v1/domain/YAHOO.COM\",\"hreflang\":null,\"title\":null,\"media\":null,\"type\":\"application/rdap+json\"},{\"value\":\"https://rdap.markmonitor.com/rdap/domain/YAHOO.COM\",\"rel\":\"related\",\"href\":\"https://rdap.markmonitor.com/rdap/domain/YAHOO.COM\",\"hreflang\":null,\"title\":null,\"media\":null,\"type\":\"application/rdap+json\"}],\"nameservers\":[{\"rdapConformance\":[],\"objectClassName\":\"nameserver\",\"handle\":null,\"port43\":null,\"lang\":null,\"events\":[],\"notices\":[],\"status\":[],\"entities\":[],\"remarks\":[],\"links\":[],\"nameservers\":[],\"entity\":null,\"errorCode\":null,\"errorTitle\":null,\"errorDescription\":[],\"ldhName\":\"NS1.YAHOO.COM\",\"unicodeName\":null,\"variants\":[],\"secureDNS\":null,\"publicIds\":[],\"network\":null,\"nicbr_arbitration\":false,\"delegate\":null,\"ipAddresses\":null,\"switch_name\":null,\"switch_aceString\":null},{\"rdapConformance\":[],\"objectClassName\":\"nameserver\",\"handle\":null,\"port43\":null,\"lang\":null,\"events\":[],\"notices\":[],\"status\":[],\"entities\":[],\"remarks\":[],\"links\":[],\"nameservers\":[],\"entity\":null,\"errorCode\":null,\"errorTitle\":null,\"errorDescription\":[],\"ldhName\":\"NS2.YAHOO.COM\",\"unicodeName\":null,\"variants\":[],\"secureDNS\":null,\"publicIds\":[],\"network\":null,\"nicbr_arbitration\":false,\"delegate\":null,\"ipAddresses\":null,\"switch_name\":null,\"switch_aceString\":null},{\"rdapConformance\":[],\"objectClassName\":\"nameserver\",\"handle\":null,\"port43\":null,\"lang\":null,\"events\":[],\"notices\":[],\"status\":[],\"entities\":[],\"remarks\":[],\"links\":[],\"nameservers\":[],\"entity\":null,\"errorCode\":null,\"errorTitle\":null,\"errorDescription\":[],\"ldhName\":\"NS3.YAHOO.COM\",\"unicodeName\":null,\"variants\":[],\"secureDNS\":null,\"publicIds\":[],\"network\":null,\"nicbr_arbitration\":false,\"delegate\":null,\"ipAddresses\":null,\"switch_name\":null,\"switch_aceString\":null},{\"rdapConformance\":[],\"objectClassName\":\"nameserver\",\"handle\":null,\"port43\":null,\"lang\":null,\"events\":[],\"notices\":[],\"status\":[],\"entities\":[],\"remarks\":[],\"links\":[],\"nameservers\":[],\"entity\":null,\"errorCode\":null,\"errorTitle\":null,\"errorDescription\":[],\"ldhName\":\"NS4.YAHOO.COM\",\"unicodeName\":null,\"variants\":[],\"secureDNS\":null,\"publicIds\":[],\"network\":null,\"nicbr_arbitration\":false,\"delegate\":null,\"ipAddresses\":null,\"switch_name\":null,\"switch_aceString\":null},{\"rdapConformance\":[],\"objectClassName\":\"nameserver\",\"handle\":null,\"port43\":null,\"lang\":null,\"events\":[],\"notices\":[],\"status\":[],\"entities\":[],\"remarks\":[],\"links\":[],\"nameservers\":[],\"entity\":null,\"errorCode\":null,\"errorTitle\":null,\"errorDescription\":[],\"ldhName\":\"NS5.YAHOO.COM\",\"unicodeName\":null,\"variants\":[],\"secureDNS\":null,\"publicIds\":[],\"network\":null,\"nicbr_arbitration\":false,\"delegate\":null,\"ipAddresses\":null,\"switch_name\":null,\"switch_aceString\":null}],\"entity\":null,\"errorCode\":null,\"errorTitle\":null,\"errorDescription\":[],\"ldhName\":\"YAHOO.COM\",\"unicodeName\":null,\"variants\":[],\"secureDNS\":{\"zoneSigned\":null,\"delegationSigned\":false,\"maxSigLife\":null,\"dsData\":[],\"keyData\":[]},\"publicIds\":[],\"network\":null,\"nicbr_arbitration\":false,\"delegate\":null,\"switch_name\":null,\"switch_aceString\":null}", "raw": "Registry: \n  Handle: 3643624_DOMAIN_COM-VRSN\n  LDH Name: YAHOO.COM\n  Nameserver: \n    LDH Name: NS1.YAHOO.COM\n  Nameserver: \n    LDH Name: NS2.YAHOO.COM\n  Nameserver: \n    LDH Name: NS3.YAHOO.COM\n  Nameserver: \n    LDH Name: NS4.YAHOO.COM\n  Nameserver: \n    LDH Name: NS5.YAHOO.COM\n  SecureDNS: \n    Delegation Signed: false\n  Event: \n    Action: registration\n    Date: 1995-01-18T05:00:00Z\n  Event: \n    Action: expiration\n    Date: 2023-01-19T05:00:00Z\n  Event: \n    Action: last update of RDAP database\n    Date: 2021-09-13T09:24:32Z\n  Status: \n    client delete prohibited\n    client transfer prohibited\n    client update prohibited\n    server delete prohibited\n    server transfer prohibited\n    server update prohibited\n  Entity: \n    Handle: 292\n    Role: \n      REGISTRAR\n    VCard: \n      Formatted Name: MarkMonitor Inc.\n    Entity: \n      Role: \n        ABUSE\n      VCard: \n        Formatted Name: \n            TYPE: voice\n        Email: abusecomplaints@markmonitor.com\n  Link: \n    Rel: self\n    Value: https://rdap.verisign.com/com/v1/domain/YAHOO.COM\n    Type: application/rdap+json\n    Href: https://rdap.verisign.com/com/v1/domain/YAHOO.COM\n  Link: \n    Rel: related\n    Value: https://rdap.markmonitor.com/rdap/domain/YAHOO.COM\n    Type: application/rdap+json\n    Href: https://rdap.markmonitor.com/rdap/domain/YAHOO.COM\n  Notice: \n    Title: Terms of Use\n      Description: Service subject to Terms of Use.\n      Link: \n        Type: text/html\n        Href: https://www.verisign.com/domain-names/registration-data-access-protocol/terms-service/index.xhtml\n  Notice: \n    Title: Status Codes\n      Description: For more information on domain status codes, please visit https://icann.org/epp\n      Link: \n        Type: text/html\n        Href: https://icann.org/epp\n  Notice: \n    Title: RDDS Inaccuracy Complaint Form\n      Description: URL of the ICANN RDDS Inaccuracy Complaint Form: https://icann.org/wicf\n      Link: \n        Type: text/html\n        Href: https://icann.org/wicf\n  RDAP Conformance: \n    rdap_level_0\n    icann_rdap_technical_implementation_guide_0\n    icann_rdap_response_profile_0\n", "whoisRawID": 0, "source": "WHOIS_RDAP", "match_whitelist": {"domain": true}}, "whoisID": 6843256398458657049, "registrarIanaID": 292, "registrarName": "MarkMonitor Inc.", "whoisServer": "rdap.verisign.com", "createdAt": 1631559466, "expired": false, "contactOrganizations": [], "registrarParseCode": 40963, "auditUpdatedAt": 1631559466, "id": 6843256398458657049, "registrarPhone": "+1.2083895740", "updatedAt": 1632603257, "domainUnicode": "yahoo.com", "auditCreatedAt": 1631559466, "registrarExpiresAt": 1674104400, "contactCountries": [], "compositeParseCode": 40963, "contactEmails": ["abusecomplaints@markmonitor.com"], "registrarEmail": "abusecomplaints@markmonitor.com", "domainStatus": "client delete prohibited,client transfer prohibited,client update prohibited,server delete prohibited,server transfer prohibited,server update prohibited", "tld": "com", "domainAvailable": false, "registrarCreatedAt": 790405200, "noRecord": false, "nameservers": ["ns1.yahoo.com", "ns2.yahoo.com", "ns3.yahoo.com", "ns4.yahoo.com", "ns5.yahoo.com"], "domain": "yahoo.com", "contactNames": ["MarkMonitor Inc."], "contacts": [{"address": "", "whoisContactID": 0, "name": "MarkMonitor Inc.", "id": 0}, {"address": "", "phone": "+1.2083895740", "whoisContactID": 0, "id": 0, "email": "abusecomplaints@markmonitor.com"}], "status": "INACTIVE", "domainMd5": "50cd1a9a183758039b0841aa738c3f0b", "task_id": "6e0e80471f2a4bbbbf0e0d0a83eee766", "match_whitelist": {"domain": true}}, {"abuse": {"address": "", "phone": "+1.2083895770", "whoisContactID": 0, "id": 0, "email": "abusecomplaints@markmonitor.com"}, "technical": {"zip": "20166", "country": "US", "address": "22000 AOL Way\nDulles\n20166\nVA\nUS\n", "city": "Dulles", "phone": "+1.4083493300", "whoisContactID": 0, "street": "22000 AOL Way", "organization": "Oath Inc.", "name": "Domain Admin", "state": "VA", "id": 0, "email": "domain-admin@oath.com"}, "registrar": {"zip": "83646", "country": "US", "address": "3540 E Longwing Ln\nMeridian\n83646\nID\nUS\n", "city": "Meridian", "whoisContactID": 0, "street": "3540 E Longwing Ln", "organization": "MarkMonitor Inc.", "state": "ID", "id": 0}, "rawResponse": {"domain": "yahoo.com", "whoisID": 6828929550010711451, "unparsed": "{\"rdapConformance\":[\"rdap_level_0\",\"icann_rdap_technical_implementation_guide_0\",\"icann_rdap_response_profile_0\"],\"objectClassName\":\"domain\",\"handle\":\"3643624_DOMAIN_COM-VRSN\",\"port43\":null,\"lang\":null,\"events\":[{\"eventAction\":\"registration\",\"eventDate\":\"1995-01-18T05:00:00Z\",\"eventActor\":null,\"status\":[]},{\"eventAction\":\"expiration\",\"eventDate\":\"2023-01-19T05:00:00Z\",\"eventActor\":null,\"status\":[]},{\"eventAction\":\"last update of RDAP database\",\"eventDate\":\"2021-08-05T09:36:45Z\",\"eventActor\":null,\"status\":[]}],\"notices\":[{\"title\":\"Terms of Use\",\"type\":null,\"description\":[\"Service subject to Terms of Use.\"],\"links\":[{\"value\":null,\"rel\":null,\"href\":\"https://www.verisign.com/domain-names/registration-data-access-protocol/terms-service/index.xhtml\",\"hreflang\":null,\"title\":null,\"media\":null,\"type\":\"text/html\"}]},{\"title\":\"Status Codes\",\"type\":null,\"description\":[\"For more information on domain status codes, please visit https://icann.org/epp\"],\"links\":[{\"value\":null,\"rel\":null,\"href\":\"https://icann.org/epp\",\"hreflang\":null,\"title\":null,\"media\":null,\"type\":\"text/html\"}]},{\"title\":\"RDDS Inaccuracy Complaint Form\",\"type\":null,\"description\":[\"URL of the ICANN RDDS Inaccuracy Complaint Form: https://icann.org/wicf\"],\"links\":[{\"value\":null,\"rel\":null,\"href\":\"https://icann.org/wicf\",\"hreflang\":null,\"title\":null,\"media\":null,\"type\":\"text/html\"}]}],\"status\":[\"client delete prohibited\",\"client transfer prohibited\",\"client update prohibited\",\"server delete prohibited\",\"server transfer prohibited\",\"server update prohibited\"],\"entities\":[{\"rdapConformance\":[],\"objectClassName\":\"entity\",\"handle\":\"292\",\"port43\":null,\"lang\":null,\"events\":[],\"notices\":[],\"status\":[],\"entities\":[{\"rdapConformance\":[],\"objectClassName\":\"entity\",\"handle\":null,\"port43\":null,\"lang\":null,\"events\":[],\"notices\":[],\"status\":[],\"entities\":[],\"remarks\":[],\"links\":[],\"nameservers\":[],\"entity\":null,\"errorCode\":null,\"errorTitle\":null,\"errorDescription\":[],\"vcardArray\":[\"vcard\",[[\"version\",{},\"text\",\"4.0\"],[\"fn\",{},\"text\",\"\"],[\"tel\",{\"type\":\"voice\"},\"uri\",\"tel:+1.2083895740\"],[\"email\",{},\"text\",\"abusecomplaints@markmonitor.com\"]]],\"roles\":[\"abuse\"],\"publicIds\":[],\"legalRepresentative\":null,\"networks\":null,\"autnums\":null,\"nicbr_domainCount\":0,\"nicbr_inetCount\":0,\"nicbr_autnumCount\":0,\"url\":null,\"contact_URI\":null}],\"remarks\":[],\"links\":[],\"nameservers\":[],\"entity\":null,\"errorCode\":null,\"errorTitle\":null,\"errorDescription\":[],\"vcardArray\":[\"vcard\",[[\"version\",{},\"text\",\"4.0\"],[\"fn\",{},\"text\",\"MarkMonitor Inc.\"]]],\"roles\":[\"registrar\"],\"publicIds\":[{\"type\":\"IANA Registrar ID\",\"identifier\":\"292\"}],\"legalRepresentative\":null,\"networks\":null,\"autnums\":null,\"nicbr_domainCount\":0,\"nicbr_inetCount\":0,\"nicbr_autnumCount\":0,\"url\":null,\"contact_URI\":null}],\"remarks\":[],\"links\":[{\"value\":\"https://rdap.verisign.com/com/v1/domain/YAHOO.COM\",\"rel\":\"self\",\"href\":\"https://rdap.verisign.com/com/v1/domain/YAHOO.COM\",\"hreflang\":null,\"title\":null,\"media\":null,\"type\":\"application/rdap+json\"},{\"value\":\"https://rdap.markmonitor.com/rdap/domain/YAHOO.COM\",\"rel\":\"related\",\"href\":\"https://rdap.markmonitor.com/rdap/domain/YAHOO.COM\",\"hreflang\":null,\"title\":null,\"media\":null,\"type\":\"application/rdap+json\"}],\"nameservers\":[{\"rdapConformance\":[],\"objectClassName\":\"nameserver\",\"handle\":null,\"port43\":null,\"lang\":null,\"events\":[],\"notices\":[],\"status\":[],\"entities\":[],\"remarks\":[],\"links\":[],\"nameservers\":[],\"entity\":null,\"errorCode\":null,\"errorTitle\":null,\"errorDescription\":[],\"ldhName\":\"NS1.YAHOO.COM\",\"unicodeName\":null,\"variants\":[],\"secureDNS\":null,\"publicIds\":[],\"network\":null,\"nicbr_arbitration\":false,\"delegate\":null,\"ipAddresses\":null,\"switch_name\":null,\"switch_aceString\":null},{\"rdapConformance\":[],\"objectClassName\":\"nameserver\",\"handle\":null,\"port43\":null,\"lang\":null,\"events\":[],\"notices\":[],\"status\":[],\"entities\":[],\"remarks\":[],\"links\":[],\"nameservers\":[],\"entity\":null,\"errorCode\":null,\"errorTitle\":null,\"errorDescription\":[],\"ldhName\":\"NS2.YAHOO.COM\",\"unicodeName\":null,\"variants\":[],\"secureDNS\":null,\"publicIds\":[],\"network\":null,\"nicbr_arbitration\":false,\"delegate\":null,\"ipAddresses\":null,\"switch_name\":null,\"switch_aceString\":null},{\"rdapConformance\":[],\"objectClassName\":\"nameserver\",\"handle\":null,\"port43\":null,\"lang\":null,\"events\":[],\"notices\":[],\"status\":[],\"entities\":[],\"remarks\":[],\"links\":[],\"nameservers\":[],\"entity\":null,\"errorCode\":null,\"errorTitle\":null,\"errorDescription\":[],\"ldhName\":\"NS3.YAHOO.COM\",\"unicodeName\":null,\"variants\":[],\"secureDNS\":null,\"publicIds\":[],\"network\":null,\"nicbr_arbitration\":false,\"delegate\":null,\"ipAddresses\":null,\"switch_name\":null,\"switch_aceString\":null},{\"rdapConformance\":[],\"objectClassName\":\"nameserver\",\"handle\":null,\"port43\":null,\"lang\":null,\"events\":[],\"notices\":[],\"status\":[],\"entities\":[],\"remarks\":[],\"links\":[],\"nameservers\":[],\"entity\":null,\"errorCode\":null,\"errorTitle\":null,\"errorDescription\":[],\"ldhName\":\"NS4.YAHOO.COM\",\"unicodeName\":null,\"variants\":[],\"secureDNS\":null,\"publicIds\":[],\"network\":null,\"nicbr_arbitration\":false,\"delegate\":null,\"ipAddresses\":null,\"switch_name\":null,\"switch_aceString\":null},{\"rdapConformance\":[],\"objectClassName\":\"nameserver\",\"handle\":null,\"port43\":null,\"lang\":null,\"events\":[],\"notices\":[],\"status\":[],\"entities\":[],\"remarks\":[],\"links\":[],\"nameservers\":[],\"entity\":null,\"errorCode\":null,\"errorTitle\":null,\"errorDescription\":[],\"ldhName\":\"NS5.YAHOO.COM\",\"unicodeName\":null,\"variants\":[],\"secureDNS\":null,\"publicIds\":[],\"network\":null,\"nicbr_arbitration\":false,\"delegate\":null,\"ipAddresses\":null,\"switch_name\":null,\"switch_aceString\":null}],\"entity\":null,\"errorCode\":null,\"errorTitle\":null,\"errorDescription\":[],\"ldhName\":\"YAHOO.COM\",\"unicodeName\":null,\"variants\":[],\"secureDNS\":{\"zoneSigned\":null,\"delegationSigned\":false,\"maxSigLife\":null,\"dsData\":[],\"keyData\":[]},\"publicIds\":[],\"network\":null,\"nicbr_arbitration\":false,\"delegate\":{\"rdapConformance\":[\"rdap_level_0\",\"icann_rdap_technical_implementation_guide_0\",\"icann_rdap_response_profile_0\"],\"objectClassName\":\"domain\",\"handle\":\"3643624_DOMAIN_COM-VRSN\",\"port43\":\"whois.markmonitor.com\",\"lang\":null,\"events\":[{\"eventAction\":\"expiration\",\"eventDate\":\"2023-01-19T05:00:00Z\",\"eventActor\":null,\"status\":[]},{\"eventAction\":\"registration\",\"eventDate\":\"1995-01-18T08:00:00Z\",\"eventActor\":null,\"status\":[]},{\"eventAction\":\"last update\",\"eventDate\":\"2021-07-16T19:03:35Z\",\"eventActor\":null,\"status\":[]},{\"eventAction\":\"last update of RDAP database\",\"eventDate\":\"2021-08-05T06:07:18Z\",\"eventActor\":null,\"status\":[]}],\"notices\":[{\"title\":\"Terms of Use\",\"type\":null,\"description\":[\"By submitting an RDAP query, you agree that you will use this data only for\",\"lawful purposes and that, under no circumstances will you use this data to:\",\"(1) allow, enable, or otherwise support the transmission by email, telephone,\",\"or facsimile of mass, unsolicited, commercial advertising, or spam; or\",\"(2) enable high volume, automated, or electronic processes that send queries,\",\"data, or email to MarkMonitor (or its systems) or the domain name contacts (or\",\"its systems).\",\"MarkMonitor reserves the right to modify these terms at any time.\",\"By submitting this query, you agree to abide by this policy.\",\"MarkMonitor Domain Management(TM)\",\"Protecting companies and consumers in a digital world.\",\"Visit MarkMonitor at https://www.markmonitor.com\",\"Contact us at +1.8007459229\",\"In Europe, at +44.02032062220\"],\"links\":[{\"value\":\"https://www.markmonitor.com/legal/domain-management-terms-and-conditions\",\"rel\":\"related\",\"href\":\"https://www.markmonitor.com/legal/domain-management-terms-and-conditions\",\"hreflang\":null,\"title\":null,\"media\":null,\"type\":\"text/html\"}]},{\"title\":\"Status Codes\",\"type\":null,\"description\":[\"For more information on domain status codes, please visit https://icann.org/epp.\"],\"links\":[{\"value\":\"https://icann.org/epp\",\"rel\":\"related\",\"href\":\"https://icann.org/epp\",\"hreflang\":null,\"title\":null,\"media\":null,\"type\":\"text/html\"}]},{\"title\":\"RDDS Inaccuracy Complaint Form\",\"type\":null,\"description\":[\"URL of the ICANN RDDS Inaccuracy Complaint Form: https://www.icann.org/wicf.\"],\"links\":[{\"value\":\"https://www.icann.org/wicf\",\"rel\":\"related\",\"href\":\"https://www.icann.org/wicf\",\"hreflang\":null,\"title\":null,\"media\":null,\"type\":\"text/html\"}]}],\"status\":[\"client update prohibited\",\"client transfer prohibited\",\"client delete prohibited\",\"server update prohibited\",\"server transfer prohibited\",\"server delete prohibited\"],\"entities\":[{\"rdapConformance\":[],\"objectClassName\":\"entity\",\"handle\":\"171459\",\"port43\":null,\"lang\":null,\"events\":[{\"eventAction\":\"last update\",\"eventDate\":\"2019-04-24T19:00:18Z\",\"eventActor\":null,\"status\":[]}],\"notices\":[],\"status\":[],\"entities\":[],\"remarks\":[],\"links\":[],\"nameservers\":[],\"entity\":null,\"errorCode\":null,\"errorTitle\":null,\"errorDescription\":[],\"vcardArray\":[\"vcard\",[[\"version\",{},\"text\",\"4.0\"],[\"fn\",{},\"text\",\"Domain Admin\"],[\"org\",{\"type\":\"work\"},\"text\",\"Oath Inc.\"],[\"adr\",{},\"text\",[\"\",\"\",\"22000 AOL Way\",\"Dulles\",\"VA\",\"20166\",\"US\"]],[\"email\",{\"type\":\"work\"},\"text\",\"domain-admin@oath.com\"],[\"tel\",{\"type\":\"voice\"},\"text\",\"+1.4083493300\"]]],\"roles\":[\"admin\",\"registrant\",\"technical\"],\"publicIds\":[],\"legalRepresentative\":null,\"networks\":null,\"autnums\":null,\"nicbr_domainCount\":0,\"nicbr_inetCount\":0,\"nicbr_autnumCount\":0,\"url\":null,\"contact_URI\":null},{\"rdapConformance\":[],\"objectClassName\":\"entity\",\"handle\":\"292\",\"port43\":null,\"lang\":null,\"events\":[{\"eventAction\":\"registrar expiration\",\"eventDate\":\"2020-09-14T04:00:00Z\",\"eventActor\":null,\"status\":[]}],\"notices\":[],\"status\":[],\"entities\":[{\"rdapConformance\":[],\"objectClassName\":\"entity\",\"handle\":null,\"port43\":null,\"lang\":null,\"events\":[],\"notices\":[],\"status\":[],\"entities\":[],\"remarks\":[],\"links\":[],\"nameservers\":[],\"entity\":null,\"errorCode\":null,\"errorTitle\":null,\"errorDescription\":[],\"vcardArray\":[\"vcard\",[[\"version\",{},\"text\",\"4.0\"],[\"email\",{\"type\":\"work\"},\"text\",\"abusecomplaints@markmonitor.com\"],[\"tel\",{\"type\":\"voice\"},\"text\",\"+1.2083895770\"]]],\"roles\":[\"abuse\"],\"publicIds\":[],\"legalRepresentative\":null,\"networks\":null,\"autnums\":null,\"nicbr_domainCount\":0,\"nicbr_inetCount\":0,\"nicbr_autnumCount\":0,\"url\":null,\"contact_URI\":null}],\"remarks\":[],\"links\":[],\"nameservers\":[],\"entity\":null,\"errorCode\":null,\"errorTitle\":null,\"errorDescription\":[],\"vcardArray\":[\"vcard\",[[\"version\",{},\"text\",\"4.0\"],[\"org\",{\"type\":\"work\"},\"text\",\"MarkMonitor Inc.\"],[\"adr\",{},\"text\",[\"\",\"\",\"3540 E Longwing Ln\",\"Meridian\",\"ID\",\"83646\",\"US\"]]]],\"roles\":[\"registrar\"],\"publicIds\":[{\"type\":\"IANA Registrar ID\",\"identifier\":\"292\"}],\"legalRepresentative\":null,\"networks\":null,\"autnums\":null,\"nicbr_domainCount\":0,\"nicbr_inetCount\":0,\"nicbr_autnumCount\":0,\"url\":null,\"contact_URI\":null}],\"remarks\":[],\"links\":[{\"value\":\"https://rdap.markmonitor.com/rdap/domain/yahoo.com\",\"rel\":\"self\",\"href\":\"https://rdap.markmonitor.com/rdap/domain/yahoo.com\",\"hreflang\":null,\"title\":null,\"media\":null,\"type\":\"application/rdap+json\"}],\"nameservers\":[{\"rdapConformance\":[],\"objectClassName\":\"nameserver\",\"handle\":null,\"port43\":null,\"lang\":null,\"events\":[{\"eventAction\":\"last changed\",\"eventDate\":\"2013-07-11T16:30:20Z\",\"eventActor\":null,\"status\":[]}],\"notices\":[],\"status\":[\"active\"],\"entities\":[],\"remarks\":[],\"links\":[],\"nameservers\":[],\"entity\":null,\"errorCode\":null,\"errorTitle\":null,\"errorDescription\":[],\"ldhName\":\"ns1.yahoo.com\",\"unicodeName\":null,\"variants\":[],\"secureDNS\":null,\"publicIds\":[],\"network\":null,\"nicbr_arbitration\":false,\"delegate\":null,\"ipAddresses\":null,\"switch_name\":null,\"switch_aceString\":null},{\"rdapConformance\":[],\"objectClassName\":\"nameserver\",\"handle\":null,\"port43\":null,\"lang\":null,\"events\":[{\"eventAction\":\"last changed\",\"eventDate\":\"2013-07-11T16:30:20Z\",\"eventActor\":null,\"status\":[]}],\"notices\":[],\"status\":[\"active\"],\"entities\":[],\"remarks\":[],\"links\":[],\"nameservers\":[],\"entity\":null,\"errorCode\":null,\"errorTitle\":null,\"errorDescription\":[],\"ldhName\":\"ns2.yahoo.com\",\"unicodeName\":null,\"variants\":[],\"secureDNS\":null,\"publicIds\":[],\"network\":null,\"nicbr_arbitration\":false,\"delegate\":null,\"ipAddresses\":null,\"switch_name\":null,\"switch_aceString\":null},{\"rdapConformance\":[],\"objectClassName\":\"nameserver\",\"handle\":null,\"port43\":null,\"lang\":null,\"events\":[{\"eventAction\":\"last changed\",\"eventDate\":\"2013-07-11T16:30:20Z\",\"eventActor\":null,\"status\":[]}],\"notices\":[],\"status\":[\"active\"],\"entities\":[],\"remarks\":[],\"links\":[],\"nameservers\":[],\"entity\":null,\"errorCode\":null,\"errorTitle\":null,\"errorDescription\":[],\"ldhName\":\"ns3.yahoo.com\",\"unicodeName\":null,\"variants\":[],\"secureDNS\":null,\"publicIds\":[],\"network\":null,\"nicbr_arbitration\":false,\"delegate\":null,\"ipAddresses\":null,\"switch_name\":null,\"switch_aceString\":null},{\"rdapConformance\":[],\"objectClassName\":\"nameserver\",\"handle\":null,\"port43\":null,\"lang\":null,\"events\":[{\"eventAction\":\"last changed\",\"eventDate\":\"2013-07-11T16:30:20Z\",\"eventActor\":null,\"status\":[]}],\"notices\":[],\"status\":[\"active\"],\"entities\":[],\"remarks\":[],\"links\":[],\"nameservers\":[],\"entity\":null,\"errorCode\":null,\"errorTitle\":null,\"errorDescription\":[],\"ldhName\":\"ns4.yahoo.com\",\"unicodeName\":null,\"variants\":[],\"secureDNS\":null,\"publicIds\":[],\"network\":null,\"nicbr_arbitration\":false,\"delegate\":null,\"ipAddresses\":null,\"switch_name\":null,\"switch_aceString\":null},{\"rdapConformance\":[],\"objectClassName\":\"nameserver\",\"handle\":null,\"port43\":null,\"lang\":null,\"events\":[{\"eventAction\":\"last changed\",\"eventDate\":\"2013-07-11T16:30:20Z\",\"eventActor\":null,\"status\":[]}],\"notices\":[],\"status\":[\"active\"],\"entities\":[],\"remarks\":[],\"links\":[],\"nameservers\":[],\"entity\":null,\"errorCode\":null,\"errorTitle\":null,\"errorDescription\":[],\"ldhName\":\"ns5.yahoo.com\",\"unicodeName\":null,\"variants\":[],\"secureDNS\":null,\"publicIds\":[],\"network\":null,\"nicbr_arbitration\":false,\"delegate\":null,\"ipAddresses\":null,\"switch_name\":null,\"switch_aceString\":null}],\"entity\":null,\"errorCode\":null,\"errorTitle\":null,\"errorDescription\":[],\"ldhName\":\"yahoo.com\",\"unicodeName\":null,\"variants\":[],\"secureDNS\":{\"zoneSigned\":null,\"delegationSigned\":false,\"maxSigLife\":null,\"dsData\":[],\"keyData\":[]},\"publicIds\":[],\"network\":null,\"nicbr_arbitration\":false,\"delegate\":null,\"switch_name\":null,\"switch_aceString\":null},\"switch_name\":null,\"switch_aceString\":null}", "raw": "Registrar: \n  Handle: 3643624_DOMAIN_COM-VRSN\n  LDH Name: yahoo.com\n  Nameserver: \n    LDH Name: ns1.yahoo.com\n    Event: \n      Action: last changed\n      Date: 2013-07-11T16:30:20Z\n      Status: active\n  Nameserver: \n    LDH Name: ns2.yahoo.com\n    Event: \n      Action: last changed\n      Date: 2013-07-11T16:30:20Z\n      Status: active\n  Nameserver: \n    LDH Name: ns3.yahoo.com\n    Event: \n      Action: last changed\n      Date: 2013-07-11T16:30:20Z\n      Status: active\n  Nameserver: \n    LDH Name: ns4.yahoo.com\n    Event: \n      Action: last changed\n      Date: 2013-07-11T16:30:20Z\n      Status: active\n  Nameserver: \n    LDH Name: ns5.yahoo.com\n    Event: \n      Action: last changed\n      Date: 2013-07-11T16:30:20Z\n      Status: active\n  SecureDNS: \n    Delegation Signed: false\n  Event: \n    Action: expiration\n    Date: 2023-01-19T05:00:00Z\n  Event: \n    Action: registration\n    Date: 1995-01-18T08:00:00Z\n  Event: \n    Action: last update\n    Date: 2021-07-16T19:03:35Z\n  Event: \n    Action: last update of RDAP database\n    Date: 2021-08-05T06:07:18Z\n  Status: \n    client update prohibited\n    client transfer prohibited\n    client delete prohibited\n    server update prohibited\n    server transfer prohibited\n    server delete prohibited\n  Entity: \n    Handle: 171459\n    Role: \n      ADMIN\n      REGISTRANT\n      TECHNICAL\n    VCard: \n      Formatted Name: Domain Admin\n          Organization: Oath Inc.\n          TYPE: work\n      Address: \n          Street: 22000 AOL Way\n          Locale: Dulles\n          Region: VA\n          Postal Code: 20166\n          Country: US\n      Email: domain-admin@oath.com\n          TYPE: work\n      Telephone: +1.4083493300\n          TYPE: voice\n    Event: \n      Action: last update\n      Date: 2019-04-24T19:00:18Z\n  Entity: \n    Handle: 292\n    Role: \n      REGISTRAR\n    VCard: \n          Organization: MarkMonitor Inc.\n          TYPE: work\n      Address: \n          Street: 3540 E Longwing Ln\n          Locale: Meridian\n          Region: ID\n          Postal Code: 83646\n          Country: US\n    Event: \n      Action: registrar expiration\n      Date: 2020-09-14T04:00:00Z\n    Entity: \n      Role: \n        ABUSE\n      VCard: \n        Email: abusecomplaints@markmonitor.com\n            TYPE: work\n        Telephone: +1.2083895770\n            TYPE: voice\n  Link: \n    Rel: self\n    Value: https://rdap.markmonitor.com/rdap/domain/yahoo.com\n    Type: application/rdap+json\n    Href: https://rdap.markmonitor.com/rdap/domain/yahoo.com\n  Notice: \n    Title: Terms of Use\n    Description: \n      By submitting an RDAP query, you agree that you will use this data only for\n      lawful purposes and that, under no circumstances will you use this data to:\n      (1) allow, enable, or otherwise support the transmission by email, telephone,\n      or facsimile of mass, unsolicited, commercial advertising, or spam; or\n      (2) enable high volume, automated, or electronic processes that send queries,\n      data, or email to MarkMonitor (or its systems) or the domain name contacts (or\n      its systems).\n      MarkMonitor reserves the right to modify these terms at any time.\n      By submitting this query, you agree to abide by this policy.\n      MarkMonitor Domain Management(TM)\n      Protecting companies and consumers in a digital world.\n      Visit MarkMonitor at https://www.markmonitor.com\n      Contact us at +1.8007459229\n      In Europe, at +44.02032062220\n      Link: \n        Rel: related\n        Value: https://www.markmonitor.com/legal/domain-management-terms-and-conditions\n        Type: text/html\n        Href: https://www.markmonitor.com/legal/domain-management-terms-and-conditions\n  Notice: \n    Title: Status Codes\n      Description: For more information on domain status codes, please visit https://icann.org/epp.\n      Link: \n        Rel: related\n        Value: https://icann.org/epp\n        Type: text/html\n        Href: https://icann.org/epp\n  Notice: \n    Title: RDDS Inaccuracy Complaint Form\n      Description: URL of the ICANN RDDS Inaccuracy Complaint Form: https://www.icann.org/wicf.\n      Link: \n        Rel: related\n        Value: https://www.icann.org/wicf\n        Type: text/html\n        Href: https://www.icann.org/wicf\n  RDAP Conformance: \n    rdap_level_0\n    icann_rdap_technical_implementation_guide_0\n    icann_rdap_response_profile_0\n\n\n  Registry: \n    Handle: 3643624_DOMAIN_COM-VRSN\n    LDH Name: YAHOO.COM\n    Nameserver: \n      LDH Name: NS1.YAHOO.COM\n    Nameserver: \n      LDH Name: NS2.YAHOO.COM\n    Nameserver: \n      LDH Name: NS3.YAHOO.COM\n    Nameserver: \n      LDH Name: NS4.YAHOO.COM\n    Nameserver: \n      LDH Name: NS5.YAHOO.COM\n    SecureDNS: \n      Delegation Signed: false\n    Event: \n      Action: registration\n      Date: 1995-01-18T05:00:00Z\n    Event: \n      Action: expiration\n      Date: 2023-01-19T05:00:00Z\n    Event: \n      Action: last update of RDAP database\n      Date: 2021-08-05T09:36:45Z\n    Status: \n      client delete prohibited\n      client transfer prohibited\n      client update prohibited\n      server delete prohibited\n      server transfer prohibited\n      server update prohibited\n    Entity: \n      Handle: 292\n      Role: \n        REGISTRAR\n      VCard: \n        Formatted Name: MarkMonitor Inc.\n      Entity: \n        Role: \n          ABUSE\n        VCard: \n          Formatted Name: \n              TYPE: voice\n          Email: abusecomplaints@markmonitor.com\n    Link: \n      Rel: self\n      Value: https://rdap.verisign.com/com/v1/domain/YAHOO.COM\n      Type: application/rdap+json\n      Href: https://rdap.verisign.com/com/v1/domain/YAHOO.COM\n    Link: \n      Rel: related\n      Value: https://rdap.markmonitor.com/rdap/domain/YAHOO.COM\n      Type: application/rdap+json\n      Href: https://rdap.markmonitor.com/rdap/domain/YAHOO.COM\n    Notice: \n      Title: Terms of Use\n        Description: Service subject to Terms of Use.\n        Link: \n          Type: text/html\n          Href: https://www.verisign.com/domain-names/registration-data-access-protocol/terms-service/index.xhtml\n    Notice: \n      Title: Status Codes\n        Description: For more information on domain status codes, please visit https://icann.org/epp\n        Link: \n          Type: text/html\n          Href: https://icann.org/epp\n    Notice: \n      Title: RDDS Inaccuracy Complaint Form\n        Description: URL of the ICANN RDDS Inaccuracy Complaint Form: https://icann.org/wicf\n        Link: \n          Type: text/html\n          Href: https://icann.org/wicf\n    RDAP Conformance: \n      rdap_level_0\n      icann_rdap_technical_implementation_guide_0\n      icann_rdap_response_profile_0\n", "whoisRawID": 0, "source": "WHOIS_RDAP", "match_whitelist": {"domain": true}}, "registrarUpdatedAt": 1626462215, "whoisID": 6828929550010711451, "registrarIanaID": 292, "registrarName": "MarkMonitor Inc.", "admin": {"zip": "20166", "country": "US", "address": "22000 AOL Way\nDulles\n20166\nVA\nUS\n", "city": "Dulles", "phone": "+1.4083493300", "whoisContactID": 0, "street": "22000 AOL Way", "organization": "Oath Inc.", "name": "Domain Admin", "state": "VA", "id": 0, "email": "domain-admin@oath.com"}, "whoisServer": "rdap.markmonitor.com", "createdAt": 1628143680, "expired": false, "contactOrganizations": ["Oath Inc.", "MarkMonitor Inc."], "registrarParseCode": 44323, "auditUpdatedAt": 1628791075, "id": 6828929550010711451, "registrarPhone": "+1.2083895740", "updatedAt": 1631559466, "domainUnicode": "yahoo.com", "auditCreatedAt": 1628143680, "registrarExpiresAt": 1674104400, "contactCountries": ["US"], "compositeParseCode": 44323, "contactEmails": ["domain-admin@oath.com", "abusecomplaints@markmonitor.com"], "registrarEmail": "abusecomplaints@markmonitor.com", "domainStatus": "client update prohibited,client transfer prohibited,client delete prohibited,server update prohibited,server transfer prohibited,server delete prohibited", "tld": "com", "domainAvailable": false, "registrarCreatedAt": 790416000, "noRecord": false, "nameservers": ["ns1.yahoo.com", "ns2.yahoo.com", "ns3.yahoo.com", "ns4.yahoo.com", "ns5.yahoo.com"], "domain": "yahoo.com", "registrant": {"zip": "20166", "country": "US", "address": "22000 AOL Way\nDulles\n20166\nVA\nUS\n", "city": "Dulles", "phone": "+1.4083493300", "whoisContactID": 0, "street": "22000 AOL Way", "organization": "Oath Inc.", "name": "Domain Admin", "state": "VA", "id": 0, "email": "domain-admin@oath.com"}, "contactNames": ["Domain Admin"], "contacts": [{"zip": "20166", "country": "US", "address": "22000 AOL Way\nDulles\n20166\nVA\nUS\n", "city": "Dulles", "phone": "+1.4083493300", "whoisContactID": 0, "street": "22000 AOL Way", "organization": "Oath Inc.", "name": "Domain Admin", "state": "VA", "id": 0, "email": "domain-admin@oath.com"}, {"zip": "83646", "country": "US", "address": "3540 E Longwing Ln\nMeridian\n83646\nID\nUS\n", "city": "Meridian", "whoisContactID": 0, "street": "3540 E Longwing Ln", "organization": "MarkMonitor Inc.", "state": "ID", "id": 0}, {"address": "", "phone": "+1.2083895770", "whoisContactID": 0, "id": 0, "email": "abusecomplaints@markmonitor.com"}], "status": "INACTIVE", "domainMd5": "50cd1a9a183758039b0841aa738c3f0b", "task_id": "f38e5312c7964653a46ea35c7bc07c9b", "match_whitelist": {"domain": true}}, {"abuse": {"address": "", "phone": "+1.2083895770", "whoisContactID": 0, "id": 0, "email": "abusecomplaints@markmonitor.com"}, "technical": {"zip": "20166", "country": "US", "address": "22000 AOL Way\nDulles\n20166\nVA\nUS\n", "city": "Dulles", "phone": "+1.4083493300", "whoisContactID": 0, "street": "22000 AOL Way", "organization": "Oath Inc.", "name": "Domain Admin", "state": "VA", "id": 0, "email": "domain-admin@oath.com"}, "registrar": {"zip": "83646", "country": "us", "address": "3540 E Longwing Ln\nmeridian\n83646\nid\nus\n", "city": "meridian", "whoisContactID": 0, "street": "3540 E Longwing Ln", "organization": "MarkMonitor Inc.", "state": "id", "id": 0}, "rawResponse": {"domain": "yahoo.com", "whoisID": 6702004964111632248, "unparsed": "{\"rdapConformance\":[\"rdap_level_0\",\"icann_rdap_technical_implementation_guide_0\",\"icann_rdap_response_profile_0\"],\"objectClassName\":\"domain\",\"handle\":\"3643624_DOMAIN_COM-VRSN\",\"port43\":null,\"lang\":null,\"events\":[{\"eventAction\":\"registration\",\"eventDate\":\"1995-01-18T05:00:00Z\",\"eventActor\":null,\"status\":[]},{\"eventAction\":\"expiration\",\"eventDate\":\"2023-01-19T05:00:00Z\",\"eventActor\":null,\"status\":[]},{\"eventAction\":\"last update of RDAP database\",\"eventDate\":\"2021-02-14T11:44:57Z\",\"eventActor\":null,\"status\":[]}],\"notices\":[{\"title\":\"Terms of Use\",\"type\":null,\"description\":[\"Service subject to Terms of Use.\"],\"links\":[{\"value\":null,\"rel\":null,\"href\":\"https://www.verisign.com/domain-names/registration-data-access-protocol/terms-service/index.xhtml\",\"hreflang\":null,\"title\":null,\"media\":null,\"type\":\"text/html\"}]},{\"title\":\"Status Codes\",\"type\":null,\"description\":[\"For more information on domain status codes, please visit https://icann.org/epp\"],\"links\":[{\"value\":null,\"rel\":null,\"href\":\"https://icann.org/epp\",\"hreflang\":null,\"title\":null,\"media\":null,\"type\":\"text/html\"}]},{\"title\":\"RDDS Inaccuracy Complaint Form\",\"type\":null,\"description\":[\"URL of the ICANN RDDS Inaccuracy Complaint Form: https://icann.org/wicf\"],\"links\":[{\"value\":null,\"rel\":null,\"href\":\"https://icann.org/wicf\",\"hreflang\":null,\"title\":null,\"media\":null,\"type\":\"text/html\"}]}],\"status\":[\"client delete prohibited\",\"client transfer prohibited\",\"client update prohibited\",\"server delete prohibited\",\"server transfer prohibited\",\"server update prohibited\"],\"entities\":[{\"rdapConformance\":[],\"objectClassName\":\"entity\",\"handle\":\"292\",\"port43\":null,\"lang\":null,\"events\":[],\"notices\":[],\"status\":[],\"entities\":[{\"rdapConformance\":[],\"objectClassName\":\"entity\",\"handle\":null,\"port43\":null,\"lang\":null,\"events\":[],\"notices\":[],\"status\":[],\"entities\":[],\"remarks\":[],\"links\":[],\"nameservers\":[],\"entity\":null,\"errorCode\":null,\"errorTitle\":null,\"errorDescription\":[],\"vcardArray\":[\"vcard\",[[\"version\",{},\"text\",\"4.0\"],[\"fn\",{},\"text\",\"\"],[\"tel\",{\"type\":\"voice\"},\"uri\",\"tel:+1.2083895740\"],[\"email\",{},\"text\",\"abusecomplaints@markmonitor.com\"]]],\"roles\":[\"abuse\"],\"publicIds\":[],\"legalRepresentative\":null,\"networks\":null,\"autnums\":null,\"nicbr_domainCount\":0,\"nicbr_inetCount\":0,\"nicbr_autnumCount\":0,\"contact_URI\":null}],\"remarks\":[],\"links\":[],\"nameservers\":[],\"entity\":null,\"errorCode\":null,\"errorTitle\":null,\"errorDescription\":[],\"vcardArray\":[\"vcard\",[[\"version\",{},\"text\",\"4.0\"],[\"fn\",{},\"text\",\"MarkMonitor Inc.\"]]],\"roles\":[\"registrar\"],\"publicIds\":[{\"type\":\"IANA Registrar ID\",\"identifier\":\"292\"}],\"legalRepresentative\":null,\"networks\":null,\"autnums\":null,\"nicbr_domainCount\":0,\"nicbr_inetCount\":0,\"nicbr_autnumCount\":0,\"contact_URI\":null}],\"remarks\":[],\"links\":[{\"value\":\"https://rdap.verisign.com/com/v1/domain/YAHOO.COM\",\"rel\":\"self\",\"href\":\"https://rdap.verisign.com/com/v1/domain/YAHOO.COM\",\"hreflang\":null,\"title\":null,\"media\":null,\"type\":\"application/rdap+json\"},{\"value\":\"https://rdap.markmonitor.com/rdap/domain/YAHOO.COM\",\"rel\":\"related\",\"href\":\"https://rdap.markmonitor.com/rdap/domain/YAHOO.COM\",\"hreflang\":null,\"title\":null,\"media\":null,\"type\":\"application/rdap+json\"}],\"nameservers\":[{\"rdapConformance\":[],\"objectClassName\":\"nameserver\",\"handle\":null,\"port43\":null,\"lang\":null,\"events\":[],\"notices\":[],\"status\":[],\"entities\":[],\"remarks\":[],\"links\":[],\"nameservers\":[],\"entity\":null,\"errorCode\":null,\"errorTitle\":null,\"errorDescription\":[],\"ldhName\":\"NS1.YAHOO.COM\",\"unicodeName\":null,\"variants\":[],\"secureDNS\":null,\"publicIds\":[],\"network\":null,\"nicbr_arbitration\":false,\"delegate\":null,\"ipAddresses\":null},{\"rdapConformance\":[],\"objectClassName\":\"nameserver\",\"handle\":null,\"port43\":null,\"lang\":null,\"events\":[],\"notices\":[],\"status\":[],\"entities\":[],\"remarks\":[],\"links\":[],\"nameservers\":[],\"entity\":null,\"errorCode\":null,\"errorTitle\":null,\"errorDescription\":[],\"ldhName\":\"NS2.YAHOO.COM\",\"unicodeName\":null,\"variants\":[],\"secureDNS\":null,\"publicIds\":[],\"network\":null,\"nicbr_arbitration\":false,\"delegate\":null,\"ipAddresses\":null},{\"rdapConformance\":[],\"objectClassName\":\"nameserver\",\"handle\":null,\"port43\":null,\"lang\":null,\"events\":[],\"notices\":[],\"status\":[],\"entities\":[],\"remarks\":[],\"links\":[],\"nameservers\":[],\"entity\":null,\"errorCode\":null,\"errorTitle\":null,\"errorDescription\":[],\"ldhName\":\"NS3.YAHOO.COM\",\"unicodeName\":null,\"variants\":[],\"secureDNS\":null,\"publicIds\":[],\"network\":null,\"nicbr_arbitration\":false,\"delegate\":null,\"ipAddresses\":null},{\"rdapConformance\":[],\"objectClassName\":\"nameserver\",\"handle\":null,\"port43\":null,\"lang\":null,\"events\":[],\"notices\":[],\"status\":[],\"entities\":[],\"remarks\":[],\"links\":[],\"nameservers\":[],\"entity\":null,\"errorCode\":null,\"errorTitle\":null,\"errorDescription\":[],\"ldhName\":\"NS4.YAHOO.COM\",\"unicodeName\":null,\"variants\":[],\"secureDNS\":null,\"publicIds\":[],\"network\":null,\"nicbr_arbitration\":false,\"delegate\":null,\"ipAddresses\":null},{\"rdapConformance\":[],\"objectClassName\":\"nameserver\",\"handle\":null,\"port43\":null,\"lang\":null,\"events\":[],\"notices\":[],\"status\":[],\"entities\":[],\"remarks\":[],\"links\":[],\"nameservers\":[],\"entity\":null,\"errorCode\":null,\"errorTitle\":null,\"errorDescription\":[],\"ldhName\":\"NS5.YAHOO.COM\",\"unicodeName\":null,\"variants\":[],\"secureDNS\":null,\"publicIds\":[],\"network\":null,\"nicbr_arbitration\":false,\"delegate\":null,\"ipAddresses\":null}],\"entity\":null,\"errorCode\":null,\"errorTitle\":null,\"errorDescription\":[],\"ldhName\":\"YAHOO.COM\",\"unicodeName\":null,\"variants\":[],\"secureDNS\":{\"zoneSigned\":null,\"delegationSigned\":false,\"maxSigLife\":null,\"dsData\":[],\"keyData\":[]},\"publicIds\":[],\"network\":null,\"nicbr_arbitration\":false,\"delegate\":{\"rdapConformance\":[\"rdap_level_0\",\"icann_rdap_technical_implementation_guide_0\",\"icann_rdap_response_profile_0\"],\"objectClassName\":\"domain\",\"handle\":\"3643624_DOMAIN_COM-VRSN\",\"port43\":\"whois.markmonitor.com\",\"lang\":null,\"events\":[{\"eventAction\":\"expiration\",\"eventDate\":\"2023-01-19T05:00:00Z\",\"eventActor\":null,\"status\":[]},{\"eventAction\":\"registration\",\"eventDate\":\"1995-01-18T08:00:00Z\",\"eventActor\":null,\"status\":[]},{\"eventAction\":\"last update\",\"eventDate\":\"2020-07-30T18:35:29Z\",\"eventActor\":null,\"status\":[]},{\"eventAction\":\"last update of RDAP database\",\"eventDate\":\"2021-02-14T20:10:11Z\",\"eventActor\":null,\"status\":[]}],\"notices\":[{\"title\":\"Terms of Use\",\"type\":null,\"description\":[\"By submitting an RDAP query, you agree that you will use this data only for\",\"lawful purposes and that, under no circumstances will you use this data to:\",\"(1) allow, enable, or otherwise support the transmission by email, telephone,\",\"or facsimile of mass, unsolicited, commercial advertising, or spam; or\",\"(2) enable high volume, automated, or electronic processes that send queries,\",\"data, or email to MarkMonitor (or its systems) or the domain name contacts (or\",\"its systems).\",\"MarkMonitor reserves the right to modify these terms at any time.\",\"By submitting this query, you agree to abide by this policy.\",\"MarkMonitor Domain Management(TM)\",\"Protecting companies and consumers in a digital world.\",\"Visit MarkMonitor at https://www.markmonitor.com\",\"Contact us at +1.8007459229\",\"In Europe, at +44.02032062220\"],\"links\":[{\"value\":\"https://www.markmonitor.com/legal/domain-management-terms-and-conditions\",\"rel\":\"related\",\"href\":\"https://www.markmonitor.com/legal/domain-management-terms-and-conditions\",\"hreflang\":null,\"title\":null,\"media\":null,\"type\":\"text/html\"}]},{\"title\":\"Status Codes\",\"type\":null,\"description\":[\"For more information on domain status codes, please visit https://icann.org/epp.\"],\"links\":[{\"value\":\"https://icann.org/epp\",\"rel\":\"related\",\"href\":\"https://icann.org/epp\",\"hreflang\":null,\"title\":null,\"media\":null,\"type\":\"text/html\"}]},{\"title\":\"RDDS Inaccuracy Complaint Form\",\"type\":null,\"description\":[\"URL of the ICANN RDDS Inaccuracy Complaint Form: https://www.icann.org/wicf.\"],\"links\":[{\"value\":\"https://www.icann.org/wicf\",\"rel\":\"related\",\"href\":\"https://www.icann.org/wicf\",\"hreflang\":null,\"title\":null,\"media\":null,\"type\":\"text/html\"}]}],\"status\":[\"client update prohibited\",\"client transfer prohibited\",\"client delete prohibited\",\"server update prohibited\",\"server transfer prohibited\",\"server delete prohibited\"],\"entities\":[{\"rdapConformance\":[],\"objectClassName\":\"entity\",\"handle\":\"171459\",\"port43\":null,\"lang\":null,\"events\":[{\"eventAction\":\"last update\",\"eventDate\":\"2019-04-24T19:00:18Z\",\"eventActor\":null,\"status\":[]}],\"notices\":[],\"status\":[],\"entities\":[],\"remarks\":[],\"links\":[],\"nameservers\":[],\"entity\":null,\"errorCode\":null,\"errorTitle\":null,\"errorDescription\":[],\"vcardArray\":[\"vcard\",[[\"version\",{},\"text\",\"4.0\"],[\"fn\",{},\"text\",\"Domain Admin\"],[\"org\",{\"type\":\"work\"},\"text\",\"Oath Inc.\"],[\"adr\",{},\"text\",[\"\",\"\",\"22000 AOL Way\",\"Dulles\",\"VA\",\"20166\",\"US\"]],[\"email\",{\"type\":\"work\"},\"text\",\"domain-admin@oath.com\"],[\"tel\",{\"type\":\"voice\"},\"text\",\"+1.4083493300\"]]],\"roles\":[\"admin\",\"registrant\",\"technical\"],\"publicIds\":[],\"legalRepresentative\":null,\"networks\":null,\"autnums\":null,\"nicbr_domainCount\":0,\"nicbr_inetCount\":0,\"nicbr_autnumCount\":0,\"contact_URI\":null},{\"rdapConformance\":[],\"objectClassName\":\"entity\",\"handle\":\"292\",\"port43\":null,\"lang\":null,\"events\":[{\"eventAction\":\"registrar expiration\",\"eventDate\":\"2020-09-14T04:00:00Z\",\"eventActor\":null,\"status\":[]}],\"notices\":[],\"status\":[],\"entities\":[{\"rdapConformance\":[],\"objectClassName\":\"entity\",\"handle\":null,\"port43\":null,\"lang\":null,\"events\":[],\"notices\":[],\"status\":[],\"entities\":[],\"remarks\":[],\"links\":[],\"nameservers\":[],\"entity\":null,\"errorCode\":null,\"errorTitle\":null,\"errorDescription\":[],\"vcardArray\":[\"vcard\",[[\"version\",{},\"text\",\"4.0\"],[\"email\",{\"type\":\"work\"},\"text\",\"abusecomplaints@markmonitor.com\"],[\"tel\",{\"type\":\"voice\"},\"text\",\"+1.2083895770\"]]],\"roles\":[\"abuse\"],\"publicIds\":[],\"legalRepresentative\":null,\"networks\":null,\"autnums\":null,\"nicbr_domainCount\":0,\"nicbr_inetCount\":0,\"nicbr_autnumCount\":0,\"contact_URI\":null}],\"remarks\":[],\"links\":[],\"nameservers\":[],\"entity\":null,\"errorCode\":null,\"errorTitle\":null,\"errorDescription\":[],\"vcardArray\":[\"vcard\",[[\"version\",{},\"text\",\"4.0\"],[\"org\",{\"type\":\"work\"},\"text\",\"MarkMonitor Inc.\"],[\"adr\",{},\"text\",[\"\",\"\",\"3540 E Longwing Ln\",\"Meridian\",\"ID\",\"83646\",\"US\"]]]],\"roles\":[\"registrar\"],\"publicIds\":[{\"type\":\"IANA Registrar ID\",\"identifier\":\"292\"}],\"legalRepresentative\":null,\"networks\":null,\"autnums\":null,\"nicbr_domainCount\":0,\"nicbr_inetCount\":0,\"nicbr_autnumCount\":0,\"contact_URI\":null}],\"remarks\":[],\"links\":[{\"value\":\"https://rdap.markmonitor.com/rdap/domain/yahoo.com\",\"rel\":\"self\",\"href\":\"https://rdap.markmonitor.com/rdap/domain/yahoo.com\",\"hreflang\":null,\"title\":null,\"media\":null,\"type\":\"application/rdap+json\"}],\"nameservers\":[{\"rdapConformance\":[],\"objectClassName\":\"nameserver\",\"handle\":null,\"port43\":null,\"lang\":null,\"events\":[{\"eventAction\":\"last changed\",\"eventDate\":\"2013-07-11T16:30:20Z\",\"eventActor\":null,\"status\":[]}],\"notices\":[],\"status\":[\"active\"],\"entities\":[],\"remarks\":[],\"links\":[],\"nameservers\":[],\"entity\":null,\"errorCode\":null,\"errorTitle\":null,\"errorDescription\":[],\"ldhName\":\"ns1.yahoo.com\",\"unicodeName\":null,\"variants\":[],\"secureDNS\":null,\"publicIds\":[],\"network\":null,\"nicbr_arbitration\":false,\"delegate\":null,\"ipAddresses\":null},{\"rdapConformance\":[],\"objectClassName\":\"nameserver\",\"handle\":null,\"port43\":null,\"lang\":null,\"events\":[{\"eventAction\":\"last changed\",\"eventDate\":\"2013-07-11T16:30:20Z\",\"eventActor\":null,\"status\":[]}],\"notices\":[],\"status\":[\"active\"],\"entities\":[],\"remarks\":[],\"links\":[],\"nameservers\":[],\"entity\":null,\"errorCode\":null,\"errorTitle\":null,\"errorDescription\":[],\"ldhName\":\"ns2.yahoo.com\",\"unicodeName\":null,\"variants\":[],\"secureDNS\":null,\"publicIds\":[],\"network\":null,\"nicbr_arbitration\":false,\"delegate\":null,\"ipAddresses\":null},{\"rdapConformance\":[],\"objectClassName\":\"nameserver\",\"handle\":null,\"port43\":null,\"lang\":null,\"events\":[{\"eventAction\":\"last changed\",\"eventDate\":\"2013-07-11T16:30:20Z\",\"eventActor\":null,\"status\":[]}],\"notices\":[],\"status\":[\"active\"],\"entities\":[],\"remarks\":[],\"links\":[],\"nameservers\":[],\"entity\":null,\"errorCode\":null,\"errorTitle\":null,\"errorDescription\":[],\"ldhName\":\"ns3.yahoo.com\",\"unicodeName\":null,\"variants\":[],\"secureDNS\":null,\"publicIds\":[],\"network\":null,\"nicbr_arbitration\":false,\"delegate\":null,\"ipAddresses\":null},{\"rdapConformance\":[],\"objectClassName\":\"nameserver\",\"handle\":null,\"port43\":null,\"lang\":null,\"events\":[{\"eventAction\":\"last changed\",\"eventDate\":\"2013-07-11T16:30:20Z\",\"eventActor\":null,\"status\":[]}],\"notices\":[],\"status\":[\"active\"],\"entities\":[],\"remarks\":[],\"links\":[],\"nameservers\":[],\"entity\":null,\"errorCode\":null,\"errorTitle\":null,\"errorDescription\":[],\"ldhName\":\"ns4.yahoo.com\",\"unicodeName\":null,\"variants\":[],\"secureDNS\":null,\"publicIds\":[],\"network\":null,\"nicbr_arbitration\":false,\"delegate\":null,\"ipAddresses\":null},{\"rdapConformance\":[],\"objectClassName\":\"nameserver\",\"handle\":null,\"port43\":null,\"lang\":null,\"events\":[{\"eventAction\":\"last changed\",\"eventDate\":\"2013-07-11T16:30:20Z\",\"eventActor\":null,\"status\":[]}],\"notices\":[],\"status\":[\"active\"],\"entities\":[],\"remarks\":[],\"links\":[],\"nameservers\":[],\"entity\":null,\"errorCode\":null,\"errorTitle\":null,\"errorDescription\":[],\"ldhName\":\"ns5.yahoo.com\",\"unicodeName\":null,\"variants\":[],\"secureDNS\":null,\"publicIds\":[],\"network\":null,\"nicbr_arbitration\":false,\"delegate\":null,\"ipAddresses\":null}],\"entity\":null,\"errorCode\":null,\"errorTitle\":null,\"errorDescription\":[],\"ldhName\":\"yahoo.com\",\"unicodeName\":null,\"variants\":[],\"secureDNS\":{\"zoneSigned\":null,\"delegationSigned\":false,\"maxSigLife\":null,\"dsData\":[],\"keyData\":[]},\"publicIds\":[],\"network\":null,\"nicbr_arbitration\":false,\"delegate\":null}}", "raw": "Registrar: \n  Handle: 3643624_DOMAIN_COM-VRSN\n  LDH Name: yahoo.com\n  Nameserver: \n    LDH Name: ns1.yahoo.com\n    Event: \n      Action: last changed\n      Date: 2013-07-11T16:30:20Z\n      Status: active\n  Nameserver: \n    LDH Name: ns2.yahoo.com\n    Event: \n      Action: last changed\n      Date: 2013-07-11T16:30:20Z\n      Status: active\n  Nameserver: \n    LDH Name: ns3.yahoo.com\n    Event: \n      Action: last changed\n      Date: 2013-07-11T16:30:20Z\n      Status: active\n  Nameserver: \n    LDH Name: ns4.yahoo.com\n    Event: \n      Action: last changed\n      Date: 2013-07-11T16:30:20Z\n      Status: active\n  Nameserver: \n    LDH Name: ns5.yahoo.com\n    Event: \n      Action: last changed\n      Date: 2013-07-11T16:30:20Z\n      Status: active\n  SecureDNS: \n    Delegation Signed: false\n  Event: \n    Action: expiration\n    Date: 2023-01-19T05:00:00Z\n  Event: \n    Action: registration\n    Date: 1995-01-18T08:00:00Z\n  Event: \n    Action: last update\n    Date: 2020-07-30T18:35:29Z\n  Event: \n    Action: last update of RDAP database\n    Date: 2021-02-14T20:10:11Z\n  Status: \n    client update prohibited\n    client transfer prohibited\n    client delete prohibited\n    server update prohibited\n    server transfer prohibited\n    server delete prohibited\n  Entity: \n    Handle: 171459\n    Role: \n      ADMIN\n      REGISTRANT\n      TECHNICAL\n    VCard: \n      Formatted Name: Domain Admin\n          Organization: Oath Inc.\n          TYPE: work\n      Address: \n          Street: 22000 AOL Way\n          Locale: Dulles\n          Region: VA\n          Postal Code: 20166\n          Country: US\n      Email: domain-admin@oath.com\n          TYPE: work\n      Telephone: +1.4083493300\n          TYPE: voice\n    Event: \n      Action: last update\n      Date: 2019-04-24T19:00:18Z\n  Entity: \n    Handle: 292\n    Role: \n      REGISTRAR\n    VCard: \n          Organization: MarkMonitor Inc.\n          TYPE: work\n      Address: \n          Street: 3540 E Longwing Ln\n          Locale: Meridian\n          Region: ID\n          Postal Code: 83646\n          Country: US\n    Event: \n      Action: registrar expiration\n      Date: 2020-09-14T04:00:00Z\n    Entity: \n      Role: \n        ABUSE\n      VCard: \n        Email: abusecomplaints@markmonitor.com\n            TYPE: work\n        Telephone: +1.2083895770\n            TYPE: voice\n  Link: \n    Rel: self\n    Value: https://rdap.markmonitor.com/rdap/domain/yahoo.com\n    Type: application/rdap+json\n    Href: https://rdap.markmonitor.com/rdap/domain/yahoo.com\n  Notice: \n    Title: Terms of Use\n    Description: \n      By submitting an RDAP query, you agree that you will use this data only for\n      lawful purposes and that, under no circumstances will you use this data to:\n      (1) allow, enable, or otherwise support the transmission by email, telephone,\n      or facsimile of mass, unsolicited, commercial advertising, or spam; or\n      (2) enable high volume, automated, or electronic processes that send queries,\n      data, or email to MarkMonitor (or its systems) or the domain name contacts (or\n      its systems).\n      MarkMonitor reserves the right to modify these terms at any time.\n      By submitting this query, you agree to abide by this policy.\n      MarkMonitor Domain Management(TM)\n      Protecting companies and consumers in a digital world.\n      Visit MarkMonitor at https://www.markmonitor.com\n      Contact us at +1.8007459229\n      In Europe, at +44.02032062220\n      Link: \n        Rel: related\n        Value: https://www.markmonitor.com/legal/domain-management-terms-and-conditions\n        Type: text/html\n        Href: https://www.markmonitor.com/legal/domain-management-terms-and-conditions\n  Notice: \n    Title: Status Codes\n      Description: For more information on domain status codes, please visit https://icann.org/epp.\n      Link: \n        Rel: related\n        Value: https://icann.org/epp\n        Type: text/html\n        Href: https://icann.org/epp\n  Notice: \n    Title: RDDS Inaccuracy Complaint Form\n      Description: URL of the ICANN RDDS Inaccuracy Complaint Form: https://www.icann.org/wicf.\n      Link: \n        Rel: related\n        Value: https://www.icann.org/wicf\n        Type: text/html\n        Href: https://www.icann.org/wicf\n  RDAP Conformance: \n    rdap_level_0\n    icann_rdap_technical_implementation_guide_0\n    icann_rdap_response_profile_0\n\n\n  Registry: \n    Handle: 3643624_DOMAIN_COM-VRSN\n    LDH Name: YAHOO.COM\n    Nameserver: \n      LDH Name: NS1.YAHOO.COM\n    Nameserver: \n      LDH Name: NS2.YAHOO.COM\n    Nameserver: \n      LDH Name: NS3.YAHOO.COM\n    Nameserver: \n      LDH Name: NS4.YAHOO.COM\n    Nameserver: \n      LDH Name: NS5.YAHOO.COM\n    SecureDNS: \n      Delegation Signed: false\n    Event: \n      Action: registration\n      Date: 1995-01-18T05:00:00Z\n    Event: \n      Action: expiration\n      Date: 2023-01-19T05:00:00Z\n    Event: \n      Action: last update of RDAP database\n      Date: 2021-02-14T11:44:57Z\n    Status: \n      client delete prohibited\n      client transfer prohibited\n      client update prohibited\n      server delete prohibited\n      server transfer prohibited\n      server update prohibited\n    Entity: \n      Handle: 292\n      Role: \n        REGISTRAR\n      VCard: \n        Formatted Name: MarkMonitor Inc.\n      Entity: \n        Role: \n          ABUSE\n        VCard: \n          Formatted Name: \n              TYPE: voice\n          Email: abusecomplaints@markmonitor.com\n    Link: \n      Rel: self\n      Value: https://rdap.verisign.com/com/v1/domain/YAHOO.COM\n      Type: application/rdap+json\n      Href: https://rdap.verisign.com/com/v1/domain/YAHOO.COM\n    Link: \n      Rel: related\n      Value: https://rdap.markmonitor.com/rdap/domain/YAHOO.COM\n      Type: application/rdap+json\n      Href: https://rdap.markmonitor.com/rdap/domain/YAHOO.COM\n    Notice: \n      Title: Terms of Use\n        Description: Service subject to Terms of Use.\n        Link: \n          Type: text/html\n          Href: https://www.verisign.com/domain-names/registration-data-access-protocol/terms-service/index.xhtml\n    Notice: \n      Title: Status Codes\n        Description: For more information on domain status codes, please visit https://icann.org/epp\n        Link: \n          Type: text/html\n          Href: https://icann.org/epp\n    Notice: \n      Title: RDDS Inaccuracy Complaint Form\n        Description: URL of the ICANN RDDS Inaccuracy Complaint Form: https://icann.org/wicf\n        Link: \n          Type: text/html\n          Href: https://icann.org/wicf\n    RDAP Conformance: \n      rdap_level_0\n      icann_rdap_technical_implementation_guide_0\n      icann_rdap_response_profile_0\n", "whoisRawID": 0, "source": "WHOIS_RDAP", "match_whitelist": {"domain": true}}, "registrarUpdatedAt": 1596134129, "whoisID": 6702004964111632248, "registrarIanaID": 292, "registrarName": "MarkMonitor Inc.", "admin": {"zip": "20166", "country": "US", "address": "22000 AOL Way\nDulles\n20166\nVA\nUS\n", "city": "Dulles", "phone": "+1.4083493300", "whoisContactID": 0, "street": "22000 AOL Way", "organization": "Oath Inc.", "name": "Domain Admin", "state": "VA", "id": 0, "email": "domain-admin@oath.com"}, "whoisServer": "rdap.markmonitor.com", "createdAt": 1597882500, "expired": false, "contactOrganizations": ["Oath Inc.", "MarkMonitor Inc."], "registrarParseCode": 44323, "auditUpdatedAt": 1624551057, "id": 6702004964111632248, "registrarPhone": "+1.2083895740", "updatedAt": 1628143680, "domainUnicode": "yahoo.com", "auditCreatedAt": 1597882500, "registrarExpiresAt": 1674104400, "contactCountries": ["US", "us"], "compositeParseCode": 44323, "contactEmails": ["domain-admin@oath.com", "abusecomplaints@markmonitor.com"], "registrarEmail": "abusecomplaints@markmonitor.com", "domainStatus": "client update prohibited,client transfer prohibited,client delete prohibited,server update prohibited,server transfer prohibited,server delete prohibited", "tld": "com", "domainAvailable": false, "registrarCreatedAt": 790416000, "noRecord": false, "nameservers": ["ns1.yahoo.com", "ns2.yahoo.com", "ns3.yahoo.com", "ns4.yahoo.com", "ns5.yahoo.com"], "domain": "yahoo.com", "registrant": {"zip": "20166", "country": "US", "address": "22000 AOL Way\nDulles\n20166\nVA\nUS\n", "city": "Dulles", "phone": "+1.4083493300", "whoisContactID": 0, "street": "22000 AOL Way", "organization": "Oath Inc.", "name": "Domain Admin", "state": "VA", "id": 0, "email": "domain-admin@oath.com"}, "contactNames": ["Domain Admin"], "contacts": [{"zip": "20166", "country": "US", "address": "22000 AOL Way\nDulles\n20166\nVA\nUS\n", "city": "Dulles", "phone": "+1.4083493300", "whoisContactID": 0, "street": "22000 AOL Way", "organization": "Oath Inc.", "name": "Domain Admin", "state": "VA", "id": 0, "email": "domain-admin@oath.com"}, {"zip": "83646", "country": "us", "address": "3540 E Longwing Ln\nmeridian\n83646\nid\nus\n", "city": "meridian", "whoisContactID": 0, "street": "3540 E Longwing Ln", "organization": "MarkMonitor Inc.", "state": "id", "id": 0}, {"address": "", "phone": "+1.2083895770", "whoisContactID": 0, "id": 0, "email": "abusecomplaints@markmonitor.com"}], "status": "INACTIVE", "domainMd5": "50cd1a9a183758039b0841aa738c3f0b", "task_id": "9ce5cc1710cd447aad6641b1bdcc0d93", "match_whitelist": {"domain": true}}, {"registrar": {"zip": "83646", "country": "US", "address": "3540 E Longwing Ln\nMeridian\n83646\nID\nUS\n", "city": "Meridian", "whoisContactID": 0, "street": "3540 E Longwing Ln", "organization": "MarkMonitor Inc.", "state": "ID", "id": 0}, "rawResponse": {"domain": "yahoo.com", "whoisID": 6701609909772985307, "unparsed": "{\"rdapConformance\":[\"rdap_level_0\",\"icann_rdap_technical_implementation_guide_0\",\"icann_rdap_response_profile_0\"],\"objectClassName\":\"domain\",\"handle\":\"3643624_DOMAIN_COM-VRSN\",\"port43\":null,\"lang\":null,\"events\":[{\"eventAction\":\"registration\",\"eventDate\":\"1995-01-18T05:00:00Z\",\"eventActor\":null,\"status\":[]},{\"eventAction\":\"expiration\",\"eventDate\":\"2023-01-19T05:00:00Z\",\"eventActor\":null,\"status\":[]},{\"eventAction\":\"last update of RDAP database\",\"eventDate\":\"2020-08-18T09:35:53Z\",\"eventActor\":null,\"status\":[]}],\"notices\":[{\"title\":\"Terms of Use\",\"type\":null,\"description\":[\"Service subject to Terms of Use.\"],\"links\":[{\"value\":null,\"rel\":null,\"href\":\"https://www.verisign.com/domain-names/registration-data-access-protocol/terms-service/index.xhtml\",\"hreflang\":null,\"title\":null,\"media\":null,\"type\":\"text/html\"}]},{\"title\":\"Status Codes\",\"type\":null,\"description\":[\"For more information on domain status codes, please visit https://icann.org/epp\"],\"links\":[{\"value\":null,\"rel\":null,\"href\":\"https://icann.org/epp\",\"hreflang\":null,\"title\":null,\"media\":null,\"type\":\"text/html\"}]},{\"title\":\"RDDS Inaccuracy Complaint Form\",\"type\":null,\"description\":[\"URL of the ICANN RDDS Inaccuracy Complaint Form: https://icann.org/wicf\"],\"links\":[{\"value\":null,\"rel\":null,\"href\":\"https://icann.org/wicf\",\"hreflang\":null,\"title\":null,\"media\":null,\"type\":\"text/html\"}]}],\"status\":[\"client delete prohibited\",\"client transfer prohibited\",\"client update prohibited\",\"server delete prohibited\",\"server transfer prohibited\",\"server update prohibited\"],\"entities\":[{\"rdapConformance\":[],\"objectClassName\":\"entity\",\"handle\":\"292\",\"port43\":null,\"lang\":null,\"events\":[],\"notices\":[],\"status\":[],\"entities\":[{\"rdapConformance\":[],\"objectClassName\":\"entity\",\"handle\":null,\"port43\":null,\"lang\":null,\"events\":[],\"notices\":[],\"status\":[],\"entities\":[],\"remarks\":[],\"links\":[],\"nameservers\":[],\"entity\":null,\"errorCode\":null,\"errorTitle\":null,\"errorDescription\":[],\"vcardArray\":[\"vcard\",[[\"version\",{},\"text\",\"4.0\"],[\"fn\",{},\"text\",\"\"],[\"tel\",{\"type\":\"voice\"},\"uri\",\"tel:+1.2083895740\"],[\"email\",{},\"text\",\"abusecomplaints@markmonitor.com\"]]],\"roles\":[\"abuse\"],\"publicIds\":[],\"legalRepresentative\":null,\"networks\":null,\"autnums\":null,\"nicbr_domainCount\":0,\"nicbr_inetCount\":0,\"nicbr_autnumCount\":0,\"contact_URI\":null}],\"remarks\":[],\"links\":[],\"nameservers\":[],\"entity\":null,\"errorCode\":null,\"errorTitle\":null,\"errorDescription\":[],\"vcardArray\":[\"vcard\",[[\"version\",{},\"text\",\"4.0\"],[\"fn\",{},\"text\",\"MarkMonitor Inc.\"]]],\"roles\":[\"registrar\"],\"publicIds\":[{\"type\":\"IANA Registrar ID\",\"identifier\":\"292\"}],\"legalRepresentative\":null,\"networks\":null,\"autnums\":null,\"nicbr_domainCount\":0,\"nicbr_inetCount\":0,\"nicbr_autnumCount\":0,\"contact_URI\":null}],\"remarks\":[],\"links\":[{\"value\":\"https://rdap.verisign.com/com/v1/domain/YAHOO.COM\",\"rel\":\"self\",\"href\":\"https://rdap.verisign.com/com/v1/domain/YAHOO.COM\",\"hreflang\":null,\"title\":null,\"media\":null,\"type\":\"application/rdap+json\"},{\"value\":\"https://rdap.markmonitor.com/rdap/domain/YAHOO.COM\",\"rel\":\"related\",\"href\":\"https://rdap.markmonitor.com/rdap/domain/YAHOO.COM\",\"hreflang\":null,\"title\":null,\"media\":null,\"type\":\"application/rdap+json\"}],\"nameservers\":[{\"rdapConformance\":[],\"objectClassName\":\"nameserver\",\"handle\":null,\"port43\":null,\"lang\":null,\"events\":[],\"notices\":[],\"status\":[],\"entities\":[],\"remarks\":[],\"links\":[],\"nameservers\":[],\"entity\":null,\"errorCode\":null,\"errorTitle\":null,\"errorDescription\":[],\"ldhName\":\"NS1.YAHOO.COM\",\"unicodeName\":null,\"variants\":[],\"secureDNS\":null,\"publicIds\":[],\"network\":null,\"delegate\":null,\"whois43\":null,\"ipAddresses\":null},{\"rdapConformance\":[],\"objectClassName\":\"nameserver\",\"handle\":null,\"port43\":null,\"lang\":null,\"events\":[],\"notices\":[],\"status\":[],\"entities\":[],\"remarks\":[],\"links\":[],\"nameservers\":[],\"entity\":null,\"errorCode\":null,\"errorTitle\":null,\"errorDescription\":[],\"ldhName\":\"NS2.YAHOO.COM\",\"unicodeName\":null,\"variants\":[],\"secureDNS\":null,\"publicIds\":[],\"network\":null,\"delegate\":null,\"whois43\":null,\"ipAddresses\":null},{\"rdapConformance\":[],\"objectClassName\":\"nameserver\",\"handle\":null,\"port43\":null,\"lang\":null,\"events\":[],\"notices\":[],\"status\":[],\"entities\":[],\"remarks\":[],\"links\":[],\"nameservers\":[],\"entity\":null,\"errorCode\":null,\"errorTitle\":null,\"errorDescription\":[],\"ldhName\":\"NS3.YAHOO.COM\",\"unicodeName\":null,\"variants\":[],\"secureDNS\":null,\"publicIds\":[],\"network\":null,\"delegate\":null,\"whois43\":null,\"ipAddresses\":null},{\"rdapConformance\":[],\"objectClassName\":\"nameserver\",\"handle\":null,\"port43\":null,\"lang\":null,\"events\":[],\"notices\":[],\"status\":[],\"entities\":[],\"remarks\":[],\"links\":[],\"nameservers\":[],\"entity\":null,\"errorCode\":null,\"errorTitle\":null,\"errorDescription\":[],\"ldhName\":\"NS4.YAHOO.COM\",\"unicodeName\":null,\"variants\":[],\"secureDNS\":null,\"publicIds\":[],\"network\":null,\"delegate\":null,\"whois43\":null,\"ipAddresses\":null},{\"rdapConformance\":[],\"objectClassName\":\"nameserver\",\"handle\":null,\"port43\":null,\"lang\":null,\"events\":[],\"notices\":[],\"status\":[],\"entities\":[],\"remarks\":[],\"links\":[],\"nameservers\":[],\"entity\":null,\"errorCode\":null,\"errorTitle\":null,\"errorDescription\":[],\"ldhName\":\"NS5.YAHOO.COM\",\"unicodeName\":null,\"variants\":[],\"secureDNS\":null,\"publicIds\":[],\"network\":null,\"delegate\":null,\"whois43\":null,\"ipAddresses\":null}],\"entity\":null,\"errorCode\":null,\"errorTitle\":null,\"errorDescription\":[],\"ldhName\":\"YAHOO.COM\",\"unicodeName\":null,\"variants\":[],\"secureDNS\":{\"zoneSigned\":null,\"delegationSigned\":false,\"maxSigLife\":null,\"dsData\":[],\"keyData\":[]},\"publicIds\":[],\"network\":null,\"delegate\":{\"rdapConformance\":[\"rdap_level_0\",\"icann_rdap_technical_implementation_guide_0\",\"icann_rdap_response_profile_0\"],\"objectClassName\":\"domain\",\"handle\":\"3643624_DOMAIN_COM-VRSN\",\"port43\":\"whois.markmonitor.com\",\"lang\":null,\"events\":[{\"eventAction\":\"expiration\",\"eventDate\":\"2023-01-19T05:00:00Z\",\"eventActor\":null,\"status\":[]},{\"eventAction\":\"registration\",\"eventDate\":\"1995-01-18T08:00:00Z\",\"eventActor\":null,\"status\":[]},{\"eventAction\":\"last update\",\"eventDate\":\"2020-07-30T18:35:29Z\",\"eventActor\":null,\"status\":[]},{\"eventAction\":\"last update of RDAP database\",\"eventDate\":\"2020-08-18T22:04:32Z\",\"eventActor\":null,\"status\":[]}],\"notices\":[{\"title\":\"Terms of Use\",\"type\":null,\"description\":[\"By submitting an RDAP query, you agree that you will use this data only for\",\"lawful purposes and that, under no circumstances will you use this data to:\",\"(1) allow, enable, or otherwise support the transmission by email, telephone,\",\"or facsimile of mass, unsolicited, commercial advertising, or spam; or\",\"(2) enable high volume, automated, or electronic processes that send queries,\",\"data, or email to MarkMonitor (or its systems) or the domain name contacts (or\",\"its systems).\",\"MarkMonitor reserves the right to modify these terms at any time.\",\"By submitting this query, you agree to abide by this policy.\",\"MarkMonitor Domain Management(TM)\",\"Protecting companies and consumers in a digital world.\",\"Visit MarkMonitor at https://www.markmonitor.com\",\"Contact us at +1.8007459229\",\"In Europe, at +44.02032062220\"],\"links\":[{\"value\":\"https://www.markmonitor.com/legal/domain-management-terms-and-conditions\",\"rel\":\"related\",\"href\":\"https://www.markmonitor.com/legal/domain-management-terms-and-conditions\",\"hreflang\":null,\"title\":null,\"media\":null,\"type\":\"text/html\"}]},{\"title\":\"Status Codes\",\"type\":null,\"description\":[\"For more information on domain status codes, please visit https://icann.org/epp.\"],\"links\":[{\"value\":\"https://icann.org/epp\",\"rel\":\"related\",\"href\":\"https://icann.org/epp\",\"hreflang\":null,\"title\":null,\"media\":null,\"type\":\"text/html\"}]},{\"title\":\"RDDS Inaccuracy Complaint Form\",\"type\":null,\"description\":[\"URL of the ICANN RDDS Inaccuracy Complaint Form: https://www.icann.org/wicf.\"],\"links\":[{\"value\":\"https://www.icann.org/wicf\",\"rel\":\"related\",\"href\":\"https://www.icann.org/wicf\",\"hreflang\":null,\"title\":null,\"media\":null,\"type\":\"text/html\"}]}],\"status\":[\"client update prohibited\",\"client transfer prohibited\",\"client delete prohibited\",\"server update prohibited\",\"server transfer prohibited\",\"server delete prohibited\"],\"entities\":[{\"rdapConformance\":[],\"objectClassName\":\"entity\",\"handle\":\"292\",\"port43\":null,\"lang\":null,\"events\":[{\"eventAction\":\"registrar expiration\",\"eventDate\":\"2020-09-14T04:00:00Z\",\"eventActor\":null,\"status\":[]}],\"notices\":[],\"status\":[],\"entities\":[{\"rdapConformance\":[],\"objectClassName\":\"entity\",\"handle\":null,\"port43\":null,\"lang\":null,\"events\":[],\"notices\":[],\"status\":[],\"entities\":[],\"remarks\":[],\"links\":[],\"nameservers\":[],\"entity\":null,\"errorCode\":null,\"errorTitle\":null,\"errorDescription\":[],\"vcardArray\":[\"vcard\",[[\"version\",{},\"text\",\"4.0\"],[\"email\",{\"type\":\"work\"},\"text\",\"abusecomplaints@markmonitor.com\"],[\"tel\",{\"type\":\"voice\"},\"text\",\"+1.2083895770\"]]],\"roles\":[\"abuse\"],\"publicIds\":[],\"legalRepresentative\":null,\"networks\":null,\"autnums\":null,\"nicbr_domainCount\":0,\"nicbr_inetCount\":0,\"nicbr_autnumCount\":0,\"contact_URI\":null}],\"remarks\":[],\"links\":[],\"nameservers\":[],\"entity\":null,\"errorCode\":null,\"errorTitle\":null,\"errorDescription\":[],\"vcardArray\":[\"vcard\",[[\"version\",{},\"text\",\"4.0\"],[\"org\",{\"type\":\"work\"},\"text\",\"MarkMonitor Inc.\"],[\"adr\",{},\"text\",[\"\",\"\",\"3540 E Longwing Ln\",\"Meridian\",\"ID\",\"83646\",\"US\"]]]],\"roles\":[\"registrar\"],\"publicIds\":[{\"type\":\"IANA Registrar ID\",\"identifier\":\"292\"}],\"legalRepresentative\":null,\"networks\":null,\"autnums\":null,\"nicbr_domainCount\":0,\"nicbr_inetCount\":0,\"nicbr_autnumCount\":0,\"contact_URI\":null}],\"remarks\":[],\"links\":[{\"value\":\"https://rdap.markmonitor.com/rdap/domain/yahoo.com\",\"rel\":\"self\",\"href\":\"https://rdap.markmonitor.com/rdap/domain/yahoo.com\",\"hreflang\":null,\"title\":null,\"media\":null,\"type\":\"application/rdap+json\"}],\"nameservers\":[{\"rdapConformance\":[],\"objectClassName\":\"nameserver\",\"handle\":null,\"port43\":null,\"lang\":null,\"events\":[{\"eventAction\":\"last changed\",\"eventDate\":\"2013-07-11T16:30:20Z\",\"eventActor\":null,\"status\":[]}],\"notices\":[],\"status\":[\"active\"],\"entities\":[],\"remarks\":[],\"links\":[],\"nameservers\":[],\"entity\":null,\"errorCode\":null,\"errorTitle\":null,\"errorDescription\":[],\"ldhName\":\"ns1.yahoo.com\",\"unicodeName\":null,\"variants\":[],\"secureDNS\":null,\"publicIds\":[],\"network\":null,\"delegate\":null,\"whois43\":null,\"ipAddresses\":null},{\"rdapConformance\":[],\"objectClassName\":\"nameserver\",\"handle\":null,\"port43\":null,\"lang\":null,\"events\":[{\"eventAction\":\"last changed\",\"eventDate\":\"2013-07-11T16:30:20Z\",\"eventActor\":null,\"status\":[]}],\"notices\":[],\"status\":[\"active\"],\"entities\":[],\"remarks\":[],\"links\":[],\"nameservers\":[],\"entity\":null,\"errorCode\":null,\"errorTitle\":null,\"errorDescription\":[],\"ldhName\":\"ns2.yahoo.com\",\"unicodeName\":null,\"variants\":[],\"secureDNS\":null,\"publicIds\":[],\"network\":null,\"delegate\":null,\"whois43\":null,\"ipAddresses\":null},{\"rdapConformance\":[],\"objectClassName\":\"nameserver\",\"handle\":null,\"port43\":null,\"lang\":null,\"events\":[{\"eventAction\":\"last changed\",\"eventDate\":\"2013-07-11T16:30:20Z\",\"eventActor\":null,\"status\":[]}],\"notices\":[],\"status\":[\"active\"],\"entities\":[],\"remarks\":[],\"links\":[],\"nameservers\":[],\"entity\":null,\"errorCode\":null,\"errorTitle\":null,\"errorDescription\":[],\"ldhName\":\"ns3.yahoo.com\",\"unicodeName\":null,\"variants\":[],\"secureDNS\":null,\"publicIds\":[],\"network\":null,\"delegate\":null,\"whois43\":null,\"ipAddresses\":null},{\"rdapConformance\":[],\"objectClassName\":\"nameserver\",\"handle\":null,\"port43\":null,\"lang\":null,\"events\":[{\"eventAction\":\"last changed\",\"eventDate\":\"2013-07-11T16:30:20Z\",\"eventActor\":null,\"status\":[]}],\"notices\":[],\"status\":[\"active\"],\"entities\":[],\"remarks\":[],\"links\":[],\"nameservers\":[],\"entity\":null,\"errorCode\":null,\"errorTitle\":null,\"errorDescription\":[],\"ldhName\":\"ns4.yahoo.com\",\"unicodeName\":null,\"variants\":[],\"secureDNS\":null,\"publicIds\":[],\"network\":null,\"delegate\":null,\"whois43\":null,\"ipAddresses\":null},{\"rdapConformance\":[],\"objectClassName\":\"nameserver\",\"handle\":null,\"port43\":null,\"lang\":null,\"events\":[{\"eventAction\":\"last changed\",\"eventDate\":\"2013-07-11T16:30:20Z\",\"eventActor\":null,\"status\":[]}],\"notices\":[],\"status\":[\"active\"],\"entities\":[],\"remarks\":[],\"links\":[],\"nameservers\":[],\"entity\":null,\"errorCode\":null,\"errorTitle\":null,\"errorDescription\":[],\"ldhName\":\"ns5.yahoo.com\",\"unicodeName\":null,\"variants\":[],\"secureDNS\":null,\"publicIds\":[],\"network\":null,\"delegate\":null,\"whois43\":null,\"ipAddresses\":null}],\"entity\":null,\"errorCode\":null,\"errorTitle\":null,\"errorDescription\":[],\"ldhName\":\"yahoo.com\",\"unicodeName\":null,\"variants\":[],\"secureDNS\":{\"zoneSigned\":null,\"delegationSigned\":false,\"maxSigLife\":null,\"dsData\":[],\"keyData\":[]},\"publicIds\":[],\"network\":null,\"delegate\":null,\"whois43\":null},\"whois43\":null}", "raw": "Registrar: \n  Handle: 3643624_DOMAIN_COM-VRSN\n  LDH Name: yahoo.com\n  Nameserver: \n    LDH Name: ns1.yahoo.com\n    Event: \n      Action: last changed\n      Date: 2013-07-11T16:30:20Z\n      Status: active\n  Nameserver: \n    LDH Name: ns2.yahoo.com\n    Event: \n      Action: last changed\n      Date: 2013-07-11T16:30:20Z\n      Status: active\n  Nameserver: \n    LDH Name: ns3.yahoo.com\n    Event: \n      Action: last changed\n      Date: 2013-07-11T16:30:20Z\n      Status: active\n  Nameserver: \n    LDH Name: ns4.yahoo.com\n    Event: \n      Action: last changed\n      Date: 2013-07-11T16:30:20Z\n      Status: active\n  Nameserver: \n    LDH Name: ns5.yahoo.com\n    Event: \n      Action: last changed\n      Date: 2013-07-11T16:30:20Z\n      Status: active\n  SecureDNS: \n    Delegation Signed: false\n  Event: \n    Action: expiration\n    Date: 2023-01-19T05:00:00Z\n  Event: \n    Action: registration\n    Date: 1995-01-18T08:00:00Z\n  Event: \n    Action: last update\n    Date: 2020-07-30T18:35:29Z\n  Event: \n    Action: last update of RDAP database\n    Date: 2020-08-18T22:04:32Z\n  Status: \n    client update prohibited\n    client transfer prohibited\n    client delete prohibited\n    server update prohibited\n    server transfer prohibited\n    server delete prohibited\n  Entity: \n    Handle: 292\n    Role: \n      REGISTRAR\n    VCard: \n          Organization: MarkMonitor Inc.\n          TYPE: work\n      Address: \n          Street: 3540 E Longwing Ln\n          Locale: Meridian\n          Region: ID\n          Postal Code: 83646\n          Country: US\n    Event: \n      Action: registrar expiration\n      Date: 2020-09-14T04:00:00Z\n    Entity: \n      Role: \n        ABUSE\n      VCard: \n        Email: abusecomplaints@markmonitor.com\n            TYPE: work\n        Telephone: +1.2083895770\n            TYPE: voice\n  Link: \n    Rel: self\n    Value: https://rdap.markmonitor.com/rdap/domain/yahoo.com\n    Type: application/rdap+json\n    Href: https://rdap.markmonitor.com/rdap/domain/yahoo.com\n  Notice: \n    Title: Terms of Use\n    Description: \n      By submitting an RDAP query, you agree that you will use this data only for\n      lawful purposes and that, under no circumstances will you use this data to:\n      (1) allow, enable, or otherwise support the transmission by email, telephone,\n      or facsimile of mass, unsolicited, commercial advertising, or spam; or\n      (2) enable high volume, automated, or electronic processes that send queries,\n      data, or email to MarkMonitor (or its systems) or the domain name contacts (or\n      its systems).\n      MarkMonitor reserves the right to modify these terms at any time.\n      By submitting this query, you agree to abide by this policy.\n      MarkMonitor Domain Management(TM)\n      Protecting companies and consumers in a digital world.\n      Visit MarkMonitor at https://www.markmonitor.com\n      Contact us at +1.8007459229\n      In Europe, at +44.02032062220\n      Link: \n        Rel: related\n        Value: https://www.markmonitor.com/legal/domain-management-terms-and-conditions\n        Type: text/html\n        Href: https://www.markmonitor.com/legal/domain-management-terms-and-conditions\n  Notice: \n    Title: Status Codes\n      Description: For more information on domain status codes, please visit https://icann.org/epp.\n      Link: \n        Rel: related\n        Value: https://icann.org/epp\n        Type: text/html\n        Href: https://icann.org/epp\n  Notice: \n    Title: RDDS Inaccuracy Complaint Form\n      Description: URL of the ICANN RDDS Inaccuracy Complaint Form: https://www.icann.org/wicf.\n      Link: \n        Rel: related\n        Value: https://www.icann.org/wicf\n        Type: text/html\n        Href: https://www.icann.org/wicf\n  RDAP Conformance: \n    rdap_level_0\n    icann_rdap_technical_implementation_guide_0\n    icann_rdap_response_profile_0\n\n\n  Registry: \n    Handle: 3643624_DOMAIN_COM-VRSN\n    LDH Name: YAHOO.COM\n    Nameserver: \n      LDH Name: NS1.YAHOO.COM\n    Nameserver: \n      LDH Name: NS2.YAHOO.COM\n    Nameserver: \n      LDH Name: NS3.YAHOO.COM\n    Nameserver: \n      LDH Name: NS4.YAHOO.COM\n    Nameserver: \n      LDH Name: NS5.YAHOO.COM\n    SecureDNS: \n      Delegation Signed: false\n    Event: \n      Action: registration\n      Date: 1995-01-18T05:00:00Z\n    Event: \n      Action: expiration\n      Date: 2023-01-19T05:00:00Z\n    Event: \n      Action: last update of RDAP database\n      Date: 2020-08-18T09:35:53Z\n    Status: \n      client delete prohibited\n      client transfer prohibited\n      client update prohibited\n      server delete prohibited\n      server transfer prohibited\n      server update prohibited\n    Entity: \n      Handle: 292\n      Role: \n        REGISTRAR\n      VCard: \n        Formatted Name: MarkMonitor Inc.\n      Entity: \n        Role: \n          ABUSE\n        VCard: \n          Formatted Name: \n              TYPE: voice\n          Email: abusecomplaints@markmonitor.com\n    Link: \n      Rel: self\n      Value: https://rdap.verisign.com/com/v1/domain/YAHOO.COM\n      Type: application/rdap+json\n      Href: https://rdap.verisign.com/com/v1/domain/YAHOO.COM\n    Link: \n      Rel: related\n      Value: https://rdap.markmonitor.com/rdap/domain/YAHOO.COM\n      Type: application/rdap+json\n      Href: https://rdap.markmonitor.com/rdap/domain/YAHOO.COM\n    Notice: \n      Title: Terms of Use\n        Description: Service subject to Terms of Use.\n        Link: \n          Type: text/html\n          Href: https://www.verisign.com/domain-names/registration-data-access-protocol/terms-service/index.xhtml\n    Notice: \n      Title: Status Codes\n        Description: For more information on domain status codes, please visit https://icann.org/epp\n        Link: \n          Type: text/html\n          Href: https://icann.org/epp\n    Notice: \n      Title: RDDS Inaccuracy Complaint Form\n        Description: URL of the ICANN RDDS Inaccuracy Complaint Form: https://icann.org/wicf\n        Link: \n          Type: text/html\n          Href: https://icann.org/wicf\n    RDAP Conformance: \n      rdap_level_0\n      icann_rdap_technical_implementation_guide_0\n      icann_rdap_response_profile_0\n", "whoisRawID": 0, "source": "WHOIS_RDAP", "match_whitelist": {"domain": true}}, "registrarUpdatedAt": 1596134129, "whoisID": 6701609909772985307, "registrarIanaID": 292, "registrarName": "MarkMonitor Inc.", "whoisServer": "rdap.markmonitor.com", "createdAt": 1597788312, "expired": false, "contactOrganizations": ["MarkMonitor Inc."], "registrarParseCode": 32803, "auditUpdatedAt": 1597788312, "id": 6701609909772985307, "registrarPhone": "+1.2083895740", "updatedAt": 1597788312, "domainUnicode": "yahoo.com", "auditCreatedAt": 1597788312, "registrarExpiresAt": 1674104400, "contactCountries": ["US"], "compositeParseCode": 32803, "contactEmails": [], "registrarEmail": "abusecomplaints@markmonitor.com", "domainStatus": "client update prohibited,client transfer prohibited,client delete prohibited,server update prohibited,server transfer prohibited,server delete prohibited", "tld": "com", "domainAvailable": false, "registrarCreatedAt": 790416000, "noRecord": false, "nameservers": ["ns1.yahoo.com", "ns2.yahoo.com", "ns3.yahoo.com", "ns4.yahoo.com", "ns5.yahoo.com"], "domain": "yahoo.com", "contactNames": [], "contacts": [{"zip": "83646", "country": "US", "address": "3540 E Longwing Ln\nMeridian\n83646\nID\nUS\n", "city": "Meridian", "whoisContactID": 0, "street": "3540 E Longwing Ln", "organization": "MarkMonitor Inc.", "state": "ID", "id": 0}], "status": "ACTIVE", "domainMd5": "50cd1a9a183758039b0841aa738c3f0b", "task_id": "0b768f9f963f4cb1a0eb01e554abd479", "match_whitelist": {"domain": true}}]}